[I 2026-10-01 18:44:56,209] A new study created in RDB with name: F1__pt__b10
[F1__pt__b10] trial 0: -0.15341 [-0.1211, -0.1585, -0.0746, -0.1829, -0.164, -0.1923, -0.158, -0.1758] {"eim_R": 16, "eim_Tmax": 7.3329031629428645e-06, "eim_Tmin": 1.1006348269620852e-06, "eim_anneal": 0.9462286962175356, "eim_hscale": 1.8587633596816164, "eim_m
[I 2026-10-01 18:51:16,935] Trial 0 finished with value: -0.1534092427952018 and parameters: {'start': 'lp', 'eim_R': 16, 'eim_Tmin': 1.1006348269620852e-06, 'eim_Tratio': 6.662430611234392, 'eim_moves': 18358, 'p_add': 0.22230587257383633, 'p_swap': 0.46272105013386755, 'topw': 20, 'eim_rho': 3.506794739778118, 'eim_hscale': 1.8587633596816164, 'eim_anneal': 0.9462286962175356, 'g_scale': 774.8399988560119}. Best is trial 0 with value: -0.1534092427952018.
[F1__pt__b10] trial 1: -0.11871 [-0.0998, -0.1314, -0.0693, -0.146, -0.1084, -0.1537, -0.1126, -0.1284] {"eim_R": 64, "eim_Tmax": 0.022388264096178515, "eim_Tmin": 5.6279320474151646e-06, "eim_anneal": 0.07032569761590807, "eim_hscale": 59.812219011525556, "eim_mo
[I 2026-10-01 18:53:41,163] Trial 1 finished with value: -0.11870557198246073 and parameters: {'start': 'pgreedy', 'eim_R': 64, 'eim_Tmin': 5.6279320474151646e-06, 'eim_Tratio': 3978.0622629338873, 'eim_moves': 174910, 'p_add': 0.19172075941288885, 'p_swap': 0.6420036530145916, 'topw': 11, 'eim_rho': 18.71450068624066, 'eim_hscale': 59.812219011525556, 'eim_anneal': 0.07032569761590807, 'g_scale': 149.36835544198456}. Best is trial 0 with value: -0.1534092427952018.
[F1__pt__b10] trial 2: -0.14114 [-0.1187, -0.151, -0.0746, -0.1653, -0.1449, -0.1778, -0.1401, -0.1566] {"eim_R": 32, "eim_Tmax": 0.01081686613933192, "eim_Tmin": 7.013219779945795e-06, "eim_anneal": 0.2619100559835807, "eim_hscale": 1.7538232373118046, "eim_moves
[I 2026-10-01 19:01:24,878] Trial 2 finished with value: -0.14113579184463598 and parameters: {'start': 'pgreedy', 'eim_R': 32, 'eim_Tmin': 7.013219779945795e-06, 'eim_Tratio': 1542.3537945099908, 'eim_moves': 7734, 'p_add': 0.3199605106637619, 'p_swap': 0.2616475745120573, 'topw': 52, 'eim_rho': 12.229065947034353, 'eim_hscale': 1.7538232373118046, 'eim_anneal': 0.2619100559835807, 'g_scale': 3535.6346291488144}. Best is trial 0 with value: -0.1534092427952018.
[F1__pt__b10] trial 3: -0.09459 [-0.0884, -0.1185, -0.0563, -0.1187, -0.0876, -0.1197, -0.0751, -0.0925] {"eim_R": 16, "eim_Tmax": 0.3963283547730436, "eim_Tmin": 0.0005956516018710562, "eim_anneal": 0.2082787354631025, "eim_hscale": 10.278118224157009, "eim_moves"
[I 2026-10-01 19:07:46,059] Trial 3 finished with value: -0.09459289229483744 and parameters: {'start': 'pgreedy', 'eim_R': 16, 'eim_Tmin': 0.0005956516018710562, 'eim_Tratio': 665.369409782665, 'eim_moves': 18832, 'p_add': 0.21851597689967073, 'p_swap': 0.5707798346517168, 'topw': 2, 'eim_rho': 46.458679515124714, 'eim_hscale': 10.278118224157009, 'eim_anneal': 0.2082787354631025, 'g_scale': 181.07254066631089}. Best is trial 0 with value: -0.1534092427952018.
[F1__pt__b10] trial 4: -0.14925 [-0.1197, -0.157, -0.0746, -0.1763, -0.1587, -0.1863, -0.1509, -0.1706] {"eim_R": 16, "eim_Tmax": 6.840342246366934e-06, "eim_Tmin": 3.2202378453311506e-07, "eim_anneal": 0.5962767279261619, "eim_hscale": 99.13773847646657, "eim_mov
[I 2026-10-01 19:09:40,036] Trial 4 finished with value: -0.14925232372715014 and parameters: {'start': 'lp', 'eim_R': 16, 'eim_Tmin': 3.2202378453311506e-07, 'eim_Tratio': 21.2417298811775, 'eim_moves': 5383, 'p_add': 0.20003338804169363, 'p_swap': 0.3482973720482757, 'topw': 9, 'eim_rho': 1.1167684943566796, 'eim_hscale': 99.13773847646657, 'eim_anneal': 0.5962767279261619, 'g_scale': 5387.10565840382}. Best is trial 0 with value: -0.1534092427952018.
[F1__pt__b10] trial 5: -0.15073 [-0.1198, -0.1581, -0.0746, -0.1782, -0.1597, -0.1897, -0.1522, -0.1736] {"eim_R": 16, "eim_Tmax": 4.916584503124671e-06, "eim_Tmin": 1.110324680870858e-06, "eim_anneal": 0.9626479280331366, "eim_hscale": 1.2345170019454539, "eim_mov
[I 2026-10-01 19:11:26,821] Trial 5 finished with value: -0.15072966551660638 and parameters: {'start': 'lp', 'eim_R': 16, 'eim_Tmin': 1.110324680870858e-06, 'eim_Tratio': 4.428060177198312, 'eim_moves': 18070, 'p_add': 0.22790323701173293, 'p_swap': 0.44854489566179034, 'topw': 24, 'eim_rho': 1.9100041270013748, 'eim_hscale': 1.2345170019454539, 'eim_anneal': 0.9626479280331366, 'g_scale': 586.7669480720929}. Best is trial 0 with value: -0.1534092427952018.
[F1__pt__b10] trial 6: -0.14950 [-0.1165, -0.152, -0.0746, -0.1775, -0.1581, -0.1902, -0.1523, -0.1748] {"eim_R": 16, "eim_Tmax": 0.0008862259007534354, "eim_Tmin": 9.336328220135168e-07, "eim_anneal": 0.4650937978406958, "eim_hscale": 0.4599103083359571, "eim_mov
[I 2026-10-01 19:13:13,129] Trial 6 finished with value: -0.14949591529423095 and parameters: {'start': 'lp', 'eim_R': 16, 'eim_Tmin': 9.336328220135168e-07, 'eim_Tratio': 949.2231633868212, 'eim_moves': 116558, 'p_add': 0.23418122254197093, 'p_swap': 0.46785249215510616, 'topw': 24, 'eim_rho': 1.6548033478379185, 'eim_hscale': 0.4599103083359571, 'eim_anneal': 0.4650937978406958, 'g_scale': 616.7703130750243}. Best is trial 0 with value: -0.1534092427952018.
[F1__pt__b10] trial 7: -0.14812 [-0.1136, -0.1552, -0.0746, -0.1746, -0.1572, -0.1877, -0.1499, -0.1722] {"eim_R": 16, "eim_Tmax": 0.026999323033934215, "eim_Tmin": 0.0001324182382335442, "eim_anneal": 0.6739268486288983, "eim_hscale": 9.291790515401686, "eim_moves
[I 2026-10-01 19:16:36,518] Trial 7 finished with value: -0.14812316748656312 and parameters: {'start': 'lp', 'eim_R': 16, 'eim_Tmin': 0.0001324182382335442, 'eim_Tratio': 203.89429276589442, 'eim_moves': 19715, 'p_add': 0.020957344109181264, 'p_swap': 0.9151876015568418, 'topw': 35, 'eim_rho': 0.3056181839452163, 'eim_hscale': 9.291790515401686, 'eim_anneal': 0.6739268486288983, 'g_scale': 964.6274766454133}. Best is trial 0 with value: -0.1534092427952018.
[F1__pt__b10] trial 8: -0.15055 [-0.1206, -0.1532, -0.0746, -0.1794, -0.16, -0.1908, -0.1534, -0.1724] {"eim_R": 16, "eim_Tmax": 9.663794481154574e-05, "eim_Tmin": 2.832153136362731e-07, "eim_anneal": 0.8144961485977071, "eim_hscale": 3.03784040968439, "eim_moves
[I 2026-10-01 19:18:21,399] Trial 8 finished with value: -0.15054926587547768 and parameters: {'start': 'lp', 'eim_R': 16, 'eim_Tmin': 2.832153136362731e-07, 'eim_Tratio': 341.2172299964529, 'eim_moves': 38873, 'p_add': 0.07699567169359897, 'p_swap': 0.8057036692395034, 'topw': 16, 'eim_rho': 983.6620223104848, 'eim_hscale': 3.03784040968439, 'eim_anneal': 0.8144961485977071, 'g_scale': 122.4530753301341}. Best is trial 0 with value: -0.1534092427952018.
[F1__pt__b10] trial 9: -0.15343 [-0.1208, -0.1581, -0.0746, -0.1811, -0.1642, -0.1926, -0.1587, -0.1772] {"eim_R": 16, "eim_Tmax": 6.797811914032077e-06, "eim_Tmin": 4.243691530342208e-07, "eim_anneal": 0.805185495739135, "eim_hscale": 5.28310260416195, "eim_moves"
[I 2026-10-01 19:25:10,369] Trial 9 finished with value: -0.1534269556367559 and parameters: {'start': 'lp', 'eim_R': 16, 'eim_Tmin': 4.243691530342208e-07, 'eim_Tratio': 16.0186287467598, 'eim_moves': 39664, 'p_add': 0.34530778360406, 'p_swap': 0.2120831155936331, 'topw': 3, 'eim_rho': 12.090487283123066, 'eim_hscale': 5.28310260416195, 'eim_anneal': 0.805185495739135, 'g_scale': 192.99522546169908}. Best is trial 9 with value: -0.1534269556367559.
[F1__pt__b10] trial 10: -0.14645 [-0.1194, -0.1561, -0.0746, -0.1746, -0.1509, -0.1852, -0.1465, -0.1643] {"eim_R": 16, "eim_Tmax": 0.00014830800208093614, "eim_Tmin": 3.244054199587758e-06, "eim_anneal": 0.6037874160638619, "eim_hscale": 90.5078689544596, "eim_move
[I 2026-10-01 19:28:36,296] Trial 10 finished with value: -0.14645219671642312 and parameters: {'start': 'lp', 'eim_R': 16, 'eim_Tmin': 3.244054199587758e-06, 'eim_Tratio': 45.71686937283062, 'eim_moves': 128039, 'p_add': 0.15818853671327276, 'p_swap': 0.20045906613591222, 'topw': 18, 'eim_rho': 6.627058998907854, 'eim_hscale': 90.5078689544596, 'eim_anneal': 0.6037874160638619, 'g_scale': 435.44627404524476}. Best is trial 9 with value: -0.1534269556367559.
[F1__pt__b10] trial 11: -0.15052 [-0.1205, -0.1575, -0.0746, -0.1776, -0.1604, -0.188, -0.1533, -0.1722] {"eim_R": 16, "eim_Tmax": 2.338089814581073e-05, "eim_Tmin": 6.212374570810587e-07, "eim_anneal": 0.7601028573682942, "eim_hscale": 14.904040393285731, "eim_mov
[I 2026-10-01 19:35:21,433] Trial 11 finished with value: -0.15051870609220347 and parameters: {'start': 'lp', 'eim_R': 16, 'eim_Tmin': 6.212374570810587e-07, 'eim_Tratio': 37.636008388270774, 'eim_moves': 45923, 'p_add': 0.38101111733034726, 'p_swap': 0.30900978956291303, 'topw': 14, 'eim_rho': 13.62070081414459, 'eim_hscale': 14.904040393285731, 'eim_anneal': 0.7601028573682942, 'g_scale': 903.0799285012382}. Best is trial 9 with value: -0.1534269556367559.
[F1__pt__b10] BEST t9 -0.15343 cfg={"eim_R": 16, "eim_Tmax": 6.797811914032077e-06, "eim_Tmin": 4.243691530342208e-07, "eim_anneal": 0.805185495739135, "eim_hscale": 5.28310260416195, "eim_moves": 39664, "eim_rho": 12.090487283123066, "g_scale": 192.99522546169908, "p_add": 0.34530778360406, "p_swap": 0.2120831155936331, "start": "lp", "topw": 3}
[I 2026-10-01 19:35:21,476] A new study created in RDB with name: F1__lp__b10
[F1__lp__b10] trial 0: -0.13375 [-0.1106, -0.1478, -0.0613, -0.1581, -0.1347, -0.1697, -0.1342, -0.1536] {"lexi": false}
[I 2026-10-01 19:35:33,717] Trial 0 finished with value: -0.13374612090361304 and parameters: {'start': 'lp', 'lexi': False}. Best is trial 0 with value: -0.13374612090361304.
[F1__lp__b10] trial 1: -0.13294 [-0.1118, -0.1475, -0.054, -0.1581, -0.1347, -0.1697, -0.1342, -0.1536] {"lexi": false}
[I 2026-10-01 19:35:58,662] Trial 1 finished with value: -0.13293518231323564 and parameters: {'start': 'pgreedy', 'lexi': False}. Best is trial 0 with value: -0.13374612090361304.
[F1__lp__b10] trial 2: -0.13420 [-0.1096, -0.1488, -0.0617, -0.1581, -0.1376, -0.1701, -0.1342, -0.1534] {"lexi": true}
[I 2026-10-01 19:37:05,598] Trial 2 finished with value: -0.1342032115498874 and parameters: {'start': 'pgreedy', 'lexi': True}. Best is trial 2 with value: -0.1342032115498874.
[F1__lp__b10] trial 3: -0.13421 [-0.1139, -0.1484, -0.0611, -0.1581, -0.1347, -0.1697, -0.1342, -0.1536] {"lexi": false}
[I 2026-10-01 19:37:31,170] Trial 3 finished with value: -0.13420675960834555 and parameters: {'start': 'lp', 'lexi': False}. Best is trial 3 with value: -0.13420675960834555.
[F1__lp__b10] trial 4: -0.13307 [-0.1092, -0.1473, -0.054, -0.1581, -0.1376, -0.1701, -0.1342, -0.154] {"lexi": true}
[I 2026-10-01 19:38:39,378] Trial 4 finished with value: -0.13306778924904322 and parameters: {'start': 'lp', 'lexi': True}. Best is trial 3 with value: -0.13420675960834555.
[F1__lp__b10] trial 5: -0.13482 [-0.1144, -0.1502, -0.0637, -0.1581, -0.1347, -0.1697, -0.1342, -0.1536] {"lexi": false}
[I 2026-10-01 19:39:07,227] Trial 5 finished with value: -0.13482266678435742 and parameters: {'start': 'lp', 'lexi': False}. Best is trial 5 with value: -0.13482266678435742.
[F1__lp__b10] trial 6: -0.13264 [-0.1097, -0.1368, -0.0644, -0.1581, -0.1347, -0.1697, -0.1342, -0.1536] {"lexi": false}
[I 2026-10-01 19:39:34,944] Trial 6 finished with value: -0.13263567399063636 and parameters: {'start': 'lp', 'lexi': False}. Best is trial 5 with value: -0.13482266678435742.
[F1__lp__b10] trial 7: -0.13386 [-0.1075, -0.1512, -0.0587, -0.1581, -0.1376, -0.1701, -0.1342, -0.1534] {"lexi": true}
[I 2026-10-01 19:40:48,944] Trial 7 finished with value: -0.1338637596281081 and parameters: {'start': 'lp', 'lexi': True}. Best is trial 5 with value: -0.13482266678435742.
[F1__lp__b10] trial 8: -0.13357 [-0.1117, -0.1466, -0.0609, -0.1572, -0.1347, -0.1697, -0.1342, -0.1536] {"lexi": false}
[I 2026-10-01 19:41:20,046] Trial 8 finished with value: -0.13357167891997196 and parameters: {'start': 'pgreedy', 'lexi': False}. Best is trial 5 with value: -0.13482266678435742.
[F1__lp__b10] trial 9: -0.13357 [-0.11, -0.1446, -0.0637, -0.1581, -0.1347, -0.1697, -0.1342, -0.1536] {"lexi": false}
[I 2026-10-01 19:41:50,271] Trial 9 finished with value: -0.1335717893311822 and parameters: {'start': 'lp', 'lexi': False}. Best is trial 5 with value: -0.13482266678435742.
[F1__lp__b10] trial 10: -0.13435 [-0.112, -0.149, -0.0597, -0.1581, -0.1376, -0.1701, -0.1342, -0.154] {"lexi": true}
[I 2026-10-01 19:42:37,654] Trial 10 finished with value: -0.13434600258987714 and parameters: {'start': 'pgreedy', 'lexi': True}. Best is trial 5 with value: -0.13482266678435742.
[F1__lp__b10] trial 11: -0.13407 [-0.1135, -0.1491, -0.0565, -0.1581, -0.1376, -0.1701, -0.1342, -0.1534] {"lexi": true}
[I 2026-10-01 19:43:25,222] Trial 11 finished with value: -0.1340691127045036 and parameters: {'start': 'pgreedy', 'lexi': True}. Best is trial 5 with value: -0.13482266678435742.
[F1__lp__b10] BEST t5 -0.13482 cfg={"lexi": false}
[I 2026-10-01 19:43:25,251] A new study created in RDB with name: F1__eim__b10
[F1__eim__b10] trial 0: -0.15298 [-0.12, -0.1576, -0.0746, -0.1804, -0.1648, -0.1934, -0.1583, -0.1748] {"eim_R": 16, "eim_Tmax": 0.0007255047403074508, "eim_Tmin": 0.00013246974647468452, "eim_anneal": 0.7664913525398744, "eim_eta": 0.23358825194833557, "eim_hsca
[I 2026-10-01 19:45:11,833] Trial 0 finished with value: -0.15298044110595668 and parameters: {'start': 'lp', 'eim_R': 16, 'eim_Tmin': 0.00013246974647468452, 'eim_Tratio': 5.476757973912916, 'eim_moves': 52984, 'p_add': 0.0716766437045232, 'p_swap': 0.8407909904010871, 'topw': 11, 'eim_rho': 4.5566719139214715, 'eim_hscale': 0.6218230782016851, 'eim_anneal': 0.7664913525398744, 'eim_eta': 0.23358825194833557, 'g_scale': 1370.4648392849028}. Best is trial 0 with value: -0.15298044110595668.
[F1__eim__b10] trial 1: -0.14687 [-0.1178, -0.1519, -0.0746, -0.1701, -0.1565, -0.1877, -0.1483, -0.1681] {"eim_R": 64, "eim_Tmax": 0.022388264096178515, "eim_Tmin": 5.6279320474151646e-06, "eim_anneal": 0.07032569761590807, "eim_eta": 0.018255254802399014, "eim_hsc
[I 2026-10-01 19:47:01,280] Trial 1 finished with value: -0.14687154515679612 and parameters: {'start': 'pgreedy', 'eim_R': 64, 'eim_Tmin': 5.6279320474151646e-06, 'eim_Tratio': 3978.0622629338873, 'eim_moves': 174910, 'p_add': 0.19172075941288885, 'p_swap': 0.6420036530145916, 'topw': 11, 'eim_rho': 18.71450068624066, 'eim_hscale': 59.812219011525556, 'eim_anneal': 0.07032569761590807, 'eim_eta': 0.018255254802399014, 'g_scale': 109.7581541938016}. Best is trial 0 with value: -0.15298044110595668.
[F1__eim__b10] trial 2: -0.15326 [-0.1197, -0.1576, -0.0746, -0.1799, -0.1645, -0.1952, -0.1576, -0.1769] {"eim_R": 16, "eim_Tmax": 0.0007255047403074508, "eim_Tmin": 0.00013246974647468452, "eim_anneal": 0.7664913525398744, "eim_eta": 0.23358825194833557, "eim_hsca
[I 2026-10-01 19:48:47,806] Trial 2 finished with value: -0.15325600870941122 and parameters: {'start': 'lp', 'eim_R': 16, 'eim_Tmin': 0.00013246974647468452, 'eim_Tratio': 5.476757973912916, 'eim_moves': 52984, 'p_add': 0.0716766437045232, 'p_swap': 0.8407909904010871, 'topw': 11, 'eim_rho': 4.5566719139214715, 'eim_hscale': 0.6218230782016851, 'eim_anneal': 0.7664913525398744, 'eim_eta': 0.23358825194833557, 'g_scale': 1370.4648392849028}. Best is trial 2 with value: -0.15325600870941122.
[F1__eim__b10] trial 3: -0.13260 [-0.1111, -0.1434, -0.0746, -0.1426, -0.1381, -0.1686, -0.1325, -0.1498] {"eim_R": 32, "eim_Tmax": 0.00022679302095938696, "eim_Tmin": 2.741773675242096e-06, "eim_anneal": 0.312274067414942, "eim_eta": 0.1233480570086002, "eim_hscale
[I 2026-10-01 19:50:33,842] Trial 3 finished with value: -0.1325954186407307 and parameters: {'start': 'pgreedy', 'eim_R': 32, 'eim_Tmin': 2.741773675242096e-06, 'eim_Tratio': 82.71763019949535, 'eim_moves': 65555, 'p_add': 0.030112735814634917, 'p_swap': 0.6799968666320435, 'topw': 19, 'eim_rho': 0.6942729492430144, 'eim_hscale': 0.24365700014641997, 'eim_anneal': 0.312274067414942, 'eim_eta': 0.1233480570086002, 'g_scale': 1381.6356822574794}. Best is trial 2 with value: -0.15325600870941122.
[F1__eim__b10] trial 4: -0.14524 [-0.1172, -0.1543, -0.0736, -0.1719, -0.1484, -0.182, -0.147, -0.1674] {"eim_R": 16, "eim_Tmax": 0.013323197406244793, "eim_Tmin": 0.0004987435476609301, "eim_anneal": 0.6411080434933271, "eim_eta": 0.23236965081001948, "eim_hscale
[I 2026-10-01 19:52:20,552] Trial 4 finished with value: -0.1452389805475337 and parameters: {'start': 'lp', 'eim_R': 16, 'eim_Tmin': 0.0004987435476609301, 'eim_Tratio': 26.713523350286117, 'eim_moves': 133508, 'p_add': 0.4207271306233804, 'p_swap': 0.2125472978851706, 'topw': 4, 'eim_rho': 0.12908945670149974, 'eim_hscale': 6.742610434179981, 'eim_anneal': 0.6411080434933271, 'eim_eta': 0.23236965081001948, 'g_scale': 1453.27196243909}. Best is trial 2 with value: -0.15325600870941122.
[F1__eim__b10] trial 5: -0.14116 [-0.1177, -0.1551, -0.0708, -0.1672, -0.1467, -0.1756, -0.1372, -0.1589] {"eim_R": 16, "eim_Tmax": 4.51185205643839, "eim_Tmin": 0.0008845595679055938, "eim_anneal": 0.3255240062214654, "eim_eta": 3.482210394350657, "eim_hscale": 4.0
[I 2026-10-01 19:54:07,118] Trial 5 finished with value: -0.14115947033845158 and parameters: {'start': 'lp', 'eim_R': 16, 'eim_Tmin': 0.0008845595679055938, 'eim_Tratio': 5100.676336723459, 'eim_moves': 150312, 'p_add': 0.3439690180416784, 'p_swap': 0.29370114286669824, 'topw': 5, 'eim_rho': 292.7195532639329, 'eim_hscale': 4.01238248611403, 'eim_anneal': 0.3255240062214654, 'eim_eta': 3.482210394350657, 'g_scale': 577.6755975599551}. Best is trial 2 with value: -0.15325600870941122.
[F1__eim__b10] trial 6: -0.14145 [-0.1137, -0.1501, -0.0709, -0.1697, -0.1448, -0.1802, -0.1406, -0.1616] {"eim_R": 16, "eim_Tmax": 0.04879630578473809, "eim_Tmin": 0.00011178746891153904, "eim_anneal": 0.4793374153598661, "eim_eta": 0.07778317759140305, "eim_hscale
[I 2026-10-01 19:55:53,119] Trial 6 finished with value: -0.14144991747399527 and parameters: {'start': 'lp', 'eim_R': 16, 'eim_Tmin': 0.00011178746891153904, 'eim_Tratio': 436.5096218732008, 'eim_moves': 11457, 'p_add': 0.005458090909369079, 'p_swap': 0.9281323674707972, 'topw': 35, 'eim_rho': 1.5541118768198727, 'eim_hscale': 54.90547524524427, 'eim_anneal': 0.4793374153598661, 'eim_eta': 0.07778317759140305, 'g_scale': 393.16917471712173}. Best is trial 2 with value: -0.15325600870941122.
[F1__eim__b10] trial 7: -0.15202 [-0.1205, -0.1581, -0.0746, -0.18, -0.1624, -0.1914, -0.1545, -0.1747] {"eim_R": 16, "eim_Tmax": 0.00012327498633804795, "eim_Tmin": 3.6068502913388537e-07, "eim_anneal": 0.5900231429474612, "eim_eta": 0.04023452434764971, "eim_hsc
[I 2026-10-01 19:57:39,245] Trial 7 finished with value: -0.1520173350600516 and parameters: {'start': 'lp', 'eim_R': 16, 'eim_Tmin': 3.6068502913388537e-07, 'eim_Tratio': 341.78015825627347, 'eim_moves': 97971, 'p_add': 0.13006306822199382, 'p_swap': 0.42462141761195854, 'topw': 3, 'eim_rho': 4.645401139217687, 'eim_hscale': 4.273274002444589, 'eim_anneal': 0.5900231429474612, 'eim_eta': 0.04023452434764971, 'g_scale': 8140.1901034183975}. Best is trial 2 with value: -0.15325600870941122.
[F1__eim__b10] trial 8: -0.14901 [-0.1182, -0.1486, -0.0746, -0.1784, -0.1577, -0.1888, -0.1524, -0.1734] {"eim_R": 16, "eim_Tmax": 0.05902572994144991, "eim_Tmin": 1.4903856339506539e-05, "eim_anneal": 0.7418092153852135, "eim_eta": 0.7472165461477982, "eim_hscale"
[I 2026-10-01 19:59:25,341] Trial 8 finished with value: -0.14900798536755877 and parameters: {'start': 'lp', 'eim_R': 16, 'eim_Tmin': 1.4903856339506539e-05, 'eim_Tratio': 3960.4333668318377, 'eim_moves': 63710, 'p_add': 0.12584006620126276, 'p_swap': 0.47121771568598714, 'topw': 15, 'eim_rho': 0.15677955703511037, 'eim_hscale': 0.6859043102902815, 'eim_anneal': 0.7418092153852135, 'eim_eta': 0.7472165461477982, 'g_scale': 4777.205536179907}. Best is trial 2 with value: -0.15325600870941122.
[F1__eim__b10] trial 9: -0.15078 [-0.1197, -0.1575, -0.0746, -0.1802, -0.1629, -0.1888, -0.1526, -0.1698] {"eim_R": 16, "eim_Tmax": 0.04412351500343946, "eim_Tmin": 0.00020827188679238984, "eim_anneal": 0.9719942231917424, "eim_eta": 0.30362340943985383, "eim_hscale
[I 2026-10-01 20:01:10,525] Trial 9 finished with value: -0.15078317431740768 and parameters: {'start': 'lp', 'eim_R': 16, 'eim_Tmin': 0.00020827188679238984, 'eim_Tratio': 211.85535735518056, 'eim_moves': 96916, 'p_add': 0.329610509590732, 'p_swap': 0.3811991373951533, 'topw': 13, 'eim_rho': 240.58174820146084, 'eim_hscale': 0.22984569932818313, 'eim_anneal': 0.9719942231917424, 'eim_eta': 0.30362340943985383, 'g_scale': 3328.687869531856}. Best is trial 2 with value: -0.15325600870941122.
[F1__eim__b10] trial 10: -0.15137 [-0.1196, -0.1564, -0.0746, -0.1782, -0.1625, -0.1916, -0.1545, -0.1735] {"eim_R": 16, "eim_Tmax": 0.001172759505483624, "eim_Tmin": 1.1730152401998691e-05, "eim_anneal": 0.9013128533134908, "eim_eta": 2.4542845700257967, "eim_hscale
[I 2026-10-01 20:02:55,091] Trial 10 finished with value: -0.15136895366754688 and parameters: {'start': 'lp', 'eim_R': 16, 'eim_Tmin': 1.1730152401998691e-05, 'eim_Tratio': 99.97819851716491, 'eim_moves': 13822, 'p_add': 0.01554383701771591, 'p_swap': 0.6087929361734351, 'topw': 8, 'eim_rho': 0.877608034253783, 'eim_hscale': 3.5846987338583545, 'eim_anneal': 0.9013128533134908, 'eim_eta': 2.4542845700257967, 'g_scale': 1255.1171888007152}. Best is trial 2 with value: -0.15325600870941122.
[F1__eim__b10] trial 11: -0.15074 [-0.1197, -0.157, -0.0746, -0.1752, -0.1591, -0.1911, -0.1543, -0.175] {"eim_R": 16, "eim_Tmax": 0.005601627986578593, "eim_Tmin": 0.0005097365871263062, "eim_anneal": 0.9567651602538499, "eim_eta": 0.06283585971027122, "eim_hscale
