[I 2026-10-01 15:00:22,751] A new study created in RDB with name: F1__pt__b1
[F1__pt__b1] trial 0: -0.08571 [-0.1181, -0.1516, -0.0746, -0.0757, -0.0576, -0.0822, -0.0644, -0.0614] {"eim_R": 16, "eim_Tmax": 7.3329031629428645e-06, "eim_Tmin": 1.1006348269620852e-06, "eim_anneal": 0.9462286962175356, "eim_hscale": 1.8587633596816164, "eim_m
[I 2026-10-01 15:00:32,251] Trial 0 finished with value: -0.08571088142281542 and parameters: {'start': 'lp', 'eim_R': 16, 'eim_Tmin': 1.1006348269620852e-06, 'eim_Tratio': 6.662430611234392, 'eim_moves': 18358, 'p_add': 0.22230587257383633, 'p_swap': 0.46272105013386755, 'topw': 20, 'eim_rho': 3.506794739778118, 'eim_hscale': 1.8587633596816164, 'eim_anneal': 0.9462286962175356, 'g_scale': 774.8399988560119}. Best is trial 0 with value: -0.08571088142281542.
[F1__pt__b1] trial 1: -0.08631 [-0.0566, -0.1121, -0.064, -0.1042, -0.0753, -0.1163, -0.0761, -0.086] {"eim_R": 64, "eim_Tmax": 0.022388264096178515, "eim_Tmin": 5.6279320474151646e-06, "eim_anneal": 0.07032569761590807, "eim_hscale": 59.812219011525556, "eim_mo
[I 2026-10-01 15:00:44,173] Trial 1 finished with value: -0.08630894797286418 and parameters: {'start': 'pgreedy', 'eim_R': 64, 'eim_Tmin': 5.6279320474151646e-06, 'eim_Tratio': 3978.0622629338873, 'eim_moves': 174910, 'p_add': 0.19172075941288885, 'p_swap': 0.6420036530145916, 'topw': 11, 'eim_rho': 18.71450068624066, 'eim_hscale': 59.812219011525556, 'eim_anneal': 0.07032569761590807, 'g_scale': 149.36835544198456}. Best is trial 1 with value: -0.08630894797286418.
[F1__pt__b1] trial 2: -0.08932 [-0.0751, -0.1068, -0.0552, -0.1131, -0.0793, -0.1123, -0.0846, -0.0881] {"eim_R": 32, "eim_Tmax": 0.01081686613933192, "eim_Tmin": 7.013219779945795e-06, "eim_anneal": 0.2619100559835807, "eim_hscale": 1.7538232373118046, "eim_moves
[I 2026-10-01 15:00:53,746] Trial 2 finished with value: -0.08931905013814351 and parameters: {'start': 'pgreedy', 'eim_R': 32, 'eim_Tmin': 7.013219779945795e-06, 'eim_Tratio': 1542.3537945099908, 'eim_moves': 7734, 'p_add': 0.3199605106637619, 'p_swap': 0.2616475745120573, 'topw': 52, 'eim_rho': 12.229065947034353, 'eim_hscale': 1.7538232373118046, 'eim_anneal': 0.2619100559835807, 'g_scale': 3535.6346291488144}. Best is trial 2 with value: -0.08931905013814351.
[F1__pt__b1] trial 3: -0.09414 [-0.0867, -0.116, -0.0566, -0.1195, -0.0853, -0.1166, -0.0775, -0.095] {"eim_R": 16, "eim_Tmax": 0.3963283547730436, "eim_Tmin": 0.0005956516018710562, "eim_anneal": 0.2082787354631025, "eim_hscale": 10.278118224157009, "eim_moves"
[I 2026-10-01 15:01:03,221] Trial 3 finished with value: -0.0941395708357867 and parameters: {'start': 'pgreedy', 'eim_R': 16, 'eim_Tmin': 0.0005956516018710562, 'eim_Tratio': 665.369409782665, 'eim_moves': 18832, 'p_add': 0.21851597689967073, 'p_swap': 0.5707798346517168, 'topw': 2, 'eim_rho': 46.458679515124714, 'eim_hscale': 10.278118224157009, 'eim_anneal': 0.2082787354631025, 'g_scale': 181.07254066631089}. Best is trial 3 with value: -0.0941395708357867.
[F1__pt__b1] trial 4: -0.10857 [-0.0962, -0.1213, -0.0549, -0.1266, -0.0999, -0.1449, -0.1038, -0.1211] {"eim_R": 16, "eim_Tmax": 0.0018454771330095238, "eim_Tmin": 2.3364917297093765e-06, "eim_anneal": 0.37442683988677017, "eim_hscale": 15.798790043320883, "eim_m
[I 2026-10-01 15:01:12,615] Trial 4 finished with value: -0.1085708462561199 and parameters: {'start': 'pgreedy', 'eim_R': 16, 'eim_Tmin': 2.3364917297093765e-06, 'eim_Tratio': 789.8496320545815, 'eim_moves': 10230, 'p_add': 0.3385264442295092, 'p_swap': 0.22443066908599205, 'topw': 2, 'eim_rho': 1.291360202801736, 'eim_hscale': 15.798790043320883, 'eim_anneal': 0.37442683988677017, 'g_scale': 1367.4385728086665}. Best is trial 4 with value: -0.1085708462561199.
[F1__pt__b1] trial 5: -0.11473 [-0.0937, -0.1241, -0.0695, -0.1363, -0.1099, -0.1467, -0.1132, -0.1243] {"eim_R": 16, "eim_Tmax": 9.652015291543115e-05, "eim_Tmin": 9.103174488464979e-07, "eim_anneal": 0.6940426877145585, "eim_hscale": 51.087850352945644, "eim_mov
[I 2026-10-01 15:01:22,111] Trial 5 finished with value: -0.11472522579728041 and parameters: {'start': 'pgreedy', 'eim_R': 16, 'eim_Tmin': 9.103174488464979e-07, 'eim_Tratio': 106.02911439051944, 'eim_moves': 15662, 'p_add': 0.05214329821518898, 'p_swap': 0.8827286755648714, 'topw': 3, 'eim_rho': 0.27042397645623645, 'eim_hscale': 51.087850352945644, 'eim_anneal': 0.6940426877145585, 'g_scale': 5671.407524071687}. Best is trial 5 with value: -0.11472522579728041.
[F1__pt__b1] trial 6: -0.12176 [-0.1016, -0.1363, -0.0746, -0.1406, -0.1151, -0.1559, -0.1175, -0.1325] {"eim_R": 16, "eim_Tmax": 3.949337716221304e-05, "eim_Tmin": 4.436381976497595e-06, "eim_anneal": 0.7788059172121389, "eim_hscale": 11.150146265598396, "eim_mov
[I 2026-10-01 15:01:31,612] Trial 6 finished with value: -0.12175654514241761 and parameters: {'start': 'pgreedy', 'eim_R': 16, 'eim_Tmin': 4.436381976497595e-06, 'eim_Tratio': 8.902158869870805, 'eim_moves': 25466, 'p_add': 0.09456781797506153, 'p_swap': 0.8125918619786677, 'topw': 4, 'eim_rho': 1.0318704311651328, 'eim_hscale': 11.150146265598396, 'eim_anneal': 0.7788059172121389, 'g_scale': 7195.057490616544}. Best is trial 6 with value: -0.12175654514241761.
[F1__pt__b1] trial 7: -0.12951 [-0.1074, -0.1438, -0.0746, -0.1529, -0.1273, -0.1635, -0.1237, -0.143] {"eim_R": 16, "eim_Tmax": 0.028957879838155714, "eim_Tmin": 0.00014085806091378926, "eim_anneal": 0.6667937093223893, "eim_hscale": 14.397526962964195, "eim_mov
[I 2026-10-01 15:01:41,226] Trial 7 finished with value: -0.12950630693617976 and parameters: {'start': 'pgreedy', 'eim_R': 16, 'eim_Tmin': 0.00014085806091378926, 'eim_Tratio': 205.58198551291352, 'eim_moves': 21240, 'p_add': 0.016112416050217765, 'p_swap': 0.9199404544251992, 'topw': 29, 'eim_rho': 0.2732819455468925, 'eim_hscale': 14.397526962964195, 'eim_anneal': 0.6667937093223893, 'g_scale': 1371.7796754231676}. Best is trial 7 with value: -0.12950630693617976.
[F1__pt__b1] trial 8: -0.10458 [-0.0936, -0.1225, -0.0678, -0.125, -0.1028, -0.1225, -0.0855, -0.117] {"eim_R": 16, "eim_Tmax": 0.1398543194837322, "eim_Tmin": 0.000983450271945902, "eim_anneal": 0.5129117643167751, "eim_hscale": 0.6947762045632158, "eim_moves":
[I 2026-10-01 15:01:51,037] Trial 8 finished with value: -0.10457858221902416 and parameters: {'start': 'pgreedy', 'eim_R': 16, 'eim_Tmin': 0.000983450271945902, 'eim_Tratio': 142.20782023580074, 'eim_moves': 64978, 'p_add': 0.3458380936480273, 'p_swap': 0.3538353950720029, 'topw': 3, 'eim_rho': 12.667905610173959, 'eim_hscale': 0.6947762045632158, 'eim_anneal': 0.5129117643167751, 'g_scale': 2747.380147053342}. Best is trial 7 with value: -0.12950630693617976.
[F1__pt__b1] trial 9: -0.13009 [-0.1122, -0.1432, -0.0709, -0.1539, -0.1285, -0.1675, -0.1242, -0.1402] {"eim_R": 16, "eim_Tmax": 0.008864549059196352, "eim_Tmin": 1.0984360218168416e-06, "eim_anneal": 0.5384470725102187, "eim_hscale": 1.2835823710365764, "eim_mov
[I 2026-10-01 15:02:01,151] Trial 9 finished with value: -0.13008638792056837 and parameters: {'start': 'pgreedy', 'eim_R': 16, 'eim_Tmin': 1.0984360218168416e-06, 'eim_Tratio': 8070.155096092132, 'eim_moves': 140985, 'p_add': 0.039777647903175034, 'p_swap': 0.7399689064220577, 'topw': 20, 'eim_rho': 14.353412217010282, 'eim_hscale': 1.2835823710365764, 'eim_anneal': 0.5384470725102187, 'g_scale': 1163.4607209533538}. Best is trial 9 with value: -0.13008638792056837.
[F1__pt__b1] trial 10: -0.11641 [-0.0964, -0.1348, -0.0729, -0.1335, -0.1144, -0.1475, -0.1112, -0.1205] {"eim_R": 16, "eim_Tmax": 0.004394809951257144, "eim_Tmin": 2.67013172576051e-06, "eim_anneal": 0.21083850426545225, "eim_hscale": 3.8286983000605996, "eim_move
[I 2026-10-01 15:02:10,931] Trial 10 finished with value: -0.11641127482935135 and parameters: {'start': 'pgreedy', 'eim_R': 16, 'eim_Tmin': 2.67013172576051e-06, 'eim_Tratio': 1645.9150343998137, 'eim_moves': 44557, 'p_add': 0.3179598841522244, 'p_swap': 0.36034612283482087, 'topw': 32, 'eim_rho': 28.48283157246602, 'eim_hscale': 3.8286983000605996, 'eim_anneal': 0.21083850426545225, 'g_scale': 1021.1798073808751}. Best is trial 9 with value: -0.13008638792056837.
[F1__pt__b1] trial 11: -0.12917 [-0.1087, -0.1402, -0.0746, -0.1481, -0.131, -0.1612, -0.1266, -0.143] {"eim_R": 16, "eim_Tmax": 0.0029829953274759097, "eim_Tmin": 3.2962861812862887e-07, "eim_anneal": 0.7266103063004783, "eim_hscale": 3.9004549474068635, "eim_mo
[I 2026-10-01 15:02:20,600] Trial 11 finished with value: -0.12917361743709477 and parameters: {'start': 'pgreedy', 'eim_R': 16, 'eim_Tmin': 3.2962861812862887e-07, 'eim_Tratio': 9049.564156204042, 'eim_moves': 89010, 'p_add': 0.11420272465356197, 'p_swap': 0.7197283444498023, 'topw': 19, 'eim_rho': 12.00149180168365, 'eim_hscale': 3.9004549474068635, 'eim_anneal': 0.7266103063004783, 'g_scale': 864.108836036295}. Best is trial 9 with value: -0.13008638792056837.
[F1__pt__b1] BEST t9 -0.13009 cfg={"eim_R": 16, "eim_Tmax": 0.008864549059196352, "eim_Tmin": 1.0984360218168416e-06, "eim_anneal": 0.5384470725102187, "eim_hscale": 1.2835823710365764, "eim_moves": 140985, "eim_rho": 14.353412217010282, "g_scale": 1163.4607209533538, "p_add": 0.039777647903175034, "p_swap": 0.7399689064220577, "start": "pgreedy", "topw": 20}
[I 2026-10-01 15:02:20,635] A new study created in RDB with name: F1__lp__b1
[F1__lp__b1] trial 0: -0.07690 [-0.1106, -0.1478, -0.0613, -0.0661, -0.046, -0.0723, -0.0547, -0.0564] {"lexi": false}
[I 2026-10-01 15:02:25,748] Trial 0 finished with value: -0.07690324199304074 and parameters: {'start': 'lp', 'lexi': False}. Best is trial 0 with value: -0.07690324199304074.
[F1__lp__b1] trial 1: -0.06560 [-0.1118, -0.0636, -0.054, -0.0661, -0.046, -0.0723, -0.0547, -0.0564] {"lexi": false}
[I 2026-10-01 15:02:30,791] Trial 1 finished with value: -0.06560412509869364 and parameters: {'start': 'pgreedy', 'lexi': False}. Best is trial 0 with value: -0.07690324199304074.
[F1__lp__b1] trial 2: +0.33806 [1.0, 1.0, 1.0, -0.0661, -0.046, -0.0723, -0.0547, -0.0564] {"lexi": true}
[I 2026-10-01 15:03:00,606] Trial 2 finished with value: 0.33806221744088694 and parameters: {'start': 'pgreedy', 'lexi': True}. Best is trial 0 with value: -0.07690324199304074.
[F1__lp__b1] trial 3: -0.05763 [-0.0407, -0.0637, -0.0611, -0.0661, -0.046, -0.0723, -0.0547, -0.0564] {"lexi": false}
[I 2026-10-01 15:03:06,332] Trial 3 finished with value: -0.0576305743348646 and parameters: {'start': 'lp', 'lexi': False}. Best is trial 0 with value: -0.07690324199304074.
[F1__lp__b1] trial 4: +0.33810 [1.0, 1.0, 1.0, -0.0658, -0.046, -0.0723, -0.0547, -0.0564] {"lexi": true}
[I 2026-10-01 15:03:30,846] Trial 4 finished with value: 0.3381003528861215 and parameters: {'start': 'lp', 'lexi': True}. Best is trial 0 with value: -0.07690324199304074.
[F1__lp__b1] trial 5: -0.07798 [-0.1144, -0.1502, -0.0637, -0.0661, -0.046, -0.0723, -0.0547, -0.0564] {"lexi": false}
[I 2026-10-01 15:03:35,662] Trial 5 finished with value: -0.07797978787378511 and parameters: {'start': 'lp', 'lexi': False}. Best is trial 5 with value: -0.07797978787378511.
[F1__lp__b1] trial 6: -0.06710 [-0.0401, -0.1368, -0.0644, -0.0661, -0.046, -0.0723, -0.0547, -0.0564] {"lexi": false}
[I 2026-10-01 15:03:40,956] Trial 6 finished with value: -0.0670988725544643 and parameters: {'start': 'lp', 'lexi': False}. Best is trial 5 with value: -0.07797978787378511.
[F1__lp__b1] trial 7: +0.20804 [-0.0401, 1.0, 1.0, -0.0661, -0.046, -0.0723, -0.0547, -0.0564] {"lexi": true}
[I 2026-10-01 15:04:08,623] Trial 7 finished with value: 0.20804412210557297 and parameters: {'start': 'lp', 'lexi': True}. Best is trial 5 with value: -0.07797978787378511.
[F1__lp__b1] trial 8: -0.07684 [-0.1117, -0.1466, -0.0609, -0.0661, -0.046, -0.0723, -0.0547, -0.0564] {"lexi": false}
[I 2026-10-01 15:04:13,798] Trial 8 finished with value: -0.0768354515746061 and parameters: {'start': 'pgreedy', 'lexi': False}. Best is trial 5 with value: -0.07797978787378511.
[F1__lp__b1] trial 9: -0.07673 [-0.11, -0.1446, -0.0637, -0.0661, -0.046, -0.0723, -0.0547, -0.0564] {"lexi": false}
[I 2026-10-01 15:04:18,943] Trial 9 finished with value: -0.07672891042060988 and parameters: {'start': 'lp', 'lexi': False}. Best is trial 5 with value: -0.07797978787378511.
[F1__lp__b1] trial 10: +0.33806 [1.0, 1.0, 1.0, -0.0661, -0.046, -0.0723, -0.0547, -0.0564] {"lexi": true}
[I 2026-10-01 15:04:53,207] Trial 10 finished with value: 0.33806221744088694 and parameters: {'start': 'pgreedy', 'lexi': True}. Best is trial 5 with value: -0.07797978787378511.
[F1__lp__b1] trial 11: -0.06815 [-0.0401, -0.1487, -0.0609, -0.0661, -0.046, -0.0723, -0.0547, -0.0564] {"lexi": false}
[I 2026-10-01 15:04:58,350] Trial 11 finished with value: -0.06815048748274437 and parameters: {'start': 'lp', 'lexi': False}. Best is trial 5 with value: -0.07797978787378511.
[F1__lp__b1] BEST t5 -0.07798 cfg={"lexi": false}
[I 2026-10-01 15:04:58,384] A new study created in RDB with name: F1__eim__b1
[F1__eim__b1] trial 0: -0.08496 [-0.1186, -0.1524, -0.0746, -0.0755, -0.0555, -0.0818, -0.0632, -0.0581] {"eim_R": 16, "eim_Tmax": 0.0007255047403074508, "eim_Tmin": 0.00013246974647468452, "eim_anneal": 0.7664913525398744, "eim_eta": 0.23358825194833557, "eim_hsca
[I 2026-10-01 15:05:08,174] Trial 0 finished with value: -0.08495624275639291 and parameters: {'start': 'lp', 'eim_R': 16, 'eim_Tmin': 0.00013246974647468452, 'eim_Tratio': 5.476757973912916, 'eim_moves': 52984, 'p_add': 0.0716766437045232, 'p_swap': 0.8407909904010871, 'topw': 11, 'eim_rho': 4.5566719139214715, 'eim_hscale': 0.6218230782016851, 'eim_anneal': 0.7664913525398744, 'eim_eta': 0.23358825194833557, 'g_scale': 1370.4648392849028}. Best is trial 0 with value: -0.08495624275639291.
[F1__eim__b1] trial 1: +0.43751 [1.0, 1.0, 1.0, 1.0, -0.1134, -0.1478, -0.1104, -0.1283] {"eim_R": 64, "eim_Tmax": 0.022388264096178515, "eim_Tmin": 5.6279320474151646e-06, "eim_anneal": 0.07032569761590807, "eim_eta": 0.018255254802399014, "eim_hsc
[I 2026-10-01 15:05:21,837] Trial 1 finished with value: 0.4375107297636186 and parameters: {'start': 'pgreedy', 'eim_R': 64, 'eim_Tmin': 5.6279320474151646e-06, 'eim_Tratio': 3978.0622629338873, 'eim_moves': 174910, 'p_add': 0.19172075941288885, 'p_swap': 0.6420036530145916, 'topw': 11, 'eim_rho': 18.71450068624066, 'eim_hscale': 59.812219011525556, 'eim_anneal': 0.07032569761590807, 'eim_eta': 0.018255254802399014, 'g_scale': 109.7581541938016}. Best is trial 0 with value: -0.08495624275639291.
[F1__eim__b1] trial 2: -0.08290 [-0.1144, -0.1542, -0.064, -0.0732, -0.0546, -0.0779, -0.0626, -0.0622] {"eim_R": 16, "eim_Tmax": 0.0007255047403074508, "eim_Tmin": 0.00013246974647468452, "eim_anneal": 0.7664913525398744, "eim_eta": 0.23358825194833557, "eim_hsca
[I 2026-10-01 15:05:31,594] Trial 2 finished with value: -0.08290294473062737 and parameters: {'start': 'lp', 'eim_R': 16, 'eim_Tmin': 0.00013246974647468452, 'eim_Tratio': 5.476757973912916, 'eim_moves': 52984, 'p_add': 0.0716766437045232, 'p_swap': 0.8407909904010871, 'topw': 11, 'eim_rho': 4.5566719139214715, 'eim_hscale': 0.6218230782016851, 'eim_anneal': 0.7664913525398744, 'eim_eta': 0.23358825194833557, 'g_scale': 1370.4648392849028}. Best is trial 0 with value: -0.08495624275639291.
[F1__eim__b1] trial 3: -0.11678 [-0.046, -0.1415, -0.0746, -0.1351, -0.129, -0.1563, -0.115, -0.1368] {"eim_R": 32, "eim_Tmax": 0.00022679302095938696, "eim_Tmin": 2.741773675242096e-06, "eim_anneal": 0.312274067414942, "eim_eta": 0.1233480570086002, "eim_hscale
[I 2026-10-01 15:05:41,602] Trial 3 finished with value: -0.11678146829360553 and parameters: {'start': 'pgreedy', 'eim_R': 32, 'eim_Tmin': 2.741773675242096e-06, 'eim_Tratio': 82.71763019949535, 'eim_moves': 65555, 'p_add': 0.030112735814634917, 'p_swap': 0.6799968666320435, 'topw': 19, 'eim_rho': 0.6942729492430144, 'eim_hscale': 0.24365700014641997, 'eim_anneal': 0.312274067414942, 'eim_eta': 0.1233480570086002, 'g_scale': 1381.6356822574794}. Best is trial 3 with value: -0.11678146829360553.
[F1__eim__b1] trial 4: -0.08986 [-0.0894, -0.1172, -0.055, -0.13, -0.0727, -0.0959, -0.0813, -0.0774] {"eim_R": 32, "eim_Tmax": 0.0005564713090974977, "eim_Tmin": 1.1943200649924919e-06, "eim_anneal": 0.38444818294888694, "eim_eta": 0.9878713308947645, "eim_hsca
[I 2026-10-01 15:05:51,318] Trial 4 finished with value: -0.08986498374068538 and parameters: {'start': 'pgreedy', 'eim_R': 32, 'eim_Tmin': 1.1943200649924919e-06, 'eim_Tratio': 465.9314746595972, 'eim_moves': 14012, 'p_add': 0.027658161561770225, 'p_swap': 0.2275256149678082, 'topw': 34, 'eim_rho': 19.102405037238547, 'eim_hscale': 0.33552530712580364, 'eim_anneal': 0.38444818294888694, 'eim_eta': 0.9878713308947645, 'g_scale': 2689.7466116165456}. Best is trial 3 with value: -0.11678146829360553.
[F1__eim__b1] trial 5: -0.00673 [-0.0024, -0.0114, -0.0019, -0.0182, 0.0026, -0.0297, 0.0072, 0.0] {"eim_R": 32, "eim_Tmax": 0.00045129537624177905, "eim_Tmin": 8.801165700619654e-07, "eim_anneal": 0.0679860061723011, "eim_eta": 0.08834979135012186, "eim_hsca
[I 2026-10-01 15:06:01,084] Trial 5 finished with value: -0.00672591171362065 and parameters: {'start': 'pgreedy', 'eim_R': 32, 'eim_Tmin': 8.801165700619654e-07, 'eim_Tratio': 512.7677305405183, 'eim_moves': 30610, 'p_add': 0.4833560442564897, 'p_swap': 0.28851454105948876, 'topw': 39, 'eim_rho': 0.3772738764687454, 'eim_hscale': 0.1721537397942278, 'eim_anneal': 0.0679860061723011, 'eim_eta': 0.08834979135012186, 'g_scale': 268.20075014564156}. Best is trial 3 with value: -0.11678146829360553.
[F1__eim__b1] trial 6: -0.01828 [-0.0086, -0.023, -0.0031, -0.0356, -0.0106, -0.0355, -0.0181, -0.0117] {"eim_R": 32, "eim_Tmax": 0.0002387626201654783, "eim_Tmin": 2.348418844873358e-05, "eim_anneal": 0.4171028155224339, "eim_eta": 0.6151974602150331, "eim_hscale
[I 2026-10-01 15:06:11,450] Trial 6 finished with value: -0.01827962684562348 and parameters: {'start': 'pgreedy', 'eim_R': 32, 'eim_Tmin': 2.348418844873358e-05, 'eim_Tratio': 10.166952146832816, 'eim_moves': 185013, 'p_add': 0.45856538713788186, 'p_swap': 0.3848469858358715, 'topw': 4, 'eim_rho': 1.6605414256086768, 'eim_hscale': 0.2795361254300747, 'eim_anneal': 0.4171028155224339, 'eim_eta': 0.6151974602150331, 'g_scale': 285.79254258339193}. Best is trial 3 with value: -0.11678146829360553.
[F1__eim__b1] trial 7: -0.12303 [-0.1077, -0.142, -0.0746, -0.1467, -0.1192, -0.1536, -0.1101, -0.1302] {"eim_R": 32, "eim_Tmax": 0.003583986660864503, "eim_Tmin": 5.783861854309937e-05, "eim_anneal": 0.12409113813250239, "eim_eta": 0.34260036476627304, "eim_hscal
[I 2026-10-01 15:06:21,832] Trial 7 finished with value: -0.12303029713317269 and parameters: {'start': 'pgreedy', 'eim_R': 32, 'eim_Tmin': 5.783861854309937e-05, 'eim_Tratio': 61.965288091966414, 'eim_moves': 104211, 'p_add': 0.14263230801054813, 'p_swap': 0.5234958816794935, 'topw': 12, 'eim_rho': 943.9510613981709, 'eim_hscale': 0.1304777081943831, 'eim_anneal': 0.12409113813250239, 'eim_eta': 0.34260036476627304, 'g_scale': 7782.319746550366}. Best is trial 7 with value: -0.12303029713317269.
[F1__eim__b1] trial 8: -0.12122 [-0.1047, -0.1388, -0.0709, -0.1466, -0.1205, -0.151, -0.1057, -0.1316] {"eim_R": 32, "eim_Tmax": 0.009266996868079566, "eim_Tmin": 8.460778489140477e-05, "eim_anneal": 0.48326296530919416, "eim_eta": 9.862970629481364, "eim_hscale"
[I 2026-10-01 15:06:31,584] Trial 8 finished with value: -0.12121960032568695 and parameters: {'start': 'pgreedy', 'eim_R': 32, 'eim_Tmin': 8.460778489140477e-05, 'eim_Tratio': 109.52889122406268, 'eim_moves': 61373, 'p_add': 0.14061170257712421, 'p_swap': 0.46479896104016744, 'topw': 8, 'eim_rho': 29.10555138799154, 'eim_hscale': 1.0081390911459134, 'eim_anneal': 0.48326296530919416, 'eim_eta': 9.862970629481364, 'g_scale': 399.2739757861661}. Best is trial 7 with value: -0.12303029713317269.
[F1__eim__b1] trial 9: +0.02940 [-0.1029, -0.1371, -0.0709, -0.1411, -0.106, 1.0, -0.0952, -0.1115] {"eim_R": 32, "eim_Tmax": 0.01127024857558427, "eim_Tmin": 1.810432741134714e-05, "eim_anneal": 0.008072696255517472, "eim_eta": 0.010940731465010017, "eim_hsca
[I 2026-10-01 15:06:42,773] Trial 9 finished with value: 0.029400152596200407 and parameters: {'start': 'pgreedy', 'eim_R': 32, 'eim_Tmin': 1.810432741134714e-05, 'eim_Tratio': 622.5168336560508, 'eim_moves': 101083, 'p_add': 0.06716824062757885, 'p_swap': 0.5576751750356489, 'topw': 4, 'eim_rho': 468.7820423204048, 'eim_hscale': 0.15681333431890665, 'eim_anneal': 0.008072696255517472, 'eim_eta': 0.010940731465010017, 'g_scale': 3298.5434065056934}. Best is trial 7 with value: -0.12303029713317269.
[F1__eim__b1] trial 10: -0.11555 [-0.1063, -0.1385, -0.0707, -0.1427, -0.1069, -0.1379, -0.1007, -0.1208] {"eim_R": 32, "eim_Tmax": 1.9440117362666638, "eim_Tmin": 0.00046486006801398067, "eim_anneal": 0.3688404475927518, "eim_eta": 0.3290945110576078, "eim_hscale":
[I 2026-10-01 15:06:52,570] Trial 10 finished with value: -0.11555374822548775 and parameters: {'start': 'pgreedy', 'eim_R': 32, 'eim_Tmin': 0.00046486006801398067, 'eim_Tratio': 4181.928864253829, 'eim_moves': 24590, 'p_add': 0.25433540653086023, 'p_swap': 0.3670537704571415, 'topw': 9, 'eim_rho': 21.50085923648859, 'eim_hscale': 0.3866079212937139, 'eim_anneal': 0.3688404475927518, 'eim_eta': 0.3290945110576078, 'g_scale': 6563.968642271072}. Best is trial 7 with value: -0.12303029713317269.
[F1__eim__b1] trial 11: +1.00000 [1.0, 1.0, 1.0, 1.0, 1.0, 1.0, 1.0, 1.0] {"eim_R": 32, "eim_Tmax": 0.08621187607408698, "eim_Tmin": 0.00020356691834271277, "eim_anneal": 0.7968759848697708, "eim_eta": 1.9629517008494923, "eim_hscale"
