[I 2026-10-01 16:30:50,502] Trial 11 finished with value: -0.13201701485259704 and parameters: {'start': 'lp', 'eim_R': 16, 'eim_Tmin': 0.0003125546686357562, 'eim_Tratio': 45.25017303780048, 'eim_moves': 22394, 'p_add': 0.045374540398040876, 'p_swap': 0.8896929648474976, 'topw': 9, 'eim_rho': 0.5296758960028881, 'eim_hscale': 1.7978607468192138, 'eim_anneal': 0.7869095566701645, 'eim_eta': 0.099778580230513, 'g_scale': 1466.1457290030783}. Best is trial 0 with value: -0.15038189871815938.
[F1__eim__b3] BEST t0 -0.15038 cfg={"eim_R": 16, "eim_Tmax": 0.0007255047403074508, "eim_Tmin": 0.00013246974647468452, "eim_anneal": 0.7664913525398744, "eim_eta": 0.23358825194833557, "eim_hscale": 0.6218230782016851, "eim_moves": 52984, "eim_rho": 4.5566719139214715, "g_scale": 1370.4648392849028, "p_add": 0.0716766437045232, "p_swap": 0.8407909904010871, "start": "lp", "topw": 11}
[I 2026-10-01 16:30:50,530] A new study created in RDB with name: F1__milp__b3
[F1__milp__b3] trial 0: -0.11160 [-0.1183, -0.1486, -0.065, -0.1084, -0.0745, -0.1551, -0.058, -0.1648] {"eps_tie": 0.0, "mip_heuristic_effort": 0.8077206102454388, "presolve": "off", "start": "pgreedy"}
[I 2026-10-01 16:31:15,535] Trial 0 finished with value: -0.1115954147774488 and parameters: {'start': 'pgreedy', 'presolve': 'off', 'mip_heuristic_effort': 0.8077206102454388, 'eps_tie': 0.0}. Best is trial 0 with value: -0.1115954147774488.
[F1__milp__b3] trial 1: +0.62490 [-0.0015, 0.0006, 0.0, 1.0, 1.0, 1.0, 1.0, 1.0] {"eps_tie": 0.0, "mip_heuristic_effort": 0.10490756141474163, "presolve": "on", "start": "pgreedy"}
[I 2026-10-01 16:37:46,426] Trial 1 finished with value: 0.6248952892594382 and parameters: {'start': 'pgreedy', 'presolve': 'on', 'mip_heuristic_effort': 0.10490756141474163, 'eps_tie': 0.0}. Best is trial 0 with value: -0.1115954147774488.
[F1__milp__b3] trial 2: -0.12573 [-0.1128, -0.0562, -0.0691, -0.1497, -0.1551, -0.1711, -0.1362, -0.1557] {"eps_tie": 0.0001, "mip_heuristic_effort": 0.15834581868043074, "presolve": "off", "start": "pgreedy"}
[I 2026-10-01 16:38:14,993] Trial 2 finished with value: -0.12573356895505614 and parameters: {'start': 'pgreedy', 'presolve': 'off', 'mip_heuristic_effort': 0.15834581868043074, 'eps_tie': 0.0001}. Best is trial 2 with value: -0.12573356895505614.
[F1__milp__b3] trial 3: -0.13565 [-0.1136, -0.1498, -0.0653, -0.1633, -0.1454, -0.1616, -0.125, -0.1611] {"eps_tie": 0.0001, "mip_heuristic_effort": 0.41985078951584265, "presolve": "off", "start": "pgreedy"}
[I 2026-10-01 16:38:55,201] Trial 3 finished with value: -0.13564576938723644 and parameters: {'start': 'pgreedy', 'presolve': 'off', 'mip_heuristic_effort': 0.41985078951584265, 'eps_tie': 0.0001}. Best is trial 3 with value: -0.13564576938723644.
[F1__milp__b3] trial 4: +0.43890 [-0.1093, -0.1463, -0.0619, 1.0, 1.0, -0.1714, 1.0, 1.0] {"eps_tie": 0.0001, "mip_heuristic_effort": 0.8527431862329753, "presolve": "on", "start": "lp"}
[I 2026-10-01 16:40:08,778] Trial 4 finished with value: 0.43890227148288263 and parameters: {'start': 'lp', 'presolve': 'on', 'mip_heuristic_effort': 0.8527431862329753, 'eps_tie': 0.0001}. Best is trial 3 with value: -0.13564576938723644.
[F1__milp__b3] trial 5: -0.13969 [-0.1161, -0.154, -0.0653, -0.1631, -0.1498, -0.1714, -0.1391, -0.1587] {"eps_tie": 0.0001, "mip_heuristic_effort": 0.0717020027989697, "presolve": "off", "start": "lp"}
[I 2026-10-01 16:45:42,558] Trial 5 finished with value: -0.13968764288468172 and parameters: {'start': 'lp', 'presolve': 'off', 'mip_heuristic_effort': 0.0717020027989697, 'eps_tie': 0.0001}. Best is trial 5 with value: -0.13968764288468172.
[F1__milp__b3] trial 6: -0.13788 [-0.1115, -0.1522, -0.0653, -0.1631, -0.1372, -0.1732, -0.1398, -0.1607] {"eps_tie": 0.0001, "mip_heuristic_effort": 0.026835444360603953, "presolve": "off", "start": "lp"}
[I 2026-10-01 16:46:22,021] Trial 6 finished with value: -0.13787561532906698 and parameters: {'start': 'lp', 'presolve': 'off', 'mip_heuristic_effort': 0.026835444360603953, 'eps_tie': 0.0001}. Best is trial 5 with value: -0.13968764288468172.
[F1__milp__b3] trial 7: -0.13989 [-0.111, -0.1524, -0.0653, -0.1669, -0.1478, -0.1795, -0.1349, -0.1614] {"eps_tie": 0.0, "mip_heuristic_effort": 0.11801028004308105, "presolve": "off", "start": "lp"}
[I 2026-10-01 16:46:51,682] Trial 7 finished with value: -0.1398937169062474 and parameters: {'start': 'lp', 'presolve': 'off', 'mip_heuristic_effort': 0.11801028004308105, 'eps_tie': 0.0}. Best is trial 7 with value: -0.1398937169062474.
[F1__milp__b3] trial 8: -0.14064 [-0.1153, -0.1506, -0.0653, -0.1674, -0.1523, -0.1771, -0.1395, -0.1575] {"eps_tie": 0.0, "mip_heuristic_effort": 0.12023390394962898, "presolve": "off", "start": "lp"}
[I 2026-10-01 16:47:14,313] Trial 8 finished with value: -0.1406400451340955 and parameters: {'start': 'lp', 'presolve': 'off', 'mip_heuristic_effort': 0.12023390394962898, 'eps_tie': 0.0}. Best is trial 8 with value: -0.1406400451340955.
[F1__milp__b3] trial 9: +0.29432 [-0.111, -0.1452, -0.0637, 1.0, 1.0, -0.1697, 1.0, -0.1558] {"eps_tie": 0.0, "mip_heuristic_effort": 0.02946618193549785, "presolve": "on", "start": "lp"}
[I 2026-10-01 16:51:18,670] Trial 9 finished with value: 0.2943218425164138 and parameters: {'start': 'lp', 'presolve': 'on', 'mip_heuristic_effort': 0.02946618193549785, 'eps_tie': 0.0}. Best is trial 8 with value: -0.1406400451340955.
[F1__milp__b3] trial 10: -0.13997 [-0.1132, -0.1514, -0.0653, -0.1696, -0.1506, -0.1726, -0.1395, -0.1575] {"eps_tie": 0.0, "mip_heuristic_effort": 0.41446703739629803, "presolve": "off", "start": "lp"}
[I 2026-10-01 16:56:38,831] Trial 10 finished with value: -0.13996663400399284 and parameters: {'start': 'lp', 'presolve': 'off', 'mip_heuristic_effort': 0.41446703739629803, 'eps_tie': 0.0}. Best is trial 8 with value: -0.1406400451340955.
[F1__milp__b3] trial 11: -0.14080 [-0.116, -0.1525, -0.0653, -0.1652, -0.1431, -0.1865, -0.1415, -0.1563] {"eps_tie": 0.0, "mip_heuristic_effort": 0.3864458389180624, "presolve": "off", "start": "lp"}
[I 2026-10-01 16:57:01,915] Trial 11 finished with value: -0.1407976491489199 and parameters: {'start': 'lp', 'presolve': 'off', 'mip_heuristic_effort': 0.3864458389180624, 'eps_tie': 0.0}. Best is trial 11 with value: -0.1407976491489199.
[F1__milp__b3] BEST t11 -0.14080 cfg={"eps_tie": 0.0, "mip_heuristic_effort": 0.3864458389180624, "presolve": "off", "start": "lp"}
[I 2026-10-01 16:57:01,953] A new study created in RDB with name: F1__sb__b3
[F1__sb__b3] trial 0: -0.13342 [-0.1106, -0.1478, -0.0613, -0.1581, -0.1347, -0.167, -0.1342, -0.1536] {"sb_agents": 32, "sb_alpha_floor": 0.19397546899179888, "sb_dt": 1.4232321618458184, "sb_eta": 0.0965605178058406, "sb_eta_mu": 4.719399631690194, "sb_heat": 0
[I 2026-10-01 16:57:47,892] Trial 0 finished with value: -0.13342176572795145 and parameters: {'start': 'lp', 'sb_agents': 32, 'sb_steps': 1432, 'sb_dt': 1.4232321618458184, 'sb_variant': 'ballistic', 'sb_heat': 0.0125536250820598, 'sb_xi': 0.07953090488826875, 'sb_warm': 0.10136029824871645, 'sb_eta_mu': 4.719399631690194, 'sb_alpha_floor': 0.19397546899179888, 'sb_tau_frac': 0.9386113363824448, 'sb_eta': 0.0965605178058406}. Best is trial 0 with value: -0.13342176572795145.
[F1__sb__b3] trial 1: -0.00042 [0.0, 0.0096, 0.0, -0.0127, 0.0, -0.0003, 0.0, 0.0] {"sb_agents": 64, "sb_alpha_floor": 0.017425859940308142, "sb_dt": 1.3593049010167038, "sb_eta": 2.3131814207377923, "sb_eta_mu": 0.0163345876110695, "sb_heat":
[I 2026-10-01 17:03:14,405] Trial 1 finished with value: -0.00041959653364390115 and parameters: {'start': 'pgreedy', 'sb_agents': 64, 'sb_steps': 250, 'sb_dt': 1.3593049010167038, 'sb_variant': 'ballistic', 'sb_heat': 0.060428515788450606, 'sb_xi': 0.5117279648784191, 'sb_warm': 0.8793168063780279, 'sb_eta_mu': 0.0163345876110695, 'sb_alpha_floor': 0.017425859940308142, 'sb_tau_frac': 0.9020218397440326, 'sb_eta': 2.3131814207377923}. Best is trial 0 with value: -0.13342176572795145.
[F1__sb__b3] trial 2: +0.00162 [0.0, 0.0113, -0.0007, 0.0, 0.0, 0.0, 0.0023, 0.0] {"sb_agents": 8, "sb_alpha_floor": 0.1136867897737297, "sb_dt": 1.031897327725781, "sb_eta": 0.8594903371659688, "sb_eta_mu": 0.23358825194833557, "sb_heat": 0.
[I 2026-10-01 17:03:53,864] Trial 2 finished with value: 0.0016182946577816826 and parameters: {'start': 'pgreedy', 'sb_agents': 8, 'sb_steps': 77, 'sb_dt': 1.031897327725781, 'sb_variant': 'discrete', 'sb_heat': 0.040973773756855375, 'sb_xi': 0.14770319740236926, 'sb_warm': 0.7355220049625057, 'sb_eta_mu': 0.23358825194833557, 'sb_alpha_floor': 0.1136867897737297, 'sb_tau_frac': 0.9018789800436355, 'sb_eta': 0.8594903371659688}. Best is trial 0 with value: -0.13342176572795145.
[F1__sb__b3] trial 3: -0.00084 [0.0, 0.0008, 0.0, 0.0, 0.0, -0.0013, -0.0062, 0.0] {"sb_agents": 8, "sb_alpha_floor": 0.08772030269246407, "sb_dt": 0.2782931131180508, "sb_eta": 0.07999440746315747, "sb_eta_mu": 0.513558960650023, "sb_heat": 0
[I 2026-10-01 17:04:42,409] Trial 3 finished with value: -0.0008423106424844812 and parameters: {'start': 'pgreedy', 'sb_agents': 8, 'sb_steps': 654, 'sb_dt': 0.2782931131180508, 'sb_variant': 'discrete', 'sb_heat': 0.015503857733727292, 'sb_xi': 0.18190696204307705, 'sb_warm': 0.3455252323954915, 'sb_eta_mu': 0.513558960650023, 'sb_alpha_floor': 0.08772030269246407, 'sb_tau_frac': 0.9988373838059226, 'sb_eta': 0.07999440746315747}. Best is trial 0 with value: -0.13342176572795145.
[F1__sb__b3] trial 4: -0.13371 [-0.1093, -0.1466, -0.0619, -0.1587, -0.1358, -0.1697, -0.1342, -0.1536] {"sb_agents": 32, "sb_alpha_floor": 0.14788120216290157, "sb_dt": 1.0142779372363275, "sb_eta": 0.9416063374779005, "sb_eta_mu": 6.719994515642705, "sb_heat": 0
[I 2026-10-01 17:16:48,146] Trial 4 finished with value: -0.13371220002235767 and parameters: {'start': 'lp', 'sb_agents': 32, 'sb_steps': 414, 'sb_dt': 1.0142779372363275, 'sb_variant': 'ballistic', 'sb_heat': 0.05067891126906621, 'sb_xi': 0.21687872938457173, 'sb_warm': 0.24329656153260945, 'sb_eta_mu': 6.719994515642705, 'sb_alpha_floor': 0.14788120216290157, 'sb_tau_frac': 0.951494525653459, 'sb_eta': 0.9416063374779005}. Best is trial 4 with value: -0.13371220002235767.
[F1__sb__b3] trial 5: -0.13426 [-0.1144, -0.1502, -0.0637, -0.1581, -0.1347, -0.1652, -0.1342, -0.1536] {"sb_agents": 32, "sb_alpha_floor": 0.08251887365127113, "sb_dt": 1.2492031628525258, "sb_eta": 0.5053090215444561, "sb_eta_mu": 0.44670887132732795, "sb_heat":
[I 2026-10-01 17:17:23,676] Trial 5 finished with value: -0.13426419526178812 and parameters: {'start': 'lp', 'sb_agents': 32, 'sb_steps': 450, 'sb_dt': 1.2492031628525258, 'sb_variant': 'ballistic', 'sb_heat': 0.09764361404518028, 'sb_xi': 0.0761632724913781, 'sb_warm': 0.6957095545119003, 'sb_eta_mu': 0.44670887132732795, 'sb_alpha_floor': 0.08251887365127113, 'sb_tau_frac': 0.9539729822516326, 'sb_eta': 0.5053090215444561}. Best is trial 5 with value: -0.13426419526178812.
[F1__sb__b3] trial 6: -0.13275 [-0.1097, -0.1417, -0.0644, -0.1581, -0.1347, -0.1684, -0.1342, -0.1508] {"sb_agents": 32, "sb_alpha_floor": 0.010277613280485376, "sb_dt": 1.3610825686445462, "sb_eta": 0.3726408156361957, "sb_eta_mu": 0.09497492375156134, "sb_heat"
[I 2026-10-01 17:18:09,371] Trial 6 finished with value: -0.13274681553107942 and parameters: {'start': 'lp', 'sb_agents': 32, 'sb_steps': 1559, 'sb_dt': 1.3610825686445462, 'sb_variant': 'ballistic', 'sb_heat': 0.2260537422899784, 'sb_xi': 0.1649024644234928, 'sb_warm': 0.2122007891204064, 'sb_eta_mu': 0.09497492375156134, 'sb_alpha_floor': 0.010277613280485376, 'sb_tau_frac': 0.9779217219938638, 'sb_eta': 0.3726408156361957}. Best is trial 5 with value: -0.13426419526178812.
[F1__sb__b3] trial 7: -0.13454 [-0.1075, -0.1515, -0.0604, -0.1617, -0.1377, -0.1692, -0.1343, -0.1541] {"sb_agents": 32, "sb_alpha_floor": 0.10495505384946222, "sb_dt": 0.2160066056566079, "sb_eta": 1.2217235389541414, "sb_eta_mu": 0.1904447617876336, "sb_heat": 
[I 2026-10-01 17:18:39,104] Trial 7 finished with value: -0.1345432928656642 and parameters: {'start': 'lp', 'sb_agents': 32, 'sb_steps': 507, 'sb_dt': 0.2160066056566079, 'sb_variant': 'ballistic', 'sb_heat': 0.02663989797176289, 'sb_xi': 0.0787719113682172, 'sb_warm': 0.7669725518987822, 'sb_eta_mu': 0.1904447617876336, 'sb_alpha_floor': 0.10495505384946222, 'sb_tau_frac': 0.942607649775167, 'sb_eta': 1.2217235389541414}. Best is trial 7 with value: -0.1345432928656642.
[F1__sb__b3] trial 8: -0.13380 [-0.1117, -0.1461, -0.0609, -0.1572, -0.137, -0.1697, -0.1343, -0.1536] {"sb_agents": 32, "sb_alpha_floor": 0.1520780094869143, "sb_dt": 0.9780940663730825, "sb_eta": 4.146720352817277, "sb_eta_mu": 0.0265801477904235, "sb_heat": 0.
[I 2026-10-01 17:19:11,311] Trial 8 finished with value: -0.13380333472256978 and parameters: {'start': 'lp', 'sb_agents': 32, 'sb_steps': 644, 'sb_dt': 0.9780940663730825, 'sb_variant': 'ballistic', 'sb_heat': 0.015212900372831396, 'sb_xi': 1.7945455492951257, 'sb_warm': 0.6133071978997868, 'sb_eta_mu': 0.0265801477904235, 'sb_alpha_floor': 0.1520780094869143, 'sb_tau_frac': 0.9347587259411718, 'sb_eta': 4.146720352817277}. Best is trial 7 with value: -0.1345432928656642.
[F1__sb__b3] trial 9: -0.13361 [-0.1112, -0.1451, -0.0637, -0.1581, -0.1367, -0.1663, -0.1342, -0.1536] {"sb_agents": 32, "sb_alpha_floor": 0.11851535463515264, "sb_dt": 0.41111377657853865, "sb_eta": 0.24862430084276013, "sb_eta_mu": 0.13644901880470514, "sb_heat
[I 2026-10-01 17:19:41,467] Trial 9 finished with value: -0.13360950482307343 and parameters: {'start': 'lp', 'sb_agents': 32, 'sb_steps': 1847, 'sb_dt': 0.41111377657853865, 'sb_variant': 'ballistic', 'sb_heat': 0.019211785607746258, 'sb_xi': 2.030895992201884, 'sb_warm': 0.35440412454419934, 'sb_eta_mu': 0.13644901880470514, 'sb_alpha_floor': 0.11851535463515264, 'sb_tau_frac': 0.947890720634899, 'sb_eta': 0.24862430084276013}. Best is trial 7 with value: -0.1345432928656642.
[F1__sb__b3] trial 10: +0.14051 [-0.1117, -0.1498, 1.0, -0.1581, -0.1347, -0.1684, 1.0, -0.1532] {"sb_agents": 32, "sb_alpha_floor": 0.1908208500640145, "sb_dt": 0.23082356718105304, "sb_eta": 0.521550401214697, "sb_eta_mu": 0.5057376644710746, "sb_heat": 0
[I 2026-10-01 17:25:16,791] Trial 10 finished with value: 0.14051302285763617 and parameters: {'start': 'lp', 'sb_agents': 32, 'sb_steps': 705, 'sb_dt': 0.23082356718105304, 'sb_variant': 'ballistic', 'sb_heat': 0.1496440355384449, 'sb_xi': 0.1565238147303939, 'sb_warm': 0.7171407470866559, 'sb_eta_mu': 0.5057376644710746, 'sb_alpha_floor': 0.1908208500640145, 'sb_tau_frac': 0.9241967093764256, 'sb_eta': 0.521550401214697}. Best is trial 7 with value: -0.1345432928656642.
[F1__sb__b3] trial 11: -0.13403 [-0.1145, -0.1487, -0.0609, -0.1581, -0.1347, -0.1687, -0.1332, -0.1535] {"sb_agents": 32, "sb_alpha_floor": 0.08522332310676776, "sb_dt": 1.0049728408727778, "sb_eta": 0.2378877059938165, "sb_eta_mu": 0.18740583854764623, "sb_heat":
[I 2026-10-01 17:26:04,071] Trial 11 finished with value: -0.13402967889540945 and parameters: {'start': 'lp', 'sb_agents': 32, 'sb_steps': 876, 'sb_dt': 1.0049728408727778, 'sb_variant': 'ballistic', 'sb_heat': 0.020611250598577505, 'sb_xi': 0.10563939657292454, 'sb_warm': 0.6573754621316215, 'sb_eta_mu': 0.18740583854764623, 'sb_alpha_floor': 0.08522332310676776, 'sb_tau_frac': 0.9312026109211035, 'sb_eta': 0.2378877059938165}. Best is trial 7 with value: -0.1345432928656642.
[F1__sb__b3] BEST t7 -0.13454 cfg={"sb_agents": 32, "sb_alpha_floor": 0.10495505384946222, "sb_dt": 0.2160066056566079, "sb_eta": 1.2217235389541414, "sb_eta_mu": 0.1904447617876336, "sb_heat": 0.02663989797176289, "sb_steps": 507, "sb_tau_frac": 0.942607649775167, "sb_variant": "ballistic", "sb_warm": 0.7669725518987822, "sb_xi": 0.0787719113682172, "start": "lp"}
[I 2026-10-01 17:26:04,109] A new study created in RDB with name: F1__cpsat__b3
[F1__cpsat__b3] trial 0: -0.11388 [-0.1152, -0.1496, -0.0746, -0.1615, -0.1411, -0.0742, -0.1355, -0.0592] {"cp_model_presolve": false, "linearization_level": 1, "repair_hint": false, "start": "lp"}
[I 2026-10-01 17:31:33,841] Trial 0 finished with value: -0.1138760194718394 and parameters: {'start': 'lp', 'linearization_level': 1, 'repair_hint': False, 'cp_model_presolve': False}. Best is trial 0 with value: -0.1138760194718394.
[F1__cpsat__b3] trial 1: -0.00262 [-0.0117, -0.0075, -0.0018, 0.0, 0.0, 0.0, 0.0, 0.0] {"cp_model_presolve": true, "linearization_level": 1, "repair_hint": false, "start": "pgreedy"}
[I 2026-10-01 17:32:09,495] Trial 1 finished with value: -0.0026172029996139323 and parameters: {'start': 'pgreedy', 'linearization_level': 1, 'repair_hint': False, 'cp_model_presolve': True}. Best is trial 0 with value: -0.1138760194718394.
[F1__cpsat__b3] trial 2: -0.06335 [-0.0712, -0.087, -0.0524, -0.0759, -0.0865, -0.0876, 0.012, -0.0582] {"cp_model_presolve": false, "linearization_level": 1, "repair_hint": false, "start": "pgreedy"}
[I 2026-10-01 17:32:34,739] Trial 2 finished with value: -0.0633484702767457 and parameters: {'start': 'pgreedy', 'linearization_level': 1, 'repair_hint': False, 'cp_model_presolve': False}. Best is trial 0 with value: -0.1138760194718394.
[F1__cpsat__b3] trial 3: -0.04169 [-0.0293, -0.0906, -0.0529, -0.0566, 0.0061, -0.0755, -0.0311, -0.0036] {"cp_model_presolve": false, "linearization_level": 0, "repair_hint": false, "start": "pgreedy"}
[I 2026-10-01 17:38:14,886] Trial 3 finished with value: -0.04169157345889228 and parameters: {'start': 'pgreedy', 'linearization_level': 0, 'repair_hint': False, 'cp_model_presolve': False}. Best is trial 0 with value: -0.1138760194718394.
[F1__cpsat__b3] trial 4: -0.12674 [-0.1161, -0.1511, -0.0746, -0.1601, -0.1407, -0.1772, -0.1354, -0.0587] {"cp_model_presolve": false, "linearization_level": 2, "repair_hint": false, "start": "lp"}
[I 2026-10-01 17:38:53,648] Trial 4 finished with value: -0.12674070829494105 and parameters: {'start': 'lp', 'linearization_level': 2, 'repair_hint': False, 'cp_model_presolve': False}. Best is trial 4 with value: -0.12674070829494105.
Check failed: heuristics.fixed_search != nullptr 
*** Check failure stack trace: ***
[F1__cpsat__b3] trial 5: +1.00000 [1.0, 1.0, 1.0, 1.0, 1.0, 1.0, 1.0, 1.0] {"cp_model_presolve": false, "linearization_level": 2, "repair_hint": true, "start": "lp"}
[I 2026-10-01 17:39:03,659] Trial 5 finished with value: 1.0 and parameters: {'start': 'lp', 'linearization_level': 2, 'repair_hint': True, 'cp_model_presolve': False}. Best is trial 4 with value: -0.12674070829494105.
[F1__cpsat__b3] trial 6: -0.12229 [-0.1146, -0.1488, -0.0613, -0.1581, -0.1347, -0.1701, -0.1342, -0.0564] {"cp_model_presolve": true, "linearization_level": 0, "repair_hint": false, "start": "lp"}
[I 2026-10-01 17:40:57,838] Trial 6 finished with value: -0.12228724970094529 and parameters: {'start': 'lp', 'linearization_level': 0, 'repair_hint': False, 'cp_model_presolve': True}. Best is trial 4 with value: -0.12674070829494105.
[F1__cpsat__b3] trial 7: -0.11443 [-0.1157, -0.1533, -0.0746, -0.1622, -0.1395, -0.076, -0.1368, -0.0574] {"cp_model_presolve": false, "linearization_level": 2, "repair_hint": false, "start": "lp"}
[I 2026-10-01 17:41:20,959] Trial 7 finished with value: -0.11443182119095174 and parameters: {'start': 'lp', 'linearization_level': 2, 'repair_hint': False, 'cp_model_presolve': False}. Best is trial 4 with value: -0.12674070829494105.
[F1__cpsat__b3] trial 8: -0.12669 [-0.1183, -0.152, -0.0746, -0.1605, -0.1403, -0.1775, -0.1319, -0.0584] {"cp_model_presolve": false, "linearization_level": 0, "repair_hint": false, "start": "lp"}
[I 2026-10-01 17:41:44,126] Trial 8 finished with value: -0.1266887545359134 and parameters: {'start': 'lp', 'linearization_level': 0, 'repair_hint': False, 'cp_model_presolve': False}. Best is trial 4 with value: -0.12674070829494105.
Check failed: heuristics.fixed_search != nullptr 
*** Check failure stack trace: ***
[F1__cpsat__b3] trial 9: +1.00000 [1.0, 1.0, 1.0, 1.0, 1.0, 1.0, 1.0, 1.0] {"cp_model_presolve": true, "linearization_level": 1, "repair_hint": true, "start": "lp"}
[I 2026-10-01 17:46:46,183] Trial 9 finished with value: 1.0 and parameters: {'start': 'lp', 'linearization_level': 1, 'repair_hint': True, 'cp_model_presolve': True}. Best is trial 4 with value: -0.12674070829494105.
[F1__cpsat__b3] trial 10: -0.05091 [-0.0269, -0.0502, -0.0533, -0.0637, -0.0128, -0.0915, -0.0412, -0.0676] {"cp_model_presolve": false, "linearization_level": 2, "repair_hint": false, "start": "pgreedy"}
[I 2026-10-01 17:47:12,814] Trial 10 finished with value: -0.05090819137040421 and parameters: {'start': 'pgreedy', 'linearization_level': 2, 'repair_hint': False, 'cp_model_presolve': False}. Best is trial 4 with value: -0.12674070829494105.
[F1__cpsat__b3] trial 11: -0.11419 [-0.1155, -0.1515, -0.0746, -0.1618, -0.14, -0.0758, -0.136, -0.0583] {"cp_model_presolve": false, "linearization_level": 0, "repair_hint": false, "start": "lp"}
[I 2026-10-01 17:50:13,039] Trial 11 finished with value: -0.11418714036222517 and parameters: {'start': 'lp', 'linearization_level': 0, 'repair_hint': False, 'cp_model_presolve': False}. Best is trial 4 with value: -0.12674070829494105.
[F1__cpsat__b3] BEST t4 -0.12674 cfg={"cp_model_presolve": false, "linearization_level": 2, "repair_hint": false, "start": "lp"}
[I 2026-10-01 17:50:13,095] A new study created in RDB with name: F1__mq__b3
[F1__mq__b3] trial 0: -0.13869 [-0.116, -0.1502, -0.0646, -0.1635, -0.1427, -0.1772, -0.1374, -0.158] {"mq_dt": 0.06526542706084622, "mq_iters": 910, "mq_ksamp": 7, "mq_nmax": 514, "mq_pen": 0.001344312143528808, "mq_q": 2, "mq_reads": 16, "mq_solver": "mq_dsb",
