[I 2026-10-01 15:13:44,347] Trial 11 finished with value: -0.0773678238654819 and parameters: {'start': 'lp', 'linearization_level': 1, 'repair_hint': False, 'cp_model_presolve': False}. Best is trial 11 with value: -0.0773678238654819.
[F1__cpsat__b1] BEST t11 -0.07737 cfg={"cp_model_presolve": false, "linearization_level": 1, "repair_hint": false, "start": "lp"}
[I 2026-10-01 15:13:44,419] A new study created in RDB with name: F1__mq__b1
[F1__mq__b1] trial 0: -0.07908 [-0.1107, -0.1486, -0.0631, -0.0704, -0.0509, -0.0737, -0.0577, -0.0575] {"mq_dt": 0.06526542706084622, "mq_iters": 910, "mq_ksamp": 7, "mq_nmax": 514, "mq_pen": 0.001344312143528808, "mq_q": 2, "mq_reads": 16, "mq_solver": "mq_dsb",
[I 2026-10-01 15:13:53,868] Trial 0 finished with value: -0.07908233694119432 and parameters: {'start': 'lp', 'mq_solver': 'mq_dsb', 'mq_nmax': 514, 'mq_reads': 16, 'mq_iters': 910, 'mq_dt': 0.06526542706084622, 'mq_xi': 0.15316981598941554, 'mq_pen': 0.001344312143528808, 'mq_q': 2, 'mq_ksamp': 7}. Best is trial 0 with value: -0.07908233694119432.
[F1__mq__b1] trial 1: -0.00566 [-0.0047, -0.0323, -0.0022, 0.0193, 0.003, -0.0358, -0.0049, 0.0122] {"mq_dt": 0.302142578942253, "mq_iters": 926, "mq_ksamp": 1, "mq_nmax": 574, "mq_pen": 0.5981221901152552, "mq_q": 2, "mq_reads": 16, "mq_solver": "mq_bsb", "mq
[I 2026-10-01 15:14:03,153] Trial 1 finished with value: -0.005659336154275052 and parameters: {'start': 'pgreedy', 'mq_solver': 'mq_bsb', 'mq_nmax': 574, 'mq_reads': 16, 'mq_iters': 926, 'mq_dt': 0.302142578942253, 'mq_xi': 0.5117279648784191, 'mq_pen': 0.5981221901152552, 'mq_q': 2, 'mq_ksamp': 1}. Best is trial 0 with value: -0.07908233694119432.
[F1__mq__b1] trial 2: -0.02074 [-0.0086, -0.0319, -0.0208, -0.0384, -0.015, -0.0451, 0.0043, -0.0105] {"mq_dt": 1.2426835241724947, "mq_iters": 84, "mq_ksamp": 7, "mq_nmax": 870, "mq_pen": 0.017538232373118037, "mq_q": 3, "mq_reads": 8, "mq_solver": "mq_cac", "m
[I 2026-10-01 15:14:12,050] Trial 2 finished with value: -0.020744255359896102 and parameters: {'start': 'pgreedy', 'mq_solver': 'mq_cac', 'mq_nmax': 870, 'mq_reads': 8, 'mq_iters': 84, 'mq_dt': 1.2426835241724947, 'mq_xi': 0.4235407976345083, 'mq_pen': 0.017538232373118037, 'mq_q': 3, 'mq_ksamp': 7}. Best is trial 0 with value: -0.07908233694119432.
[F1__mq__b1] trial 3: -0.01516 [-0.0117, -0.0299, -0.0002, -0.0219, -0.0198, -0.0118, -0.0212, -0.0048] {"mq_dt": 0.06136635506422015, "mq_iters": 654, "mq_ksamp": 2, "mq_nmax": 531, "mq_pen": 0.10278118224157008, "mq_q": 3, "mq_reads": 4, "mq_solver": "mq_dsb", "
[I 2026-10-01 15:14:21,066] Trial 3 finished with value: -0.015158966906063151 and parameters: {'start': 'pgreedy', 'mq_solver': 'mq_dsb', 'mq_nmax': 531, 'mq_reads': 4, 'mq_iters': 654, 'mq_dt': 0.06136635506422015, 'mq_xi': 0.7666234032273203, 'mq_pen': 0.10278118224157008, 'mq_q': 3, 'mq_ksamp': 2}. Best is trial 0 with value: -0.07908233694119432.
[F1__mq__b1] trial 4: -0.07689 [-0.1073, -0.1476, -0.0573, -0.0676, -0.046, -0.0739, -0.0579, -0.0575] {"mq_dt": 0.28855868921618233, "mq_iters": 180, "mq_ksamp": 6, "mq_nmax": 1221, "mq_pen": 0.08090627131445798, "mq_q": 27, "mq_reads": 16, "mq_solver": "mq_dsb"
[I 2026-10-01 15:14:31,376] Trial 4 finished with value: -0.07689126207095459 and parameters: {'start': 'lp', 'mq_solver': 'mq_dsb', 'mq_nmax': 1221, 'mq_reads': 16, 'mq_iters': 180, 'mq_dt': 0.28855868921618233, 'mq_xi': 0.30491112001620335, 'mq_pen': 0.08090627131445798, 'mq_q': 27, 'mq_ksamp': 6}. Best is trial 0 with value: -0.07908233694119432.
[F1__mq__b1] trial 5: -0.07915 [-0.1144, -0.1512, -0.0637, -0.0697, -0.0468, -0.0736, -0.0574, -0.0565] {"mq_dt": 0.8838135795898041, "mq_iters": 588, "mq_ksamp": 1, "mq_nmax": 479, "mq_pen": 0.005108724425085228, "mq_q": 2, "mq_reads": 16, "mq_solver": "mq_dsb", 
[I 2026-10-01 15:14:40,506] Trial 5 finished with value: -0.07915212694347369 and parameters: {'start': 'lp', 'mq_solver': 'mq_dsb', 'mq_nmax': 479, 'mq_reads': 16, 'mq_iters': 588, 'mq_dt': 0.8838135795898041, 'mq_xi': 0.12912784119984957, 'mq_pen': 0.005108724425085228, 'mq_q': 2, 'mq_ksamp': 1}. Best is trial 5 with value: -0.07915212694347369.
[F1__mq__b1] trial 6: -0.07739 [-0.1097, -0.1417, -0.0644, -0.0661, -0.0509, -0.0731, -0.0568, -0.0564] {"mq_dt": 0.7407732547386514, "mq_iters": 364, "mq_ksamp": 7, "mq_nmax": 431, "mq_pen": 0.001203099583244749, "mq_q": 20, "mq_reads": 16, "mq_solver": "mq_dsb",
[I 2026-10-01 15:14:50,346] Trial 6 finished with value: -0.07738902613193958 and parameters: {'start': 'lp', 'mq_solver': 'mq_dsb', 'mq_nmax': 431, 'mq_reads': 16, 'mq_iters': 364, 'mq_dt': 0.7407732547386514, 'mq_xi': 0.6265301807040595, 'mq_pen': 0.001203099583244749, 'mq_q': 20, 'mq_ksamp': 7}. Best is trial 5 with value: -0.07915212694347369.
[F1__mq__b1] trial 7: -0.01265 [0.0011, -0.0119, -0.0165, -0.0216, -0.0104, -0.0237, -0.017, -0.0011] {"mq_dt": 0.48080390037396203, "mq_iters": 859, "mq_ksamp": 1, "mq_nmax": 396, "mq_pen": 0.0010810797294768407, "mq_q": 2, "mq_reads": 16, "mq_solver": "mq_dsb"
[I 2026-10-01 15:14:59,322] Trial 7 finished with value: -0.012653175134468037 and parameters: {'start': 'pgreedy', 'mq_solver': 'mq_dsb', 'mq_nmax': 396, 'mq_reads': 16, 'mq_iters': 859, 'mq_dt': 0.48080390037396203, 'mq_xi': 0.08031749306037739, 'mq_pen': 0.0010810797294768407, 'mq_q': 2, 'mq_ksamp': 1}. Best is trial 5 with value: -0.07915212694347369.
[F1__mq__b1] trial 8: +0.06090 [1.0, -0.147, -0.0639, -0.0679, -0.0486, -0.0732, -0.0559, -0.0564] {"mq_dt": 0.892040271610272, "mq_iters": 1526, "mq_ksamp": 3, "mq_nmax": 484, "mq_pen": 0.6493797556766182, "mq_q": 3, "mq_reads": 16, "mq_solver": "mq_dsb", "m
[I 2026-10-01 15:15:09,435] Trial 8 finished with value: 0.06090082608270675 and parameters: {'start': 'lp', 'mq_solver': 'mq_dsb', 'mq_nmax': 484, 'mq_reads': 16, 'mq_iters': 1526, 'mq_dt': 0.892040271610272, 'mq_xi': 0.14741712595975012, 'mq_pen': 0.6493797556766182, 'mq_q': 3, 'mq_ksamp': 3}. Best is trial 5 with value: -0.07915212694347369.
[F1__mq__b1] trial 9: -0.07790 [-0.1105, -0.1461, -0.0642, -0.0668, -0.0488, -0.073, -0.0574, -0.0564] {"mq_dt": 0.7103444471224386, "mq_iters": 1117, "mq_ksamp": 3, "mq_nmax": 117, "mq_pen": 0.0319553953233132, "mq_q": 19, "mq_reads": 16, "mq_solver": "mq_dsb", 
[I 2026-10-01 15:15:18,783] Trial 9 finished with value: -0.07790311652004672 and parameters: {'start': 'lp', 'mq_solver': 'mq_dsb', 'mq_nmax': 117, 'mq_reads': 16, 'mq_iters': 1117, 'mq_dt': 0.7103444471224386, 'mq_xi': 0.44597428644283155, 'mq_pen': 0.0319553953233132, 'mq_q': 19, 'mq_ksamp': 3}. Best is trial 5 with value: -0.07915212694347369.
[F1__mq__b1] trial 10: -0.07979 [-0.1118, -0.1514, -0.0641, -0.0689, -0.0517, -0.0742, -0.0574, -0.0588] {"mq_dt": 0.7526220409196414, "mq_iters": 122, "mq_ksamp": 2, "mq_nmax": 774, "mq_pen": 0.03305178151743325, "mq_q": 4, "mq_reads": 16, "mq_solver": "mq_dsb", "
[I 2026-10-01 15:15:27,770] Trial 10 finished with value: -0.07978730319605415 and parameters: {'start': 'lp', 'mq_solver': 'mq_dsb', 'mq_nmax': 774, 'mq_reads': 16, 'mq_iters': 122, 'mq_dt': 0.7526220409196414, 'mq_xi': 0.9749475667194528, 'mq_pen': 0.03305178151743325, 'mq_q': 4, 'mq_ksamp': 2}. Best is trial 10 with value: -0.07978730319605415.
[F1__mq__b1] trial 11: -0.07903 [-0.1148, -0.1503, -0.0609, -0.0671, -0.0498, -0.0736, -0.0589, -0.0569] {"mq_dt": 0.9717283829203743, "mq_iters": 142, "mq_ksamp": 2, "mq_nmax": 1007, "mq_pen": 0.0377804781887413, "mq_q": 9, "mq_reads": 16, "mq_solver": "mq_dsb", "
[I 2026-10-01 15:15:37,031] Trial 11 finished with value: -0.07903460620339628 and parameters: {'start': 'lp', 'mq_solver': 'mq_dsb', 'mq_nmax': 1007, 'mq_reads': 16, 'mq_iters': 142, 'mq_dt': 0.9717283829203743, 'mq_xi': 1.221833856635457, 'mq_pen': 0.0377804781887413, 'mq_q': 9, 'mq_ksamp': 2}. Best is trial 10 with value: -0.07978730319605415.
[F1__mq__b1] BEST t10 -0.07979 cfg={"mq_dt": 0.7526220409196414, "mq_iters": 122, "mq_ksamp": 2, "mq_nmax": 774, "mq_pen": 0.03305178151743325, "mq_q": 4, "mq_reads": 16, "mq_solver": "mq_dsb", "mq_xi": 0.9749475667194528, "start": "lp"}
[I 2026-10-01 15:15:37,076] A new study created in RDB with name: F1__ls__b1
[F1__ls__b1] trial 0: -0.12908 [-0.1076, -0.1444, -0.0734, -0.1502, -0.1294, -0.161, -0.1273, -0.1392] {"g_scale": 138.69861245357328, "ls_T0": 0.0025766385746135885, "ls_T1": 3.895706556508577e-06, "ls_chains": 16, "ls_moves": 23860, "ls_restart_every": 0, "p_ad
[I 2026-10-01 15:15:46,724] Trial 0 finished with value: -0.1290760652735245 and parameters: {'start': 'pgreedy', 'ls_T0': 0.0025766385746135885, 'ls_T1_ratio': 0.0015119336467641006, 'ls_moves': 23860, 'p_add': 0.32294705653332806, 'p_swap': 0.38687290659310525, 'topw': 43, 'ls_restart_every': 0, 'ls_chains': 16, 'g_scale': 138.69861245357328}. Best is trial 0 with value: -0.1290760652735245.
[F1__ls__b1] trial 1: -0.12932 [-0.1116, -0.1438, -0.0734, -0.1497, -0.1292, -0.161, -0.1277, -0.1382] {"g_scale": 138.69861245357328, "ls_T0": 0.0025766385746135885, "ls_T1": 3.895706556508577e-06, "ls_chains": 16, "ls_moves": 23860, "ls_restart_every": 0, "p_ad
[I 2026-10-01 15:15:56,474] Trial 1 finished with value: -0.1293213125368146 and parameters: {'start': 'pgreedy', 'ls_T0': 0.0025766385746135885, 'ls_T1_ratio': 0.0015119336467641006, 'ls_moves': 23860, 'p_add': 0.32294705653332806, 'p_swap': 0.38687290659310525, 'topw': 43, 'ls_restart_every': 0, 'ls_chains': 16, 'g_scale': 138.69861245357328}. Best is trial 1 with value: -0.1293213125368146.
[F1__ls__b1] trial 2: -0.07945 [-0.1141, -0.1531, -0.0653, -0.0672, -0.0494, -0.0723, -0.0561, -0.0581] {"g_scale": 675.031252159593, "ls_T0": 0.021403233140986057, "ls_T1": 0.0002773999548118371, "ls_chains": 8, "ls_moves": 123816, "ls_restart_every": 0, "p_add":
[I 2026-10-01 15:16:06,054] Trial 2 finished with value: -0.07944762145690684 and parameters: {'start': 'lp', 'ls_T0': 0.021403233140986057, 'ls_T1_ratio': 0.01296065659727973, 'ls_moves': 123816, 'p_add': 0.489309171116382, 'p_swap': 0.4083333085150997, 'topw': 9, 'ls_restart_every': 0, 'ls_chains': 8, 'g_scale': 675.031252159593}. Best is trial 1 with value: -0.1293213125368146.
[F1__ls__b1] trial 3: -0.13339 [-0.1134, -0.1461, -0.0746, -0.1569, -0.1371, -0.1664, -0.1278, -0.1449] {"g_scale": 2155.4275565447515, "ls_T0": 0.0006677306766018312, "ls_T1": 1.2541143128078558e-06, "ls_chains": 8, "ls_moves": 5358, "ls_restart_every": 0, "p_add
[I 2026-10-01 15:16:15,386] Trial 3 finished with value: -0.13339068719923994 and parameters: {'start': 'pgreedy', 'ls_T0': 0.0006677306766018312, 'ls_T1_ratio': 0.001878173875716191, 'ls_moves': 5358, 'p_add': 0.30881774853793853, 'p_swap': 0.47004576906097556, 'topw': 15, 'ls_restart_every': 0, 'ls_chains': 8, 'g_scale': 2155.4275565447515}. Best is trial 3 with value: -0.13339068719923994.
[F1__ls__b1] trial 4: -0.13652 [-0.1146, -0.1483, -0.0746, -0.161, -0.14, -0.1738, -0.1333, -0.1466] {"g_scale": 3178.073129125386, "ls_T0": 1.2405585096771496e-05, "ls_T1": 6.925333827162641e-10, "ls_chains": 8, "ls_moves": 77113, "ls_restart_every": 0, "p_add
[I 2026-10-01 15:16:24,977] Trial 4 finished with value: -0.1365249506829882 and parameters: {'start': 'pgreedy', 'ls_T0': 1.2405585096771496e-05, 'ls_T1_ratio': 5.582432245751094e-05, 'ls_moves': 77113, 'p_add': 0.03989721933831958, 'p_swap': 0.8655037789805929, 'topw': 5, 'ls_restart_every': 0, 'ls_chains': 8, 'g_scale': 3178.073129125386}. Best is trial 4 with value: -0.1365249506829882.
[F1__ls__b1] trial 5: -0.14059 [-0.1149, -0.1492, -0.0746, -0.1636, -0.1476, -0.1792, -0.1397, -0.1561] {"g_scale": 1033.198382944086, "ls_T0": 9.976727856592743e-05, "ls_T1": 2.387300289641544e-09, "ls_chains": 8, "ls_moves": 179038, "ls_restart_every": 0, "p_add
[I 2026-10-01 15:16:34,549] Trial 5 finished with value: -0.14058930393323538 and parameters: {'start': 'pgreedy', 'ls_T0': 9.976727856592743e-05, 'ls_T1_ratio': 2.3928690087141014e-05, 'ls_moves': 179038, 'p_add': 0.16323012771885298, 'p_swap': 0.774440157136168, 'topw': 5, 'ls_restart_every': 0, 'ls_chains': 8, 'g_scale': 1033.198382944086}. Best is trial 5 with value: -0.14058930393323538.
[F1__ls__b1] trial 6: -0.12183 [-0.1125, -0.1419, -0.0744, -0.1499, -0.1262, -0.1173, -0.1168, -0.1357] {"g_scale": 691.9787954127893, "ls_T0": 0.0008058630977360917, "ls_T1": 5.52349973144525e-05, "ls_chains": 8, "ls_moves": 167990, "ls_restart_every": 0, "p_add"
[I 2026-10-01 15:16:44,471] Trial 6 finished with value: -0.12182549279428367 and parameters: {'start': 'pgreedy', 'ls_T0': 0.0008058630977360917, 'ls_T1_ratio': 0.06854141537144955, 'ls_moves': 167990, 'p_add': 0.05209989657565614, 'p_swap': 0.850930224541725, 'topw': 35, 'ls_restart_every': 0, 'ls_chains': 8, 'g_scale': 691.9787954127893}. Best is trial 5 with value: -0.14058930393323538.
[F1__ls__b1] trial 7: -0.14044 [-0.1152, -0.1494, -0.0746, -0.1634, -0.1468, -0.1786, -0.1389, -0.1565] {"g_scale": 261.12747509627076, "ls_T0": 2.2906735176214472e-05, "ls_T1": 1.397285100551552e-07, "ls_chains": 8, "ls_moves": 83790, "ls_restart_every": 20, "p_a
[I 2026-10-01 15:16:53,884] Trial 7 finished with value: -0.14043952213514221 and parameters: {'start': 'pgreedy', 'ls_T0': 2.2906735176214472e-05, 'ls_T1_ratio': 0.006099887608612346, 'ls_moves': 83790, 'p_add': 0.47557353268174246, 'p_swap': 0.2006159088485621, 'topw': 2, 'ls_restart_every': 20, 'ls_chains': 8, 'g_scale': 261.12747509627076}. Best is trial 5 with value: -0.14058930393323538.
[F1__ls__b1] trial 8: -0.13258 [-0.1116, -0.1475, -0.0746, -0.1529, -0.1349, -0.1658, -0.1266, -0.1467] {"g_scale": 1277.0209725550503, "ls_T0": 0.009150333876314542, "ls_T1": 2.4368768209125164e-07, "ls_chains": 8, "ls_moves": 18040, "ls_restart_every": 20, "p_ad
[I 2026-10-01 15:17:03,284] Trial 8 finished with value: -0.13258321621310182 and parameters: {'start': 'pgreedy', 'ls_T0': 0.009150333876314542, 'ls_T1_ratio': 2.6631561797109107e-05, 'ls_moves': 18040, 'p_add': 0.18941152504486294, 'p_swap': 0.6410716613913707, 'topw': 27, 'ls_restart_every': 20, 'ls_chains': 8, 'g_scale': 1277.0209725550503}. Best is trial 5 with value: -0.14058930393323538.
[F1__ls__b1] trial 9: -0.09698 [-0.1102, -0.1409, -0.0744, -0.1202, -0.0758, -0.1058, -0.0641, -0.0845] {"g_scale": 5858.948092075998, "ls_T0": 0.0033510634024836667, "ls_T1": 4.252408416391977e-06, "ls_chains": 8, "ls_moves": 115513, "ls_restart_every": 0, "p_add
[I 2026-10-01 15:17:12,719] Trial 9 finished with value: -0.09698145253187318 and parameters: {'start': 'pgreedy', 'ls_T0': 0.0033510634024836667, 'ls_T1_ratio': 0.001268972832098692, 'ls_moves': 115513, 'p_add': 0.0001839037522511633, 'p_swap': 0.7513393064995251, 'topw': 3, 'ls_restart_every': 0, 'ls_chains': 8, 'g_scale': 5858.948092075998}. Best is trial 5 with value: -0.14058930393323538.
[F1__ls__b1] trial 10: -0.13040 [-0.1095, -0.1477, -0.0746, -0.1409, -0.133, -0.1659, -0.1246, -0.147] {"g_scale": 8181.373383821895, "ls_T0": 0.0005202604132195953, "ls_T1": 2.4681039004331495e-08, "ls_chains": 8, "ls_moves": 106508, "ls_restart_every": 0, "p_ad
[I 2026-10-01 15:17:22,387] Trial 10 finished with value: -0.13040172159313776 and parameters: {'start': 'pgreedy', 'ls_T0': 0.0005202604132195953, 'ls_T1_ratio': 4.7439778959145875e-05, 'ls_moves': 106508, 'p_add': 0.2639841241339231, 'p_swap': 0.21451124032166968, 'topw': 3, 'ls_restart_every': 0, 'ls_chains': 8, 'g_scale': 8181.373383821895}. Best is trial 5 with value: -0.14058930393323538.
[F1__ls__b1] trial 11: -0.12884 [-0.1125, -0.1452, -0.0744, -0.1511, -0.1357, -0.157, -0.1155, -0.1393] {"g_scale": 198.73306581903927, "ls_T0": 0.00019382469536185977, "ls_T1": 6.99236871713326e-08, "ls_chains": 8, "ls_moves": 136819, "ls_restart_every": 20, "p_a
[I 2026-10-01 15:17:32,233] Trial 11 finished with value: -0.12883882695220233 and parameters: {'start': 'pgreedy', 'ls_T0': 0.00019382469536185977, 'ls_T1_ratio': 0.0003607573691308479, 'ls_moves': 136819, 'p_add': 0.4783739865290567, 'p_swap': 0.20461186272535303, 'topw': 2, 'ls_restart_every': 20, 'ls_chains': 8, 'g_scale': 198.73306581903927}. Best is trial 5 with value: -0.14058930393323538.
[F1__ls__b1] BEST t5 -0.14059 cfg={"g_scale": 1033.198382944086, "ls_T0": 9.976727856592743e-05, "ls_T1": 2.387300289641544e-09, "ls_chains": 8, "ls_moves": 179038, "ls_restart_every": 0, "p_add": 0.16323012771885298, "p_swap": 0.774440157136168, "start": "pgreedy", "topw": 5}
