[I 2026-10-01 15:17:32,592] A new study created in RDB with name: F1__pt__b3
[F1__pt__b3] trial 0: -0.14731 [-0.1208, -0.1579, -0.0746, -0.1822, -0.1625, -0.1891, -0.1562, -0.1351] {"eim_R": 16, "eim_Tmax": 7.3329031629428645e-06, "eim_Tmin": 1.1006348269620852e-06, "eim_anneal": 0.9462286962175356, "eim_hscale": 1.8587633596816164, "eim_m
[I 2026-10-01 15:17:58,257] Trial 0 finished with value: -0.14730740155976718 and parameters: {'start': 'lp', 'eim_R': 16, 'eim_Tmin': 1.1006348269620852e-06, 'eim_Tratio': 6.662430611234392, 'eim_moves': 18358, 'p_add': 0.22230587257383633, 'p_swap': 0.46272105013386755, 'topw': 20, 'eim_rho': 3.506794739778118, 'eim_hscale': 1.8587633596816164, 'eim_anneal': 0.9462286962175356, 'g_scale': 774.8399988560119}. Best is trial 0 with value: -0.14730740155976718.
[F1__pt__b3] trial 1: -0.10615 [-0.0857, -0.12, -0.0693, -0.1313, -0.0957, -0.1384, -0.0992, -0.1096] {"eim_R": 64, "eim_Tmax": 0.022388264096178515, "eim_Tmin": 5.6279320474151646e-06, "eim_anneal": 0.07032569761590807, "eim_hscale": 59.812219011525556, "eim_mo
[I 2026-10-01 15:18:26,455] Trial 1 finished with value: -0.1061488149283525 and parameters: {'start': 'pgreedy', 'eim_R': 64, 'eim_Tmin': 5.6279320474151646e-06, 'eim_Tratio': 3978.0622629338873, 'eim_moves': 174910, 'p_add': 0.19172075941288885, 'p_swap': 0.6420036530145916, 'topw': 11, 'eim_rho': 18.71450068624066, 'eim_hscale': 59.812219011525556, 'eim_anneal': 0.07032569761590807, 'g_scale': 149.36835544198456}. Best is trial 0 with value: -0.14730740155976718.
[F1__pt__b3] trial 2: -0.12770 [-0.1078, -0.142, -0.0744, -0.1478, -0.1289, -0.1587, -0.1231, -0.1389] {"eim_R": 32, "eim_Tmax": 0.01081686613933192, "eim_Tmin": 7.013219779945795e-06, "eim_anneal": 0.2619100559835807, "eim_hscale": 1.7538232373118046, "eim_moves
[I 2026-10-01 15:18:51,871] Trial 2 finished with value: -0.1276999187573447 and parameters: {'start': 'pgreedy', 'eim_R': 32, 'eim_Tmin': 7.013219779945795e-06, 'eim_Tratio': 1542.3537945099908, 'eim_moves': 7734, 'p_add': 0.3199605106637619, 'p_swap': 0.2616475745120573, 'topw': 52, 'eim_rho': 12.229065947034353, 'eim_hscale': 1.7538232373118046, 'eim_anneal': 0.2619100559835807, 'g_scale': 3535.6346291488144}. Best is trial 0 with value: -0.14730740155976718.
[F1__pt__b3] trial 3: -0.09471 [-0.0885, -0.1177, -0.0591, -0.1189, -0.0798, -0.1176, -0.0816, -0.0945] {"eim_R": 16, "eim_Tmax": 0.3963283547730436, "eim_Tmin": 0.0005956516018710562, "eim_anneal": 0.2082787354631025, "eim_hscale": 10.278118224157009, "eim_moves"
[I 2026-10-01 15:19:28,739] Trial 3 finished with value: -0.09471084780187086 and parameters: {'start': 'pgreedy', 'eim_R': 16, 'eim_Tmin': 0.0005956516018710562, 'eim_Tratio': 665.369409782665, 'eim_moves': 18832, 'p_add': 0.21851597689967073, 'p_swap': 0.5707798346517168, 'topw': 2, 'eim_rho': 46.458679515124714, 'eim_hscale': 10.278118224157009, 'eim_anneal': 0.2082787354631025, 'g_scale': 181.07254066631089}. Best is trial 0 with value: -0.14730740155976718.
[F1__pt__b3] trial 4: -0.14586 [-0.1151, -0.1553, -0.0746, -0.1728, -0.1516, -0.1835, -0.1465, -0.1674] {"eim_R": 16, "eim_Tmax": 6.840342246366934e-06, "eim_Tmin": 3.2202378453311506e-07, "eim_anneal": 0.5962767279261619, "eim_hscale": 99.13773847646657, "eim_mov
[I 2026-10-01 15:20:04,676] Trial 4 finished with value: -0.14585646647586215 and parameters: {'start': 'lp', 'eim_R': 16, 'eim_Tmin': 3.2202378453311506e-07, 'eim_Tratio': 21.2417298811775, 'eim_moves': 5383, 'p_add': 0.20003338804169363, 'p_swap': 0.3482973720482757, 'topw': 9, 'eim_rho': 1.1167684943566796, 'eim_hscale': 99.13773847646657, 'eim_anneal': 0.5962767279261619, 'g_scale': 5387.10565840382}. Best is trial 0 with value: -0.14730740155976718.
[F1__pt__b3] trial 5: -0.14745 [-0.1195, -0.158, -0.0746, -0.1778, -0.1627, -0.1625, -0.1515, -0.1729] {"eim_R": 16, "eim_Tmax": 4.916584503124671e-06, "eim_Tmin": 1.110324680870858e-06, "eim_anneal": 0.9626479280331366, "eim_hscale": 1.2345170019454539, "eim_mov
[I 2026-10-01 15:20:38,869] Trial 5 finished with value: -0.1474547630142154 and parameters: {'start': 'lp', 'eim_R': 16, 'eim_Tmin': 1.110324680870858e-06, 'eim_Tratio': 4.428060177198312, 'eim_moves': 18070, 'p_add': 0.22790323701173293, 'p_swap': 0.44854489566179034, 'topw': 24, 'eim_rho': 1.9100041270013748, 'eim_hscale': 1.2345170019454539, 'eim_anneal': 0.9626479280331366, 'g_scale': 586.7669480720929}. Best is trial 5 with value: -0.1474547630142154.
[F1__pt__b3] trial 6: -0.14913 [-0.1166, -0.1524, -0.0746, -0.177, -0.1568, -0.1885, -0.153, -0.1742] {"eim_R": 16, "eim_Tmax": 0.0008877039555141203, "eim_Tmin": 9.343933972995321e-07, "eim_anneal": 0.4651708590352262, "eim_hscale": 0.4234213933813821, "eim_mov
[I 2026-10-01 15:21:14,274] Trial 6 finished with value: -0.14913357024531468 and parameters: {'start': 'lp', 'eim_R': 16, 'eim_Tmin': 9.343933972995321e-07, 'eim_Tratio': 950.03235048498, 'eim_moves': 116510, 'p_add': 0.23582538342126894, 'p_swap': 0.45331739397375, 'topw': 25, 'eim_rho': 1.4901281631795318, 'eim_hscale': 0.4234213933813821, 'eim_anneal': 0.4651708590352262, 'g_scale': 574.9963184175464}. Best is trial 6 with value: -0.14913357024531468.
[F1__pt__b3] trial 7: -0.14066 [-0.1132, -0.1541, -0.0703, -0.1687, -0.1416, -0.1777, -0.1378, -0.1618] {"eim_R": 16, "eim_Tmax": 0.0009011491432461433, "eim_Tmin": 0.0003262968556338091, "eim_anneal": 0.39249299524699843, "eim_hscale": 0.11448873719770782, "eim_m
[I 2026-10-01 15:21:49,957] Trial 7 finished with value: -0.14066165728417562 and parameters: {'start': 'lp', 'eim_R': 16, 'eim_Tmin': 0.0003262968556338091, 'eim_Tratio': 2.761746329107963, 'eim_moves': 119213, 'p_add': 0.37521011778224267, 'p_swap': 0.2057873392646265, 'topw': 60, 'eim_rho': 0.1655768277464541, 'eim_hscale': 0.11448873719770782, 'eim_anneal': 0.39249299524699843, 'g_scale': 647.1273431714433}. Best is trial 6 with value: -0.14913357024531468.
[F1__pt__b3] trial 8: -0.14857 [-0.1195, -0.1533, -0.0746, -0.1768, -0.1578, -0.1885, -0.149, -0.1691] {"eim_R": 16, "eim_Tmax": 9.663794481154574e-05, "eim_Tmin": 2.832153136362731e-07, "eim_anneal": 0.8144961485977071, "eim_hscale": 3.03784040968439, "eim_moves
[I 2026-10-01 15:27:34,340] Trial 8 finished with value: -0.14857233675550777 and parameters: {'start': 'lp', 'eim_R': 16, 'eim_Tmin': 2.832153136362731e-07, 'eim_Tratio': 341.2172299964529, 'eim_moves': 38873, 'p_add': 0.07699567169359897, 'p_swap': 0.8349963995551384, 'topw': 16, 'eim_rho': 983.6620223104848, 'eim_hscale': 3.03784040968439, 'eim_anneal': 0.8144961485977071, 'g_scale': 122.4530753301341}. Best is trial 6 with value: -0.14913357024531468.
[F1__pt__b3] trial 9: -0.15282 [-0.1209, -0.1582, -0.0746, -0.1816, -0.164, -0.1932, -0.1559, -0.1741] {"eim_R": 16, "eim_Tmax": 0.004778562334987127, "eim_Tmin": 5.65009413558932e-07, "eim_anneal": 0.48645278005217524, "eim_hscale": 0.689973517338634, "eim_moves
[I 2026-10-01 15:28:16,359] Trial 9 finished with value: -0.15282143129960565 and parameters: {'start': 'lp', 'eim_R': 16, 'eim_Tmin': 5.65009413558932e-07, 'eim_Tratio': 8457.491539632038, 'eim_moves': 159234, 'p_add': 0.05480263669113283, 'p_swap': 0.7323744694634446, 'topw': 19, 'eim_rho': 15.504304921919466, 'eim_hscale': 0.689973517338634, 'eim_anneal': 0.48645278005217524, 'g_scale': 902.9755641720078}. Best is trial 9 with value: -0.15282143129960565.
[F1__pt__b3] trial 10: -0.14626 [-0.1191, -0.1564, -0.0746, -0.1743, -0.1506, -0.1844, -0.1454, -0.1652] {"eim_R": 16, "eim_Tmax": 0.00036248785662672543, "eim_Tmin": 3.292528056249257e-06, "eim_anneal": 0.5441101891877319, "eim_hscale": 88.19231928425427, "eim_mov
[I 2026-10-01 15:29:08,939] Trial 10 finished with value: -0.14625912706004734 and parameters: {'start': 'lp', 'eim_R': 16, 'eim_Tmin': 3.292528056249257e-06, 'eim_Tratio': 110.09408285488082, 'eim_moves': 140968, 'p_add': 0.11491374101752094, 'p_swap': 0.8285678139585109, 'topw': 24, 'eim_rho': 7.126556601007714, 'eim_hscale': 88.19231928425427, 'eim_anneal': 0.5441101891877319, 'g_scale': 555.3736624608825}. Best is trial 9 with value: -0.15282143129960565.
[F1__pt__b3] trial 11: -0.15243 [-0.121, -0.1584, -0.0746, -0.181, -0.1622, -0.192, -0.1562, -0.174] {"eim_R": 16, "eim_Tmax": 0.002080428880264467, "eim_Tmin": 2.2129755336789705e-07, "eim_anneal": 0.6851011788640109, "eim_hscale": 1.6588508687351058, "eim_mov
[I 2026-10-01 15:34:42,719] Trial 11 finished with value: -0.15243243403293855 and parameters: {'start': 'lp', 'eim_R': 16, 'eim_Tmin': 2.2129755336789705e-07, 'eim_Tratio': 9401.047813691139, 'eim_moves': 128589, 'p_add': 0.1619199121905183, 'p_swap': 0.661689003126384, 'topw': 19, 'eim_rho': 14.590085554126123, 'eim_hscale': 1.6588508687351058, 'eim_anneal': 0.6851011788640109, 'g_scale': 694.7191436627293}. Best is trial 9 with value: -0.15282143129960565.
[F1__pt__b3] BEST t9 -0.15282 cfg={"eim_R": 16, "eim_Tmax": 0.004778562334987127, "eim_Tmin": 5.65009413558932e-07, "eim_anneal": 0.48645278005217524, "eim_hscale": 0.689973517338634, "eim_moves": 159234, "eim_rho": 15.504304921919466, "g_scale": 902.9755641720078, "p_add": 0.05480263669113283, "p_swap": 0.7323744694634446, "start": "lp", "topw": 19}
[I 2026-10-01 15:34:42,764] A new study created in RDB with name: F1__lp__b3
[F1__lp__b3] trial 0: -0.13375 [-0.1106, -0.1478, -0.0613, -0.1581, -0.1347, -0.1697, -0.1342, -0.1536] {"lexi": false}
[I 2026-10-01 15:40:01,017] Trial 0 finished with value: -0.13374612090361304 and parameters: {'start': 'lp', 'lexi': False}. Best is trial 0 with value: -0.13374612090361304.
[F1__lp__b3] trial 1: -0.13294 [-0.1118, -0.1475, -0.054, -0.1581, -0.1347, -0.1697, -0.1342, -0.1536] {"lexi": false}
[I 2026-10-01 15:45:14,183] Trial 1 finished with value: -0.13293518231323564 and parameters: {'start': 'pgreedy', 'lexi': False}. Best is trial 0 with value: -0.13374612090361304.
[F1__lp__b3] trial 2: +0.42598 [1.0, 1.0, 1.0, 1.0, -0.1347, -0.1697, -0.1342, -0.1536] {"lexi": true}
[I 2026-10-01 15:45:56,625] Trial 2 finished with value: 0.42598117882560355 and parameters: {'start': 'pgreedy', 'lexi': True}. Best is trial 0 with value: -0.13374612090361304.
[F1__lp__b3] trial 3: -0.13421 [-0.1139, -0.1484, -0.0611, -0.1581, -0.1347, -0.1697, -0.1342, -0.1536] {"lexi": false}
[I 2026-10-01 15:46:08,765] Trial 3 finished with value: -0.13420675960834555 and parameters: {'start': 'lp', 'lexi': False}. Best is trial 3 with value: -0.13420675960834555.
[F1__lp__b3] trial 4: +0.42590 [1.0, 1.0, 1.0, 1.0, -0.1347, -0.1697, -0.1342, -0.1542] {"lexi": true}
[I 2026-10-01 15:46:56,265] Trial 4 finished with value: 0.42590230595787015 and parameters: {'start': 'lp', 'lexi': True}. Best is trial 3 with value: -0.13420675960834555.
[F1__lp__b3] trial 5: -0.13482 [-0.1144, -0.1502, -0.0637, -0.1581, -0.1347, -0.1697, -0.1342, -0.1536] {"lexi": false}
[I 2026-10-01 15:47:11,081] Trial 5 finished with value: -0.13482266678435742 and parameters: {'start': 'lp', 'lexi': False}. Best is trial 5 with value: -0.13482266678435742.
[F1__lp__b3] trial 6: -0.13264 [-0.1097, -0.1368, -0.0644, -0.1581, -0.1347, -0.1697, -0.1342, -0.1536] {"lexi": false}
[I 2026-10-01 15:58:07,104] Trial 6 finished with value: -0.13263567399063636 and parameters: {'start': 'lp', 'lexi': False}. Best is trial 5 with value: -0.13482266678435742.
[F1__lp__b3] trial 7: +0.42587 [1.0, 1.0, 1.0, 1.0, -0.1347, -0.1697, -0.1342, -0.1545] {"lexi": true}
[I 2026-10-01 15:58:45,750] Trial 7 finished with value: 0.42586631833761157 and parameters: {'start': 'lp', 'lexi': True}. Best is trial 5 with value: -0.13482266678435742.
[F1__lp__b3] trial 8: -0.13357 [-0.1117, -0.1466, -0.0609, -0.1572, -0.1347, -0.1697, -0.1342, -0.1536] {"lexi": false}
[I 2026-10-01 16:03:51,685] Trial 8 finished with value: -0.13357167891997196 and parameters: {'start': 'pgreedy', 'lexi': False}. Best is trial 5 with value: -0.13482266678435742.
[F1__lp__b3] trial 9: -0.13357 [-0.11, -0.1446, -0.0637, -0.1581, -0.1347, -0.1697, -0.1342, -0.1536] {"lexi": false}
[I 2026-10-01 16:04:06,259] Trial 9 finished with value: -0.1335717893311822 and parameters: {'start': 'lp', 'lexi': False}. Best is trial 5 with value: -0.13482266678435742.
[F1__lp__b3] trial 10: +0.42590 [1.0, 1.0, 1.0, 1.0, -0.1347, -0.1697, -0.1342, -0.1542] {"lexi": true}
[I 2026-10-01 16:04:51,301] Trial 10 finished with value: 0.42590230595787015 and parameters: {'start': 'pgreedy', 'lexi': True}. Best is trial 5 with value: -0.13482266678435742.
[F1__lp__b3] trial 11: -0.13429 [-0.1145, -0.1487, -0.0609, -0.1581, -0.1347, -0.1697, -0.1342, -0.1536] {"lexi": false}
[I 2026-10-01 16:05:05,949] Trial 11 finished with value: -0.13428607504933943 and parameters: {'start': 'lp', 'lexi': False}. Best is trial 5 with value: -0.13482266678435742.
[F1__lp__b3] BEST t5 -0.13482 cfg={"lexi": false}
[I 2026-10-01 16:05:05,983] A new study created in RDB with name: F1__eim__b3
[F1__eim__b3] trial 0: -0.15038 [-0.1195, -0.1563, -0.0746, -0.1764, -0.1587, -0.1905, -0.1531, -0.1739] {"eim_R": 16, "eim_Tmax": 0.0007255047403074508, "eim_Tmin": 0.00013246974647468452, "eim_anneal": 0.7664913525398744, "eim_eta": 0.23358825194833557, "eim_hsca
[I 2026-10-01 16:05:56,235] Trial 0 finished with value: -0.15038189871815938 and parameters: {'start': 'lp', 'eim_R': 16, 'eim_Tmin': 0.00013246974647468452, 'eim_Tratio': 5.476757973912916, 'eim_moves': 52984, 'p_add': 0.0716766437045232, 'p_swap': 0.8407909904010871, 'topw': 11, 'eim_rho': 4.5566719139214715, 'eim_hscale': 0.6218230782016851, 'eim_anneal': 0.7664913525398744, 'eim_eta': 0.23358825194833557, 'g_scale': 1370.4648392849028}. Best is trial 0 with value: -0.15038189871815938.
[F1__eim__b3] trial 1: +0.14827 [-0.1141, -0.1478, -0.0746, -0.1606, -0.1394, -0.1774, 1.0, 1.0] {"eim_R": 64, "eim_Tmax": 0.022388264096178515, "eim_Tmin": 5.6279320474151646e-06, "eim_anneal": 0.07032569761590807, "eim_eta": 0.018255254802399014, "eim_hsc
[I 2026-10-01 16:10:06,745] Trial 1 finished with value: 0.14826514839099683 and parameters: {'start': 'pgreedy', 'eim_R': 64, 'eim_Tmin': 5.6279320474151646e-06, 'eim_Tratio': 3978.0622629338873, 'eim_moves': 174910, 'p_add': 0.19172075941288885, 'p_swap': 0.6420036530145916, 'topw': 11, 'eim_rho': 18.71450068624066, 'eim_hscale': 59.812219011525556, 'eim_anneal': 0.07032569761590807, 'eim_eta': 0.018255254802399014, 'g_scale': 109.7581541938016}. Best is trial 0 with value: -0.15038189871815938.
[F1__eim__b3] trial 2: -0.15025 [-0.1196, -0.1565, -0.0746, -0.1774, -0.1585, -0.1905, -0.1516, -0.1733] {"eim_R": 16, "eim_Tmax": 0.0007255047403074508, "eim_Tmin": 0.00013246974647468452, "eim_anneal": 0.7664913525398744, "eim_eta": 0.23358825194833557, "eim_hsca
[I 2026-10-01 16:10:41,560] Trial 2 finished with value: -0.15024536621988094 and parameters: {'start': 'lp', 'eim_R': 16, 'eim_Tmin': 0.00013246974647468452, 'eim_Tratio': 5.476757973912916, 'eim_moves': 52984, 'p_add': 0.0716766437045232, 'p_swap': 0.8407909904010871, 'topw': 11, 'eim_rho': 4.5566719139214715, 'eim_hscale': 0.6218230782016851, 'eim_anneal': 0.7664913525398744, 'eim_eta': 0.23358825194833557, 'g_scale': 1370.4648392849028}. Best is trial 0 with value: -0.15038189871815938.
[F1__eim__b3] trial 3: -0.12987 [-0.1118, -0.1428, -0.0746, -0.1396, -0.1337, -0.1665, -0.1261, -0.1439] {"eim_R": 32, "eim_Tmax": 0.00022679302095938696, "eim_Tmin": 2.741773675242096e-06, "eim_anneal": 0.312274067414942, "eim_eta": 0.1233480570086002, "eim_hscale
[I 2026-10-01 16:16:16,350] Trial 3 finished with value: -0.12987425678602976 and parameters: {'start': 'pgreedy', 'eim_R': 32, 'eim_Tmin': 2.741773675242096e-06, 'eim_Tratio': 82.71763019949535, 'eim_moves': 65555, 'p_add': 0.030112735814634917, 'p_swap': 0.6799968666320435, 'topw': 19, 'eim_rho': 0.6942729492430144, 'eim_hscale': 0.24365700014641997, 'eim_anneal': 0.312274067414942, 'eim_eta': 0.1233480570086002, 'g_scale': 1381.6356822574794}. Best is trial 0 with value: -0.15038189871815938.
[F1__eim__b3] trial 4: -0.14446 [-0.1157, -0.1542, -0.0709, -0.1724, -0.1514, -0.182, -0.1448, -0.1643] {"eim_R": 16, "eim_Tmax": 0.013323197406244793, "eim_Tmin": 0.0004987435476609301, "eim_anneal": 0.6411080434933271, "eim_eta": 0.23236965081001948, "eim_hscale
[I 2026-10-01 16:16:45,990] Trial 4 finished with value: -0.14445774524809038 and parameters: {'start': 'lp', 'eim_R': 16, 'eim_Tmin': 0.0004987435476609301, 'eim_Tratio': 26.713523350286117, 'eim_moves': 133508, 'p_add': 0.4207271306233804, 'p_swap': 0.2125472978851706, 'topw': 4, 'eim_rho': 0.12908945670149974, 'eim_hscale': 6.742610434179981, 'eim_anneal': 0.6411080434933271, 'eim_eta': 0.23236965081001948, 'g_scale': 1453.27196243909}. Best is trial 0 with value: -0.15038189871815938.
[F1__eim__b3] trial 5: -0.14780 [-0.1181, -0.1562, -0.0709, -0.1769, -0.1578, -0.1851, -0.1473, -0.1701] {"eim_R": 16, "eim_Tmax": 0.005569704096824688, "eim_Tmin": 7.708432216203298e-06, "eim_anneal": 0.8958196025702315, "eim_eta": 0.11371266316299405, "eim_hscale
[I 2026-10-01 16:17:13,114] Trial 5 finished with value: -0.1478045069940565 and parameters: {'start': 'lp', 'eim_R': 16, 'eim_Tmin': 7.708432216203298e-06, 'eim_Tratio': 722.5469382888319, 'eim_moves': 131995, 'p_add': 0.1062819420743297, 'p_swap': 0.2694318663923838, 'topw': 2, 'eim_rho': 0.21444767762064595, 'eim_hscale': 0.20966286437375262, 'eim_anneal': 0.8958196025702315, 'eim_eta': 0.11371266316299405, 'g_scale': 362.9184310542201}. Best is trial 0 with value: -0.15038189871815938.
[F1__eim__b3] trial 6: -0.14805 [-0.1187, -0.1505, -0.0709, -0.1774, -0.1562, -0.1887, -0.1495, -0.1724] {"eim_R": 16, "eim_Tmax": 0.23493624582371722, "eim_Tmin": 5.161106531611771e-05, "eim_anneal": 0.5599992800532259, "eim_eta": 0.09916053756640525, "eim_hscale"
[I 2026-10-01 16:22:49,492] Trial 6 finished with value: -0.14805164243987903 and parameters: {'start': 'lp', 'eim_R': 16, 'eim_Tmin': 5.161106531611771e-05, 'eim_Tratio': 4552.051859126197, 'eim_moves': 38346, 'p_add': 0.22549484154459695, 'p_swap': 0.38951023623813313, 'topw': 4, 'eim_rho': 1.6773897965542055, 'eim_hscale': 5.1956439619754375, 'eim_anneal': 0.5599992800532259, 'eim_eta': 0.09916053756640525, 'g_scale': 5470.828347571033}. Best is trial 0 with value: -0.15038189871815938.
[F1__eim__b3] trial 7: -0.14987 [-0.1168, -0.1554, -0.0746, -0.1776, -0.158, -0.1904, -0.1516, -0.1745] {"eim_R": 16, "eim_Tmax": 0.0024712106819587704, "eim_Tmin": 3.279711118691455e-05, "eim_anneal": 0.7992661330313624, "eim_eta": 0.021530041252627617, "eim_hsca
[I 2026-10-01 16:23:24,711] Trial 7 finished with value: -0.14987330766296553 and parameters: {'start': 'lp', 'eim_R': 16, 'eim_Tmin': 3.279711118691455e-05, 'eim_Tratio': 75.34842528889368, 'eim_moves': 37594, 'p_add': 0.15502681030202012, 'p_swap': 0.47523776424484554, 'topw': 25, 'eim_rho': 141.26197483338572, 'eim_hscale': 0.2382126214028639, 'eim_anneal': 0.7992661330313624, 'eim_eta': 0.021530041252627617, 'g_scale': 137.8224695773061}. Best is trial 0 with value: -0.15038189871815938.
[F1__eim__b3] trial 8: -0.15015 [-0.1199, -0.1523, -0.0746, -0.1795, -0.1601, -0.1892, -0.1532, -0.1725] {"eim_R": 16, "eim_Tmax": 0.004568621603963529, "eim_Tmin": 3.772088707918623e-05, "eim_anneal": 0.3596282879725269, "eim_eta": 0.13600182079353904, "eim_hscale
[I 2026-10-01 16:24:24,088] Trial 8 finished with value: -0.15015071621092924 and parameters: {'start': 'lp', 'eim_R': 16, 'eim_Tmin': 3.772088707918623e-05, 'eim_Tratio': 121.11649427471761, 'eim_moves': 10197, 'p_add': 0.0020154464352127865, 'p_swap': 0.9342754073994838, 'topw': 10, 'eim_rho': 16.293362240939743, 'eim_hscale': 59.24928946642238, 'eim_anneal': 0.3596282879725269, 'eim_eta': 0.13600182079353904, 'g_scale': 3305.4332171398946}. Best is trial 0 with value: -0.15038189871815938.
[F1__eim__b3] trial 9: -0.14798 [-0.1165, -0.153, -0.0746, -0.1733, -0.1556, -0.1892, -0.1503, -0.1713] {"eim_R": 16, "eim_Tmax": 0.04412351500343946, "eim_Tmin": 0.00020827188679238984, "eim_anneal": 0.9719942231917424, "eim_eta": 0.30362340943985383, "eim_hscale
[I 2026-10-01 16:29:49,867] Trial 9 finished with value: -0.1479839690591196 and parameters: {'start': 'lp', 'eim_R': 16, 'eim_Tmin': 0.00020827188679238984, 'eim_Tratio': 211.85535735518056, 'eim_moves': 96916, 'p_add': 0.329610509590732, 'p_swap': 0.3811991373951533, 'topw': 13, 'eim_rho': 240.58174820146084, 'eim_hscale': 0.22984569932818313, 'eim_anneal': 0.9719942231917424, 'eim_eta': 0.30362340943985383, 'g_scale': 3328.687869531856}. Best is trial 0 with value: -0.15038189871815938.
[F1__eim__b3] trial 10: -0.14947 [-0.1179, -0.1556, -0.0746, -0.1777, -0.1574, -0.1891, -0.1514, -0.172] {"eim_R": 16, "eim_Tmax": 3.581109782573151e-05, "eim_Tmin": 2.1632671645315322e-06, "eim_anneal": 0.39909807650254175, "eim_eta": 1.0549815413611934, "eim_hsca
[I 2026-10-01 16:30:22,906] Trial 10 finished with value: -0.14947458375480177 and parameters: {'start': 'lp', 'eim_R': 16, 'eim_Tmin': 2.1632671645315322e-06, 'eim_Tratio': 16.55417250947208, 'eim_moves': 33708, 'p_add': 0.13022450133475902, 'p_swap': 0.5897194137428722, 'topw': 8, 'eim_rho': 1.1362006084851668, 'eim_hscale': 0.1721493726580704, 'eim_anneal': 0.39909807650254175, 'eim_eta': 1.0549815413611934, 'g_scale': 3432.8550464859613}. Best is trial 0 with value: -0.15038189871815938.
[F1__eim__b3] trial 11: -0.13202 [-0.1174, -0.156, -0.0746, -0.1753, -0.134, -0.1842, -0.147, -0.0675] {"eim_R": 16, "eim_Tmax": 0.014143152839540358, "eim_Tmin": 0.0003125546686357562, "eim_anneal": 0.7869095566701645, "eim_eta": 0.099778580230513, "eim_hscale":
