[I 2026-10-01 20:04:39,791] Trial 11 finished with value: -0.1507427810618851 and parameters: {'start': 'lp', 'eim_R': 16, 'eim_Tmin': 0.0005097365871263062, 'eim_Tratio': 10.989260194482725, 'eim_moves': 13823, 'p_add': 0.12048956330633165, 'p_swap': 0.820146920607552, 'topw': 7, 'eim_rho': 0.45543712120354474, 'eim_hscale': 0.49240288775971514, 'eim_anneal': 0.9567651602538499, 'eim_eta': 0.06283585971027122, 'g_scale': 1696.1818959181426}. Best is trial 2 with value: -0.15325600870941122.
[F1__eim__b10] BEST t2 -0.15326 cfg={"eim_R": 16, "eim_Tmax": 0.0007255047403074508, "eim_Tmin": 0.00013246974647468452, "eim_anneal": 0.7664913525398744, "eim_eta": 0.23358825194833557, "eim_hscale": 0.6218230782016851, "eim_moves": 52984, "eim_rho": 4.5566719139214715, "g_scale": 1370.4648392849028, "p_add": 0.0716766437045232, "p_swap": 0.8407909904010871, "start": "lp", "topw": 11}
[I 2026-10-01 20:04:39,818] A new study created in RDB with name: F1__milp__b10
[F1__milp__b10] trial 0: -0.13938 [-0.1185, -0.1493, -0.065, -0.1596, -0.1541, -0.1658, -0.1412, -0.1616] {"eps_tie": 0.0, "mip_heuristic_effort": 0.8077206102454388, "presolve": "off", "start": "pgreedy"}
[I 2026-10-01 20:05:43,501] Trial 0 finished with value: -0.13937917684681383 and parameters: {'start': 'pgreedy', 'presolve': 'off', 'mip_heuristic_effort': 0.8077206102454388, 'eps_tie': 0.0}. Best is trial 0 with value: -0.13937917684681383.
[F1__milp__b10] trial 1: +0.49928 [-0.0015, 0.0006, -0.0017, -0.0032, 1.0, 1.0, 1.0, 1.0] {"eps_tie": 0.0, "mip_heuristic_effort": 0.10490756141474163, "presolve": "on", "start": "pgreedy"}
[I 2026-10-01 20:07:41,299] Trial 1 finished with value: 0.4992775865466579 and parameters: {'start': 'pgreedy', 'presolve': 'on', 'mip_heuristic_effort': 0.10490756141474163, 'eps_tie': 0.0}. Best is trial 0 with value: -0.13937917684681383.
[F1__milp__b10] trial 2: -0.14133 [-0.1181, -0.1526, -0.0691, -0.1539, -0.1595, -0.1834, -0.1322, -0.1617] {"eps_tie": 0.0001, "mip_heuristic_effort": 0.15834581868043074, "presolve": "off", "start": "pgreedy"}
[I 2026-10-01 20:09:06,132] Trial 2 finished with value: -0.14133397049898705 and parameters: {'start': 'pgreedy', 'presolve': 'off', 'mip_heuristic_effort': 0.15834581868043074, 'eps_tie': 0.0001}. Best is trial 2 with value: -0.14133397049898705.
[F1__milp__b10] trial 3: -0.13574 [-0.1185, -0.1522, -0.0146, -0.1687, -0.1536, -0.1835, -0.134, -0.1608] {"eps_tie": 0.0001, "mip_heuristic_effort": 0.41985078951584265, "presolve": "off", "start": "pgreedy"}
[I 2026-10-01 20:10:34,165] Trial 3 finished with value: -0.1357426802475289 and parameters: {'start': 'pgreedy', 'presolve': 'off', 'mip_heuristic_effort': 0.41985078951584265, 'eps_tie': 0.0001}. Best is trial 2 with value: -0.14133397049898705.
[F1__milp__b10] trial 4: +0.44001 [-0.1081, -0.1499, -0.0619, -0.1601, 1.0, 1.0, 1.0, 1.0] {"eps_tie": 0.0001, "mip_heuristic_effort": 0.020403078330967394, "presolve": "on", "start": "lp"}
[I 2026-10-01 20:12:37,704] Trial 4 finished with value: 0.44001455447525556 and parameters: {'start': 'lp', 'presolve': 'on', 'mip_heuristic_effort': 0.020403078330967394, 'eps_tie': 0.0001}. Best is trial 2 with value: -0.14133397049898705.
[F1__milp__b10] trial 5: -0.14221 [-0.1185, -0.1524, -0.0686, -0.155, -0.16, -0.181, -0.1419, -0.1603] {"eps_tie": 0.0001, "mip_heuristic_effort": 0.04645390874549428, "presolve": "off", "start": "pgreedy"}
[I 2026-10-01 20:14:02,279] Trial 5 finished with value: -0.14221293562109394 and parameters: {'start': 'pgreedy', 'presolve': 'off', 'mip_heuristic_effort': 0.04645390874549428, 'eps_tie': 0.0001}. Best is trial 5 with value: -0.14221293562109394.
[F1__milp__b10] trial 6: -0.14570 [-0.1183, -0.1569, -0.069, -0.168, -0.1601, -0.1853, -0.1442, -0.1638] {"eps_tie": 0.0, "mip_heuristic_effort": 0.08696910001601103, "presolve": "off", "start": "lp"}
[I 2026-10-01 20:15:23,740] Trial 6 finished with value: -0.14570360244360148 and parameters: {'start': 'lp', 'presolve': 'off', 'mip_heuristic_effort': 0.08696910001601103, 'eps_tie': 0.0}. Best is trial 6 with value: -0.14570360244360148.
[F1__milp__b10] trial 7: -0.14368 [-0.1075, -0.1524, -0.0653, -0.1689, -0.1609, -0.1841, -0.1443, -0.1661] {"eps_tie": 0.0, "mip_heuristic_effort": 0.08122131303770497, "presolve": "off", "start": "lp"}
[I 2026-10-01 20:16:59,084] Trial 7 finished with value: -0.14368165241768704 and parameters: {'start': 'lp', 'presolve': 'off', 'mip_heuristic_effort': 0.08122131303770497, 'eps_tie': 0.0}. Best is trial 6 with value: -0.14570360244360148.
[F1__milp__b10] trial 8: +0.43927 [-0.1131, -0.1518, -0.0609, -0.1601, 1.0, 1.0, 1.0, 1.0] {"eps_tie": 0.0, "mip_heuristic_effort": 0.25960597744412756, "presolve": "on", "start": "lp"}
[I 2026-10-01 20:19:02,841] Trial 8 finished with value: 0.4392737203029067 and parameters: {'start': 'lp', 'presolve': 'on', 'mip_heuristic_effort': 0.25960597744412756, 'eps_tie': 0.0}. Best is trial 6 with value: -0.14570360244360148.
[F1__milp__b10] trial 9: -0.14387 [-0.1153, -0.1514, -0.0653, -0.1691, -0.1608, -0.1854, -0.1441, -0.1594] {"eps_tie": 0.0, "mip_heuristic_effort": 0.027631366526199908, "presolve": "off", "start": "lp"}
[I 2026-10-01 20:20:25,142] Trial 9 finished with value: -0.14386526079136727 and parameters: {'start': 'lp', 'presolve': 'off', 'mip_heuristic_effort': 0.027631366526199908, 'eps_tie': 0.0}. Best is trial 6 with value: -0.14570360244360148.
[F1__milp__b10] trial 10: -0.14487 [-0.1137, -0.1563, -0.0653, -0.1696, -0.1598, -0.1855, -0.1437, -0.1651] {"eps_tie": 0.0, "mip_heuristic_effort": 0.4018785825937865, "presolve": "off", "start": "lp"}
[I 2026-10-01 20:21:28,876] Trial 10 finished with value: -0.14487381833067167 and parameters: {'start': 'lp', 'presolve': 'off', 'mip_heuristic_effort': 0.4018785825937865, 'eps_tie': 0.0}. Best is trial 6 with value: -0.14570360244360148.
[F1__milp__b10] trial 11: -0.14377 [-0.116, -0.1501, -0.0653, -0.1693, -0.1593, -0.1881, -0.1436, -0.1584] {"eps_tie": 0.0, "mip_heuristic_effort": 0.4314168546105209, "presolve": "off", "start": "lp"}
[I 2026-10-01 20:22:38,505] Trial 11 finished with value: -0.14377050240986186 and parameters: {'start': 'lp', 'presolve': 'off', 'mip_heuristic_effort': 0.4314168546105209, 'eps_tie': 0.0}. Best is trial 6 with value: -0.14570360244360148.
[F1__milp__b10] BEST t6 -0.14570 cfg={"eps_tie": 0.0, "mip_heuristic_effort": 0.08696910001601103, "presolve": "off", "start": "lp"}
[I 2026-10-01 20:22:38,531] A new study created in RDB with name: F1__sb__b10
[F1__sb__b10] trial 0: -0.13395 [-0.1101, -0.1481, -0.0613, -0.1581, -0.1378, -0.1685, -0.1343, -0.1536] {"sb_agents": 32, "sb_alpha_floor": 0.19397546899179888, "sb_dt": 1.4232321618458184, "sb_eta": 0.0965605178058406, "sb_eta_mu": 4.719399631690194, "sb_heat": 0
[I 2026-10-01 20:24:00,081] Trial 0 finished with value: -0.13395485469266194 and parameters: {'start': 'lp', 'sb_agents': 32, 'sb_steps': 1432, 'sb_dt': 1.4232321618458184, 'sb_variant': 'ballistic', 'sb_heat': 0.0125536250820598, 'sb_xi': 0.07953090488826875, 'sb_warm': 0.10136029824871645, 'sb_eta_mu': 4.719399631690194, 'sb_alpha_floor': 0.19397546899179888, 'sb_tau_frac': 0.9386113363824448, 'sb_eta': 0.0965605178058406}. Best is trial 0 with value: -0.13395485469266194.
[F1__sb__b10] trial 1: -0.00380 [0.0, -0.0097, -0.0, 0.0, 0.0, -0.0207, 0.0, 0.0] {"sb_agents": 64, "sb_alpha_floor": 0.017425859940308142, "sb_dt": 1.3593049010167038, "sb_eta": 2.3131814207377923, "sb_eta_mu": 0.0163345876110695, "sb_heat":
[I 2026-10-01 20:25:21,769] Trial 1 finished with value: -0.0038009020521264647 and parameters: {'start': 'pgreedy', 'sb_agents': 64, 'sb_steps': 250, 'sb_dt': 1.3593049010167038, 'sb_variant': 'ballistic', 'sb_heat': 0.060428515788450606, 'sb_xi': 0.5117279648784191, 'sb_warm': 0.8793168063780279, 'sb_eta_mu': 0.0163345876110695, 'sb_alpha_floor': 0.017425859940308142, 'sb_tau_frac': 0.9020218397440326, 'sb_eta': 2.3131814207377923}. Best is trial 0 with value: -0.13395485469266194.
[F1__sb__b10] trial 2: -0.00445 [0.0188, 0.002, -0.0007, -0.0405, -0.0006, -0.0157, 0.0016, -0.0005] {"sb_agents": 8, "sb_alpha_floor": 0.1136867897737297, "sb_dt": 1.031897327725781, "sb_eta": 0.8594903371659688, "sb_eta_mu": 0.23358825194833557, "sb_heat": 0.
[I 2026-10-01 20:26:43,524] Trial 2 finished with value: -0.004445598518583116 and parameters: {'start': 'pgreedy', 'sb_agents': 8, 'sb_steps': 77, 'sb_dt': 1.031897327725781, 'sb_variant': 'discrete', 'sb_heat': 0.040973773756855375, 'sb_xi': 0.14770319740236926, 'sb_warm': 0.7355220049625057, 'sb_eta_mu': 0.23358825194833557, 'sb_alpha_floor': 0.1136867897737297, 'sb_tau_frac': 0.9018789800436355, 'sb_eta': 0.8594903371659688}. Best is trial 0 with value: -0.13395485469266194.
[F1__sb__b10] trial 3: -0.00459 [-0.0027, -0.0126, -0.0006, 0.0052, -0.002, -0.0315, 0.0, 0.0075] {"sb_agents": 8, "sb_alpha_floor": 0.08772030269246407, "sb_dt": 0.2782931131180508, "sb_eta": 0.07999440746315747, "sb_eta_mu": 0.513558960650023, "sb_heat": 0
[I 2026-10-01 20:28:05,010] Trial 3 finished with value: -0.004588919811310405 and parameters: {'start': 'pgreedy', 'sb_agents': 8, 'sb_steps': 654, 'sb_dt': 0.2782931131180508, 'sb_variant': 'discrete', 'sb_heat': 0.015503857733727292, 'sb_xi': 0.18190696204307705, 'sb_warm': 0.3455252323954915, 'sb_eta_mu': 0.513558960650023, 'sb_alpha_floor': 0.08772030269246407, 'sb_tau_frac': 0.9988373838059226, 'sb_eta': 0.07999440746315747}. Best is trial 0 with value: -0.13395485469266194.
[F1__sb__b10] trial 4: -0.13412 [-0.1094, -0.1474, -0.0625, -0.1577, -0.138, -0.1717, -0.1336, -0.1527] {"sb_agents": 32, "sb_alpha_floor": 0.14788120216290157, "sb_dt": 1.0142779372363275, "sb_eta": 0.9416063374779005, "sb_eta_mu": 6.719994515642705, "sb_heat": 0
[I 2026-10-01 20:29:27,176] Trial 4 finished with value: -0.13412081520562238 and parameters: {'start': 'lp', 'sb_agents': 32, 'sb_steps': 414, 'sb_dt': 1.0142779372363275, 'sb_variant': 'ballistic', 'sb_heat': 0.05067891126906621, 'sb_xi': 0.21687872938457173, 'sb_warm': 0.24329656153260945, 'sb_eta_mu': 6.719994515642705, 'sb_alpha_floor': 0.14788120216290157, 'sb_tau_frac': 0.951494525653459, 'sb_eta': 0.9416063374779005}. Best is trial 4 with value: -0.13412081520562238.
[F1__sb__b10] trial 5: -0.13507 [-0.1144, -0.1502, -0.0637, -0.1581, -0.1347, -0.1716, -0.1343, -0.1536] {"sb_agents": 32, "sb_alpha_floor": 0.08251887365127113, "sb_dt": 1.2492031628525258, "sb_eta": 0.5053090215444561, "sb_eta_mu": 0.44670887132732795, "sb_heat":
[I 2026-10-01 20:30:49,100] Trial 5 finished with value: -0.13506675755276326 and parameters: {'start': 'lp', 'sb_agents': 32, 'sb_steps': 450, 'sb_dt': 1.2492031628525258, 'sb_variant': 'ballistic', 'sb_heat': 0.09764361404518028, 'sb_xi': 0.0761632724913781, 'sb_warm': 0.6957095545119003, 'sb_eta_mu': 0.44670887132732795, 'sb_alpha_floor': 0.08251887365127113, 'sb_tau_frac': 0.9539729822516326, 'sb_eta': 0.5053090215444561}. Best is trial 5 with value: -0.13506675755276326.
[F1__sb__b10] trial 6: -0.13287 [-0.1097, -0.1389, -0.0644, -0.1581, -0.1347, -0.1694, -0.1342, -0.1536] {"sb_agents": 32, "sb_alpha_floor": 0.010277613280485376, "sb_dt": 1.3610825686445462, "sb_eta": 0.3726408156361957, "sb_eta_mu": 0.09497492375156134, "sb_heat"
[I 2026-10-01 20:32:10,821] Trial 6 finished with value: -0.13286650321013976 and parameters: {'start': 'lp', 'sb_agents': 32, 'sb_steps': 1559, 'sb_dt': 1.3610825686445462, 'sb_variant': 'ballistic', 'sb_heat': 0.2260537422899784, 'sb_xi': 0.1649024644234928, 'sb_warm': 0.2122007891204064, 'sb_eta_mu': 0.09497492375156134, 'sb_alpha_floor': 0.010277613280485376, 'sb_tau_frac': 0.9779217219938638, 'sb_eta': 0.3726408156361957}. Best is trial 5 with value: -0.13506675755276326.
[F1__sb__b10] trial 7: -0.13354 [-0.1087, -0.152, -0.0609, -0.1586, -0.1341, -0.168, -0.1343, -0.1518] {"sb_agents": 32, "sb_alpha_floor": 0.10495505384946222, "sb_dt": 0.2160066056566079, "sb_eta": 1.2217235389541414, "sb_eta_mu": 0.1904447617876336, "sb_heat": 
[I 2026-10-01 20:33:33,025] Trial 7 finished with value: -0.13354384888843485 and parameters: {'start': 'lp', 'sb_agents': 32, 'sb_steps': 507, 'sb_dt': 0.2160066056566079, 'sb_variant': 'ballistic', 'sb_heat': 0.02663989797176289, 'sb_xi': 0.0787719113682172, 'sb_warm': 0.7669725518987822, 'sb_eta_mu': 0.1904447617876336, 'sb_alpha_floor': 0.10495505384946222, 'sb_tau_frac': 0.942607649775167, 'sb_eta': 1.2217235389541414}. Best is trial 5 with value: -0.13506675755276326.
[F1__sb__b10] trial 8: -0.13500 [-0.1129, -0.1461, -0.0682, -0.1581, -0.1378, -0.1707, -0.1328, -0.1534] {"sb_agents": 32, "sb_alpha_floor": 0.07576461001794518, "sb_dt": 1.1970760201474897, "sb_eta": 0.851312731414966, "sb_eta_mu": 1.0887163584927, "sb_heat": 0.10
[I 2026-10-01 20:34:55,818] Trial 8 finished with value: -0.13500223125313826 and parameters: {'start': 'lp', 'sb_agents': 32, 'sb_steps': 105, 'sb_dt': 1.1970760201474897, 'sb_variant': 'ballistic', 'sb_heat': 0.1072133769453887, 'sb_xi': 0.1834667162090547, 'sb_warm': 0.39565474274786494, 'sb_eta_mu': 1.0887163584927, 'sb_alpha_floor': 0.07576461001794518, 'sb_tau_frac': 0.9652108564474307, 'sb_eta': 0.851312731414966}. Best is trial 5 with value: -0.13506675755276326.
[F1__sb__b10] trial 9: -0.13798 [-0.1129, -0.1424, -0.0653, -0.1639, -0.1416, -0.18, -0.1408, -0.157] {"sb_agents": 32, "sb_alpha_floor": 0.13772316276737318, "sb_dt": 0.39684192105865546, "sb_eta": 0.13278794355145754, "sb_eta_mu": 0.01808138527815477, "sb_heat
[I 2026-10-01 20:36:17,297] Trial 9 finished with value: -0.13798416715651501 and parameters: {'start': 'lp', 'sb_agents': 32, 'sb_steps': 115, 'sb_dt': 0.39684192105865546, 'sb_variant': 'ballistic', 'sb_heat': 0.09437680013831531, 'sb_xi': 0.08879437229711919, 'sb_warm': 0.3058407788616103, 'sb_eta_mu': 0.01808138527815477, 'sb_alpha_floor': 0.13772316276737318, 'sb_tau_frac': 0.9618306598976332, 'sb_eta': 0.13278794355145754}. Best is trial 9 with value: -0.13798416715651501.
[F1__sb__b10] trial 10: -0.13382 [-0.1117, -0.1498, -0.0621, -0.1581, -0.1347, -0.1665, -0.1342, -0.1536] {"sb_agents": 32, "sb_alpha_floor": 0.1484564868223045, "sb_dt": 0.749546378717677, "sb_eta": 0.2106354896145392, "sb_eta_mu": 0.016478049908339083, "sb_heat": 
[I 2026-10-01 20:37:39,321] Trial 10 finished with value: -0.1338225078167234 and parameters: {'start': 'lp', 'sb_agents': 32, 'sb_steps': 117, 'sb_dt': 0.749546378717677, 'sb_variant': 'ballistic', 'sb_heat': 0.02037777179358894, 'sb_xi': 0.585559245928529, 'sb_warm': 0.4682143762296904, 'sb_eta_mu': 0.016478049908339083, 'sb_alpha_floor': 0.1484564868223045, 'sb_tau_frac': 0.9435329201209262, 'sb_eta': 0.2106354896145392}. Best is trial 9 with value: -0.13798416715651501.
[F1__sb__b10] trial 11: -0.13390 [-0.1147, -0.1502, -0.0609, -0.1584, -0.1372, -0.169, -0.1343, -0.1466] {"sb_agents": 32, "sb_alpha_floor": 0.10943023685260242, "sb_dt": 0.9970450059396492, "sb_eta": 0.06512084353518448, "sb_eta_mu": 0.0881864839171379, "sb_heat":
[I 2026-10-01 20:39:00,814] Trial 11 finished with value: -0.13389546611498138 and parameters: {'start': 'lp', 'sb_agents': 32, 'sb_steps': 403, 'sb_dt': 0.9970450059396492, 'sb_variant': 'ballistic', 'sb_heat': 0.05236438310165979, 'sb_xi': 0.11181258574047079, 'sb_warm': 0.3250058576173832, 'sb_eta_mu': 0.0881864839171379, 'sb_alpha_floor': 0.10943023685260242, 'sb_tau_frac': 0.9474214815791856, 'sb_eta': 0.06512084353518448}. Best is trial 9 with value: -0.13798416715651501.
[F1__sb__b10] BEST t9 -0.13798 cfg={"sb_agents": 32, "sb_alpha_floor": 0.13772316276737318, "sb_dt": 0.39684192105865546, "sb_eta": 0.13278794355145754, "sb_eta_mu": 0.01808138527815477, "sb_heat": 0.09437680013831531, "sb_steps": 115, "sb_tau_frac": 0.9618306598976332, "sb_variant": "ballistic", "sb_warm": 0.3058407788616103, "sb_xi": 0.08879437229711919, "start": "lp"}
[I 2026-10-01 20:39:00,847] A new study created in RDB with name: F1__cpsat__b10
[F1__cpsat__b10] trial 0: -0.14968 [-0.118, -0.1541, -0.0746, -0.1728, -0.1629, -0.1912, -0.1545, -0.1694] {"cp_model_presolve": false, "linearization_level": 1, "repair_hint": false, "start": "lp"}
[I 2026-10-01 20:40:02,133] Trial 0 finished with value: -0.1496841956943045 and parameters: {'start': 'lp', 'linearization_level': 1, 'repair_hint': False, 'cp_model_presolve': False}. Best is trial 0 with value: -0.1496841956943045.
[F1__cpsat__b10] trial 1: -0.04860 [-0.0482, -0.069, -0.0181, -0.0694, -0.0273, -0.0692, -0.0388, -0.0487] {"cp_model_presolve": true, "linearization_level": 1, "repair_hint": false, "start": "pgreedy"}
[I 2026-10-01 20:41:12,342] Trial 1 finished with value: -0.048599376304351155 and parameters: {'start': 'pgreedy', 'linearization_level': 1, 'repair_hint': False, 'cp_model_presolve': True}. Best is trial 0 with value: -0.1496841956943045.
[F1__cpsat__b10] trial 2: -0.11797 [-0.0957, -0.1386, -0.0746, -0.1389, -0.1238, -0.1649, -0.1032, -0.1042] {"cp_model_presolve": false, "linearization_level": 1, "repair_hint": false, "start": "pgreedy"}
[I 2026-10-01 20:42:18,567] Trial 2 finished with value: -0.11797329406713264 and parameters: {'start': 'pgreedy', 'linearization_level': 1, 'repair_hint': False, 'cp_model_presolve': False}. Best is trial 0 with value: -0.1496841956943045.
[F1__cpsat__b10] trial 3: -0.10363 [-0.0878, -0.1131, -0.0746, -0.1181, -0.1092, -0.118, -0.1024, -0.1058] {"cp_model_presolve": false, "linearization_level": 0, "repair_hint": false, "start": "pgreedy"}
[I 2026-10-01 20:43:26,066] Trial 3 finished with value: -0.10363266277971817 and parameters: {'start': 'pgreedy', 'linearization_level': 0, 'repair_hint': False, 'cp_model_presolve': False}. Best is trial 0 with value: -0.1496841956943045.
[F1__cpsat__b10] trial 4: -0.14910 [-0.1195, -0.1542, -0.0746, -0.1745, -0.1609, -0.1876, -0.1507, -0.1708] {"cp_model_presolve": false, "linearization_level": 2, "repair_hint": false, "start": "lp"}
[I 2026-10-01 20:44:26,291] Trial 4 finished with value: -0.1491012253861942 and parameters: {'start': 'lp', 'linearization_level': 2, 'repair_hint': False, 'cp_model_presolve': False}. Best is trial 0 with value: -0.1496841956943045.
Check failed: heuristics.fixed_search != nullptr 
*** Check failure stack trace: ***
[F1__cpsat__b10] trial 5: +1.00000 [1.0, 1.0, 1.0, 1.0, 1.0, 1.0, 1.0, 1.0] {"cp_model_presolve": false, "linearization_level": 0, "repair_hint": true, "start": "lp"}
[I 2026-10-01 20:44:30,584] Trial 5 finished with value: 1.0 and parameters: {'start': 'lp', 'linearization_level': 0, 'repair_hint': True, 'cp_model_presolve': False}. Best is trial 0 with value: -0.1496841956943045.
[F1__cpsat__b10] trial 6: -0.14026 [-0.1187, -0.1523, -0.0613, -0.1707, -0.1421, -0.1809, -0.1367, -0.1594] {"cp_model_presolve": true, "linearization_level": 0, "repair_hint": false, "start": "lp"}
[I 2026-10-01 20:45:30,887] Trial 6 finished with value: -0.14026141287606636 and parameters: {'start': 'lp', 'linearization_level': 0, 'repair_hint': False, 'cp_model_presolve': True}. Best is trial 0 with value: -0.1496841956943045.
RESULT {"instance": "full_Region7_s0", "solver": "cpsat", "budget": 10.0, "seed": 7, "wall": 4.357, "objective": 24.160636816886836, "peak_W_util": 24.087525900025927, "status": "ok", "over_budget": 0}
Check failed: heuristics.fixed_search != nullptr 
*** Check failure stack trace: ***
[F1__cpsat__b10] trial 7: +0.86017 [-0.1187, 1.0, 1.0, 1.0, 1.0, 1.0, 1.0, 1.0] {"cp_model_presolve": true, "linearization_level": 2, "repair_hint": true, "start": "lp"}
[I 2026-10-01 20:45:39,535] Trial 7 finished with value: 0.8601653919257278 and parameters: {'start': 'lp', 'linearization_level': 2, 'repair_hint': True, 'cp_model_presolve': True}. Best is trial 0 with value: -0.1496841956943045.
Check failed: heuristics.fixed_search != nullptr 
*** Check failure stack trace: ***
[F1__cpsat__b10] trial 8: +1.00000 [1.0, 1.0, 1.0, 1.0, 1.0, 1.0, 1.0, 1.0] {"cp_model_presolve": false, "linearization_level": 2, "repair_hint": true, "start": "pgreedy"}
[I 2026-10-01 20:45:45,827] Trial 8 finished with value: 1.0 and parameters: {'start': 'pgreedy', 'linearization_level': 2, 'repair_hint': True, 'cp_model_presolve': False}. Best is trial 0 with value: -0.1496841956943045.
[F1__cpsat__b10] trial 9: -0.15076 [-0.1192, -0.1543, -0.0746, -0.1807, -0.1583, -0.1916, -0.1553, -0.172] {"cp_model_presolve": false, "linearization_level": 0, "repair_hint": false, "start": "lp"}
[I 2026-10-01 20:46:45,087] Trial 9 finished with value: -0.1507629386230054 and parameters: {'start': 'lp', 'linearization_level': 0, 'repair_hint': False, 'cp_model_presolve': False}. Best is trial 9 with value: -0.1507629386230054.
RESULT {"instance": "full_Region7_s0", "solver": "cpsat", "budget": 10.0, "seed": 10, "wall": 4.339, "objective": 24.16103138759393, "peak_W_util": 24.087525900025927, "status": "ok", "over_budget": 0}
RESULT {"instance": "full_Region7_s0.1", "solver": "cpsat", "budget": 10.0, "seed": 10, "wall": 4.629, "objective": 23.314013532763532, "peak_W_util": 23.116647241647247, "status": "ok", "over_budget": 0}
Check failed: heuristics.fixed_search != nullptr 
*** Check failure stack trace: ***
[F1__cpsat__b10] trial 10: +0.71613 [-0.1187, -0.1523, 1.0, 1.0, 1.0, 1.0, 1.0, 1.0] {"cp_model_presolve": true, "linearization_level": 1, "repair_hint": true, "start": "lp"}
[I 2026-10-01 20:46:57,683] Trial 10 finished with value: 0.7161273572897666 and parameters: {'start': 'lp', 'linearization_level': 1, 'repair_hint': True, 'cp_model_presolve': True}. Best is trial 9 with value: -0.1507629386230054.
[F1__cpsat__b10] trial 11: -0.15038 [-0.1191, -0.1554, -0.0746, -0.1802, -0.1629, -0.1886, -0.1509, -0.1713] {"cp_model_presolve": false, "linearization_level": 1, "repair_hint": false, "start": "lp"}
