[I 2026-10-01 17:55:37,582] Trial 0 finished with value: -0.13869473595838858 and parameters: {'start': 'lp', 'mq_solver': 'mq_dsb', 'mq_nmax': 514, 'mq_reads': 16, 'mq_iters': 910, 'mq_dt': 0.06526542706084622, 'mq_xi': 0.15316981598941554, 'mq_pen': 0.001344312143528808, 'mq_q': 2, 'mq_ksamp': 7}. Best is trial 0 with value: -0.13869473595838858.
[F1__mq__b3] trial 1: -0.01450 [-0.0135, -0.038, -0.0067, -0.0249, 0.0085, -0.0392, -0.0148, 0.0126] {"mq_dt": 0.302142578942253, "mq_iters": 926, "mq_ksamp": 1, "mq_nmax": 574, "mq_pen": 0.5981221901152552, "mq_q": 2, "mq_reads": 16, "mq_solver": "mq_bsb", "mq
[I 2026-10-01 17:56:07,791] Trial 1 finished with value: -0.014497385239021887 and parameters: {'start': 'pgreedy', 'mq_solver': 'mq_bsb', 'mq_nmax': 574, 'mq_reads': 16, 'mq_iters': 926, 'mq_dt': 0.302142578942253, 'mq_xi': 0.5117279648784191, 'mq_pen': 0.5981221901152552, 'mq_q': 2, 'mq_ksamp': 1}. Best is trial 0 with value: -0.13869473595838858.
[F1__mq__b3] trial 2: -0.04439 [-0.0104, -0.051, -0.0247, -0.0713, -0.0332, -0.0722, -0.0407, -0.0517] {"mq_dt": 1.2426835241724947, "mq_iters": 84, "mq_ksamp": 7, "mq_nmax": 870, "mq_pen": 0.017538232373118037, "mq_q": 3, "mq_reads": 8, "mq_solver": "mq_cac", "m
[I 2026-10-01 17:56:35,317] Trial 2 finished with value: -0.0443868760707619 and parameters: {'start': 'pgreedy', 'mq_solver': 'mq_cac', 'mq_nmax': 870, 'mq_reads': 8, 'mq_iters': 84, 'mq_dt': 1.2426835241724947, 'mq_xi': 0.4235407976345083, 'mq_pen': 0.017538232373118037, 'mq_q': 3, 'mq_ksamp': 7}. Best is trial 0 with value: -0.13869473595838858.
[F1__mq__b3] trial 3: -0.02961 [-0.0188, -0.0346, -0.0209, -0.0343, -0.0179, -0.0455, -0.0334, -0.0316] {"mq_dt": 0.06136635506422015, "mq_iters": 654, "mq_ksamp": 2, "mq_nmax": 531, "mq_pen": 0.10278118224157008, "mq_q": 3, "mq_reads": 4, "mq_solver": "mq_dsb", "
[I 2026-10-01 18:01:59,428] Trial 3 finished with value: -0.029606785356021084 and parameters: {'start': 'pgreedy', 'mq_solver': 'mq_dsb', 'mq_nmax': 531, 'mq_reads': 4, 'mq_iters': 654, 'mq_dt': 0.06136635506422015, 'mq_xi': 0.7666234032273203, 'mq_pen': 0.10278118224157008, 'mq_q': 3, 'mq_ksamp': 2}. Best is trial 0 with value: -0.13869473595838858.
[F1__mq__b3] trial 4: -0.13643 [-0.1112, -0.15, -0.0658, -0.1599, -0.1394, -0.174, -0.1344, -0.1568] {"mq_dt": 0.28855868921618233, "mq_iters": 180, "mq_ksamp": 6, "mq_nmax": 1221, "mq_pen": 0.08090627131445798, "mq_q": 27, "mq_reads": 16, "mq_solver": "mq_dsb"
[I 2026-10-01 18:02:26,954] Trial 4 finished with value: -0.13642869936980423 and parameters: {'start': 'lp', 'mq_solver': 'mq_dsb', 'mq_nmax': 1221, 'mq_reads': 16, 'mq_iters': 180, 'mq_dt': 0.28855868921618233, 'mq_xi': 0.30491112001620335, 'mq_pen': 0.08090627131445798, 'mq_q': 27, 'mq_ksamp': 6}. Best is trial 0 with value: -0.13869473595838858.
[F1__mq__b3] trial 5: -0.13859 [-0.1164, -0.1535, -0.0647, -0.1618, -0.1414, -0.1752, -0.137, -0.1587] {"mq_dt": 0.8838135795898041, "mq_iters": 588, "mq_ksamp": 1, "mq_nmax": 479, "mq_pen": 0.005108724425085228, "mq_q": 2, "mq_reads": 16, "mq_solver": "mq_dsb", 
[I 2026-10-01 18:02:52,978] Trial 5 finished with value: -0.13859081940014206 and parameters: {'start': 'lp', 'mq_solver': 'mq_dsb', 'mq_nmax': 479, 'mq_reads': 16, 'mq_iters': 588, 'mq_dt': 0.8838135795898041, 'mq_xi': 0.12912784119984957, 'mq_pen': 0.005108724425085228, 'mq_q': 2, 'mq_ksamp': 1}. Best is trial 0 with value: -0.13869473595838858.
[F1__mq__b3] trial 6: -0.14327 [-0.1155, -0.1515, -0.0736, -0.1707, -0.1479, -0.1806, -0.1423, -0.164] {"mq_dt": 0.07731178508750013, "mq_iters": 110, "mq_ksamp": 5, "mq_nmax": 206, "mq_pen": 0.33210054400944794, "mq_q": 6, "mq_reads": 16, "mq_solver": "mq_dsb", 
[I 2026-10-01 18:08:17,165] Trial 6 finished with value: -0.1432749965879923 and parameters: {'start': 'lp', 'mq_solver': 'mq_dsb', 'mq_nmax': 206, 'mq_reads': 16, 'mq_iters': 110, 'mq_dt': 0.07731178508750013, 'mq_xi': 0.09368260215934496, 'mq_pen': 0.33210054400944794, 'mq_q': 6, 'mq_ksamp': 5}. Best is trial 6 with value: -0.1432749965879923.
[F1__mq__b3] trial 7: -0.13616 [-0.1096, -0.1531, -0.0614, -0.1607, -0.1404, -0.1732, -0.1357, -0.1553] {"mq_dt": 1.1165671390448455, "mq_iters": 114, "mq_ksamp": 3, "mq_nmax": 223, "mq_pen": 0.0010783221977659573, "mq_q": 20, "mq_reads": 16, "mq_solver": "mq_dsb"
[I 2026-10-01 18:08:46,342] Trial 7 finished with value: -0.1361602525324037 and parameters: {'start': 'lp', 'mq_solver': 'mq_dsb', 'mq_nmax': 223, 'mq_reads': 16, 'mq_iters': 114, 'mq_dt': 1.1165671390448455, 'mq_xi': 2.6184688902200404, 'mq_pen': 0.0010783221977659573, 'mq_q': 20, 'mq_ksamp': 3}. Best is trial 6 with value: -0.1432749965879923.
[F1__mq__b3] trial 8: -0.13606 [-0.1138, -0.1454, -0.064, -0.1603, -0.1391, -0.1733, -0.1361, -0.1565] {"mq_dt": 0.70587276328598, "mq_iters": 1371, "mq_ksamp": 4, "mq_nmax": 401, "mq_pen": 0.7604885028043954, "mq_q": 4, "mq_reads": 16, "mq_solver": "mq_dsb", "mq
[I 2026-10-01 18:09:18,896] Trial 8 finished with value: -0.13605810571787189 and parameters: {'start': 'lp', 'mq_solver': 'mq_dsb', 'mq_nmax': 401, 'mq_reads': 16, 'mq_iters': 1371, 'mq_dt': 0.70587276328598, 'mq_xi': 0.14447614089668842, 'mq_pen': 0.7604885028043954, 'mq_q': 4, 'mq_ksamp': 4}. Best is trial 6 with value: -0.1432749965879923.
[F1__mq__b3] trial 9: -0.13736 [-0.1136, -0.1475, -0.0644, -0.1624, -0.1422, -0.1755, -0.1368, -0.1567] {"mq_dt": 0.06875599053315165, "mq_iters": 378, "mq_ksamp": 7, "mq_nmax": 334, "mq_pen": 0.06688116513645023, "mq_q": 32, "mq_reads": 16, "mq_solver": "mq_dsb",
[I 2026-10-01 18:14:43,713] Trial 9 finished with value: -0.13736245973958439 and parameters: {'start': 'lp', 'mq_solver': 'mq_dsb', 'mq_nmax': 334, 'mq_reads': 16, 'mq_iters': 378, 'mq_dt': 0.06875599053315165, 'mq_xi': 0.05801355946277158, 'mq_pen': 0.06688116513645023, 'mq_q': 32, 'mq_ksamp': 7}. Best is trial 6 with value: -0.1432749965879923.
[F1__mq__b3] trial 10: -0.14328 [-0.1168, -0.1535, -0.0709, -0.167, -0.1465, -0.1807, -0.1444, -0.1664] {"mq_dt": 0.5678576096917989, "mq_iters": 95, "mq_ksamp": 3, "mq_nmax": 674, "mq_pen": 0.06808668718516545, "mq_q": 4, "mq_reads": 16, "mq_solver": "mq_dsb", "m
[I 2026-10-01 18:15:10,986] Trial 10 finished with value: -0.14327554550332453 and parameters: {'start': 'lp', 'mq_solver': 'mq_dsb', 'mq_nmax': 674, 'mq_reads': 16, 'mq_iters': 95, 'mq_dt': 0.5678576096917989, 'mq_xi': 0.9716188220191095, 'mq_pen': 0.06808668718516545, 'mq_q': 4, 'mq_ksamp': 3}. Best is trial 10 with value: -0.14327554550332453.
[F1__mq__b3] trial 11: -0.14749 [-0.1131, -0.1568, -0.0746, -0.174, -0.1559, -0.187, -0.1485, -0.1699] {"mq_dt": 0.43931700667480106, "mq_iters": 50, "mq_ksamp": 6, "mq_nmax": 253, "mq_pen": 0.10984151369889907, "mq_q": 5, "mq_reads": 16, "mq_solver": "mq_dsb", "
[I 2026-10-01 18:19:10,546] Trial 11 finished with value: -0.14749182396209404 and parameters: {'start': 'lp', 'mq_solver': 'mq_dsb', 'mq_nmax': 253, 'mq_reads': 16, 'mq_iters': 50, 'mq_dt': 0.43931700667480106, 'mq_xi': 0.17046763810025106, 'mq_pen': 0.10984151369889907, 'mq_q': 5, 'mq_ksamp': 6}. Best is trial 11 with value: -0.14749182396209404.
[F1__mq__b3] BEST t11 -0.14749 cfg={"mq_dt": 0.43931700667480106, "mq_iters": 50, "mq_ksamp": 6, "mq_nmax": 253, "mq_pen": 0.10984151369889907, "mq_q": 5, "mq_reads": 16, "mq_solver": "mq_dsb", "mq_xi": 0.17046763810025106, "start": "lp"}
[I 2026-10-01 18:19:10,572] A new study created in RDB with name: F1__ls__b3
[F1__ls__b3] trial 0: -0.14632 [-0.1176, -0.1538, -0.0707, -0.1686, -0.1559, -0.1868, -0.1487, -0.1686] {"g_scale": 138.69861245357328, "ls_T0": 0.0025766385746135885, "ls_T1": 3.895706556508577e-06, "ls_chains": 16, "ls_moves": 23860, "ls_restart_every": 0, "p_ad
[I 2026-10-01 18:24:35,629] Trial 0 finished with value: -0.14632243652115917 and parameters: {'start': 'pgreedy', 'ls_T0': 0.0025766385746135885, 'ls_T1_ratio': 0.0015119336467641006, 'ls_moves': 23860, 'p_add': 0.32294705653332806, 'p_swap': 0.38687290659310525, 'topw': 43, 'ls_restart_every': 0, 'ls_chains': 16, 'g_scale': 138.69861245357328}. Best is trial 0 with value: -0.14632243652115917.
[F1__ls__b3] trial 1: -0.14665 [-0.1174, -0.1537, -0.0746, -0.1677, -0.1566, -0.1859, -0.1501, -0.1672] {"g_scale": 138.69861245357328, "ls_T0": 0.0025766385746135885, "ls_T1": 3.895706556508577e-06, "ls_chains": 16, "ls_moves": 23860, "ls_restart_every": 0, "p_ad
[I 2026-10-01 18:25:05,694] Trial 1 finished with value: -0.14665166898108786 and parameters: {'start': 'pgreedy', 'ls_T0': 0.0025766385746135885, 'ls_T1_ratio': 0.0015119336467641006, 'ls_moves': 23860, 'p_add': 0.32294705653332806, 'p_swap': 0.38687290659310525, 'topw': 43, 'ls_restart_every': 0, 'ls_chains': 16, 'g_scale': 138.69861245357328}. Best is trial 1 with value: -0.14665166898108786.
[F1__ls__b3] trial 2: -0.14556 [-0.1185, -0.1545, -0.0746, -0.1736, -0.1478, -0.1836, -0.1445, -0.1674] {"g_scale": 675.031252159593, "ls_T0": 0.021403233140986057, "ls_T1": 0.0002773999548118371, "ls_chains": 8, "ls_moves": 123816, "ls_restart_every": 0, "p_add":
[I 2026-10-01 18:25:34,368] Trial 2 finished with value: -0.14555797472370607 and parameters: {'start': 'lp', 'ls_T0': 0.021403233140986057, 'ls_T1_ratio': 0.01296065659727973, 'ls_moves': 123816, 'p_add': 0.489309171116382, 'p_swap': 0.4083333085150997, 'topw': 9, 'ls_restart_every': 0, 'ls_chains': 8, 'g_scale': 675.031252159593}. Best is trial 1 with value: -0.14665166898108786.
[F1__ls__b3] trial 3: -0.14414 [-0.1181, -0.1516, -0.0746, -0.1674, -0.1504, -0.183, -0.1438, -0.1643] {"g_scale": 2155.4275565447515, "ls_T0": 0.0006677306766018312, "ls_T1": 1.2541143128078558e-06, "ls_chains": 8, "ls_moves": 5358, "ls_restart_every": 0, "p_add
[I 2026-10-01 18:30:59,812] Trial 3 finished with value: -0.14414110121242565 and parameters: {'start': 'pgreedy', 'ls_T0': 0.0006677306766018312, 'ls_T1_ratio': 0.001878173875716191, 'ls_moves': 5358, 'p_add': 0.30881774853793853, 'p_swap': 0.47004576906097556, 'topw': 15, 'ls_restart_every': 0, 'ls_chains': 8, 'g_scale': 2155.4275565447515}. Best is trial 1 with value: -0.14665166898108786.
[F1__ls__b3] trial 4: -0.14059 [-0.1169, -0.1527, -0.0746, -0.1644, -0.1468, -0.1781, -0.1386, -0.1526] {"g_scale": 2259.0697610261573, "ls_T0": 1.2872257056101646e-05, "ls_T1": 7.047580528193202e-10, "ls_chains": 16, "ls_moves": 80064, "ls_restart_every": 0, "p_a
[I 2026-10-01 18:31:26,942] Trial 4 finished with value: -0.14058938721404693 and parameters: {'start': 'pgreedy', 'ls_T0': 1.2872257056101646e-05, 'ls_T1_ratio': 5.475015374131719e-05, 'ls_moves': 80064, 'p_add': 0.04008345183394285, 'p_swap': 0.8926433576732034, 'topw': 5, 'ls_restart_every': 0, 'ls_chains': 16, 'g_scale': 2259.0697610261573}. Best is trial 1 with value: -0.14665166898108786.
[F1__ls__b3] trial 5: -0.14316 [-0.1168, -0.1516, -0.0709, -0.1641, -0.1538, -0.1812, -0.1433, -0.1637] {"g_scale": 136.2213067642332, "ls_T0": 8.247314425284781e-05, "ls_T1": 5.184484366842915e-07, "ls_chains": 16, "ls_moves": 20240, "ls_restart_every": 2, "p_add
[I 2026-10-01 18:31:53,405] Trial 5 finished with value: -0.14316111269404003 and parameters: {'start': 'pgreedy', 'ls_T0': 8.247314425284781e-05, 'ls_T1_ratio': 0.006286269807961024, 'ls_moves': 20240, 'p_add': 0.19363749357962998, 'p_swap': 0.22159962229443791, 'topw': 2, 'ls_restart_every': 2, 'ls_chains': 16, 'g_scale': 136.2213067642332}. Best is trial 1 with value: -0.14665166898108786.
[F1__ls__b3] trial 6: -0.13202 [-0.1146, -0.1388, -0.0736, -0.1518, -0.1337, -0.1695, -0.127, -0.1471] {"g_scale": 3527.8566458743753, "ls_T0": 0.001527879374034651, "ls_T1": 2.2128270186119223e-08, "ls_chains": 16, "ls_moves": 114209, "ls_restart_every": 5, "p_a
[I 2026-10-01 18:37:19,285] Trial 6 finished with value: -0.13202016585146653 and parameters: {'start': 'pgreedy', 'ls_T0': 0.001527879374034651, 'ls_T1_ratio': 1.4482995557224776e-05, 'ls_moves': 114209, 'p_add': 0.34725655190733984, 'p_swap': 0.5621911436769405, 'topw': 60, 'ls_restart_every': 5, 'ls_chains': 16, 'g_scale': 3527.8566458743753}. Best is trial 1 with value: -0.14665166898108786.
[F1__ls__b3] trial 7: -0.14152 [-0.1152, -0.1486, -0.0746, -0.1598, -0.1525, -0.181, -0.14, -0.1604] {"g_scale": 319.91445572295964, "ls_T0": 1.1431492700606369e-05, "ls_T1": 2.4448136133594946e-07, "ls_chains": 16, "ls_moves": 170573, "ls_restart_every": 0, "p
[I 2026-10-01 18:37:51,873] Trial 7 finished with value: -0.14152407238600678 and parameters: {'start': 'pgreedy', 'ls_T0': 1.1431492700606369e-05, 'ls_T1_ratio': 0.02138665244679562, 'ls_moves': 170573, 'p_add': 0.11599746486861762, 'p_swap': 0.7878483273206911, 'topw': 58, 'ls_restart_every': 0, 'ls_chains': 16, 'g_scale': 319.91445572295964}. Best is trial 1 with value: -0.14665166898108786.
[F1__ls__b3] trial 8: -0.05954 [-0.0534, -0.0851, -0.0512, -0.0863, -0.0349, -0.0709, -0.0342, -0.0604] {"g_scale": 2532.993462555905, "ls_T0": 0.08430253181441454, "ls_T1": 0.0008883310385172521, "ls_chains": 16, "ls_moves": 20938, "ls_restart_every": 0, "p_add":
[I 2026-10-01 18:38:28,957] Trial 8 finished with value: -0.059537627267255255 and parameters: {'start': 'pgreedy', 'ls_T0': 0.08430253181441454, 'ls_T1_ratio': 0.0105374182648849, 'ls_moves': 20938, 'p_add': 0.209518230832611, 'p_swap': 0.22872741568987845, 'topw': 2, 'ls_restart_every': 0, 'ls_chains': 16, 'g_scale': 2532.993462555905}. Best is trial 1 with value: -0.14665166898108786.
[F1__ls__b3] trial 9: -0.07072 [-0.0646, -0.0938, -0.0587, -0.1073, -0.0453, -0.0962, -0.042, -0.058] {"g_scale": 2292.302842503798, "ls_T0": 0.004154496354981893, "ls_T1": 0.00014351050297818863, "ls_chains": 16, "ls_moves": 47865, "ls_restart_every": 0, "p_add
[I 2026-10-01 18:43:54,509] Trial 9 finished with value: -0.07071878877882515 and parameters: {'start': 'pgreedy', 'ls_T0': 0.004154496354981893, 'ls_T1_ratio': 0.034543417713219796, 'ls_moves': 47865, 'p_add': 0.02997751103433921, 'p_swap': 0.7294320857033499, 'topw': 56, 'ls_restart_every': 0, 'ls_chains': 16, 'g_scale': 2292.302842503798}. Best is trial 1 with value: -0.14665166898108786.
[F1__ls__b3] trial 10: -0.13724 [-0.1153, -0.1461, -0.0746, -0.1567, -0.1452, -0.1717, -0.1321, -0.1562] {"g_scale": 734.29005681762, "ls_T0": 2.2156816383562903e-05, "ls_T1": 6.989305531620488e-10, "ls_chains": 16, "ls_moves": 64777, "ls_restart_every": 0, "p_add"
[I 2026-10-01 18:44:22,012] Trial 10 finished with value: -0.13724496661633862 and parameters: {'start': 'pgreedy', 'ls_T0': 2.2156816383562903e-05, 'ls_T1_ratio': 3.1544719289209454e-05, 'ls_moves': 64777, 'p_add': 0.4394598142207857, 'p_swap': 0.2919712291506253, 'topw': 64, 'ls_restart_every': 0, 'ls_chains': 16, 'g_scale': 734.29005681762}. Best is trial 1 with value: -0.14665166898108786.
[F1__ls__b3] trial 11: -0.13337 [-0.1125, -0.1466, -0.0744, -0.151, -0.1358, -0.1686, -0.1317, -0.1464] {"g_scale": 192.48795440722327, "ls_T0": 0.023752386100816564, "ls_T1": 1.0002291206609414e-05, "ls_chains": 16, "ls_moves": 45753, "ls_restart_every": 0, "p_ad
[I 2026-10-01 18:44:55,792] Trial 11 finished with value: -0.13336728594725086 and parameters: {'start': 'pgreedy', 'ls_T0': 0.023752386100816564, 'ls_T1_ratio': 0.0004211067959300962, 'ls_moves': 45753, 'p_add': 0.21966870647219106, 'p_swap': 0.39357474155038835, 'topw': 39, 'ls_restart_every': 0, 'ls_chains': 16, 'g_scale': 192.48795440722327}. Best is trial 1 with value: -0.14665166898108786.
[F1__ls__b3] BEST t1 -0.14665 cfg={"g_scale": 138.69861245357328, "ls_T0": 0.0025766385746135885, "ls_T1": 3.895706556508577e-06, "ls_chains": 16, "ls_moves": 23860, "ls_restart_every": 0, "p_add": 0.32294705653332806, "p_swap": 0.38687290659310525, "start": "pgreedy", "topw": 43}
