[I 2026-10-01 15:07:16,858] Trial 11 finished with value: 1.0 and parameters: {'start': 'pgreedy', 'eim_R': 32, 'eim_Tmin': 0.00020356691834271277, 'eim_Tratio': 423.5063180990241, 'eim_moves': 135133, 'p_add': 0.1087486154584901, 'p_swap': 0.5028357166666634, 'topw': 13, 'eim_rho': 657.6374134578475, 'eim_hscale': 1.3837591392722572, 'eim_anneal': 0.7968759848697708, 'eim_eta': 1.9629517008494923, 'g_scale': 6607.596609167126}. Best is trial 7 with value: -0.12303029713317269.
[F1__eim__b1] BEST t7 -0.12303 cfg={"eim_R": 32, "eim_Tmax": 0.003583986660864503, "eim_Tmin": 5.783861854309937e-05, "eim_anneal": 0.12409113813250239, "eim_eta": 0.34260036476627304, "eim_hscale": 0.1304777081943831, "eim_moves": 104211, "eim_rho": 943.9510613981709, "g_scale": 7782.319746550366, "p_add": 0.14263230801054813, "p_swap": 0.5234958816794935, "start": "pgreedy", "topw": 12}
[I 2026-10-01 15:07:16,908] A new study created in RDB with name: F1__milp__b1
[F1__milp__b1] trial 0: -0.03682 [-0.0139, -0.039, -0.0478, -0.0471, -0.0331, -0.0487, -0.0312, -0.0337] {"eps_tie": 0.0, "mip_heuristic_effort": 0.8077206102454388, "presolve": "off", "start": "pgreedy"}
[I 2026-10-01 15:07:24,678] Trial 0 finished with value: -0.036815314129615015 and parameters: {'start': 'pgreedy', 'presolve': 'off', 'mip_heuristic_effort': 0.8077206102454388, 'eps_tie': 0.0}. Best is trial 0 with value: -0.036815314129615015.
[F1__milp__b1] trial 1: +0.87482 [-0.0015, 1.0, 1.0, 1.0, 1.0, 1.0, 1.0, 1.0] {"eps_tie": 0.0, "mip_heuristic_effort": 0.10490756141474163, "presolve": "on", "start": "pgreedy"}
[I 2026-10-01 15:08:50,941] Trial 1 finished with value: 0.8748154280964697 and parameters: {'start': 'pgreedy', 'presolve': 'on', 'mip_heuristic_effort': 0.10490756141474163, 'eps_tie': 0.0}. Best is trial 0 with value: -0.036815314129615015.
[F1__milp__b1] trial 2: -0.03545 [-0.0139, -0.0388, -0.0478, -0.0375, -0.0356, -0.0498, -0.0265, -0.0337] {"eps_tie": 0.0001, "mip_heuristic_effort": 0.15834581868043074, "presolve": "off", "start": "pgreedy"}
[I 2026-10-01 15:08:58,411] Trial 2 finished with value: -0.0354468188082981 and parameters: {'start': 'pgreedy', 'presolve': 'off', 'mip_heuristic_effort': 0.15834581868043074, 'eps_tie': 0.0001}. Best is trial 0 with value: -0.036815314129615015.
[F1__milp__b1] trial 3: -0.03478 [-0.0077, -0.04, -0.0475, -0.0394, -0.0356, -0.0378, -0.0366, -0.0337] {"eps_tie": 0.0001, "mip_heuristic_effort": 0.41985078951584265, "presolve": "off", "start": "pgreedy"}
[I 2026-10-01 15:09:05,966] Trial 3 finished with value: -0.0347804926338251 and parameters: {'start': 'pgreedy', 'presolve': 'off', 'mip_heuristic_effort': 0.41985078951584265, 'eps_tie': 0.0001}. Best is trial 0 with value: -0.036815314129615015.
[F1__milp__b1] trial 4: -0.04559 [-0.0551, -0.0465, -0.0478, -0.0455, -0.0356, -0.0601, -0.0404, -0.0337] {"eps_tie": 0.0, "mip_heuristic_effort": 0.670529732883559, "presolve": "off", "start": "pgreedy"}
[I 2026-10-01 15:09:13,292] Trial 4 finished with value: -0.04559184960686666 and parameters: {'start': 'pgreedy', 'presolve': 'off', 'mip_heuristic_effort': 0.670529732883559, 'eps_tie': 0.0}. Best is trial 4 with value: -0.04559184960686666.
[F1__milp__b1] trial 5: -0.04716 [-0.0545, -0.0534, -0.0478, -0.0548, -0.0439, -0.0606, -0.029, -0.0332] {"eps_tie": 0.0, "mip_heuristic_effort": 0.02229102402422014, "presolve": "off", "start": "pgreedy"}
[I 2026-10-01 15:09:20,921] Trial 5 finished with value: -0.04716109361574028 and parameters: {'start': 'pgreedy', 'presolve': 'off', 'mip_heuristic_effort': 0.02229102402422014, 'eps_tie': 0.0}. Best is trial 5 with value: -0.04716109361574028.
[F1__milp__b1] trial 6: -0.07621 [-0.1097, -0.1368, -0.0644, -0.0666, -0.048, -0.0723, -0.0547, -0.0572] {"eps_tie": 0.0, "mip_heuristic_effort": 0.051205391728560694, "presolve": "off", "start": "lp"}
[I 2026-10-01 15:09:27,794] Trial 6 finished with value: -0.07621208166753143 and parameters: {'start': 'lp', 'presolve': 'off', 'mip_heuristic_effort': 0.051205391728560694, 'eps_tie': 0.0}. Best is trial 6 with value: -0.07621208166753143.
[F1__milp__b1] trial 7: -0.07727 [-0.1075, -0.1515, -0.0604, -0.0666, -0.0473, -0.0728, -0.0551, -0.0572] {"eps_tie": 0.0, "mip_heuristic_effort": 0.11801028004308105, "presolve": "off", "start": "lp"}
[I 2026-10-01 15:09:34,652] Trial 7 finished with value: -0.07727308199276181 and parameters: {'start': 'lp', 'presolve': 'off', 'mip_heuristic_effort': 0.11801028004308105, 'eps_tie': 0.0}. Best is trial 7 with value: -0.07727308199276181.
[F1__milp__b1] trial 8: -0.07701 [-0.1117, -0.1467, -0.0609, -0.0666, -0.046, -0.0723, -0.0547, -0.0572] {"eps_tie": 0.0, "mip_heuristic_effort": 0.25960597744412756, "presolve": "on", "start": "lp"}
[I 2026-10-01 15:09:42,776] Trial 8 finished with value: -0.07700782230272017 and parameters: {'start': 'lp', 'presolve': 'on', 'mip_heuristic_effort': 0.25960597744412756, 'eps_tie': 0.0}. Best is trial 7 with value: -0.07727308199276181.
[F1__milp__b1] trial 9: -0.07721 [-0.11, -0.1452, -0.0637, -0.068, -0.046, -0.0728, -0.0547, -0.0572] {"eps_tie": 0.0001, "mip_heuristic_effort": 0.021899274463739373, "presolve": "on", "start": "lp"}
[I 2026-10-01 15:09:51,031] Trial 9 finished with value: -0.07721499088336324 and parameters: {'start': 'lp', 'presolve': 'on', 'mip_heuristic_effort': 0.021899274463739373, 'eps_tie': 0.0001}. Best is trial 7 with value: -0.07727308199276181.
[F1__milp__b1] trial 10: -0.07766 [-0.1117, -0.1502, -0.0621, -0.0666, -0.046, -0.0728, -0.0547, -0.0572] {"eps_tie": 0.0, "mip_heuristic_effort": 0.4134950101478543, "presolve": "off", "start": "lp"}
[I 2026-10-01 15:09:58,093] Trial 10 finished with value: -0.07766293575493229 and parameters: {'start': 'lp', 'presolve': 'off', 'mip_heuristic_effort': 0.4134950101478543, 'eps_tie': 0.0}. Best is trial 10 with value: -0.07766293575493229.
[F1__milp__b1] trial 11: -0.07779 [-0.1145, -0.1487, -0.0609, -0.0666, -0.0468, -0.0728, -0.0548, -0.0572] {"eps_tie": 0.0, "mip_heuristic_effort": 0.38541305960242617, "presolve": "off", "start": "lp"}
[I 2026-10-01 15:10:05,160] Trial 11 finished with value: -0.07778724743912305 and parameters: {'start': 'lp', 'presolve': 'off', 'mip_heuristic_effort': 0.38541305960242617, 'eps_tie': 0.0}. Best is trial 11 with value: -0.07778724743912305.
[F1__milp__b1] BEST t11 -0.07779 cfg={"eps_tie": 0.0, "mip_heuristic_effort": 0.38541305960242617, "presolve": "off", "start": "lp"}
[I 2026-10-01 15:10:05,203] A new study created in RDB with name: F1__sb__b1
[F1__sb__b1] trial 0: -0.07690 [-0.1106, -0.1478, -0.0613, -0.0661, -0.046, -0.0723, -0.0547, -0.0564] {"sb_agents": 32, "sb_alpha_floor": 0.19397546899179888, "sb_dt": 1.4232321618458184, "sb_eta": 0.0965605178058406, "sb_eta_mu": 4.719399631690194, "sb_heat": 0
[I 2026-10-01 15:10:15,515] Trial 0 finished with value: -0.07690324199304074 and parameters: {'start': 'lp', 'sb_agents': 32, 'sb_steps': 1432, 'sb_dt': 1.4232321618458184, 'sb_variant': 'ballistic', 'sb_heat': 0.0125536250820598, 'sb_xi': 0.07953090488826875, 'sb_warm': 0.10136029824871645, 'sb_eta_mu': 4.719399631690194, 'sb_alpha_floor': 0.19397546899179888, 'sb_tau_frac': 0.9386113363824448, 'sb_eta': 0.0965605178058406}. Best is trial 0 with value: -0.07690324199304074.
[F1__sb__b1] trial 1: -0.00037 [0.0, 0.0, 0.0, 0.0, 0.0, -0.003, 0.0, 0.0] {"sb_agents": 64, "sb_alpha_floor": 0.017425859940308142, "sb_dt": 1.3593049010167038, "sb_eta": 2.3131814207377923, "sb_eta_mu": 0.0163345876110695, "sb_heat":
[I 2026-10-01 15:10:25,423] Trial 1 finished with value: -0.00037026801334352766 and parameters: {'start': 'pgreedy', 'sb_agents': 64, 'sb_steps': 250, 'sb_dt': 1.3593049010167038, 'sb_variant': 'ballistic', 'sb_heat': 0.060428515788450606, 'sb_xi': 0.5117279648784191, 'sb_warm': 0.8793168063780279, 'sb_eta_mu': 0.0163345876110695, 'sb_alpha_floor': 0.017425859940308142, 'sb_tau_frac': 0.9020218397440326, 'sb_eta': 2.3131814207377923}. Best is trial 0 with value: -0.07690324199304074.
[F1__sb__b1] trial 2: +0.00150 [0.0, 0.012, 0.0, 0.0, 0.0, 0.0, -0.0, 0.0] {"sb_agents": 8, "sb_alpha_floor": 0.1136867897737297, "sb_dt": 1.031897327725781, "sb_eta": 0.8594903371659688, "sb_eta_mu": 0.23358825194833557, "sb_heat": 0.
[I 2026-10-01 15:10:35,410] Trial 2 finished with value: 0.0015014983808157717 and parameters: {'start': 'pgreedy', 'sb_agents': 8, 'sb_steps': 77, 'sb_dt': 1.031897327725781, 'sb_variant': 'discrete', 'sb_heat': 0.040973773756855375, 'sb_xi': 0.14770319740236926, 'sb_warm': 0.7355220049625057, 'sb_eta_mu': 0.23358825194833557, 'sb_alpha_floor': 0.1136867897737297, 'sb_tau_frac': 0.9018789800436355, 'sb_eta': 0.8594903371659688}. Best is trial 0 with value: -0.07690324199304074.
[F1__sb__b1] trial 3: +0.12437 [1.0, -0.0051, 0.0, 0.0, 0.0, 0.0, 0.0, 0.0] {"sb_agents": 8, "sb_alpha_floor": 0.08772030269246407, "sb_dt": 0.2782931131180508, "sb_eta": 0.07999440746315747, "sb_eta_mu": 0.513558960650023, "sb_heat": 0
[I 2026-10-01 15:10:47,144] Trial 3 finished with value: 0.12436644458323194 and parameters: {'start': 'pgreedy', 'sb_agents': 8, 'sb_steps': 654, 'sb_dt': 0.2782931131180508, 'sb_variant': 'discrete', 'sb_heat': 0.015503857733727292, 'sb_xi': 0.18190696204307705, 'sb_warm': 0.3455252323954915, 'sb_eta_mu': 0.513558960650023, 'sb_alpha_floor': 0.08772030269246407, 'sb_tau_frac': 0.9988373838059226, 'sb_eta': 0.07999440746315747}. Best is trial 0 with value: -0.07690324199304074.
[F1__sb__b1] trial 4: -0.07655 [-0.1093, -0.1458, -0.0619, -0.0661, -0.046, -0.0723, -0.0547, -0.0564] {"sb_agents": 32, "sb_alpha_floor": 0.14788120216290157, "sb_dt": 1.0142779372363275, "sb_eta": 0.9416063374779005, "sb_eta_mu": 6.719994515642705, "sb_heat": 0
[I 2026-10-01 15:10:57,306] Trial 4 finished with value: -0.07655262517586109 and parameters: {'start': 'lp', 'sb_agents': 32, 'sb_steps': 414, 'sb_dt': 1.0142779372363275, 'sb_variant': 'ballistic', 'sb_heat': 0.05067891126906621, 'sb_xi': 0.21687872938457173, 'sb_warm': 0.24329656153260945, 'sb_eta_mu': 6.719994515642705, 'sb_alpha_floor': 0.14788120216290157, 'sb_tau_frac': 0.951494525653459, 'sb_eta': 0.9416063374779005}. Best is trial 0 with value: -0.07690324199304074.
[F1__sb__b1] trial 5: +0.05528 [-0.1144, -0.1502, -0.0637, 1.0, -0.046, -0.0723, -0.0547, -0.0564] {"sb_agents": 32, "sb_alpha_floor": 0.08251887365127113, "sb_dt": 1.2492031628525258, "sb_eta": 0.5053090215444561, "sb_eta_mu": 0.44670887132732795, "sb_heat":
[I 2026-10-01 15:11:10,864] Trial 5 finished with value: 0.055284009139744975 and parameters: {'start': 'lp', 'sb_agents': 32, 'sb_steps': 450, 'sb_dt': 1.2492031628525258, 'sb_variant': 'ballistic', 'sb_heat': 0.09764361404518028, 'sb_xi': 0.0761632724913781, 'sb_warm': 0.6957095545119003, 'sb_eta_mu': 0.44670887132732795, 'sb_alpha_floor': 0.08251887365127113, 'sb_tau_frac': 0.9539729822516326, 'sb_eta': 0.5053090215444561}. Best is trial 0 with value: -0.07690324199304074.
[F1__sb__b1] trial 6: -0.07579 [-0.1097, -0.1368, -0.0644, -0.0661, -0.046, -0.0723, -0.0547, -0.0564] {"sb_agents": 32, "sb_alpha_floor": 0.19496502826966167, "sb_dt": 1.4381961286297296, "sb_eta": 0.07739242752774056, "sb_eta_mu": 4.6879347048311395, "sb_heat":
[I 2026-10-01 15:11:21,576] Trial 6 finished with value: -0.07579279508006405 and parameters: {'start': 'lp', 'sb_agents': 32, 'sb_steps': 1563, 'sb_dt': 1.4381961286297296, 'sb_variant': 'ballistic', 'sb_heat': 0.011565122739528644, 'sb_xi': 0.07146533546934425, 'sb_warm': 0.09611590638437702, 'sb_eta_mu': 4.6879347048311395, 'sb_alpha_floor': 0.19496502826966167, 'sb_tau_frac': 0.9329656530564482, 'sb_eta': 0.07739242752774056}. Best is trial 0 with value: -0.07690324199304074.
[F1__sb__b1] trial 7: -0.07686 [-0.1075, -0.1515, -0.0604, -0.0661, -0.046, -0.0723, -0.0547, -0.0564] {"sb_agents": 32, "sb_alpha_floor": 0.10495505384946222, "sb_dt": 0.2160066056566079, "sb_eta": 1.2217235389541414, "sb_eta_mu": 0.1904447617876336, "sb_heat": 
[I 2026-10-01 15:11:31,779] Trial 7 finished with value: -0.07686053849851147 and parameters: {'start': 'lp', 'sb_agents': 32, 'sb_steps': 507, 'sb_dt': 0.2160066056566079, 'sb_variant': 'ballistic', 'sb_heat': 0.02663989797176289, 'sb_xi': 0.0787719113682172, 'sb_warm': 0.7669725518987822, 'sb_eta_mu': 0.1904447617876336, 'sb_alpha_floor': 0.10495505384946222, 'sb_tau_frac': 0.942607649775167, 'sb_eta': 1.2217235389541414}. Best is trial 0 with value: -0.07690324199304074.
[F1__sb__b1] trial 8: -0.07684 [-0.1117, -0.1466, -0.0609, -0.0661, -0.046, -0.0723, -0.0547, -0.0564] {"sb_agents": 32, "sb_alpha_floor": 0.16222436059873674, "sb_dt": 1.1147401893109368, "sb_eta": 3.818519028925482, "sb_eta_mu": 0.03309945815403003, "sb_heat": 
[I 2026-10-01 15:11:42,275] Trial 8 finished with value: -0.0768354515746061 and parameters: {'start': 'lp', 'sb_agents': 32, 'sb_steps': 707, 'sb_dt': 1.1147401893109368, 'sb_variant': 'ballistic', 'sb_heat': 0.014737208286711916, 'sb_xi': 1.7943789966474426, 'sb_warm': 0.5132551063363158, 'sb_eta_mu': 0.03309945815403003, 'sb_alpha_floor': 0.16222436059873674, 'sb_tau_frac': 0.9337928836995604, 'sb_eta': 3.818519028925482}. Best is trial 0 with value: -0.07690324199304074.
[F1__sb__b1] trial 9: -0.07684 [-0.11, -0.1455, -0.0637, -0.0661, -0.046, -0.0723, -0.0547, -0.0564] {"sb_agents": 32, "sb_alpha_floor": 0.12937050425834662, "sb_dt": 0.5105651450466572, "sb_eta": 0.16449703914336528, "sb_eta_mu": 0.22309198379998565, "sb_heat"
[I 2026-10-01 15:11:52,627] Trial 9 finished with value: -0.07684003919690073 and parameters: {'start': 'lp', 'sb_agents': 32, 'sb_steps': 1871, 'sb_dt': 0.5105651450466572, 'sb_variant': 'ballistic', 'sb_heat': 0.018437433346967267, 'sb_xi': 2.0307216047275527, 'sb_warm': 0.2606713043127498, 'sb_eta_mu': 0.22309198379998565, 'sb_alpha_floor': 0.12937050425834662, 'sb_tau_frac': 0.9470181330689641, 'sb_eta': 0.16449703914336528}. Best is trial 0 with value: -0.07690324199304074.
[F1__sb__b1] trial 10: +0.31927 [-0.1117, -0.1498, 1.0, -0.0661, -0.046, -0.0723, 1.0, 1.0] {"sb_agents": 32, "sb_alpha_floor": 0.19371610054851676, "sb_dt": 0.25018668713713943, "sb_eta": 0.32925951975957823, "sb_eta_mu": 0.8918187647737446, "sb_heat"
[I 2026-10-01 15:12:06,974] Trial 10 finished with value: 0.3192682749392426 and parameters: {'start': 'lp', 'sb_agents': 32, 'sb_steps': 773, 'sb_dt': 0.25018668713713943, 'sb_variant': 'ballistic', 'sb_heat': 0.14950067037901996, 'sb_xi': 0.15657969874831568, 'sb_warm': 0.6318309251410723, 'sb_eta_mu': 0.8918187647737446, 'sb_alpha_floor': 0.19371610054851676, 'sb_tau_frac': 0.9232911153656576, 'sb_eta': 0.32925951975957823}. Best is trial 0 with value: -0.07690324199304074.
[F1__sb__b1] trial 11: +0.19447 [1.0, -0.1487, 1.0, -0.0661, -0.046, -0.0723, -0.0547, -0.0564] {"sb_agents": 32, "sb_alpha_floor": 0.07625564400575507, "sb_dt": 1.0362848258280566, "sb_eta": 0.09308237468833556, "sb_eta_mu": 0.2238814955427991, "sb_heat":
[I 2026-10-01 15:12:20,892] Trial 11 finished with value: 0.1944739799785933 and parameters: {'start': 'lp', 'sb_agents': 32, 'sb_steps': 889, 'sb_dt': 1.0362848258280566, 'sb_variant': 'ballistic', 'sb_heat': 0.019428548519543787, 'sb_xi': 0.10563939657292454, 'sb_warm': 0.46370921592643927, 'sb_eta_mu': 0.2238814955427991, 'sb_alpha_floor': 0.07625564400575507, 'sb_tau_frac': 0.9312026109211035, 'sb_eta': 0.09308237468833556}. Best is trial 0 with value: -0.07690324199304074.
[F1__sb__b1] BEST t0 -0.07690 cfg={"sb_agents": 32, "sb_alpha_floor": 0.19397546899179888, "sb_dt": 1.4232321618458184, "sb_eta": 0.0965605178058406, "sb_eta_mu": 4.719399631690194, "sb_heat": 0.0125536250820598, "sb_steps": 1432, "sb_tau_frac": 0.9386113363824448, "sb_variant": "ballistic", "sb_warm": 0.10136029824871645, "sb_xi": 0.07953090488826875, "start": "lp"}
[I 2026-10-01 15:12:20,931] A new study created in RDB with name: F1__cpsat__b1
[F1__cpsat__b1] trial 0: -0.07696 [-0.1106, -0.1478, -0.0613, -0.0666, -0.046, -0.0723, -0.0547, -0.0564] {"cp_model_presolve": false, "linearization_level": 1, "repair_hint": false, "start": "lp"}
[I 2026-10-01 15:12:28,423] Trial 0 finished with value: -0.07696073619949481 and parameters: {'start': 'lp', 'linearization_level': 1, 'repair_hint': False, 'cp_model_presolve': False}. Best is trial 0 with value: -0.07696073619949481.
[F1__cpsat__b1] trial 1: +0.00000 [0.0, 0.0, 0.0, 0.0, 0.0, 0.0, 0.0, 0.0] {"cp_model_presolve": true, "linearization_level": 1, "repair_hint": false, "start": "pgreedy"}
[I 2026-10-01 15:12:36,439] Trial 1 finished with value: 0.0 and parameters: {'start': 'pgreedy', 'linearization_level': 1, 'repair_hint': False, 'cp_model_presolve': True}. Best is trial 0 with value: -0.07696073619949481.
[F1__cpsat__b1] trial 2: -0.00477 [-0.0066, -0.0024, -0.0006, -0.0045, -0.0032, -0.0171, -0.0045, 0.0008] {"cp_model_presolve": false, "linearization_level": 1, "repair_hint": false, "start": "pgreedy"}
[I 2026-10-01 15:12:44,872] Trial 2 finished with value: -0.004773151111795035 and parameters: {'start': 'pgreedy', 'linearization_level': 1, 'repair_hint': False, 'cp_model_presolve': False}. Best is trial 0 with value: -0.07696073619949481.
[F1__cpsat__b1] trial 3: -0.00688 [-0.0064, -0.0054, -0.0006, -0.0134, -0.0014, -0.017, -0.0087, -0.0021] {"cp_model_presolve": false, "linearization_level": 0, "repair_hint": false, "start": "pgreedy"}
[I 2026-10-01 15:12:53,418] Trial 3 finished with value: -0.006880226199221989 and parameters: {'start': 'pgreedy', 'linearization_level': 0, 'repair_hint': False, 'cp_model_presolve': False}. Best is trial 0 with value: -0.07696073619949481.
[F1__cpsat__b1] trial 4: -0.07692 [-0.1106, -0.1478, -0.0613, -0.0663, -0.046, -0.0723, -0.0547, -0.0564] {"cp_model_presolve": false, "linearization_level": 2, "repair_hint": false, "start": "lp"}
[I 2026-10-01 15:13:00,880] Trial 4 finished with value: -0.07692070430917468 and parameters: {'start': 'lp', 'linearization_level': 2, 'repair_hint': False, 'cp_model_presolve': False}. Best is trial 0 with value: -0.07696073619949481.
RESULT {"instance": "full_Region7_s0", "solver": "cpsat", "budget": 1.0, "seed": 5, "wall": 0.688, "objective": 24.381058177933234, "peak_W_util": 24.087525900025927, "status": "ok", "over_budget": 0}
RESULT {"instance": "full_Region7_s0.1", "solver": "cpsat", "budget": 1.0, "seed": 5, "wall": 0.722, "objective": 23.439284673659685, "peak_W_util": 23.116647241647247, "status": "ok", "over_budget": 0}
RESULT {"instance": "full_Region7_s0.2", "solver": "cpsat", "budget": 1.0, "seed": 5, "wall": 0.628, "objective": 25.77706957394453, "peak_W_util": 25.666925666925614, "status": "ok", "over_budget": 0}
Check failed: heuristics.fixed_search != nullptr 
*** Check failure stack trace: ***
[F1__cpsat__b1] trial 5: +0.58503 [-0.1106, -0.1478, -0.0613, 1.0, 1.0, 1.0, 1.0, 1.0] {"cp_model_presolve": false, "linearization_level": 0, "repair_hint": true, "start": "lp"}
[I 2026-10-01 15:13:04,649] Trial 5 finished with value: 0.5850345405660723 and parameters: {'start': 'lp', 'linearization_level': 0, 'repair_hint': True, 'cp_model_presolve': False}. Best is trial 0 with value: -0.07696073619949481.
[F1__cpsat__b1] trial 6: -0.07690 [-0.1106, -0.1478, -0.0613, -0.0661, -0.046, -0.0723, -0.0547, -0.0564] {"cp_model_presolve": true, "linearization_level": 0, "repair_hint": false, "start": "lp"}
[I 2026-10-01 15:13:11,915] Trial 6 finished with value: -0.07690324199304074 and parameters: {'start': 'lp', 'linearization_level': 0, 'repair_hint': False, 'cp_model_presolve': True}. Best is trial 0 with value: -0.07696073619949481.
[F1__cpsat__b1] trial 7: -0.06830 [-0.0418, -0.1478, -0.0613, -0.0661, -0.046, -0.0723, -0.0547, -0.0564] {"cp_model_presolve": true, "linearization_level": 2, "repair_hint": true, "start": "lp"}
[I 2026-10-01 15:13:19,579] Trial 7 finished with value: -0.06829800255350615 and parameters: {'start': 'lp', 'linearization_level': 2, 'repair_hint': True, 'cp_model_presolve': True}. Best is trial 0 with value: -0.07696073619949481.
Check failed: heuristics.fixed_search != nullptr 
*** Check failure stack trace: ***
[F1__cpsat__b1] trial 8: +1.00000 [1.0, 1.0, 1.0, 1.0, 1.0, 1.0, 1.0, 1.0] {"cp_model_presolve": false, "linearization_level": 2, "repair_hint": true, "start": "pgreedy"}
[I 2026-10-01 15:13:20,924] Trial 8 finished with value: 1.0 and parameters: {'start': 'pgreedy', 'linearization_level': 2, 'repair_hint': True, 'cp_model_presolve': False}. Best is trial 0 with value: -0.07696073619949481.
[F1__cpsat__b1] trial 9: -0.07730 [-0.1106, -0.1478, -0.0613, -0.0664, -0.0484, -0.0723, -0.055, -0.0566] {"cp_model_presolve": false, "linearization_level": 0, "repair_hint": false, "start": "lp"}
[I 2026-10-01 15:13:28,741] Trial 9 finished with value: -0.07729971288243977 and parameters: {'start': 'lp', 'linearization_level': 0, 'repair_hint': False, 'cp_model_presolve': False}. Best is trial 9 with value: -0.07729971288243977.
[F1__cpsat__b1] trial 10: -0.07690 [-0.1106, -0.1478, -0.0613, -0.0661, -0.046, -0.0723, -0.0547, -0.0564] {"cp_model_presolve": true, "linearization_level": 1, "repair_hint": true, "start": "lp"}
[I 2026-10-01 15:13:36,430] Trial 10 finished with value: -0.07690324199304074 and parameters: {'start': 'lp', 'linearization_level': 1, 'repair_hint': True, 'cp_model_presolve': True}. Best is trial 9 with value: -0.07729971288243977.
[F1__cpsat__b1] trial 11: -0.07737 [-0.1106, -0.1478, -0.0613, -0.0664, -0.0476, -0.0726, -0.056, -0.0566] {"cp_model_presolve": false, "linearization_level": 1, "repair_hint": false, "start": "lp"}
