[I 2026-10-01 20:47:56,886] Trial 11 finished with value: -0.15037642080950123 and parameters: {'start': 'lp', 'linearization_level': 1, 'repair_hint': False, 'cp_model_presolve': False}. Best is trial 9 with value: -0.1507629386230054.
[F1__cpsat__b10] BEST t9 -0.15076 cfg={"cp_model_presolve": false, "linearization_level": 0, "repair_hint": false, "start": "lp"}
[I 2026-10-01 20:47:56,947] A new study created in RDB with name: F1__mq__b10
[F1__mq__b10] trial 0: -0.14297 [-0.1171, -0.1526, -0.0739, -0.1692, -0.1467, -0.179, -0.1412, -0.1641] {"mq_dt": 0.06526542706084622, "mq_iters": 910, "mq_ksamp": 7, "mq_nmax": 514, "mq_pen": 0.001344312143528808, "mq_q": 2, "mq_reads": 16, "mq_solver": "mq_dsb",
[I 2026-10-01 20:49:17,601] Trial 0 finished with value: -0.14296691621957075 and parameters: {'start': 'lp', 'mq_solver': 'mq_dsb', 'mq_nmax': 514, 'mq_reads': 16, 'mq_iters': 910, 'mq_dt': 0.06526542706084622, 'mq_xi': 0.15316981598941554, 'mq_pen': 0.001344312143528808, 'mq_q': 2, 'mq_ksamp': 7}. Best is trial 0 with value: -0.14296691621957075.
[F1__mq__b10] trial 1: -0.03358 [-0.0233, -0.0581, -0.0333, -0.056, -0.0209, -0.0358, -0.0232, -0.018] {"mq_dt": 0.302142578942253, "mq_iters": 926, "mq_ksamp": 1, "mq_nmax": 574, "mq_pen": 0.5981221901152552, "mq_q": 2, "mq_reads": 16, "mq_solver": "mq_bsb", "mq
[I 2026-10-01 20:50:38,414] Trial 1 finished with value: -0.03357804609440253 and parameters: {'start': 'pgreedy', 'mq_solver': 'mq_bsb', 'mq_nmax': 574, 'mq_reads': 16, 'mq_iters': 926, 'mq_dt': 0.302142578942253, 'mq_xi': 0.5117279648784191, 'mq_pen': 0.5981221901152552, 'mq_q': 2, 'mq_ksamp': 1}. Best is trial 0 with value: -0.14296691621957075.
[F1__mq__b10] trial 2: -0.05592 [-0.0221, -0.077, -0.0423, -0.0878, -0.0474, -0.0674, -0.0436, -0.0596] {"mq_dt": 1.2426835241724947, "mq_iters": 84, "mq_ksamp": 7, "mq_nmax": 870, "mq_pen": 0.017538232373118037, "mq_q": 3, "mq_reads": 8, "mq_solver": "mq_cac", "m
[I 2026-10-01 20:51:58,957] Trial 2 finished with value: -0.0559150750619898 and parameters: {'start': 'pgreedy', 'mq_solver': 'mq_cac', 'mq_nmax': 870, 'mq_reads': 8, 'mq_iters': 84, 'mq_dt': 1.2426835241724947, 'mq_xi': 0.4235407976345083, 'mq_pen': 0.017538232373118037, 'mq_q': 3, 'mq_ksamp': 7}. Best is trial 0 with value: -0.14296691621957075.
[F1__mq__b10] trial 3: -0.06504 [-0.0556, -0.0841, -0.0324, -0.0933, -0.0595, -0.0817, -0.0605, -0.0533] {"mq_dt": 0.06136635506422015, "mq_iters": 654, "mq_ksamp": 2, "mq_nmax": 531, "mq_pen": 0.10278118224157008, "mq_q": 3, "mq_reads": 4, "mq_solver": "mq_dsb", "
[I 2026-10-01 20:53:19,471] Trial 3 finished with value: -0.06504344802867719 and parameters: {'start': 'pgreedy', 'mq_solver': 'mq_dsb', 'mq_nmax': 531, 'mq_reads': 4, 'mq_iters': 654, 'mq_dt': 0.06136635506422015, 'mq_xi': 0.7666234032273203, 'mq_pen': 0.10278118224157008, 'mq_q': 3, 'mq_ksamp': 2}. Best is trial 0 with value: -0.14296691621957075.
[F1__mq__b10] trial 4: -0.14192 [-0.1147, -0.1504, -0.0658, -0.1672, -0.1476, -0.1811, -0.1435, -0.165] {"mq_dt": 0.28855868921618233, "mq_iters": 180, "mq_ksamp": 6, "mq_nmax": 1221, "mq_pen": 0.08090627131445798, "mq_q": 27, "mq_reads": 16, "mq_solver": "mq_dsb"
[I 2026-10-01 20:54:41,237] Trial 4 finished with value: -0.14191637288100234 and parameters: {'start': 'lp', 'mq_solver': 'mq_dsb', 'mq_nmax': 1221, 'mq_reads': 16, 'mq_iters': 180, 'mq_dt': 0.28855868921618233, 'mq_xi': 0.30491112001620335, 'mq_pen': 0.08090627131445798, 'mq_q': 27, 'mq_ksamp': 6}. Best is trial 0 with value: -0.14296691621957075.
[F1__mq__b10] trial 5: -0.14275 [-0.1178, -0.1551, -0.07, -0.1688, -0.1451, -0.1795, -0.1425, -0.1633] {"mq_dt": 0.8838135795898041, "mq_iters": 588, "mq_ksamp": 1, "mq_nmax": 479, "mq_pen": 0.005108724425085228, "mq_q": 2, "mq_reads": 16, "mq_solver": "mq_dsb", 
[I 2026-10-01 20:56:01,712] Trial 5 finished with value: -0.14274564862203593 and parameters: {'start': 'lp', 'mq_solver': 'mq_dsb', 'mq_nmax': 479, 'mq_reads': 16, 'mq_iters': 588, 'mq_dt': 0.8838135795898041, 'mq_xi': 0.12912784119984957, 'mq_pen': 0.005108724425085228, 'mq_q': 2, 'mq_ksamp': 1}. Best is trial 0 with value: -0.14296691621957075.
[F1__mq__b10] trial 6: -0.14679 [-0.1177, -0.1528, -0.0736, -0.1745, -0.1527, -0.1865, -0.1479, -0.1686] {"mq_dt": 0.07731178508750013, "mq_iters": 110, "mq_ksamp": 5, "mq_nmax": 206, "mq_pen": 0.33210054400944794, "mq_q": 6, "mq_reads": 16, "mq_solver": "mq_dsb", 
[I 2026-10-01 20:57:22,001] Trial 6 finished with value: -0.1467925704376365 and parameters: {'start': 'lp', 'mq_solver': 'mq_dsb', 'mq_nmax': 206, 'mq_reads': 16, 'mq_iters': 110, 'mq_dt': 0.07731178508750013, 'mq_xi': 0.09368260215934496, 'mq_pen': 0.33210054400944794, 'mq_q': 6, 'mq_ksamp': 5}. Best is trial 6 with value: -0.1467925704376365.
[F1__mq__b10] trial 7: -0.13738 [-0.1118, -0.1535, -0.0614, -0.1624, -0.1417, -0.1746, -0.1362, -0.1574] {"mq_dt": 1.1165671390448455, "mq_iters": 114, "mq_ksamp": 3, "mq_nmax": 223, "mq_pen": 0.0010783221977659573, "mq_q": 20, "mq_reads": 16, "mq_solver": "mq_dsb"
[I 2026-10-01 20:58:42,347] Trial 7 finished with value: -0.1373794485602716 and parameters: {'start': 'lp', 'mq_solver': 'mq_dsb', 'mq_nmax': 223, 'mq_reads': 16, 'mq_iters': 114, 'mq_dt': 1.1165671390448455, 'mq_xi': 2.6184688902200404, 'mq_pen': 0.0010783221977659573, 'mq_q': 20, 'mq_ksamp': 3}. Best is trial 6 with value: -0.1467925704376365.
[F1__mq__b10] trial 8: -0.13915 [-0.1157, -0.1483, -0.064, -0.1644, -0.1452, -0.1778, -0.1376, -0.1601] {"mq_dt": 0.70587276328598, "mq_iters": 1371, "mq_ksamp": 4, "mq_nmax": 401, "mq_pen": 0.7604885028043954, "mq_q": 4, "mq_reads": 16, "mq_solver": "mq_dsb", "mq
[I 2026-10-01 21:00:03,429] Trial 8 finished with value: -0.13915346789248223 and parameters: {'start': 'lp', 'mq_solver': 'mq_dsb', 'mq_nmax': 401, 'mq_reads': 16, 'mq_iters': 1371, 'mq_dt': 0.70587276328598, 'mq_xi': 0.14447614089668842, 'mq_pen': 0.7604885028043954, 'mq_q': 4, 'mq_ksamp': 4}. Best is trial 6 with value: -0.1467925704376365.
[F1__mq__b10] trial 9: -0.14231 [-0.1159, -0.1494, -0.0718, -0.169, -0.1452, -0.1811, -0.1424, -0.1636] {"mq_dt": 0.06875599053315165, "mq_iters": 378, "mq_ksamp": 7, "mq_nmax": 334, "mq_pen": 0.06688116513645023, "mq_q": 32, "mq_reads": 16, "mq_solver": "mq_dsb",
[I 2026-10-01 21:01:24,109] Trial 9 finished with value: -0.14230600236551683 and parameters: {'start': 'lp', 'mq_solver': 'mq_dsb', 'mq_nmax': 334, 'mq_reads': 16, 'mq_iters': 378, 'mq_dt': 0.06875599053315165, 'mq_xi': 0.05801355946277158, 'mq_pen': 0.06688116513645023, 'mq_q': 32, 'mq_ksamp': 7}. Best is trial 6 with value: -0.1467925704376365.
[F1__mq__b10] trial 10: -0.14711 [-0.119, -0.1557, -0.0746, -0.1758, -0.1494, -0.186, -0.1459, -0.1704] {"mq_dt": 0.5678576096917989, "mq_iters": 95, "mq_ksamp": 3, "mq_nmax": 674, "mq_pen": 0.06808668718516545, "mq_q": 4, "mq_reads": 16, "mq_solver": "mq_dsb", "m
[I 2026-10-01 21:02:44,512] Trial 10 finished with value: -0.1471058034529319 and parameters: {'start': 'lp', 'mq_solver': 'mq_dsb', 'mq_nmax': 674, 'mq_reads': 16, 'mq_iters': 95, 'mq_dt': 0.5678576096917989, 'mq_xi': 0.9716188220191095, 'mq_pen': 0.06808668718516545, 'mq_q': 4, 'mq_ksamp': 3}. Best is trial 10 with value: -0.1471058034529319.
[F1__mq__b10] trial 11: -0.15039 [-0.1205, -0.1578, -0.0746, -0.1774, -0.1585, -0.1879, -0.1529, -0.1735] {"mq_dt": 0.43931700667480106, "mq_iters": 50, "mq_ksamp": 6, "mq_nmax": 253, "mq_pen": 0.10984151369889907, "mq_q": 5, "mq_reads": 16, "mq_solver": "mq_dsb", "
[I 2026-10-01 21:04:04,816] Trial 11 finished with value: -0.15038662295425864 and parameters: {'start': 'lp', 'mq_solver': 'mq_dsb', 'mq_nmax': 253, 'mq_reads': 16, 'mq_iters': 50, 'mq_dt': 0.43931700667480106, 'mq_xi': 0.17046763810025106, 'mq_pen': 0.10984151369889907, 'mq_q': 5, 'mq_ksamp': 6}. Best is trial 11 with value: -0.15038662295425864.
[F1__mq__b10] BEST t11 -0.15039 cfg={"mq_dt": 0.43931700667480106, "mq_iters": 50, "mq_ksamp": 6, "mq_nmax": 253, "mq_pen": 0.10984151369889907, "mq_q": 5, "mq_reads": 16, "mq_solver": "mq_dsb", "mq_xi": 0.17046763810025106, "start": "lp"}
[I 2026-10-01 21:04:04,841] A new study created in RDB with name: F1__ls__b10
[F1__ls__b10] trial 0: -0.15215 [-0.1193, -0.1556, -0.0746, -0.1766, -0.1661, -0.1917, -0.1574, -0.1758] {"g_scale": 138.69861245357328, "ls_T0": 0.0025766385746135885, "ls_T1": 3.895706556508577e-06, "ls_chains": 16, "ls_moves": 23860, "ls_restart_every": 0, "p_ad
[I 2026-10-01 21:05:26,149] Trial 0 finished with value: -0.1521536384214024 and parameters: {'start': 'pgreedy', 'ls_T0': 0.0025766385746135885, 'ls_T1_ratio': 0.0015119336467641006, 'ls_moves': 23860, 'p_add': 0.32294705653332806, 'p_swap': 0.38687290659310525, 'topw': 43, 'ls_restart_every': 0, 'ls_chains': 16, 'g_scale': 138.69861245357328}. Best is trial 0 with value: -0.1521536384214024.
[F1__ls__b10] trial 1: -0.15223 [-0.1193, -0.1558, -0.0746, -0.177, -0.165, -0.1931, -0.1577, -0.1751] {"g_scale": 138.69861245357328, "ls_T0": 0.0025766385746135885, "ls_T1": 3.895706556508577e-06, "ls_chains": 16, "ls_moves": 23860, "ls_restart_every": 0, "p_ad
[I 2026-10-01 21:06:47,390] Trial 1 finished with value: -0.15222565639640054 and parameters: {'start': 'pgreedy', 'ls_T0': 0.0025766385746135885, 'ls_T1_ratio': 0.0015119336467641006, 'ls_moves': 23860, 'p_add': 0.32294705653332806, 'p_swap': 0.38687290659310525, 'topw': 43, 'ls_restart_every': 0, 'ls_chains': 16, 'g_scale': 138.69861245357328}. Best is trial 1 with value: -0.15222565639640054.
[F1__ls__b10] trial 2: -0.14725 [-0.1197, -0.1557, -0.0746, -0.1717, -0.1569, -0.1861, -0.1471, -0.1663] {"g_scale": 675.031252159593, "ls_T0": 0.021403233140986057, "ls_T1": 0.0002773999548118371, "ls_chains": 8, "ls_moves": 123816, "ls_restart_every": 0, "p_add":
[I 2026-10-01 21:08:08,717] Trial 2 finished with value: -0.14724813744691714 and parameters: {'start': 'lp', 'ls_T0': 0.021403233140986057, 'ls_T1_ratio': 0.01296065659727973, 'ls_moves': 123816, 'p_add': 0.489309171116382, 'p_swap': 0.4083333085150997, 'topw': 9, 'ls_restart_every': 0, 'ls_chains': 8, 'g_scale': 675.031252159593}. Best is trial 1 with value: -0.15222565639640054.
[F1__ls__b10] trial 3: -0.15247 [-0.1199, -0.1575, -0.0746, -0.1782, -0.1649, -0.1917, -0.1571, -0.1756] {"g_scale": 2155.4275565447515, "ls_T0": 0.0006677306766018312, "ls_T1": 1.2541143128078558e-06, "ls_chains": 8, "ls_moves": 5358, "ls_restart_every": 0, "p_add
[I 2026-10-01 21:09:29,884] Trial 3 finished with value: -0.15246616130542762 and parameters: {'start': 'pgreedy', 'ls_T0': 0.0006677306766018312, 'ls_T1_ratio': 0.001878173875716191, 'ls_moves': 5358, 'p_add': 0.30881774853793853, 'p_swap': 0.47004576906097556, 'topw': 15, 'ls_restart_every': 0, 'ls_chains': 8, 'g_scale': 2155.4275565447515}. Best is trial 3 with value: -0.15246616130542762.
[F1__ls__b10] trial 4: -0.14444 [-0.1188, -0.1516, -0.0746, -0.1673, -0.1543, -0.1834, -0.145, -0.1606] {"g_scale": 3178.073129125386, "ls_T0": 1.2405585096771496e-05, "ls_T1": 6.925333827162641e-10, "ls_chains": 8, "ls_moves": 77113, "ls_restart_every": 0, "p_add
[I 2026-10-01 21:10:51,208] Trial 4 finished with value: -0.1444422436064804 and parameters: {'start': 'pgreedy', 'ls_T0': 1.2405585096771496e-05, 'ls_T1_ratio': 5.582432245751094e-05, 'ls_moves': 77113, 'p_add': 0.03989721933831958, 'p_swap': 0.8655037789805929, 'topw': 5, 'ls_restart_every': 0, 'ls_chains': 8, 'g_scale': 3178.073129125386}. Best is trial 3 with value: -0.15246616130542762.
[F1__ls__b10] trial 5: -0.14658 [-0.1205, -0.1534, -0.0746, -0.1733, -0.1541, -0.1882, -0.1435, -0.165] {"g_scale": 4820.6027290668935, "ls_T0": 1.127705712133727e-05, "ls_T1": 2.1663696050856983e-07, "ls_chains": 8, "ls_moves": 9699, "ls_restart_every": 0, "p_add
[I 2026-10-01 21:12:12,463] Trial 5 finished with value: -0.14658332382997394 and parameters: {'start': 'pgreedy', 'ls_T0': 1.127705712133727e-05, 'ls_T1_ratio': 0.01921041617308757, 'ls_moves': 9699, 'p_add': 0.2725088471002392, 'p_swap': 0.5925636215853355, 'topw': 19, 'ls_restart_every': 0, 'ls_chains': 8, 'g_scale': 4820.6027290668935}. Best is trial 3 with value: -0.15246616130542762.
[F1__ls__b10] trial 6: -0.14420 [-0.1187, -0.1549, -0.0746, -0.1665, -0.1499, -0.1828, -0.1431, -0.1629] {"g_scale": 1601.1619608628619, "ls_T0": 0.024871286929722347, "ls_T1": 2.9478436517158238e-06, "ls_chains": 8, "ls_moves": 5027, "ls_restart_every": 0, "p_add"
[I 2026-10-01 21:13:33,766] Trial 6 finished with value: -0.14419645567132322 and parameters: {'start': 'pgreedy', 'ls_T0': 0.024871286929722347, 'ls_T1_ratio': 0.0001185239694289005, 'ls_moves': 5027, 'p_add': 0.21489072851035154, 'p_swap': 0.20299491460523583, 'topw': 21, 'ls_restart_every': 0, 'ls_chains': 8, 'g_scale': 1601.1619608628619}. Best is trial 3 with value: -0.15246616130542762.
[F1__ls__b10] trial 7: -0.14891 [-0.1195, -0.1541, -0.0746, -0.1777, -0.1585, -0.1892, -0.1527, -0.1649] {"g_scale": 278.804288658635, "ls_T0": 2.8029093342086568e-05, "ls_T1": 2.744537702587405e-07, "ls_chains": 8, "ls_moves": 59008, "ls_restart_every": 20, "p_add
[I 2026-10-01 21:14:55,185] Trial 7 finished with value: -0.1489081884852177 and parameters: {'start': 'pgreedy', 'ls_T0': 2.8029093342086568e-05, 'ls_T1_ratio': 0.0097917462726716, 'ls_moves': 59008, 'p_add': 0.48178649909196525, 'p_swap': 0.20060196478177705, 'topw': 3, 'ls_restart_every': 20, 'ls_chains': 8, 'g_scale': 278.804288658635}. Best is trial 3 with value: -0.15246616130542762.
[F1__ls__b10] trial 8: -0.15134 [-0.1195, -0.1573, -0.0744, -0.1766, -0.1628, -0.1914, -0.1549, -0.1739] {"g_scale": 8782.372737065447, "ls_T0": 0.008484917186036604, "ls_T1": 3.831033058698438e-05, "ls_chains": 8, "ls_moves": 38439, "ls_restart_every": 0, "p_add":
[I 2026-10-01 21:16:16,481] Trial 8 finished with value: -0.1513413190029382 and parameters: {'start': 'pgreedy', 'ls_T0': 0.008484917186036604, 'ls_T1_ratio': 0.0045151095463878705, 'ls_moves': 38439, 'p_add': 0.3528211388089467, 'p_swap': 0.504506131588883, 'topw': 30, 'ls_restart_every': 0, 'ls_chains': 8, 'g_scale': 8782.372737065447}. Best is trial 3 with value: -0.15246616130542762.
[F1__ls__b10] trial 9: -0.15261 [-0.1197, -0.1526, -0.0746, -0.1793, -0.1662, -0.1934, -0.158, -0.1769] {"g_scale": 1198.298653579562, "ls_T0": 0.0012705528127100602, "ls_T1": 0.00012504985158089566, "ls_chains": 8, "ls_moves": 17150, "ls_restart_every": 0, "p_add
[I 2026-10-01 21:17:37,622] Trial 9 finished with value: -0.1526085632676592 and parameters: {'start': 'pgreedy', 'ls_T0': 0.0012705528127100602, 'ls_T1_ratio': 0.09842160855491491, 'ls_moves': 17150, 'p_add': 0.327950305259883, 'p_swap': 0.5985999245777737, 'topw': 14, 'ls_restart_every': 0, 'ls_chains': 8, 'g_scale': 1198.298653579562}. Best is trial 9 with value: -0.1526085632676592.
[F1__ls__b10] trial 10: -0.14802 [-0.1204, -0.1557, -0.0746, -0.1735, -0.157, -0.1885, -0.1496, -0.1648] {"g_scale": 8313.247413084076, "ls_T0": 0.0009048598292654199, "ls_T1": 8.595070348311532e-08, "ls_chains": 8, "ls_moves": 80626, "ls_restart_every": 0, "p_add"
[I 2026-10-01 21:18:58,922] Trial 10 finished with value: -0.14801580944815873 and parameters: {'start': 'pgreedy', 'ls_T0': 0.0009048598292654199, 'ls_T1_ratio': 9.498786519553146e-05, 'ls_moves': 80626, 'p_add': 0.30357896175211324, 'p_swap': 0.5730152209533494, 'topw': 4, 'ls_restart_every': 0, 'ls_chains': 8, 'g_scale': 8313.247413084076}. Best is trial 9 with value: -0.1526085632676592.
[F1__ls__b10] trial 11: -0.14832 [-0.1206, -0.1525, -0.0746, -0.174, -0.1603, -0.1883, -0.1488, -0.1675] {"g_scale": 2775.836431774303, "ls_T0": 0.0004753111143891475, "ls_T1": 3.508618705196006e-06, "ls_chains": 8, "ls_moves": 5842, "ls_restart_every": 0, "p_add":
[I 2026-10-01 21:20:20,101] Trial 11 finished with value: -0.14831647451002622 and parameters: {'start': 'pgreedy', 'ls_T0': 0.0004753111143891475, 'ls_T1_ratio': 0.007381730826356028, 'ls_moves': 5842, 'p_add': 0.4701575661818365, 'p_swap': 0.4434903526029874, 'topw': 11, 'ls_restart_every': 0, 'ls_chains': 8, 'g_scale': 2775.836431774303}. Best is trial 9 with value: -0.1526085632676592.
[F1__ls__b10] BEST t9 -0.15261 cfg={"g_scale": 1198.298653579562, "ls_T0": 0.0012705528127100602, "ls_T1": 0.00012504985158089566, "ls_chains": 8, "ls_moves": 17150, "ls_restart_every": 0, "p_add": 0.327950305259883, "p_swap": 0.5985999245777737, "start": "pgreedy", "topw": 14}
TUNE DONE Thu Oct  1 09:20:20 PM EDT 2026
