[I 2026-09-28 17:08:24,067] A new study created in RDB with name: F1__ls__b10
[F1__ls__b10] trial 0: -0.14697 [-0.11968150133042554, -0.17425895547583992] {"g_scale": 3000.0, "ls_T0": 0.002, "ls_T1": 1e-06, "ls_chains": 8, "ls_moves": 20000, "ls_restart_every": 0, "p_add": 0.2, "p_swap": 0.6, "start": "lp", "topw": 8}
[I 2026-09-28 17:08:47,640] Trial 0 finished with value: -0.14697022840313273 and parameters: {'start': 'lp', 'ls_T0': 0.002, 'ls_T1_ratio': 0.0005, 'ls_moves': 20000, 'p_add': 0.2, 'p_swap': 0.6, 'topw': 8, 'ls_restart_every': 0, 'ls_chains': 8, 'g_scale': 3000.0}. Best is trial 0 with value: -0.14697022840313273.
[F1__ls__b10] trial 1: -0.14901 [-0.11863039398654973, -0.17938997749904717] {"g_scale": 138.69861245357328, "ls_T0": 0.0025766385746135885, "ls_T1": 3.895706556508577e-06, "ls_chains": 16, "ls_moves": 23860, "ls_restart_every": 0, "p_add": 0.32294705653332806, "p_swap": 0.386
[I 2026-09-28 17:09:09,518] Trial 1 finished with value: -0.14901018574279845 and parameters: {'start': 'pgreedy', 'ls_T0': 0.0025766385746135885, 'ls_T1_ratio': 0.0015119336467641006, 'ls_moves': 23860, 'p_add': 0.32294705653332806, 'p_swap': 0.38687290659310525, 'topw': 43, 'ls_restart_every': 0, 'ls_chains': 16, 'g_scale': 138.69861245357328}. Best is trial 1 with value: -0.14901018574279845.
[F1__ls__b10] trial 2: -0.14411 [-0.11888899858949054, -0.16932260879869854] {"g_scale": 675.031252159593, "ls_T0": 0.021403233140986057, "ls_T1": 0.0002773999548118371, "ls_chains": 8, "ls_moves": 123816, "ls_restart_every": 0, "p_add": 0.489309171116382, "p_swap": 0.40833330
[I 2026-09-28 17:09:31,449] Trial 2 finished with value: -0.14410580369409454 and parameters: {'start': 'lp', 'ls_T0': 0.021403233140986057, 'ls_T1_ratio': 0.01296065659727973, 'ls_moves': 123816, 'p_add': 0.489309171116382, 'p_swap': 0.4083333085150997, 'topw': 9, 'ls_restart_every': 0, 'ls_chains': 8, 'g_scale': 675.031252159593}. Best is trial 1 with value: -0.14901018574279845.
[F1__ls__b10] trial 3: -0.14854 [-0.11881094460168096, -0.17827476800318343] {"g_scale": 2155.4275565447515, "ls_T0": 0.0006677306766018312, "ls_T1": 1.2541143128078558e-06, "ls_chains": 8, "ls_moves": 5358, "ls_restart_every": 0, "p_add": 0.30881774853793853, "p_swap": 0.4700
[I 2026-09-28 17:09:53,141] Trial 3 finished with value: -0.1485428563024322 and parameters: {'start': 'pgreedy', 'ls_T0': 0.0006677306766018312, 'ls_T1_ratio': 0.001878173875716191, 'ls_moves': 5358, 'p_add': 0.30881774853793853, 'p_swap': 0.47004576906097556, 'topw': 15, 'ls_restart_every': 0, 'ls_chains': 8, 'g_scale': 2155.4275565447515}. Best is trial 1 with value: -0.14901018574279845.
[F1__ls__b10] trial 4: -0.14546 [-0.1157759958363338, -0.17514632326690915] {"g_scale": 289.7212311414237, "ls_T0": 3.72040022970518e-05, "ls_T1": 5.863590765858074e-07, "ls_chains": 16, "ls_moves": 9443, "ls_restart_every": 0, "p_add": 0.013333258633848627, "p_swap": 0.91874
[I 2026-09-28 17:10:14,910] Trial 4 finished with value: -0.14546115955162148 and parameters: {'start': 'pgreedy', 'ls_T0': 3.72040022970518e-05, 'ls_T1_ratio': 0.015760645102214522, 'ls_moves': 9443, 'p_add': 0.013333258633848627, 'p_swap': 0.9187426839734351, 'topw': 52, 'ls_restart_every': 0, 'ls_chains': 16, 'g_scale': 289.7212311414237}. Best is trial 1 with value: -0.14901018574279845.
[F1__ls__b10] trial 5: -0.14698 [-0.11994283819216356, -0.17401769816526724] {"g_scale": 555.6606116591612, "ls_T0": 0.000156986831163984, "ls_T1": 9.068448111123078e-08, "ls_chains": 16, "ls_moves": 67676, "ls_restart_every": 0, "p_add": 0.4480331602070674, "p_swap": 0.211723
[I 2026-09-28 17:10:36,897] Trial 5 finished with value: -0.1469802681787154 and parameters: {'start': 'pgreedy', 'ls_T0': 0.000156986831163984, 'ls_T1_ratio': 0.0005776566125887613, 'ls_moves': 67676, 'p_add': 0.4480331602070674, 'p_swap': 0.21172323729529735, 'topw': 7, 'ls_restart_every': 0, 'ls_chains': 16, 'g_scale': 555.6606116591612}. Best is trial 1 with value: -0.14901018574279845.
[F1__ls__b10] trial 6: -0.11918 [-0.10422814095117616, -0.13413205875140866] {"g_scale": 511.4496398156002, "ls_T0": 0.0016594443735891288, "ls_T1": 0.00011989335628061841, "ls_chains": 16, "ls_moves": 151644, "ls_restart_every": 0, "p_add": 0.07116304365302778, "p_swap": 0.80
[I 2026-09-28 17:10:58,960] Trial 6 finished with value: -0.11918009985129241 and parameters: {'start': 'pgreedy', 'ls_T0': 0.0016594443735891288, 'ls_T1_ratio': 0.07224909625702433, 'ls_moves': 151644, 'p_add': 0.07116304365302778, 'p_swap': 0.8076662933277226, 'topw': 43, 'ls_restart_every': 0, 'ls_chains': 16, 'g_scale': 511.4496398156002}. Best is trial 1 with value: -0.14901018574279845.
[F1__ls__b10] trial 7: -0.10998 [-0.10329289614928061, -0.11667172236254619] {"g_scale": 2200.175974838301, "ls_T0": 0.0002942789028480088, "ls_T1": 1.6553404579837536e-07, "ls_chains": 16, "ls_moves": 31503, "ls_restart_every": 0, "p_add": 0.008224288684886394, "p_swap": 0.20
[I 2026-09-28 17:11:20,746] Trial 7 finished with value: -0.1099823092559134 and parameters: {'start': 'pgreedy', 'ls_T0': 0.0002942789028480088, 'ls_T1_ratio': 0.0005625073499878839, 'ls_moves': 31503, 'p_add': 0.008224288684886394, 'p_swap': 0.2016648037950276, 'topw': 24, 'ls_restart_every': 0, 'ls_chains': 16, 'g_scale': 2200.175974838301}. Best is trial 1 with value: -0.14901018574279845.
[F1__ls__b10] trial 8: -0.14134 [-0.11674033550218066, -0.16594344129666283] {"g_scale": 8337.984800372698, "ls_T0": 0.012194259304779041, "ls_T1": 5.151008441261852e-05, "ls_chains": 16, "ls_moves": 42329, "ls_restart_every": 0, "p_add": 0.35547372709938485, "p_swap": 0.32367
[I 2026-09-28 17:11:42,610] Trial 8 finished with value: -0.14134188839942174 and parameters: {'start': 'pgreedy', 'ls_T0': 0.012194259304779041, 'ls_T1_ratio': 0.00422412572385034, 'ls_moves': 42329, 'p_add': 0.35547372709938485, 'p_swap': 0.3236774599178473, 'topw': 33, 'ls_restart_every': 0, 'ls_chains': 16, 'g_scale': 8337.984800372698}. Best is trial 1 with value: -0.14901018574279845.
[F1__ls__b10] trial 9: -0.13207 [-0.11152844107872872, -0.15261675117255924] {"g_scale": 762.7288777398302, "ls_T0": 0.001932618175969679, "ls_T1": 0.00019004614895555696, "ls_chains": 16, "ls_moves": 19784, "ls_restart_every": 0, "p_add": 0.3306282293893413, "p_swap": 0.32306
[I 2026-09-28 17:12:04,576] Trial 9 finished with value: -0.13207259612564398 and parameters: {'start': 'pgreedy', 'ls_T0': 0.001932618175969679, 'ls_T1_ratio': 0.09833610762777935, 'ls_moves': 19784, 'p_add': 0.3306282293893413, 'p_swap': 0.3230642188291738, 'topw': 15, 'ls_restart_every': 0, 'ls_chains': 16, 'g_scale': 762.7288777398302}. Best is trial 1 with value: -0.14901018574279845.
[F1__ls__b10] BEST -0.14901 cfg={"g_scale": 138.69861245357328, "ls_T0": 0.0025766385746135885, "ls_T1": 3.895706556508577e-06, "ls_chains": 16, "ls_moves": 23860, "ls_restart_every": 0, "p_add": 0.32294705653332806, "p_swap": 0.38687290659310525, "start": "pgreedy", "topw": 43}
[I 2026-09-28 17:12:04,651] A new study created in RDB with name: F1__pt__b10
[F1__pt__b10] trial 0: -0.14737 [-0.12030320097410208, -0.17444096052756042] {"eim_R": 16, "eim_Tmax": 0.003, "eim_Tmin": 1e-06, "eim_anneal": 0.0, "eim_hscale": 10.0, "eim_moves": 20000, "eim_rho": 50.0, "g_scale": 3000.0, "p_add": 0.2, "p_swap": 0.6, "start": "lp", "topw": 8
[I 2026-09-28 17:12:26,499] Trial 0 finished with value: -0.14737208075083125 and parameters: {'start': 'lp', 'eim_R': 16, 'eim_Tmin': 1e-06, 'eim_Tratio': 3000.0, 'eim_moves': 20000, 'p_add': 0.2, 'p_swap': 0.6, 'topw': 8, 'eim_rho': 50.0, 'eim_hscale': 10.0, 'eim_anneal': 0.0, 'g_scale': 3000.0}. Best is trial 0 with value: -0.14737208075083125.
[F1__pt__b10] trial 1: -0.11223 [-0.1026819778511302, -0.12177315552190049] {"eim_R": 64, "eim_Tmax": 0.022388264096178515, "eim_Tmin": 5.6279320474151646e-06, "eim_anneal": 0.07032569761590807, "eim_hscale": 59.812219011525556, "eim_moves": 174910, "eim_rho": 18.714500686240
[I 2026-09-28 17:12:48,573] Trial 1 finished with value: -0.11222756668651535 and parameters: {'start': 'pgreedy', 'eim_R': 64, 'eim_Tmin': 5.6279320474151646e-06, 'eim_Tratio': 3978.0622629338873, 'eim_moves': 174910, 'p_add': 0.19172075941288885, 'p_swap': 0.6420036530145916, 'topw': 11, 'eim_rho': 18.71450068624066, 'eim_hscale': 59.812219011525556, 'eim_anneal': 0.07032569761590807, 'g_scale': 149.36835544198456}. Best is trial 0 with value: -0.14737208075083125.
[F1__pt__b10] trial 2: -0.14073 [-0.11677526410788985, -0.16468066013724103] {"eim_R": 32, "eim_Tmax": 0.01081686613933192, "eim_Tmin": 7.013219779945795e-06, "eim_anneal": 0.2619100559835807, "eim_hscale": 1.7538232373118046, "eim_moves": 7734, "eim_rho": 12.229065947034353, 
[I 2026-09-28 17:13:10,585] Trial 2 finished with value: -0.14072796212256544 and parameters: {'start': 'pgreedy', 'eim_R': 32, 'eim_Tmin': 7.013219779945795e-06, 'eim_Tratio': 1542.3537945099908, 'eim_moves': 7734, 'p_add': 0.3199605106637619, 'p_swap': 0.2616475745120573, 'topw': 52, 'eim_rho': 12.229065947034353, 'eim_hscale': 1.7538232373118046, 'eim_anneal': 0.2619100559835807, 'g_scale': 3535.6346291488144}. Best is trial 0 with value: -0.14737208075083125.
[F1__pt__b10] trial 3: -0.09197 [-0.0854810056691423, -0.09845310612265856] {"eim_R": 16, "eim_Tmax": 0.3963283547730436, "eim_Tmin": 0.0005956516018710562, "eim_anneal": 0.2082787354631025, "eim_hscale": 10.278118224157009, "eim_moves": 18832, "eim_rho": 46.458679515124714, 
[I 2026-09-28 17:13:32,469] Trial 3 finished with value: -0.09196705589590043 and parameters: {'start': 'pgreedy', 'eim_R': 16, 'eim_Tmin': 0.0005956516018710562, 'eim_Tratio': 665.369409782665, 'eim_moves': 18832, 'p_add': 0.21851597689967073, 'p_swap': 0.5707798346517168, 'topw': 2, 'eim_rho': 46.458679515124714, 'eim_hscale': 10.278118224157009, 'eim_anneal': 0.2082787354631025, 'g_scale': 181.07254066631089}. Best is trial 0 with value: -0.14737208075083125.
[F1__pt__b10] trial 4: -0.14582 [-0.1199250415875639, -0.17171714536777716] {"eim_R": 16, "eim_Tmax": 6.840342246366934e-06, "eim_Tmin": 3.2202378453311506e-07, "eim_anneal": 0.5962767279261619, "eim_hscale": 99.13773847646657, "eim_moves": 5383, "eim_rho": 1.1167684943566796
[I 2026-09-28 17:13:54,470] Trial 4 finished with value: -0.14582109347767053 and parameters: {'start': 'lp', 'eim_R': 16, 'eim_Tmin': 3.2202378453311506e-07, 'eim_Tratio': 21.2417298811775, 'eim_moves': 5383, 'p_add': 0.20003338804169363, 'p_swap': 0.3482973720482757, 'topw': 9, 'eim_rho': 1.1167684943566796, 'eim_hscale': 99.13773847646657, 'eim_anneal': 0.5962767279261619, 'g_scale': 5387.10565840382}. Best is trial 0 with value: -0.14737208075083125.
[F1__pt__b10] trial 5: -0.15010 [-0.1206693974977977, -0.17952569871083313] {"eim_R": 16, "eim_Tmax": 7.3329031629428645e-06, "eim_Tmin": 1.1006348269620852e-06, "eim_anneal": 0.9462286962175356, "eim_hscale": 1.8587633596816164, "eim_moves": 18358, "eim_rho": 3.5067947397781
[I 2026-09-28 17:14:16,533] Trial 5 finished with value: -0.15009754810431541 and parameters: {'start': 'lp', 'eim_R': 16, 'eim_Tmin': 1.1006348269620852e-06, 'eim_Tratio': 6.662430611234392, 'eim_moves': 18358, 'p_add': 0.22230587257383633, 'p_swap': 0.46272105013386755, 'topw': 20, 'eim_rho': 3.506794739778118, 'eim_hscale': 1.8587633596816164, 'eim_anneal': 0.9462286962175356, 'g_scale': 774.8399988560119}. Best is trial 5 with value: -0.15009754810431541.
[F1__pt__b10] trial 6: -0.14897 [-0.12047939474412406, -0.17746662681734737] {"eim_R": 16, "eim_Tmax": 5.781299393458698e-06, "eim_Tmin": 1.64051916149452e-06, "eim_anneal": 0.6629489546805363, "eim_hscale": 2.3613697065671944, "eim_moves": 17276, "eim_rho": 85.54444659081884,
[I 2026-09-28 17:14:38,625] Trial 6 finished with value: -0.14897301078073572 and parameters: {'start': 'lp', 'eim_R': 16, 'eim_Tmin': 1.64051916149452e-06, 'eim_Tratio': 3.5240669716968798, 'eim_moves': 17276, 'p_add': 0.02502959652654488, 'p_swap': 0.877168501001951, 'topw': 7, 'eim_rho': 85.54444659081884, 'eim_hscale': 2.3613697065671944, 'eim_anneal': 0.6629489546805363, 'g_scale': 469.3417407209877}. Best is trial 5 with value: -0.15009754810431541.
[F1__pt__b10] trial 7: -0.14643 [-0.11777726463824278, -0.1750852077294751] {"eim_R": 16, "eim_Tmax": 0.01334810167563324, "eim_Tmin": 0.0001882482965355216, "eim_anneal": 0.9525411717301083, "eim_hscale": 0.8718494407847459, "eim_moves": 59172, "eim_rho": 27.09573752806049, 
[I 2026-09-28 17:15:00,746] Trial 7 finished with value: -0.14643123618385895 and parameters: {'start': 'lp', 'eim_R': 16, 'eim_Tmin': 0.0001882482965355216, 'eim_Tratio': 70.9068922337606, 'eim_moves': 59172, 'p_add': 0.194981001084837, 'p_swap': 0.4243939610308033, 'topw': 31, 'eim_rho': 27.09573752806049, 'eim_hscale': 0.8718494407847459, 'eim_anneal': 0.9525411717301083, 'g_scale': 269.6408142513329}. Best is trial 5 with value: -0.15009754810431541.
[F1__pt__b10] trial 8: -0.14299 [-0.11804539522455837, -0.16794408077386924] {"eim_R": 16, "eim_Tmax": 2.1789220462003005, "eim_Tmin": 0.000527895176446479, "eim_anneal": 0.9518128726995312, "eim_hscale": 5.696605978323529, "eim_moves": 6686, "eim_rho": 2.649339554344387, "g_s
[I 2026-09-28 17:15:22,674] Trial 8 finished with value: -0.1429947379992138 and parameters: {'start': 'lp', 'eim_R': 16, 'eim_Tmin': 0.000527895176446479, 'eim_Tratio': 4127.5657430092315, 'eim_moves': 6686, 'p_add': 0.1034179031978551, 'p_swap': 0.8102848055978014, 'topw': 27, 'eim_rho': 2.649339554344387, 'eim_hscale': 5.696605978323529, 'eim_anneal': 0.9518128726995312, 'g_scale': 4993.941412749836}. Best is trial 5 with value: -0.15009754810431541.
[F1__pt__b10] trial 9: -0.13671 [-0.11441437097236495, -0.15900325030315277] {"eim_R": 16, "eim_Tmax": 0.0002818248884904255, "eim_Tmin": 2.7318348440821506e-05, "eim_anneal": 0.6641115471181485, "eim_hscale": 0.8660018700283132, "eim_moves": 8103, "eim_rho": 0.222202142001787
[I 2026-09-28 17:15:44,521] Trial 9 finished with value: -0.13670881063775886 and parameters: {'start': 'lp', 'eim_R': 16, 'eim_Tmin': 2.7318348440821506e-05, 'eim_Tratio': 10.316322346533134, 'eim_moves': 8103, 'p_add': 0.06514230661112433, 'p_swap': 0.21837077298886115, 'topw': 41, 'eim_rho': 0.22220214200178764, 'eim_hscale': 0.8660018700283132, 'eim_anneal': 0.6641115471181485, 'g_scale': 1483.3493457279637}. Best is trial 5 with value: -0.15009754810431541.
[F1__pt__b10] BEST -0.15010 cfg={"eim_R": 16, "eim_Tmax": 7.3329031629428645e-06, "eim_Tmin": 1.1006348269620852e-06, "eim_anneal": 0.9462286962175356, "eim_hscale": 1.8587633596816164, "eim_moves": 18358, "eim_rho": 3.506794739778118, "g_scale": 774.8399988560119, "p_add": 0.22230587257383633, "p_swap": 0.46272105013386755, "start": "lp", "topw": 20}
[I 2026-09-28 17:15:44,570] A new study created in RDB with name: F1__eim__b10
[F1__eim__b10] trial 0: -0.14959 [-0.1198885622403768, -0.1792825781216798] {"eim_R": 16, "eim_Tmax": 0.003, "eim_Tmin": 1e-06, "eim_anneal": 0.0, "eim_eta": 1.0, "eim_hscale": 10.0, "eim_moves": 20000, "eim_rho": 50.0, "g_scale": 3000.0, "p_add": 0.2, "p_swap": 0.6, "start":
[I 2026-09-28 17:16:06,735] Trial 0 finished with value: -0.1495855701810283 and parameters: {'start': 'lp', 'eim_R': 16, 'eim_Tmin': 1e-06, 'eim_Tratio': 3000.0, 'eim_moves': 20000, 'p_add': 0.2, 'p_swap': 0.6, 'topw': 8, 'eim_rho': 50.0, 'eim_hscale': 10.0, 'eim_anneal': 0.0, 'eim_eta': 1.0, 'g_scale': 3000.0}. Best is trial 0 with value: -0.1495855701810283.
[F1__eim__b10] trial 1: -0.14367 [-0.11687045009680741, -0.17046159372924885] {"eim_R": 64, "eim_Tmax": 0.022388264096178515, "eim_Tmin": 5.6279320474151646e-06, "eim_anneal": 0.07032569761590807, "eim_eta": 0.018255254802399014, "eim_hscale": 59.812219011525556, "eim_moves": 1
[I 2026-09-28 17:16:29,757] Trial 1 finished with value: -0.14366602191302813 and parameters: {'start': 'pgreedy', 'eim_R': 64, 'eim_Tmin': 5.6279320474151646e-06, 'eim_Tratio': 3978.0622629338873, 'eim_moves': 174910, 'p_add': 0.19172075941288885, 'p_swap': 0.6420036530145916, 'topw': 11, 'eim_rho': 18.71450068624066, 'eim_hscale': 59.812219011525556, 'eim_anneal': 0.07032569761590807, 'eim_eta': 0.018255254802399014, 'g_scale': 109.7581541938016}. Best is trial 0 with value: -0.1495855701810283.
[F1__eim__b10] trial 2: -0.14973 [-0.11968150133042554, -0.17977955178461014] {"eim_R": 16, "eim_Tmax": 0.0007255047403074508, "eim_Tmin": 0.00013246974647468452, "eim_anneal": 0.7664913525398744, "eim_eta": 0.23358825194833557, "eim_hscale": 0.6218230782016851, "eim_moves": 52
[I 2026-09-28 17:16:51,757] Trial 2 finished with value: -0.14973052655751784 and parameters: {'start': 'lp', 'eim_R': 16, 'eim_Tmin': 0.00013246974647468452, 'eim_Tratio': 5.476757973912916, 'eim_moves': 52984, 'p_add': 0.0716766437045232, 'p_swap': 0.8407909904010871, 'topw': 11, 'eim_rho': 4.5566719139214715, 'eim_hscale': 0.6218230782016851, 'eim_anneal': 0.7664913525398744, 'eim_eta': 0.23358825194833557, 'g_scale': 1370.4648392849028}. Best is trial 2 with value: -0.14973052655751784.
[F1__eim__b10] trial 3: -0.13212 [-0.10988155362733543, -0.15435183618650816] {"eim_R": 32, "eim_Tmax": 0.00022679302095938696, "eim_Tmin": 2.741773675242096e-06, "eim_anneal": 0.312274067414942, "eim_eta": 0.1233480570086002, "eim_hscale": 0.24365700014641997, "eim_moves": 655
[I 2026-09-28 17:17:13,806] Trial 3 finished with value: -0.1321166949069218 and parameters: {'start': 'pgreedy', 'eim_R': 32, 'eim_Tmin': 2.741773675242096e-06, 'eim_Tratio': 82.71763019949535, 'eim_moves': 65555, 'p_add': 0.030112735814634917, 'p_swap': 0.6799968666320435, 'topw': 19, 'eim_rho': 0.6942729492430144, 'eim_hscale': 0.24365700014641997, 'eim_anneal': 0.312274067414942, 'eim_eta': 0.1233480570086002, 'g_scale': 1381.6356822574794}. Best is trial 2 with value: -0.14973052655751784.
[F1__eim__b10] trial 4: -0.14686 [-0.11862234489982193, -0.17510659816757534] {"eim_R": 16, "eim_Tmax": 0.013323197406244793, "eim_Tmin": 0.0004987435476609301, "eim_anneal": 0.6411080434933271, "eim_eta": 0.23236965081001948, "eim_hscale": 6.742610434179981, "eim_moves": 13350
[I 2026-09-28 17:17:35,746] Trial 4 finished with value: -0.14686447153369864 and parameters: {'start': 'lp', 'eim_R': 16, 'eim_Tmin': 0.0004987435476609301, 'eim_Tratio': 26.713523350286117, 'eim_moves': 133508, 'p_add': 0.4207271306233804, 'p_swap': 0.3782564144063032, 'topw': 4, 'eim_rho': 0.12908945670149974, 'eim_hscale': 6.742610434179981, 'eim_anneal': 0.6411080434933271, 'eim_eta': 0.23236965081001948, 'g_scale': 1453.27196243909}. Best is trial 2 with value: -0.14973052655751784.
[F1__eim__b10] trial 5: -0.14912 [-0.1196388190173191, -0.17859443207641468] {"eim_R": 16, "eim_Tmax": 4.7046732748998884e-05, "eim_Tmin": 2.9038180032521327e-06, "eim_anneal": 0.9556153540439627, "eim_eta": 1.5761932982033324, "eim_hscale": 5.276338475187873, "eim_moves": 482
[I 2026-09-28 17:17:57,867] Trial 5 finished with value: -0.1491166255468669 and parameters: {'start': 'lp', 'eim_R': 16, 'eim_Tmin': 2.9038180032521327e-06, 'eim_Tratio': 16.20168092363532, 'eim_moves': 48206, 'p_add': 0.21747725607858887, 'p_swap': 0.2157770964030835, 'topw': 9, 'eim_rho': 57.388915924662584, 'eim_hscale': 5.276338475187873, 'eim_anneal': 0.9556153540439627, 'eim_eta': 1.5761932982033324, 'g_scale': 1066.2548683756768}. Best is trial 2 with value: -0.14973052655751784.
[F1__eim__b10] trial 6: -0.14789 [-0.11914036639885872, -0.17663180348224405] {"eim_R": 16, "eim_Tmax": 0.23493624582371722, "eim_Tmin": 5.161106531611771e-05, "eim_anneal": 0.5599992800532259, "eim_eta": 0.09916053756640525, "eim_hscale": 5.1956439619754375, "eim_moves": 38346
[I 2026-09-28 17:18:19,871] Trial 6 finished with value: -0.1478860849405514 and parameters: {'start': 'lp', 'eim_R': 16, 'eim_Tmin': 5.161106531611771e-05, 'eim_Tratio': 4552.051859126197, 'eim_moves': 38346, 'p_add': 0.22549484154459695, 'p_swap': 0.46537274181273974, 'topw': 4, 'eim_rho': 1.6773897965542055, 'eim_hscale': 5.1956439619754375, 'eim_anneal': 0.5599992800532259, 'eim_eta': 0.09916053756640525, 'g_scale': 5470.828347571033}. Best is trial 2 with value: -0.14973052655751784.
[F1__eim__b10] trial 7: -0.14763 [-0.11994283819216356, -0.17531193146712198] {"eim_R": 16, "eim_Tmax": 0.0024712106819587704, "eim_Tmin": 3.279711118691455e-05, "eim_anneal": 0.7992661330313624, "eim_eta": 0.021530041252627617, "eim_hscale": 0.2382126214028639, "eim_moves": 37
[I 2026-09-28 17:18:41,723] Trial 7 finished with value: -0.14762738482964277 and parameters: {'start': 'lp', 'eim_R': 16, 'eim_Tmin': 3.279711118691455e-05, 'eim_Tratio': 75.34842528889368, 'eim_moves': 37594, 'p_add': 0.15502681030202012, 'p_swap': 0.7940013736708005, 'topw': 25, 'eim_rho': 141.26197483338572, 'eim_hscale': 0.2382126214028639, 'eim_anneal': 0.7992661330313624, 'eim_eta': 0.021530041252627617, 'g_scale': 137.8224695773061}. Best is trial 2 with value: -0.14973052655751784.
[F1__eim__b10] trial 8: -0.14328 [-0.11608710411508483, -0.17046293528982592] {"eim_R": 16, "eim_Tmax": 0.02091931819668552, "eim_Tmin": 0.00011868799266337023, "eim_anneal": 0.7436258176096252, "eim_eta": 1.358227493972809, "eim_hscale": 0.2051314480603037, "eim_moves": 30813,
[I 2026-09-28 17:19:03,865] Trial 8 finished with value: -0.14327501970245538 and parameters: {'start': 'lp', 'eim_R': 16, 'eim_Tmin': 0.00011868799266337023, 'eim_Tratio': 176.25471395424225, 'eim_moves': 30813, 'p_add': 0.08971842766584243, 'p_swap': 0.8485399733132015, 'topw': 2, 'eim_rho': 40.85457496393755, 'eim_hscale': 0.2051314480603037, 'eim_anneal': 0.7436258176096252, 'eim_eta': 1.358227493972809, 'g_scale': 229.87233718109368}. Best is trial 2 with value: -0.14973052655751784.
[F1__eim__b10] trial 9: -0.14310 [-0.11596260172771788, -0.17024083248305577] {"eim_R": 16, "eim_Tmax": 0.04412351500343946, "eim_Tmin": 0.00020827188679238984, "eim_anneal": 0.9719942231917424, "eim_eta": 0.30362340943985383, "eim_hscale": 0.22984569932818313, "eim_moves": 969
