[I 2026-09-28 17:39:18,319] A new study created in RDB with name: F1__ls__b60
[F1__ls__b60] trial 0: -0.15174 [-0.11907228146341875, -0.18441233311545335] {"g_scale": 138.69861245357328, "ls_T0": 0.0025766385746135885, "ls_T1": 3.895706556508577e-06, "ls_chains": 16, "ls_moves": 23860, "ls_restart_every": 0, "p_add": 0.32294705653332806, "p_swap": 0.386
[I 2026-09-28 17:41:21,745] Trial 0 finished with value: -0.15174230728943605 and parameters: {'start': 'pgreedy', 'ls_T0': 0.0025766385746135885, 'ls_T1_ratio': 0.0015119336467641006, 'ls_moves': 23860, 'p_add': 0.32294705653332806, 'p_swap': 0.38687290659310525, 'topw': 43, 'ls_restart_every': 0, 'ls_chains': 16, 'g_scale': 138.69861245357328}. Best is trial 0 with value: -0.15174230728943605.
[F1__ls__b60] trial 1: -0.15229 [-0.11930075737475465, -0.1852874032678924] {"g_scale": 2155.4275565447515, "ls_T0": 0.0006677306766018312, "ls_T1": 1.2541143128078558e-06, "ls_chains": 8, "ls_moves": 5358, "ls_restart_every": 0, "p_add": 0.30881774853793853, "p_swap": 0.4700
[I 2026-09-28 17:43:23,551] Trial 1 finished with value: -0.15229408032132352 and parameters: {'start': 'pgreedy', 'ls_T0': 0.0006677306766018312, 'ls_T1_ratio': 0.001878173875716191, 'ls_moves': 5358, 'p_add': 0.30881774853793853, 'p_swap': 0.47004576906097556, 'topw': 15, 'ls_restart_every': 0, 'ls_chains': 8, 'g_scale': 2155.4275565447515}. Best is trial 1 with value: -0.15229408032132352.
[F1__ls__b60] trial 2: -0.15147 [-0.11994283819216356, -0.18300458888248605] {"g_scale": 3000.0, "ls_T0": 0.002, "ls_T1": 1e-06, "ls_chains": 8, "ls_moves": 20000, "ls_restart_every": 0, "p_add": 0.2, "p_swap": 0.6, "start": "lp", "topw": 8}
[I 2026-09-28 17:45:25,353] Trial 2 finished with value: -0.1514737135373248 and parameters: {'start': 'lp', 'ls_T0': 0.002, 'ls_T1_ratio': 0.0005, 'ls_moves': 20000, 'p_add': 0.2, 'p_swap': 0.6, 'topw': 8, 'ls_restart_every': 0, 'ls_chains': 8, 'g_scale': 3000.0}. Best is trial 1 with value: -0.15229408032132352.
[F1__ls__b60] BEST -0.15229 cfg={"g_scale": 2155.4275565447515, "ls_T0": 0.0006677306766018312, "ls_T1": 1.2541143128078558e-06, "ls_chains": 8, "ls_moves": 5358, "ls_restart_every": 0, "p_add": 0.30881774853793853, "p_swap": 0.47004576906097556, "start": "pgreedy", "topw": 15}
[I 2026-09-28 17:45:25,426] A new study created in RDB with name: F1__pt__b60
[F1__pt__b60] trial 0: -0.15167 [-0.1209328020148418, -0.18241422769711313] {"eim_R": 16, "eim_Tmax": 7.3329031629428645e-06, "eim_Tmin": 1.1006348269620852e-06, "eim_anneal": 0.9462286962175356, "eim_hscale": 1.8587633596816164, "eim_moves": 18358, "eim_rho": 3.5067947397781
[I 2026-09-28 17:47:27,332] Trial 0 finished with value: -0.15167351485597746 and parameters: {'start': 'lp', 'eim_R': 16, 'eim_Tmin': 1.1006348269620852e-06, 'eim_Tratio': 6.662430611234392, 'eim_moves': 18358, 'p_add': 0.22230587257383633, 'p_swap': 0.46272105013386755, 'topw': 20, 'eim_rho': 3.506794739778118, 'eim_hscale': 1.8587633596816164, 'eim_anneal': 0.9462286962175356, 'g_scale': 774.8399988560119}. Best is trial 0 with value: -0.15167351485597746.
[F1__pt__b60] trial 1: -0.15034 [-0.1206714651531039, -0.1800137286365785] {"eim_R": 16, "eim_Tmax": 5.781299393458698e-06, "eim_Tmin": 1.64051916149452e-06, "eim_anneal": 0.6629489546805363, "eim_hscale": 2.3613697065671944, "eim_moves": 17276, "eim_rho": 85.54444659081884,
[I 2026-09-28 17:49:29,196] Trial 1 finished with value: -0.1503425968948412 and parameters: {'start': 'lp', 'eim_R': 16, 'eim_Tmin': 1.64051916149452e-06, 'eim_Tratio': 3.5240669716968798, 'eim_moves': 17276, 'p_add': 0.02502959652654488, 'p_swap': 0.877168501001951, 'topw': 7, 'eim_rho': 85.54444659081884, 'eim_hscale': 2.3613697065671944, 'eim_anneal': 0.6629489546805363, 'g_scale': 469.3417407209877}. Best is trial 0 with value: -0.15167351485597746.
[F1__pt__b60] trial 2: -0.14961 [-0.1206714651531039, -0.17854047152872865] {"eim_R": 16, "eim_Tmax": 0.003, "eim_Tmin": 1e-06, "eim_anneal": 0.0, "eim_hscale": 10.0, "eim_moves": 20000, "eim_rho": 50.0, "g_scale": 3000.0, "p_add": 0.2, "p_swap": 0.6, "start": "lp", "topw": 8
[I 2026-09-28 17:51:30,975] Trial 2 finished with value: -0.14960596834091627 and parameters: {'start': 'lp', 'eim_R': 16, 'eim_Tmin': 1e-06, 'eim_Tratio': 3000.0, 'eim_moves': 20000, 'p_add': 0.2, 'p_swap': 0.6, 'topw': 8, 'eim_rho': 50.0, 'eim_hscale': 10.0, 'eim_anneal': 0.0, 'g_scale': 3000.0}. Best is trial 0 with value: -0.15167351485597746.
[F1__pt__b60] BEST -0.15167 cfg={"eim_R": 16, "eim_Tmax": 7.3329031629428645e-06, "eim_Tmin": 1.1006348269620852e-06, "eim_anneal": 0.9462286962175356, "eim_hscale": 1.8587633596816164, "eim_moves": 18358, "eim_rho": 3.506794739778118, "g_scale": 774.8399988560119, "p_add": 0.22230587257383633, "p_swap": 0.46272105013386755, "start": "lp", "topw": 20}
[I 2026-09-28 17:51:31,007] A new study created in RDB with name: F1__eim__b60
[F1__eim__b60] trial 0: -0.15110 [-0.11994283819216356, -0.18225324042777746] {"eim_R": 16, "eim_Tmax": 0.0007255047403074508, "eim_Tmin": 0.00013246974647468452, "eim_anneal": 0.7664913525398744, "eim_eta": 0.23358825194833557, "eim_hscale": 0.6218230782016851, "eim_moves": 52
[I 2026-09-28 17:53:33,000] Trial 0 finished with value: -0.1510980393099705 and parameters: {'start': 'lp', 'eim_R': 16, 'eim_Tmin': 0.00013246974647468452, 'eim_Tratio': 5.476757973912916, 'eim_moves': 52984, 'p_add': 0.0716766437045232, 'p_swap': 0.8407909904010871, 'topw': 11, 'eim_rho': 4.5566719139214715, 'eim_hscale': 0.6218230782016851, 'eim_anneal': 0.7664913525398744, 'eim_eta': 0.23358825194833557, 'g_scale': 1370.4648392849028}. Best is trial 0 with value: -0.1510980393099705.
[F1__eim__b60] trial 1: -0.15042 [-0.120428589499457, -0.18041135228560878] {"eim_R": 16, "eim_Tmax": 0.003, "eim_Tmin": 1e-06, "eim_anneal": 0.0, "eim_eta": 1.0, "eim_hscale": 10.0, "eim_moves": 20000, "eim_rho": 50.0, "g_scale": 3000.0, "p_add": 0.2, "p_swap": 0.6, "start":
[I 2026-09-28 17:55:34,842] Trial 1 finished with value: -0.1504199708925329 and parameters: {'start': 'lp', 'eim_R': 16, 'eim_Tmin': 1e-06, 'eim_Tratio': 3000.0, 'eim_moves': 20000, 'p_add': 0.2, 'p_swap': 0.6, 'topw': 8, 'eim_rho': 50.0, 'eim_hscale': 10.0, 'eim_anneal': 0.0, 'eim_eta': 1.0, 'g_scale': 3000.0}. Best is trial 0 with value: -0.1510980393099705.
[F1__eim__b60] trial 2: -0.15037 [-0.11856806894803407, -0.1821778894419942] {"eim_R": 64, "eim_Tmax": 0.022388264096178515, "eim_Tmin": 5.6279320474151646e-06, "eim_anneal": 0.07032569761590807, "eim_eta": 0.018255254802399014, "eim_hscale": 59.812219011525556, "eim_moves": 1
[I 2026-09-28 17:57:37,659] Trial 2 finished with value: -0.15037297919501413 and parameters: {'start': 'pgreedy', 'eim_R': 64, 'eim_Tmin': 5.6279320474151646e-06, 'eim_Tratio': 3978.0622629338873, 'eim_moves': 174910, 'p_add': 0.19172075941288885, 'p_swap': 0.6420036530145916, 'topw': 11, 'eim_rho': 18.71450068624066, 'eim_hscale': 59.812219011525556, 'eim_anneal': 0.07032569761590807, 'eim_eta': 0.018255254802399014, 'g_scale': 109.7581541938016}. Best is trial 0 with value: -0.1510980393099705.
[F1__eim__b60] BEST -0.15110 cfg={"eim_R": 16, "eim_Tmax": 0.0007255047403074508, "eim_Tmin": 0.00013246974647468452, "eim_anneal": 0.7664913525398744, "eim_eta": 0.23358825194833557, "eim_hscale": 0.6218230782016851, "eim_moves": 52984, "eim_rho": 4.5566719139214715, "g_scale": 1370.4648392849028, "p_add": 0.0716766437045232, "p_swap": 0.8407909904010871, "start": "lp", "topw": 11}
[I 2026-09-28 17:57:37,703] A new study created in RDB with name: F1__milp__b60
[F1__milp__b60] trial 0: -0.14798 [-0.11936086706829951, -0.17659416525492067] {"eps_tie": 0.0, "mip_heuristic_effort": 0.8077206102454388, "presolve": "off", "start": "pgreedy"}
[I 2026-09-28 17:58:51,114] Trial 0 finished with value: -0.1479775161616101 and parameters: {'start': 'pgreedy', 'presolve': 'off', 'mip_heuristic_effort': 0.8077206102454388, 'eps_tie': 0.0}. Best is trial 0 with value: -0.1479775161616101.
[F1__milp__b60] trial 1: -0.14472 [-0.11954562683887493, -0.16989791469314275] {"eps_tie": 0.0001, "mip_heuristic_effort": 0.41985078951584265, "presolve": "off", "start": "pgreedy"}
[I 2026-09-28 18:00:10,344] Trial 1 finished with value: -0.14472177076600884 and parameters: {'start': 'pgreedy', 'presolve': 'off', 'mip_heuristic_effort': 0.41985078951584265, 'eps_tie': 0.0001}. Best is trial 0 with value: -0.1479775161616101.
[F1__milp__b60] trial 2: -0.13420 [-0.11590020284436986, -0.15249675603199053] {"eps_tie": 0.0, "mip_heuristic_effort": 0.05, "presolve": "on", "start": "lp"}
[I 2026-09-28 18:01:45,114] Trial 2 finished with value: -0.1341984794381802 and parameters: {'start': 'lp', 'presolve': 'on', 'mip_heuristic_effort': 0.05, 'eps_tie': 0.0}. Best is trial 0 with value: -0.1479775161616101.
[F1__milp__b60] BEST -0.14798 cfg={"eps_tie": 0.0, "mip_heuristic_effort": 0.8077206102454388, "presolve": "off", "start": "pgreedy"}
[I 2026-09-28 18:01:45,148] A new study created in RDB with name: F1__cpsat__b60
[F1__cpsat__b60] trial 0: -0.15530 [-0.12060928780425317, -0.18998182185417] {"cp_model_presolve": false, "linearization_level": 1, "repair_hint": false, "start": "lp"}
[I 2026-09-28 18:03:01,617] Trial 0 finished with value: -0.1552955548292116 and parameters: {'start': 'lp', 'linearization_level': 1, 'repair_hint': False, 'cp_model_presolve': False}. Best is trial 0 with value: -0.1552955548292116.
[F1__cpsat__b60] trial 1: -0.15221 [-0.11903956820268125, -0.185389138278371] {"cp_model_presolve": true, "linearization_level": 1, "repair_hint": false, "start": "lp"}
[I 2026-09-28 18:04:17,841] Trial 1 finished with value: -0.15221435324052612 and parameters: {'start': 'lp', 'linearization_level': 1, 'repair_hint': False, 'cp_model_presolve': True}. Best is trial 0 with value: -0.1552955548292116.
[F1__cpsat__b60] trial 2: -0.12410 [-0.11332213205686203, -0.13487476159350587] {"cp_model_presolve": true, "linearization_level": 1, "repair_hint": false, "start": "pgreedy"}
[I 2026-09-28 18:05:39,116] Trial 2 finished with value: -0.12409844682518395 and parameters: {'start': 'pgreedy', 'linearization_level': 1, 'repair_hint': False, 'cp_model_presolve': True}. Best is trial 0 with value: -0.1552955548292116.
[F1__cpsat__b60] BEST -0.15530 cfg={"cp_model_presolve": false, "linearization_level": 1, "repair_hint": false, "start": "lp"}
[I 2026-09-28 18:05:39,152] A new study created in RDB with name: F1__hlns__b60
[F1__hlns__b60] trial 0: -0.14792 [-0.11824263477180408, -0.17760137912427343] {"eim_R": 8, "eim_Tmax": 0.002149211332011167, "eim_Tmin": 2.742194550436767e-06, "eim_moves": 28133, "hl_frac_sel": 1.4390612928037052, "hl_nmax": 2899, "hl_p_block": 0.035120747192818935, "hl_p_milp
[I 2026-09-28 18:07:40,970] Trial 0 finished with value: -0.14792200694803875 and parameters: {'start': 'lp', 'hl_nmax': 2899, 'hl_slice': 0.1354209346186694, 'hl_q': 13, 'hl_p_block': 0.035120747192818935, 'hl_frac_sel': 1.4390612928037052, 'hl_p_milp': 0.28955460282642714, 'eim_R': 8, 'eim_Tmin': 2.742194550436767e-06, 'eim_Tratio': 783.7559635106298, 'eim_moves': 28133}. Best is trial 0 with value: -0.14792200694803875.
[F1__hlns__b60] trial 1: -0.14796 [-0.11996868388349102, -0.17595848913447631] {"eim_R": 8, "eim_Tmax": 5.504103655676379e-05, "eim_Tmin": 5.599668416030328e-07, "eim_moves": 36632, "hl_frac_sel": 1.1778115524924693, "hl_nmax": 4485, "hl_p_block": 0.29046821963088276, "hl_p_milp
[I 2026-09-28 18:09:42,686] Trial 1 finished with value: -0.14796358650898367 and parameters: {'start': 'lp', 'hl_nmax': 4485, 'hl_slice': 0.06451219192567251, 'hl_q': 11, 'hl_p_block': 0.29046821963088276, 'hl_frac_sel': 1.1778115524924693, 'hl_p_milp': 0.28415144243150015, 'eim_R': 8, 'eim_Tmin': 5.599668416030328e-07, 'eim_Tratio': 98.29338537116998, 'eim_moves': 36632}. Best is trial 1 with value: -0.14796358650898367.
[F1__hlns__b60] trial 2: -0.14198 [-0.1180124604293239, -0.16593993833292964] {"eim_R": 8, "eim_Tmax": 0.003, "eim_Tmin": 1e-06, "eim_moves": 20000, "hl_frac_sel": 0.5, "hl_nmax": 3000, "hl_p_block": 0.3, "hl_p_milp": 0.0, "hl_q": 8, "hl_slice": 0.25, "start": "lp"}
[I 2026-09-28 18:11:44,431] Trial 2 finished with value: -0.14197619938112677 and parameters: {'start': 'lp', 'hl_nmax': 3000, 'hl_slice': 0.25, 'hl_q': 8, 'hl_p_block': 0.3, 'hl_frac_sel': 0.5, 'hl_p_milp': 0.0, 'eim_R': 8, 'eim_Tmin': 1e-06, 'eim_Tratio': 3000.0, 'eim_moves': 20000}. Best is trial 1 with value: -0.14796358650898367.
[F1__hlns__b60] BEST -0.14796 cfg={"eim_R": 8, "eim_Tmax": 5.504103655676379e-05, "eim_Tmin": 5.599668416030328e-07, "eim_moves": 36632, "hl_frac_sel": 1.1778115524924693, "hl_nmax": 4485, "hl_p_block": 0.29046821963088276, "hl_p_milp": 0.28415144243150015, "hl_q": 11, "hl_slice": 0.06451219192567251, "start": "lp"}
[I 2026-09-28 18:11:44,468] A new study created in RDB with name: F1__lp__b60
[F1__lp__b60] trial 0: -0.13022 [-0.10787253111802741, -0.1525759081060809] {"lexi": false}
[I 2026-09-28 18:11:48,261] Trial 0 finished with value: -0.13022421961205416 and parameters: {'start': 'lp', 'lexi': False}. Best is trial 0 with value: -0.13022421961205416.
[F1__lp__b60] trial 1: -0.13149 [-0.10962701049017554, -0.15336034838837298] {"lexi": true}
[I 2026-09-28 18:12:06,236] Trial 1 finished with value: -0.13149367943927426 and parameters: {'start': 'pgreedy', 'lexi': True}. Best is trial 1 with value: -0.13149367943927426.
[F1__lp__b60] trial 2: -0.13127 [-0.1099707581848327, -0.15257590810608057] {"lexi": false}
[I 2026-09-28 18:12:09,634] Trial 2 finished with value: -0.13127333314545664 and parameters: {'start': 'pgreedy', 'lexi': False}. Best is trial 1 with value: -0.13149367943927426.
[F1__lp__b60] BEST -0.13149 cfg={"lexi": true}
[I 2026-09-28 18:12:09,669] A new study created in RDB with name: F1__sb__b60
[F1__sb__b60] trial 0: -0.12994 [-0.10787253111802741, -0.15201468859770284] {"sb_agents": 32, "sb_alpha_floor": 0.19397546899179888, "sb_dt": 1.4232321618458184, "sb_eta": 0.0965605178058406, "sb_eta_mu": 4.719399631690194, "sb_heat": 0.0125536250820598, "sb_steps": 1432, "sb
[I 2026-09-28 18:14:13,981] Trial 0 finished with value: -0.12994360985786513 and parameters: {'start': 'lp', 'sb_agents': 32, 'sb_steps': 1432, 'sb_dt': 1.4232321618458184, 'sb_variant': 'ballistic', 'sb_heat': 0.0125536250820598, 'sb_xi': 0.07953090488826875, 'sb_warm': 0.10136029824871645, 'sb_eta_mu': 4.719399631690194, 'sb_alpha_floor': 0.19397546899179888, 'sb_tau_frac': 0.9386113363824448, 'sb_eta': 0.0965605178058406}. Best is trial 0 with value: -0.12994360985786513.
[F1__sb__b60] trial 1: -0.13236 [-0.11215169146388437, -0.15257590810608057] {"sb_agents": 32, "sb_alpha_floor": 0.12790764691351628, "sb_dt": 0.9781366314927988, "sb_eta": 1.1053939319688928, "sb_eta_mu": 6.38817009093146, "sb_heat": 0.06306448033812095, "sb_steps": 361, "sb_
[I 2026-09-28 18:16:18,250] Trial 1 finished with value: -0.13236379978498247 and parameters: {'start': 'lp', 'sb_agents': 32, 'sb_steps': 361, 'sb_dt': 0.9781366314927988, 'sb_variant': 'ballistic', 'sb_heat': 0.06306448033812095, 'sb_xi': 0.31896357793988156, 'sb_warm': 0.24073122565136285, 'sb_eta_mu': 6.38817009093146, 'sb_alpha_floor': 0.12790764691351628, 'sb_tau_frac': 0.9592088870691005, 'sb_eta': 1.1053939319688928}. Best is trial 1 with value: -0.13236379978498247.
[F1__sb__b60] trial 2: -0.13127 [-0.1099707581848327, -0.15257590810608057] {"sb_agents": 32, "sb_alpha_floor": 0.0, "sb_dt": 1.0, "sb_eta": 0.5, "sb_eta_mu": 1.0, "sb_heat": 0.06, "sb_steps": 400, "sb_tau_frac": 0.97, "sb_variant": "ballistic", "sb_warm": 0.0, "sb_xi": 0.7, 
[I 2026-09-28 18:18:22,467] Trial 2 finished with value: -0.13127333314545664 and parameters: {'start': 'lp', 'sb_agents': 32, 'sb_steps': 400, 'sb_dt': 1.0, 'sb_variant': 'ballistic', 'sb_heat': 0.06, 'sb_xi': 0.7, 'sb_warm': 0.0, 'sb_eta_mu': 1.0, 'sb_alpha_floor': 0.0, 'sb_tau_frac': 0.97, 'sb_eta': 0.5}. Best is trial 1 with value: -0.13236379978498247.
[F1__sb__b60] BEST -0.13236 cfg={"sb_agents": 32, "sb_alpha_floor": 0.12790764691351628, "sb_dt": 0.9781366314927988, "sb_eta": 1.1053939319688928, "sb_eta_mu": 6.38817009093146, "sb_heat": 0.06306448033812095, "sb_steps": 361, "sb_tau_frac": 0.9592088870691005, "sb_variant": "ballistic", "sb_warm": 0.24073122565136285, "sb_xi": 0.31896357793988156, "start": "lp"}
[I 2026-09-28 18:18:22,497] A new study created in RDB with name: F1__mq__b60
[F1__mq__b60] trial 0: -0.13930 [-0.1161173804963539, -0.1624841528156734] {"mq_dt": 0.06526542706084622, "mq_iters": 910, "mq_ksamp": 7, "mq_nmax": 514, "mq_pen": 0.001344312143528808, "mq_q": 2, "mq_reads": 16, "mq_solver": "mq_dsb", "mq_xi": 0.15316981598941554, "start": 
[I 2026-09-28 18:20:25,129] Trial 0 finished with value: -0.13930076665601365 and parameters: {'start': 'lp', 'mq_solver': 'mq_dsb', 'mq_nmax': 514, 'mq_reads': 16, 'mq_iters': 910, 'mq_dt': 0.06526542706084622, 'mq_xi': 0.15316981598941554, 'mq_pen': 0.001344312143528808, 'mq_q': 2, 'mq_ksamp': 7}. Best is trial 0 with value: -0.13930076665601365.
[F1__mq__b60] trial 1: -0.14036 [-0.11849267337419034, -0.1622184492901262] {"mq_dt": 1.0, "mq_iters": 300, "mq_ksamp": 4, "mq_nmax": 800, "mq_pen": 0.05, "mq_q": 6, "mq_reads": 16, "mq_solver": "mq_dsb", "mq_xi": 0.5, "start": "lp"}
[I 2026-09-28 18:22:27,752] Trial 1 finished with value: -0.14035556133215826 and parameters: {'start': 'lp', 'mq_solver': 'mq_dsb', 'mq_nmax': 800, 'mq_reads': 16, 'mq_iters': 300, 'mq_dt': 1.0, 'mq_xi': 0.5, 'mq_pen': 0.05, 'mq_q': 6, 'mq_ksamp': 4}. Best is trial 1 with value: -0.14035556133215826.
[F1__mq__b60] trial 2: -0.07260 [-0.07306133869309028, -0.07212945165201767] {"mq_dt": 1.1646313382487206, "mq_iters": 405, "mq_ksamp": 7, "mq_nmax": 1119, "mq_pen": 0.001825525480239901, "mq_q": 2, "mq_reads": 4, "mq_solver": "dwave_sa", "mq_xi": 0.06687793579777104, "start":
[I 2026-09-28 18:24:29,392] Trial 2 finished with value: -0.07259539517255398 and parameters: {'start': 'pgreedy', 'mq_solver': 'dwave_sa', 'mq_nmax': 1119, 'mq_reads': 4, 'mq_iters': 405, 'mq_dt': 1.1646313382487206, 'mq_xi': 0.06687793579777104, 'mq_pen': 0.001825525480239901, 'mq_q': 2, 'mq_ksamp': 7}. Best is trial 1 with value: -0.14035556133215826.
[F1__mq__b60] BEST -0.14036 cfg={"mq_dt": 1.0, "mq_iters": 300, "mq_ksamp": 4, "mq_nmax": 800, "mq_pen": 0.05, "mq_q": 6, "mq_reads": 16, "mq_solver": "mq_dsb", "mq_xi": 0.5, "start": "lp"}
