[I 2026-09-28 17:19:25,899] Trial 9 finished with value: -0.14310171710538683 and parameters: {'start': 'lp', 'eim_R': 16, 'eim_Tmin': 0.00020827188679238984, 'eim_Tratio': 211.85535735518056, 'eim_moves': 96916, 'p_add': 0.329610509590732, 'p_swap': 0.20573397698847973, 'topw': 13, 'eim_rho': 240.58174820146084, 'eim_hscale': 0.22984569932818313, 'eim_anneal': 0.9719942231917424, 'eim_eta': 0.30362340943985383, 'g_scale': 3328.687869531856}. Best is trial 2 with value: -0.14973052655751784.
[F1__eim__b10] BEST -0.14973 cfg={"eim_R": 16, "eim_Tmax": 0.0007255047403074508, "eim_Tmin": 0.00013246974647468452, "eim_anneal": 0.7664913525398744, "eim_eta": 0.23358825194833557, "eim_hscale": 0.6218230782016851, "eim_moves": 52984, "eim_rho": 4.5566719139214715, "g_scale": 1370.4648392849028, "p_add": 0.0716766437045232, "p_swap": 0.8407909904010871, "start": "lp", "topw": 11}
[I 2026-09-28 17:19:25,938] A new study created in RDB with name: F1__milp__b10
[F1__milp__b10] trial 0: +0.44588 [-0.10823400157245078, 1.0] {"eps_tie": 0.0, "mip_heuristic_effort": 0.05, "presolve": "on", "start": "lp"}
[I 2026-09-28 17:20:06,840] Trial 0 finished with value: 0.4458829992137746 and parameters: {'start': 'lp', 'presolve': 'on', 'mip_heuristic_effort': 0.05, 'eps_tie': 0.0}. Best is trial 0 with value: 0.4458829992137746.
[F1__milp__b10] trial 1: +0.49959 [-0.000811628552518151, 1.0] {"eps_tie": 0.0, "mip_heuristic_effort": 0.10490756141474163, "presolve": "on", "start": "pgreedy"}
[I 2026-09-28 17:20:46,856] Trial 1 finished with value: 0.4995941857237409 and parameters: {'start': 'pgreedy', 'presolve': 'on', 'mip_heuristic_effort': 0.10490756141474163, 'eps_tie': 0.0}. Best is trial 0 with value: 0.4458829992137746.
[F1__milp__b10] trial 2: -0.14594 [-0.11781433474409053, -0.17406741043778684] {"eps_tie": 0.0001, "mip_heuristic_effort": 0.15834581868043074, "presolve": "off", "start": "pgreedy"}
[I 2026-09-28 17:21:06,261] Trial 2 finished with value: -0.1459408725909387 and parameters: {'start': 'pgreedy', 'presolve': 'off', 'mip_heuristic_effort': 0.15834581868043074, 'eps_tie': 0.0001}. Best is trial 2 with value: -0.1459408725909387.
[F1__milp__b10] trial 3: -0.14641 [-0.11744917204804795, -0.17537662449942804] {"eps_tie": 0.0001, "mip_heuristic_effort": 0.41985078951584265, "presolve": "off", "start": "pgreedy"}
[I 2026-09-28 17:21:24,614] Trial 3 finished with value: -0.146412898273738 and parameters: {'start': 'pgreedy', 'presolve': 'off', 'mip_heuristic_effort': 0.41985078951584265, 'eps_tie': 0.0001}. Best is trial 3 with value: -0.146412898273738.
[F1__milp__b10] trial 4: -0.14475 [-0.11738832390617993, -0.17210463278132992] {"eps_tie": 0.0001, "mip_heuristic_effort": 0.6117180301996844, "presolve": "off", "start": "lp"}
[I 2026-09-28 17:21:45,754] Trial 4 finished with value: -0.14474647834375493 and parameters: {'start': 'lp', 'presolve': 'off', 'mip_heuristic_effort': 0.6117180301996844, 'eps_tie': 0.0001}. Best is trial 3 with value: -0.146412898273738.
[F1__milp__b10] trial 5: +0.49931 [-0.001370560088684969, 1.0] {"eps_tie": 0.0001, "mip_heuristic_effort": 0.4914059552471096, "presolve": "on", "start": "pgreedy"}
[I 2026-09-28 17:22:25,268] Trial 5 finished with value: 0.4993147199556575 and parameters: {'start': 'pgreedy', 'presolve': 'on', 'mip_heuristic_effort': 0.4914059552471096, 'eps_tie': 0.0001}. Best is trial 3 with value: -0.146412898273738.
[F1__milp__b10] trial 6: -0.14603 [-0.11771102582361215, -0.1743424303562352] {"eps_tie": 0.0001, "mip_heuristic_effort": 0.03017874796956039, "presolve": "off", "start": "lp"}
[I 2026-09-28 17:22:43,672] Trial 6 finished with value: -0.14602672808992367 and parameters: {'start': 'lp', 'presolve': 'off', 'mip_heuristic_effort': 0.03017874796956039, 'eps_tie': 0.0001}. Best is trial 3 with value: -0.146412898273738.
[F1__milp__b10] trial 7: -0.14760 [-0.11969309496910585, -0.17550094244630465] {"eps_tie": 0.0, "mip_heuristic_effort": 0.8077206102454388, "presolve": "off", "start": "pgreedy"}
[I 2026-09-28 17:22:58,336] Trial 7 finished with value: -0.14759701870770525 and parameters: {'start': 'pgreedy', 'presolve': 'off', 'mip_heuristic_effort': 0.8077206102454388, 'eps_tie': 0.0}. Best is trial 7 with value: -0.14759701870770525.
[F1__milp__b10] trial 8: -0.14569 [-0.11806053341519285, -0.17332843415285137] {"eps_tie": 0.0, "mip_heuristic_effort": 0.0247828031863947, "presolve": "off", "start": "pgreedy"}
[I 2026-09-28 17:23:13,119] Trial 8 finished with value: -0.1456944837840221 and parameters: {'start': 'pgreedy', 'presolve': 'off', 'mip_heuristic_effort': 0.0247828031863947, 'eps_tie': 0.0}. Best is trial 7 with value: -0.14759701870770525.
[F1__milp__b10] trial 9: -0.14431 [-0.1184631354412441, -0.1701630965006865] {"eps_tie": 0.0, "mip_heuristic_effort": 0.6151716512607516, "presolve": "off", "start": "pgreedy"}
[I 2026-09-28 17:23:27,938] Trial 9 finished with value: -0.1443131159709653 and parameters: {'start': 'pgreedy', 'presolve': 'off', 'mip_heuristic_effort': 0.6151716512607516, 'eps_tie': 0.0}. Best is trial 7 with value: -0.14759701870770525.
[F1__milp__b10] BEST -0.14760 cfg={"eps_tie": 0.0, "mip_heuristic_effort": 0.8077206102454388, "presolve": "off", "start": "pgreedy"}
[I 2026-09-28 17:23:27,985] A new study created in RDB with name: F1__cpsat__b10
[F1__cpsat__b10] trial 0: -0.13219 [-0.11180402999311201, -0.1525759081060809] {"cp_model_presolve": true, "linearization_level": 1, "repair_hint": false, "start": "lp"}
[I 2026-09-28 17:23:45,747] Trial 0 finished with value: -0.13218996904959646 and parameters: {'start': 'lp', 'linearization_level': 1, 'repair_hint': False, 'cp_model_presolve': True}. Best is trial 0 with value: -0.13218996904959646.
[F1__cpsat__b10] trial 1: -0.02075 [-0.039883077046227955, -0.0016238100171348524] {"cp_model_presolve": true, "linearization_level": 1, "repair_hint": false, "start": "pgreedy"}
[I 2026-09-28 17:24:05,611] Trial 1 finished with value: -0.020753443531681404 and parameters: {'start': 'pgreedy', 'linearization_level': 1, 'repair_hint': False, 'cp_model_presolve': True}. Best is trial 0 with value: -0.13218996904959646.
[F1__cpsat__b10] trial 2: -0.11120 [-0.10750795918064493, -0.11489661412469432] {"cp_model_presolve": false, "linearization_level": 1, "repair_hint": false, "start": "pgreedy"}
[I 2026-09-28 17:24:23,869] Trial 2 finished with value: -0.11120228665266962 and parameters: {'start': 'pgreedy', 'linearization_level': 1, 'repair_hint': False, 'cp_model_presolve': False}. Best is trial 0 with value: -0.13218996904959646.
[F1__cpsat__b10] trial 3: -0.08904 [-0.07993075422379636, -0.09814678312406133] {"cp_model_presolve": false, "linearization_level": 0, "repair_hint": false, "start": "pgreedy"}
[I 2026-09-28 17:24:43,786] Trial 3 finished with value: -0.08903876867392885 and parameters: {'start': 'pgreedy', 'linearization_level': 0, 'repair_hint': False, 'cp_model_presolve': False}. Best is trial 0 with value: -0.13218996904959646.
[F1__cpsat__b10] trial 4: -0.13219 [-0.11180402999311201, -0.1525759081060809] {"cp_model_presolve": true, "linearization_level": 2, "repair_hint": false, "start": "lp"}
[I 2026-09-28 17:25:01,347] Trial 4 finished with value: -0.13218996904959646 and parameters: {'start': 'lp', 'linearization_level': 2, 'repair_hint': False, 'cp_model_presolve': True}. Best is trial 0 with value: -0.13218996904959646.
[F1__cpsat__b10] trial 5: -0.13219 [-0.11180402999311201, -0.1525759081060809] {"cp_model_presolve": true, "linearization_level": 0, "repair_hint": true, "start": "lp"}
[I 2026-09-28 17:25:18,923] Trial 5 finished with value: -0.13218996904959646 and parameters: {'start': 'lp', 'linearization_level': 0, 'repair_hint': True, 'cp_model_presolve': True}. Best is trial 0 with value: -0.13218996904959646.
Check failed: heuristics.fixed_search != nullptr 
*** Check failure stack trace: ***
[F1__cpsat__b10] trial 6: +0.44119 [-0.11762987035284356, 1.0] {"cp_model_presolve": false, "linearization_level": 2, "repair_hint": true, "start": "lp"}
[I 2026-09-28 17:25:36,662] Trial 6 finished with value: 0.4411850648235782 and parameters: {'start': 'lp', 'linearization_level': 2, 'repair_hint': True, 'cp_model_presolve': False}. Best is trial 0 with value: -0.13218996904959646.
[F1__cpsat__b10] trial 7: -0.13219 [-0.11180402999311201, -0.1525759081060809] {"cp_model_presolve": true, "linearization_level": 0, "repair_hint": false, "start": "lp"}
[I 2026-09-28 17:25:54,417] Trial 7 finished with value: -0.13218996904959646 and parameters: {'start': 'lp', 'linearization_level': 0, 'repair_hint': False, 'cp_model_presolve': True}. Best is trial 0 with value: -0.13218996904959646.
[F1__cpsat__b10] trial 8: -0.14471 [-0.11707042190285011, -0.17235043649163873] {"cp_model_presolve": false, "linearization_level": 1, "repair_hint": false, "start": "lp"}
[I 2026-09-28 17:26:12,131] Trial 8 finished with value: -0.14471042919724442 and parameters: {'start': 'lp', 'linearization_level': 1, 'repair_hint': False, 'cp_model_presolve': False}. Best is trial 8 with value: -0.14471042919724442.
[F1__cpsat__b10] trial 9: -0.14566 [-0.1176403563190388, -0.17368260614538877] {"cp_model_presolve": false, "linearization_level": 1, "repair_hint": false, "start": "lp"}
[I 2026-09-28 17:26:29,692] Trial 9 finished with value: -0.14566148123221379 and parameters: {'start': 'lp', 'linearization_level': 1, 'repair_hint': False, 'cp_model_presolve': False}. Best is trial 9 with value: -0.14566148123221379.
[F1__cpsat__b10] BEST -0.14566 cfg={"cp_model_presolve": false, "linearization_level": 1, "repair_hint": false, "start": "lp"}
[I 2026-09-28 17:26:29,723] A new study created in RDB with name: F1__hlns__b10
[F1__hlns__b10] trial 0: -0.13819 [-0.11491836195325278, -0.16145182195106134] {"eim_R": 8, "eim_Tmax": 0.003, "eim_Tmin": 1e-06, "eim_moves": 20000, "hl_frac_sel": 0.5, "hl_nmax": 3000, "hl_p_block": 0.3, "hl_p_milp": 0.0, "hl_q": 8, "hl_slice": 0.25, "start": "lp"}
[I 2026-09-28 17:26:51,433] Trial 0 finished with value: -0.13818509195215706 and parameters: {'start': 'lp', 'hl_nmax': 3000, 'hl_slice': 0.25, 'hl_q': 8, 'hl_p_block': 0.3, 'hl_frac_sel': 0.5, 'hl_p_milp': 0.0, 'eim_R': 8, 'eim_Tmin': 1e-06, 'eim_Tratio': 3000.0, 'eim_moves': 20000}. Best is trial 0 with value: -0.13818509195215706.
[F1__hlns__b10] trial 1: -0.04735 [-0.03656079803814971, -0.05813093780301448] {"eim_R": 4, "eim_Tmax": 0.003294499661706162, "eim_Tmin": 1.3049073550362386e-05, "eim_moves": 74745, "hl_frac_sel": 0.25119498706364835, "hl_nmax": 2170, "hl_p_block": 0.5167152904533249, "hl_p_milp
[I 2026-09-28 17:27:13,145] Trial 1 finished with value: -0.047345867920582096 and parameters: {'start': 'pgreedy', 'hl_nmax': 2170, 'hl_slice': 0.37316899400505027, 'hl_q': 6, 'hl_p_block': 0.5167152904533249, 'hl_frac_sel': 0.25119498706364835, 'hl_p_milp': 0.2675319002346239, 'eim_R': 4, 'eim_Tmin': 1.3049073550362386e-05, 'eim_Tratio': 252.47000478548688, 'eim_moves': 74745}. Best is trial 0 with value: -0.13818509195215706.
[F1__hlns__b10] trial 2: -0.03456 [-0.024826263416775518, -0.04429907559022972] {"eim_R": 8, "eim_Tmax": 0.00024602179969746214, "eim_Tmin": 3.628140404024378e-05, "eim_moves": 80536, "hl_frac_sel": 1.8483120598659897, "hl_nmax": 320, "hl_p_block": 0.6960097185974554, "hl_p_milp"
[I 2026-09-28 17:27:34,865] Trial 2 finished with value: -0.03456266950350262 and parameters: {'start': 'pgreedy', 'hl_nmax': 320, 'hl_slice': 1.0786410564546558, 'hl_q': 16, 'hl_p_block': 0.6960097185974554, 'hl_frac_sel': 1.8483120598659897, 'hl_p_milp': 0.23974756926501706, 'eim_R': 8, 'eim_Tmin': 3.628140404024378e-05, 'eim_Tratio': 6.780933820107175, 'eim_moves': 80536}. Best is trial 0 with value: -0.13818509195215706.
[F1__hlns__b10] trial 3: -0.13631 [-0.11371269737523748, -0.1589085212201321] {"eim_R": 16, "eim_Tmax": 0.0022809729374061983, "eim_Tmin": 5.336803302756711e-05, "eim_moves": 11053, "hl_frac_sel": 0.05358859760545354, "hl_nmax": 714, "hl_p_block": 0.4547471590949188, "hl_p_milp
[I 2026-09-28 17:27:56,688] Trial 3 finished with value: -0.1363106092976848 and parameters: {'start': 'lp', 'hl_nmax': 714, 'hl_slice': 0.8696386278445376, 'hl_q': 6, 'hl_p_block': 0.4547471590949188, 'hl_frac_sel': 0.05358859760545354, 'hl_p_milp': 0.1852906491227631, 'eim_R': 16, 'eim_Tmin': 5.336803302756711e-05, 'eim_Tratio': 42.740434825993454, 'eim_moves': 11053}. Best is trial 0 with value: -0.13818509195215706.
[F1__hlns__b10] trial 4: -0.13872 [-0.1143441445367861, -0.1630968733440099] {"eim_R": 8, "eim_Tmax": 0.008011355863608797, "eim_Tmin": 1.2344819320729512e-06, "eim_moves": 6598, "hl_frac_sel": 0.40395860098418684, "hl_nmax": 2272, "hl_p_block": 0.05751986868961895, "hl_p_milp
[I 2026-09-28 17:28:18,415] Trial 4 finished with value: -0.138720508940398 and parameters: {'start': 'lp', 'hl_nmax': 2272, 'hl_slice': 0.9259960792591326, 'hl_q': 15, 'hl_p_block': 0.05751986868961895, 'hl_frac_sel': 0.40395860098418684, 'hl_p_milp': 0.21702967139742327, 'eim_R': 8, 'eim_Tmin': 1.2344819320729512e-06, 'eim_Tratio': 6489.650156447466, 'eim_moves': 6598}. Best is trial 4 with value: -0.138720508940398.
[F1__hlns__b10] trial 5: -0.13555 [-0.11033333631174214, -0.16075987481749] {"eim_R": 8, "eim_Tmax": 5.793475874104928e-06, "eim_Tmin": 3.9208214167899065e-07, "eim_moves": 3644, "hl_frac_sel": 1.8790491396530897, "hl_nmax": 6568, "hl_p_block": 0.1889267903162376, "hl_p_milp"
[I 2026-09-28 17:28:40,187] Trial 5 finished with value: -0.13554660556461606 and parameters: {'start': 'lp', 'hl_nmax': 6568, 'hl_slice': 1.5481078287156222, 'hl_q': 10, 'hl_p_block': 0.1889267903162376, 'hl_frac_sel': 1.8790491396530897, 'hl_p_milp': 0.2662340583262359, 'eim_R': 8, 'eim_Tmin': 3.9208214167899065e-07, 'eim_Tratio': 14.776178913163099, 'eim_moves': 3644}. Best is trial 4 with value: -0.138720508940398.
[F1__hlns__b10] trial 6: -0.13534 [-0.11346782791111742, -0.15720250335203612] {"eim_R": 8, "eim_Tmax": 9.743771432792573e-05, "eim_Tmin": 5.094376884806586e-07, "eim_moves": 4932, "hl_frac_sel": 1.245245382673479, "hl_nmax": 1586, "hl_p_block": 0.13900799821383697, "hl_p_milp":
[I 2026-09-28 17:29:01,877] Trial 6 finished with value: -0.13533516563157677 and parameters: {'start': 'lp', 'hl_nmax': 1586, 'hl_slice': 1.2638745229913981, 'hl_q': 2, 'hl_p_block': 0.13900799821383697, 'hl_frac_sel': 1.245245382673479, 'hl_p_milp': 0.07498454774008419, 'eim_R': 8, 'eim_Tmin': 5.094376884806586e-07, 'eim_Tratio': 191.26522542633805, 'eim_moves': 4932}. Best is trial 4 with value: -0.138720508940398.
[F1__hlns__b10] trial 7: -0.13558 [-0.11472525771661912, -0.1564250689972052] {"eim_R": 8, "eim_Tmax": 1.280248970566445e-05, "eim_Tmin": 3.896419357017322e-07, "eim_moves": 4761, "hl_frac_sel": 0.14825222055770715, "hl_nmax": 708, "hl_p_block": 0.5584046065728129, "hl_p_milp":
[I 2026-09-28 17:29:23,529] Trial 7 finished with value: -0.13557516335691217 and parameters: {'start': 'lp', 'hl_nmax': 708, 'hl_slice': 1.680526157690484, 'hl_q': 6, 'hl_p_block': 0.5584046065728129, 'hl_frac_sel': 0.14825222055770715, 'hl_p_milp': 0.25616192486093003, 'eim_R': 8, 'eim_Tmin': 3.896419357017322e-07, 'eim_Tratio': 32.857063197285456, 'eim_moves': 4761}. Best is trial 4 with value: -0.138720508940398.
[F1__hlns__b10] trial 8: -0.13970 [-0.11599354271247853, -0.16340334540489387] {"eim_R": 8, "eim_Tmax": 5.504103655676379e-05, "eim_Tmin": 5.599668416030328e-07, "eim_moves": 36632, "hl_frac_sel": 1.1778115524924693, "hl_nmax": 4485, "hl_p_block": 0.29046821963088276, "hl_p_milp
[I 2026-09-28 17:29:45,421] Trial 8 finished with value: -0.1396984440586862 and parameters: {'start': 'lp', 'hl_nmax': 4485, 'hl_slice': 0.06451219192567251, 'hl_q': 11, 'hl_p_block': 0.29046821963088276, 'hl_frac_sel': 1.1778115524924693, 'hl_p_milp': 0.28415144243150015, 'eim_R': 8, 'eim_Tmin': 5.599668416030328e-07, 'eim_Tratio': 98.29338537116998, 'eim_moves': 36632}. Best is trial 8 with value: -0.1396984440586862.
[F1__hlns__b10] trial 9: -0.14066 [-0.11651163805634812, -0.16481735025388922] {"eim_R": 8, "eim_Tmax": 0.002149211332011167, "eim_Tmin": 2.742194550436767e-06, "eim_moves": 28133, "hl_frac_sel": 1.4390612928037052, "hl_nmax": 2899, "hl_p_block": 0.035120747192818935, "hl_p_milp
[I 2026-09-28 17:30:07,114] Trial 9 finished with value: -0.14066449415511867 and parameters: {'start': 'lp', 'hl_nmax': 2899, 'hl_slice': 0.1354209346186694, 'hl_q': 13, 'hl_p_block': 0.035120747192818935, 'hl_frac_sel': 1.4390612928037052, 'hl_p_milp': 0.28955460282642714, 'eim_R': 8, 'eim_Tmin': 2.742194550436767e-06, 'eim_Tratio': 783.7559635106298, 'eim_moves': 28133}. Best is trial 9 with value: -0.14066449415511867.
[F1__hlns__b10] BEST -0.14066 cfg={"eim_R": 8, "eim_Tmax": 0.002149211332011167, "eim_Tmin": 2.742194550436767e-06, "eim_moves": 28133, "hl_frac_sel": 1.4390612928037052, "hl_nmax": 2899, "hl_p_block": 0.035120747192818935, "hl_p_milp": 0.28955460282642714, "hl_q": 13, "hl_slice": 0.1354209346186694, "start": "lp"}
[I 2026-09-28 17:30:07,150] A new study created in RDB with name: F1__lp__b10
[F1__lp__b10] trial 0: -0.13022 [-0.10787253111802741, -0.1525759081060809] {"lexi": false}
[I 2026-09-28 17:30:10,698] Trial 0 finished with value: -0.13022421961205416 and parameters: {'start': 'pgreedy', 'lexi': False}. Best is trial 0 with value: -0.13022421961205416.
[F1__lp__b10] trial 1: +0.42349 [1.0, -0.15301862309675196] {"lexi": true}
[I 2026-09-28 17:30:29,648] Trial 1 finished with value: 0.423490688451624 and parameters: {'start': 'lp', 'lexi': True}. Best is trial 0 with value: -0.13022421961205416.
[F1__lp__b10] trial 2: -0.13127 [-0.1099707581848327, -0.15257590810608057] {"lexi": false}
[I 2026-09-28 17:30:33,044] Trial 2 finished with value: -0.13127333314545664 and parameters: {'start': 'pgreedy', 'lexi': False}. Best is trial 2 with value: -0.13127333314545664.
[F1__lp__b10] trial 3: -0.12706 [-0.1011033230248416, -0.15301862309675196] {"lexi": true}
[I 2026-09-28 17:30:51,137] Trial 3 finished with value: -0.12706097306079678 and parameters: {'start': 'lp', 'lexi': True}. Best is trial 2 with value: -0.13127333314545664.
[F1__lp__b10] trial 4: -0.13161 [-0.11064584764230756, -0.1525759081060809] {"lexi": false}
[I 2026-09-28 17:30:54,799] Trial 4 finished with value: -0.13161087787419423 and parameters: {'start': 'pgreedy', 'lexi': False}. Best is trial 4 with value: -0.13161087787419423.
[F1__lp__b10] trial 5: -0.12842 [-0.10382819733909054, -0.15301862309675196] {"lexi": true}
[I 2026-09-28 17:31:12,925] Trial 5 finished with value: -0.12842341021792125 and parameters: {'start': 'pgreedy', 'lexi': True}. Best is trial 4 with value: -0.13161087787419423.
[F1__lp__b10] trial 6: -0.13172 [-0.11086154839764473, -0.15257590810608057] {"lexi": false}
[I 2026-09-28 17:31:16,314] Trial 6 finished with value: -0.13171872825186265 and parameters: {'start': 'lp', 'lexi': False}. Best is trial 6 with value: -0.13171872825186265.
[F1__lp__b10] trial 7: -0.13172 [-0.11086029303549494, -0.15257590810608057] {"lexi": false}
[I 2026-09-28 17:31:19,844] Trial 7 finished with value: -0.13171810057078776 and parameters: {'start': 'lp', 'lexi': False}. Best is trial 6 with value: -0.13171872825186265.
[F1__lp__b10] trial 8: -0.13086 [-0.10914325299335426, -0.1525759081060809] {"lexi": false}
[I 2026-09-28 17:31:23,472] Trial 8 finished with value: -0.13085958054971758 and parameters: {'start': 'lp', 'lexi': False}. Best is trial 6 with value: -0.13171872825186265.
[F1__lp__b10] trial 9: -0.13101 [-0.10944225071959979, -0.1525759081060809] {"lexi": false}
[I 2026-09-28 17:31:26,811] Trial 9 finished with value: -0.13100907941284035 and parameters: {'start': 'lp', 'lexi': False}. Best is trial 6 with value: -0.13171872825186265.
[F1__lp__b10] BEST -0.13172 cfg={"lexi": false}
[I 2026-09-28 17:31:26,851] A new study created in RDB with name: F1__sb__b10
[F1__sb__b10] trial 0: -0.13022 [-0.10787253111802741, -0.1525759081060809] {"sb_agents": 32, "sb_alpha_floor": 0.0, "sb_dt": 1.0, "sb_eta": 0.5, "sb_eta_mu": 1.0, "sb_heat": 0.06, "sb_steps": 400, "sb_tau_frac": 0.97, "sb_variant": "ballistic", "sb_warm": 0.0, "sb_xi": 0.7, 
[I 2026-09-28 17:31:51,521] Trial 0 finished with value: -0.13022421961205416 and parameters: {'start': 'lp', 'sb_agents': 32, 'sb_steps': 400, 'sb_dt': 1.0, 'sb_variant': 'ballistic', 'sb_heat': 0.06, 'sb_xi': 0.7, 'sb_warm': 0.0, 'sb_eta_mu': 1.0, 'sb_alpha_floor': 0.0, 'sb_tau_frac': 0.97, 'sb_eta': 0.5}. Best is trial 0 with value: -0.13022421961205416.
[F1__sb__b10] trial 1: +0.00000 [0.0, 0.0] {"sb_agents": 64, "sb_alpha_floor": 0.017425859940308142, "sb_dt": 1.3593049010167038, "sb_eta": 2.3131814207377923, "sb_eta_mu": 0.0163345876110695, "sb_heat": 0.060428515788450606, "sb_steps": 250, 
[I 2026-09-28 17:32:15,798] Trial 1 finished with value: 0.0 and parameters: {'start': 'pgreedy', 'sb_agents': 64, 'sb_steps': 250, 'sb_dt': 1.3593049010167038, 'sb_variant': 'ballistic', 'sb_heat': 0.060428515788450606, 'sb_xi': 0.5117279648784191, 'sb_warm': 0.8793168063780279, 'sb_eta_mu': 0.0163345876110695, 'sb_alpha_floor': 0.017425859940308142, 'sb_tau_frac': 0.9020218397440326, 'sb_eta': 2.3131814207377923}. Best is trial 0 with value: -0.13022421961205416.
[F1__sb__b10] trial 2: +0.00000 [0.0, 0.0] {"sb_agents": 8, "sb_alpha_floor": 0.1136867897737297, "sb_dt": 1.031897327725781, "sb_eta": 0.8594903371659688, "sb_eta_mu": 0.23358825194833557, "sb_heat": 0.040973773756855375, "sb_steps": 77, "sb_
