[I 2026-09-28 16:55:20,964] Trial 1 finished with value: 0.0 and parameters: {'start': 'pgreedy', 'sb_agents': 64, 'sb_steps': 250, 'sb_dt': 1.3593049010167038, 'sb_variant': 'ballistic', 'sb_heat': 0.060428515788450606, 'sb_xi': 0.5117279648784191, 'sb_warm': 0.8793168063780279, 'sb_eta_mu': 0.0163345876110695, 'sb_alpha_floor': 0.017425859940308142}. Best is trial 1 with value: 0.0.
[F2b_tau_rel0.6__sb__b10] trial 2: +0.00000 [0.0, 0.0] {"sb_agents": 32, "sb_alpha_floor": 0.15484673788684333, "sb_dt": 1.214687929172392, "sb_eta_mu": 0.06218230782016853, "sb_heat": 0.24853670483449902, "sb_steps": 273, "sb_variant": "discrete", "sb_wa
[I 2026-09-28 16:55:45,311] Trial 2 finished with value: 0.0 and parameters: {'start': 'pgreedy', 'sb_agents': 32, 'sb_steps': 273, 'sb_dt': 1.214687929172392, 'sb_variant': 'discrete', 'sb_heat': 0.24853670483449902, 'sb_xi': 0.4235407976345083, 'sb_warm': 0.3939288429909974, 'sb_eta_mu': 0.06218230782016853, 'sb_alpha_floor': 0.15484673788684333}. Best is trial 1 with value: 0.0.
[F2b_tau_rel0.6__sb__b10] trial 3: +0.00000 [0.0, 0.0] {"sb_agents": 16, "sb_alpha_floor": 0.02578525953097066, "sb_dt": 1.0863663888345285, "sb_eta_mu": 0.0427708304996207, "sb_heat": 0.012273271012844034, "sb_steps": 1625, "sb_variant": "heated", "sb_wa
[I 2026-09-28 16:56:09,889] Trial 3 finished with value: 0.0 and parameters: {'start': 'pgreedy', 'sb_agents': 16, 'sb_steps': 1625, 'sb_dt': 1.0863663888345285, 'sb_variant': 'heated', 'sb_heat': 0.012273271012844034, 'sb_xi': 0.7666234032273203, 'sb_warm': 0.6371059761372514, 'sb_eta_mu': 0.0427708304996207, 'sb_alpha_floor': 0.02578525953097066}. Best is trial 1 with value: 0.0.
[F2b_tau_rel0.6__sb__b10] trial 4: +0.00000 [0.0, 0.0] {"sb_agents": 64, "sb_alpha_floor": 0.10309851026405195, "sb_dt": 0.6547553491462884, "sb_eta_mu": 0.4589433026215744, "sb_heat": 0.22344186631776727, "sb_steps": 564, "sb_variant": "ballistic", "sb_w
[I 2026-09-28 16:56:35,021] Trial 4 finished with value: 0.0 and parameters: {'start': 'pgreedy', 'sb_agents': 64, 'sb_steps': 564, 'sb_dt': 0.6547553491462884, 'sb_variant': 'ballistic', 'sb_heat': 0.22344186631776727, 'sb_xi': 0.4056004110439779, 'sb_warm': 0.9110797114690506, 'sb_eta_mu': 0.4589433026215744, 'sb_alpha_floor': 0.10309851026405195}. Best is trial 1 with value: 0.0.
[F2b_tau_rel0.6__sb__b10] trial 5: +0.00000 [0.0, 0.0] {"sb_agents": 64, "sb_alpha_floor": 0.1629973906471776, "sb_dt": 1.3518798049246434, "sb_eta_mu": 1.5423979778329577, "sb_heat": 0.026313042205482584, "sb_steps": 570, "sb_variant": "ballistic", "sb_w
[I 2026-09-28 16:56:59,167] Trial 5 finished with value: 0.0 and parameters: {'start': 'pgreedy', 'sb_agents': 64, 'sb_steps': 570, 'sb_dt': 1.3518798049246434, 'sb_variant': 'ballistic', 'sb_heat': 0.026313042205482584, 'sb_xi': 0.052372490154992, 'sb_warm': 0.35249649824283646, 'sb_eta_mu': 1.5423979778329577, 'sb_alpha_floor': 0.1629973906471776}. Best is trial 1 with value: 0.0.
[F2b_tau_rel0.6__sb__b10] trial 6: +0.00000 [0.0, 0.0] {"sb_agents": 64, "sb_alpha_floor": 0.020395068626972046, "sb_dt": 0.8292241742611886, "sb_eta_mu": 0.01929182922163699, "sb_heat": 0.01343460600595445, "sb_steps": 188, "sb_variant": "ballistic", "sb
[I 2026-09-28 16:57:23,344] Trial 6 finished with value: 0.0 and parameters: {'start': 'pgreedy', 'sb_agents': 64, 'sb_steps': 188, 'sb_dt': 0.8292241742611886, 'sb_variant': 'ballistic', 'sb_heat': 0.01343460600595445, 'sb_xi': 0.10243095236279803, 'sb_warm': 0.4119236202156892, 'sb_eta_mu': 0.01929182922163699, 'sb_alpha_floor': 0.020395068626972046}. Best is trial 1 with value: 0.0.
[F2b_tau_rel0.6__sb__b10] trial 7: +0.00000 [0.0, 0.0] {"sb_agents": 64, "sb_alpha_floor": 0.009898997058028863, "sb_dt": 1.2958386968342557, "sb_eta_mu": 3.6391222668043945, "sb_heat": 0.0675854099875873, "sb_steps": 56, "sb_variant": "ballistic", "sb_wa
[I 2026-09-28 16:57:47,623] Trial 7 finished with value: 0.0 and parameters: {'start': 'pgreedy', 'sb_agents': 64, 'sb_steps': 56, 'sb_dt': 1.2958386968342557, 'sb_variant': 'ballistic', 'sb_heat': 0.0675854099875873, 'sb_xi': 0.1536484086419294, 'sb_warm': 0.08799663300715477, 'sb_eta_mu': 3.6391222668043945, 'sb_alpha_floor': 0.009898997058028863}. Best is trial 1 with value: 0.0.
[F2b_tau_rel0.6__sb__b10] trial 8: +0.00000 [0.0, 0.0] {"sb_agents": 64, "sb_alpha_floor": 0.003153686122105207, "sb_dt": 1.3489045180351462, "sb_eta_mu": 0.013573268050001334, "sb_heat": 0.04235250057128964, "sb_steps": 704, "sb_variant": "ballistic", "s
[I 2026-09-28 16:58:12,201] Trial 8 finished with value: 0.0 and parameters: {'start': 'pgreedy', 'sb_agents': 64, 'sb_steps': 704, 'sb_dt': 1.3489045180351462, 'sb_variant': 'ballistic', 'sb_heat': 0.04235250057128964, 'sb_xi': 1.134005008519199, 'sb_warm': 0.9359644473723686, 'sb_eta_mu': 0.013573268050001334, 'sb_alpha_floor': 0.003153686122105207}. Best is trial 1 with value: 0.0.
[F2b_tau_rel0.6__sb__b10] trial 9: +0.00000 [0.0, 0.0] {"sb_agents": 64, "sb_alpha_floor": 0.08135397637543632, "sb_dt": 1.4811218099413979, "sb_eta_mu": 0.6569339112013449, "sb_heat": 0.2758246619450391, "sb_steps": 1114, "sb_variant": "ballistic", "sb_w
[I 2026-09-28 16:58:36,608] Trial 9 finished with value: 0.0 and parameters: {'start': 'pgreedy', 'sb_agents': 64, 'sb_steps': 1114, 'sb_dt': 1.4811218099413979, 'sb_variant': 'ballistic', 'sb_heat': 0.2758246619450391, 'sb_xi': 1.1329830822842206, 'sb_warm': 0.07765792843736197, 'sb_eta_mu': 0.6569339112013449, 'sb_alpha_floor': 0.08135397637543632}. Best is trial 1 with value: 0.0.
[F2b_tau_rel0.6__sb__b10] BEST +0.00000 cfg={"sb_agents": 64, "sb_alpha_floor": 0.017425859940308142, "sb_dt": 1.3593049010167038, "sb_eta_mu": 0.0163345876110695, "sb_heat": 0.060428515788450606, "sb_steps": 250, "sb_variant": "ballistic", "sb_warm": 0.8793168063780279, "sb_xi": 0.5117279648784191, "start": "pgreedy"}
[I 2026-09-28 16:58:36,646] A new study created in RDB with name: F2b_tau_rel0.6__scip__b10
[F2b_tau_rel0.6__scip__b10] trial 0: +0.00603 [0.006003137340540032, 0.006058631525951652] {"emphasis": "default", "start": "lp"}
[I 2026-09-28 16:58:58,192] Trial 0 finished with value: 0.006030884433245842 and parameters: {'start': 'lp', 'emphasis': 'default'}. Best is trial 0 with value: 0.006030884433245842.
[F2b_tau_rel0.6__scip__b10] trial 1: +0.00000 [0.0, 0.0] {"emphasis": "default", "start": "pgreedy"}
[I 2026-09-28 16:59:19,675] Trial 1 finished with value: 0.0 and parameters: {'start': 'pgreedy', 'emphasis': 'default'}. Best is trial 1 with value: 0.0.
[F2b_tau_rel0.6__scip__b10] trial 2: +0.00601 [0.005971286385699992, 0.006058631525951652] {"emphasis": "aggressive", "start": "lp"}
[I 2026-09-28 16:59:41,112] Trial 2 finished with value: 0.006014958955825822 and parameters: {'start': 'lp', 'emphasis': 'aggressive'}. Best is trial 1 with value: 0.0.
[F2b_tau_rel0.6__scip__b10] trial 3: +0.00603 [0.006004005669767665, 0.006058631525951652] {"emphasis": "aggressive", "start": "lp"}
[I 2026-09-28 17:00:02,490] Trial 3 finished with value: 0.006031318597859658 and parameters: {'start': 'lp', 'emphasis': 'aggressive'}. Best is trial 1 with value: 0.0.
[F2b_tau_rel0.6__scip__b10] trial 4: +0.00000 [0.0, 0.0] {"emphasis": "default", "start": "pgreedy"}
[I 2026-09-28 17:00:23,959] Trial 4 finished with value: 0.0 and parameters: {'start': 'pgreedy', 'emphasis': 'default'}. Best is trial 1 with value: 0.0.
[F2b_tau_rel0.6__scip__b10] trial 5: +0.00000 [0.0, 0.0] {"emphasis": "fast", "start": "pgreedy"}
[I 2026-09-28 17:00:45,369] Trial 5 finished with value: 0.0 and parameters: {'start': 'pgreedy', 'emphasis': 'fast'}. Best is trial 1 with value: 0.0.
[F2b_tau_rel0.6__scip__b10] trial 6: +0.00000 [0.0, 0.0] {"emphasis": "default", "start": "pgreedy"}
[I 2026-09-28 17:01:06,825] Trial 6 finished with value: 0.0 and parameters: {'start': 'pgreedy', 'emphasis': 'default'}. Best is trial 1 with value: 0.0.
[F2b_tau_rel0.6__scip__b10] trial 7: +0.00000 [0.0, 0.0] {"emphasis": "aggressive", "start": "pgreedy"}
[I 2026-09-28 17:01:28,173] Trial 7 finished with value: 0.0 and parameters: {'start': 'pgreedy', 'emphasis': 'aggressive'}. Best is trial 1 with value: 0.0.
[F2b_tau_rel0.6__scip__b10] trial 8: +0.00600 [0.005936394171321968, 0.006058631525951652] {"emphasis": "fast", "start": "lp"}
[I 2026-09-28 17:01:49,563] Trial 8 finished with value: 0.00599751284863681 and parameters: {'start': 'lp', 'emphasis': 'fast'}. Best is trial 1 with value: 0.0.
[F2b_tau_rel0.6__scip__b10] trial 9: +0.00000 [0.0, 0.0] {"emphasis": "default", "start": "pgreedy"}
[I 2026-09-28 17:02:10,916] Trial 9 finished with value: 0.0 and parameters: {'start': 'pgreedy', 'emphasis': 'default'}. Best is trial 1 with value: 0.0.
[F2b_tau_rel0.6__scip__b10] BEST +0.00000 cfg={"emphasis": "default", "start": "pgreedy"}
[I 2026-09-28 17:02:10,956] A new study created in RDB with name: F2b_tau_rel0.6__mq__b10
[F2b_tau_rel0.6__mq__b10] trial 0: +0.00603 [0.006003137340540032, 0.006058631525951652] {"mq_dt": 1.0, "mq_iters": 300, "mq_ksamp": 4, "mq_nmax": 800, "mq_pen": 0.05, "mq_q": 6, "mq_reads": 16, "mq_solver": "mq_dsb", "mq_xi": 0.5, "start": "lp"}
[I 2026-09-28 17:02:34,144] Trial 0 finished with value: 0.006030884433245842 and parameters: {'start': 'lp', 'mq_solver': 'mq_dsb', 'mq_nmax': 800, 'mq_reads': 16, 'mq_iters': 300, 'mq_dt': 1.0, 'mq_xi': 0.5, 'mq_pen': 0.05, 'mq_q': 6, 'mq_ksamp': 4}. Best is trial 0 with value: 0.006030884433245842.
[F2b_tau_rel0.6__mq__b10] trial 1: +0.00000 [0.0, 0.0] {"mq_dt": 1.1646313382487206, "mq_iters": 405, "mq_ksamp": 7, "mq_nmax": 1119, "mq_pen": 0.001825525480239901, "mq_q": 2, "mq_reads": 4, "mq_solver": "dwave_sa", "mq_xi": 0.06687793579777104, "start":
[I 2026-09-28 17:02:55,960] Trial 1 finished with value: 0.0 and parameters: {'start': 'pgreedy', 'mq_solver': 'dwave_sa', 'mq_nmax': 1119, 'mq_reads': 4, 'mq_iters': 405, 'mq_dt': 1.1646313382487206, 'mq_xi': 0.06687793579777104, 'mq_pen': 0.001825525480239901, 'mq_q': 2, 'mq_ksamp': 7}. Best is trial 1 with value: 0.0.
[F2b_tau_rel0.6__mq__b10] trial 2: -0.00010 [0.0, -0.0001945517173993494] {"mq_dt": 0.6959964799137436, "mq_iters": 132, "mq_ksamp": 5, "mq_nmax": 565, "mq_pen": 0.05073432032394333, "mq_q": 2, "mq_reads": 8, "mq_solver": "mq_bsb", "mq_xi": 0.3236490137439119, "start": "pgr
[I 2026-09-28 17:03:18,608] Trial 2 finished with value: -9.72758586996747e-05 and parameters: {'start': 'pgreedy', 'mq_solver': 'mq_bsb', 'mq_nmax': 565, 'mq_reads': 8, 'mq_iters': 132, 'mq_dt': 0.6959964799137436, 'mq_xi': 0.3236490137439119, 'mq_pen': 0.05073432032394333, 'mq_q': 2, 'mq_ksamp': 5}. Best is trial 2 with value: -9.72758586996747e-05.
[F2b_tau_rel0.6__mq__b10] trial 3: -0.00019 [-0.00023832815857449674, -0.0001403575318478234] {"mq_dt": 0.17227208685390633, "mq_iters": 159, "mq_ksamp": 1, "mq_nmax": 117, "mq_pen": 0.02069209865653834, "mq_q": 31, "mq_reads": 8, "mq_solver": "mq_bsb", "mq_xi": 0.5162571798019395, "start": "p
[I 2026-09-28 17:03:41,151] Trial 3 finished with value: -0.00018934284521116007 and parameters: {'start': 'pgreedy', 'mq_solver': 'mq_bsb', 'mq_nmax': 117, 'mq_reads': 8, 'mq_iters': 159, 'mq_dt': 0.17227208685390633, 'mq_xi': 0.5162571798019395, 'mq_pen': 0.02069209865653834, 'mq_q': 31, 'mq_ksamp': 1}. Best is trial 3 with value: -0.00018934284521116007.
[F2b_tau_rel0.6__mq__b10] trial 4: -0.00004 [0.0, -8.276192617029388e-05] {"mq_dt": 0.10969086993596948, "mq_iters": 84, "mq_ksamp": 7, "mq_nmax": 159, "mq_pen": 0.0012022631938673073, "mq_q": 27, "mq_reads": 16, "mq_solver": "mq_bsb", "mq_xi": 1.111479412759992, "start": "
[I 2026-09-28 17:04:03,858] Trial 4 finished with value: -4.138096308514694e-05 and parameters: {'start': 'pgreedy', 'mq_solver': 'mq_bsb', 'mq_nmax': 159, 'mq_reads': 16, 'mq_iters': 84, 'mq_dt': 0.10969086993596948, 'mq_xi': 1.111479412759992, 'mq_pen': 0.0012022631938673073, 'mq_q': 27, 'mq_ksamp': 7}. Best is trial 3 with value: -0.00018934284521116007.
[F2b_tau_rel0.6__mq__b10] trial 5: -0.00004 [-1.589407488233885e-05, -6.736930699735577e-05] {"mq_dt": 0.97082874736767, "mq_iters": 121, "mq_ksamp": 1, "mq_nmax": 234, "mq_pen": 0.005467268720503918, "mq_q": 30, "mq_reads": 4, "mq_solver": "mq_bsb", "mq_xi": 1.0182128739641982, "start": "pgr
[I 2026-09-28 17:04:26,610] Trial 5 finished with value: -4.163169093984731e-05 and parameters: {'start': 'pgreedy', 'mq_solver': 'mq_bsb', 'mq_nmax': 234, 'mq_reads': 4, 'mq_iters': 121, 'mq_dt': 0.97082874736767, 'mq_xi': 1.0182128739641982, 'mq_pen': 0.005467268720503918, 'mq_q': 30, 'mq_ksamp': 1}. Best is trial 3 with value: -0.00018934284521116007.
[F2b_tau_rel0.6__mq__b10] trial 6: -0.00006 [-9.325195612697179e-06, -0.00011365958488773753] {"mq_dt": 0.07448044762885073, "mq_iters": 208, "mq_ksamp": 1, "mq_nmax": 116, "mq_pen": 0.012106718952367564, "mq_q": 6, "mq_reads": 8, "mq_solver": "mq_bsb", "mq_xi": 0.1024984864100098, "start": "p
[I 2026-09-28 17:04:49,324] Trial 6 finished with value: -6.149239025021735e-05 and parameters: {'start': 'pgreedy', 'mq_solver': 'mq_bsb', 'mq_nmax': 116, 'mq_reads': 8, 'mq_iters': 208, 'mq_dt': 0.07448044762885073, 'mq_xi': 0.1024984864100098, 'mq_pen': 0.012106718952367564, 'mq_q': 6, 'mq_ksamp': 1}. Best is trial 3 with value: -0.00018934284521116007.
[F2b_tau_rel0.6__mq__b10] trial 7: -0.00002 [-1.4819702041646288e-05, -2.012342378820975e-05] {"mq_dt": 0.834852499565282, "mq_iters": 463, "mq_ksamp": 3, "mq_nmax": 117, "mq_pen": 0.005184318833808465, "mq_q": 8, "mq_reads": 8, "mq_solver": "mq_bsb", "mq_xi": 0.10379277955913387, "start": "pg
[I 2026-09-28 17:05:11,950] Trial 7 finished with value: -1.7471562914928018e-05 and parameters: {'start': 'pgreedy', 'mq_solver': 'mq_bsb', 'mq_nmax': 117, 'mq_reads': 8, 'mq_iters': 463, 'mq_dt': 0.834852499565282, 'mq_xi': 0.10379277955913387, 'mq_pen': 0.005184318833808465, 'mq_q': 8, 'mq_ksamp': 3}. Best is trial 3 with value: -0.00018934284521116007.
[F2b_tau_rel0.6__mq__b10] trial 8: +0.00000 [0.0, 0.0] {"mq_dt": 0.1725975876714125, "mq_iters": 330, "mq_ksamp": 5, "mq_nmax": 142, "mq_pen": 0.011682909697246035, "mq_q": 28, "mq_reads": 8, "mq_solver": "mq_bsb", "mq_xi": 0.878574376927204, "start": "pg
[I 2026-09-28 17:05:34,687] Trial 8 finished with value: 0.0 and parameters: {'start': 'pgreedy', 'mq_solver': 'mq_bsb', 'mq_nmax': 142, 'mq_reads': 8, 'mq_iters': 330, 'mq_dt': 0.1725975876714125, 'mq_xi': 0.878574376927204, 'mq_pen': 0.011682909697246035, 'mq_q': 28, 'mq_ksamp': 5}. Best is trial 3 with value: -0.00018934284521116007.
[F2b_tau_rel0.6__mq__b10] trial 9: -0.00017 [-0.00021440494684243916, -0.0001165706953220047] {"mq_dt": 0.39691260063316103, "mq_iters": 141, "mq_ksamp": 8, "mq_nmax": 377, "mq_pen": 0.8432169904639403, "mq_q": 21, "mq_reads": 8, "mq_solver": "mq_bsb", "mq_xi": 1.139407416383334, "start": "pgr
[I 2026-09-28 17:05:57,224] Trial 9 finished with value: -0.00016548782108222193 and parameters: {'start': 'pgreedy', 'mq_solver': 'mq_bsb', 'mq_nmax': 377, 'mq_reads': 8, 'mq_iters': 141, 'mq_dt': 0.39691260063316103, 'mq_xi': 1.139407416383334, 'mq_pen': 0.8432169904639403, 'mq_q': 21, 'mq_ksamp': 8}. Best is trial 3 with value: -0.00018934284521116007.
[F2b_tau_rel0.6__mq__b10] BEST -0.00019 cfg={"mq_dt": 0.17227208685390633, "mq_iters": 159, "mq_ksamp": 1, "mq_nmax": 117, "mq_pen": 0.02069209865653834, "mq_q": 31, "mq_reads": 8, "mq_solver": "mq_bsb", "mq_xi": 0.5162571798019395, "start": "pgreedy"}
