[I 2026-09-28 16:28:38,161] A new study created in RDB with name: F2b_tau_rel0.6__ls__b10
[F2b_tau_rel0.6__ls__b10] trial 0: +0.00603 [0.006003137340540032, 0.006058631525951652] {"ls_T0": 0.002, "ls_T1": 1e-06, "ls_chains": 8, "ls_moves": 20000, "ls_restart_every": 0, "p_add": 0.2, "p_swap": 0.6, "start": "lp", "topw": 8}
[I 2026-09-28 16:29:01,294] Trial 0 finished with value: 0.006030884433245842 and parameters: {'start': 'lp', 'ls_T0': 0.002, 'ls_T1_ratio': 0.0005, 'ls_moves': 20000, 'p_add': 0.2, 'p_swap': 0.6, 'topw': 8, 'ls_restart_every': 0, 'ls_chains': 8}. Best is trial 0 with value: 0.006030884433245842.
[F2b_tau_rel0.6__ls__b10] trial 1: -0.00001 [0.0, -2.7965150532494043e-05] {"ls_T0": 0.0025766385746135885, "ls_T1": 3.895706556508577e-06, "ls_chains": 16, "ls_moves": 23860, "ls_restart_every": 0, "p_add": 0.32294705653332806, "p_swap": 0.38687290659310525, "start": "pgree
[I 2026-09-28 16:29:22,957] Trial 1 finished with value: -1.3982575266247022e-05 and parameters: {'start': 'pgreedy', 'ls_T0': 0.0025766385746135885, 'ls_T1_ratio': 0.0015119336467641006, 'ls_moves': 23860, 'p_add': 0.32294705653332806, 'p_swap': 0.38687290659310525, 'topw': 43, 'ls_restart_every': 0, 'ls_chains': 16}. Best is trial 1 with value: -1.3982575266247022e-05.
[F2b_tau_rel0.6__ls__b10] trial 2: -0.00126 [-0.0009866332464572025, -0.001534036971604369] {"ls_T0": 1.2046852412030316e-05, "ls_T1": 2.5784159078973507e-07, "ls_chains": 16, "ls_moves": 88230, "ls_restart_every": 2, "p_add": 0.4350060741234096, "p_swap": 0.5082588335547389, "start": "pgree
[I 2026-09-28 16:29:44,648] Trial 2 finished with value: -0.0012603351090307857 and parameters: {'start': 'pgreedy', 'ls_T0': 1.2046852412030316e-05, 'ls_T1_ratio': 0.021403233140986057, 'ls_moves': 88230, 'p_add': 0.4350060741234096, 'p_swap': 0.5082588335547389, 'topw': 30, 'ls_restart_every': 2, 'ls_chains': 16}. Best is trial 2 with value: -0.0012603351090307857.
[F2b_tau_rel0.6__ls__b10] trial 3: +0.00419 [0.004411971830246442, 0.003963101192193452] {"ls_T0": 0.00011434638743472202, "ls_T1": 1.42941128395717e-06, "ls_chains": 16, "ls_moves": 26898, "ls_restart_every": 5, "p_add": 0.28421697443432425, "p_swap": 0.20875197009702076, "start": "lp", 
[I 2026-09-28 16:30:06,428] Trial 3 finished with value: 0.004187536511219947 and parameters: {'start': 'lp', 'ls_T0': 0.00011434638743472202, 'ls_T1_ratio': 0.01250071223083625, 'ls_moves': 26898, 'p_add': 0.28421697443432425, 'p_swap': 0.20875197009702076, 'topw': 15, 'ls_restart_every': 5, 'ls_chains': 16}. Best is trial 2 with value: -0.0012603351090307857.
[F2b_tau_rel0.6__ls__b10] trial 4: -0.00139 [-0.0009727868524216365, -0.001811338023079312] {"ls_T0": 1.2218338087757811e-05, "ls_T1": 1.2362234394156396e-08, "ls_chains": 16, "ls_moves": 65395, "ls_restart_every": 2, "p_add": 0.08970270583120943, "p_swap": 0.8259353559696305, "start": "pgre
[I 2026-09-28 16:30:28,292] Trial 4 finished with value: -0.0013920624377504742 and parameters: {'start': 'pgreedy', 'ls_T0': 1.2218338087757811e-05, 'ls_T1_ratio': 0.0010117770768303393, 'ls_moves': 65395, 'p_add': 0.08970270583120943, 'p_swap': 0.8259353559696305, 'topw': 52, 'ls_restart_every': 2, 'ls_chains': 16}. Best is trial 4 with value: -0.0013920624377504742.
[F2b_tau_rel0.6__ls__b10] trial 5: -0.00080 [-0.00018647907263902308, -0.0014183068783701902] {"ls_T0": 0.009910049764216533, "ls_T1": 2.7477864387857466e-06, "ls_chains": 16, "ls_moves": 180500, "ls_restart_every": 2, "p_add": 0.12023894431332266, "p_swap": 0.7888312169833216, "start": "pgree
[I 2026-09-28 16:30:50,052] Trial 5 finished with value: -0.0008023929755046066 and parameters: {'start': 'pgreedy', 'ls_T0': 0.009910049764216533, 'ls_T1_ratio': 0.00027727271851928797, 'ls_moves': 180500, 'p_add': 0.12023894431332266, 'p_swap': 0.7888312169833216, 'topw': 34, 'ls_restart_every': 2, 'ls_chains': 16}. Best is trial 4 with value: -0.0013920624377504742.
[F2b_tau_rel0.6__ls__b10] trial 6: -0.00143 [-0.0009429067683054404, -0.0019257477755048047] {"ls_T0": 3.2220065042137596e-05, "ls_T1": 2.030806446101361e-09, "ls_chains": 16, "ls_moves": 42158, "ls_restart_every": 2, "p_add": 0.09878227236788217, "p_swap": 0.8274527914175818, "start": "pgree
[I 2026-09-28 16:31:11,631] Trial 6 finished with value: -0.0014343272719051225 and parameters: {'start': 'pgreedy', 'ls_T0': 3.2220065042137596e-05, 'ls_T1_ratio': 6.30292472546365e-05, 'ls_moves': 42158, 'p_add': 0.09878227236788217, 'p_swap': 0.8274527914175818, 'topw': 43, 'ls_restart_every': 2, 'ls_chains': 16}. Best is trial 6 with value: -0.0014343272719051225.
[F2b_tau_rel0.6__ls__b10] trial 7: -0.00123 [-0.0011154747601895831, -0.0013457596066511757] {"ls_T0": 0.0003848242761004573, "ls_T1": 7.839368476615419e-08, "ls_chains": 16, "ls_moves": 9617, "ls_restart_every": 2, "p_add": 0.14325636702277678, "p_swap": 0.21166217599631276, "start": "pgreed
[I 2026-09-28 16:31:33,261] Trial 7 finished with value: -0.0012306171834203794 and parameters: {'start': 'pgreedy', 'ls_T0': 0.0003848242761004573, 'ls_T1_ratio': 0.00020371294025559275, 'ls_moves': 9617, 'p_add': 0.14325636702277678, 'p_swap': 0.21166217599631276, 'topw': 4, 'ls_restart_every': 2, 'ls_chains': 16}. Best is trial 6 with value: -0.0014343272719051225.
[F2b_tau_rel0.6__ls__b10] trial 8: -0.00131 [-0.0011543723314620946, -0.0014656566809122529] {"ls_T0": 0.0001958766975831573, "ls_T1": 1.3933899731893475e-06, "ls_chains": 16, "ls_moves": 54464, "ls_restart_every": 2, "p_add": 0.10578534650269383, "p_swap": 0.6638381920724397, "start": "pgree
[I 2026-09-28 16:31:54,893] Trial 8 finished with value: -0.0013100145061871737 and parameters: {'start': 'pgreedy', 'ls_T0': 0.0001958766975831573, 'ls_T1_ratio': 0.007113607643899546, 'ls_moves': 54464, 'p_add': 0.10578534650269383, 'p_swap': 0.6638381920724397, 'topw': 7, 'ls_restart_every': 2, 'ls_chains': 16}. Best is trial 6 with value: -0.0014343272719051225.
[F2b_tau_rel0.6__ls__b10] trial 9: -0.00141 [-0.0011920554050405263, -0.0016347672153496084] {"ls_T0": 2.9111987182497216e-05, "ls_T1": 8.640890510506227e-10, "ls_chains": 16, "ls_moves": 61839, "ls_restart_every": 2, "p_add": 0.15725961632424748, "p_swap": 0.37142198850520264, "start": "pgre
[I 2026-09-28 16:32:16,590] Trial 9 finished with value: -0.0014134113101950674 and parameters: {'start': 'pgreedy', 'ls_T0': 2.9111987182497216e-05, 'ls_T1_ratio': 2.9681555080174417e-05, 'ls_moves': 61839, 'p_add': 0.15725961632424748, 'p_swap': 0.37142198850520264, 'topw': 17, 'ls_restart_every': 2, 'ls_chains': 16}. Best is trial 6 with value: -0.0014343272719051225.
[F2b_tau_rel0.6__ls__b10] BEST -0.00143 cfg={"ls_T0": 3.2220065042137596e-05, "ls_T1": 2.030806446101361e-09, "ls_chains": 16, "ls_moves": 42158, "ls_restart_every": 2, "p_add": 0.09878227236788217, "p_swap": 0.8274527914175818, "start": "pgreedy", "topw": 43}
[I 2026-09-28 16:32:16,626] A new study created in RDB with name: F2b_tau_rel0.6__eim__b10
[F2b_tau_rel0.6__eim__b10] trial 0: +0.00220 [0.0027032421393078376, 0.0017001737818433948] {"eim_R": 16, "eim_Tmax": 0.003, "eim_Tmin": 1e-06, "eim_anneal": 0.0, "eim_eta": 1.0, "eim_hscale": 10.0, "eim_moves": 20000, "eim_rho": 50.0, "p_add": 0.2, "p_swap": 0.6, "start": "lp", "topw": 8}
[I 2026-09-28 16:32:38,501] Trial 0 finished with value: 0.0022017079605756162 and parameters: {'start': 'lp', 'eim_R': 16, 'eim_Tmin': 1e-06, 'eim_Tratio': 3000.0, 'eim_moves': 20000, 'p_add': 0.2, 'p_swap': 0.6, 'topw': 8, 'eim_rho': 50.0, 'eim_hscale': 10.0, 'eim_anneal': 0.0, 'eim_eta': 1.0}. Best is trial 0 with value: 0.0022017079605756162.
[F2b_tau_rel0.6__eim__b10] trial 1: -0.00104 [-0.0003819686466007832, -0.0016880357692952153] {"eim_R": 64, "eim_Tmax": 0.022388264096178515, "eim_Tmin": 5.6279320474151646e-06, "eim_anneal": 0.07032569761590807, "eim_eta": 0.018255254802399014, "eim_hscale": 59.812219011525556, "eim_moves": 1
[I 2026-09-28 16:33:01,022] Trial 1 finished with value: -0.0010350022079479992 and parameters: {'start': 'pgreedy', 'eim_R': 64, 'eim_Tmin': 5.6279320474151646e-06, 'eim_Tratio': 3978.0622629338873, 'eim_moves': 174910, 'p_add': 0.19172075941288885, 'p_swap': 0.6420036530145916, 'topw': 11, 'eim_rho': 18.71450068624066, 'eim_hscale': 59.812219011525556, 'eim_anneal': 0.07032569761590807, 'eim_eta': 0.018255254802399014}. Best is trial 1 with value: -0.0010350022079479992.
[F2b_tau_rel0.6__eim__b10] trial 2: -0.00001 [-1.1106096369450924e-05, -1.7177616634334036e-05] {"eim_R": 32, "eim_Tmax": 0.01081686613933192, "eim_Tmin": 7.013219779945795e-06, "eim_anneal": 0.2619100559835807, "eim_eta": 2.102330874348012, "eim_hscale": 1.7538232373118046, "eim_moves": 7734, "
[I 2026-09-28 16:33:22,793] Trial 2 finished with value: -1.414185650189248e-05 and parameters: {'start': 'pgreedy', 'eim_R': 32, 'eim_Tmin': 7.013219779945795e-06, 'eim_Tratio': 1542.3537945099908, 'eim_moves': 7734, 'p_add': 0.3199605106637619, 'p_swap': 0.2616475745120573, 'topw': 52, 'eim_rho': 12.229065947034353, 'eim_hscale': 1.7538232373118046, 'eim_anneal': 0.2619100559835807, 'eim_eta': 2.102330874348012}. Best is trial 1 with value: -0.0010350022079479992.
[F2b_tau_rel0.6__eim__b10] trial 3: +0.00000 [-1.4708875156643764e-05, 2.0515495333217615e-05] {"eim_R": 16, "eim_Tmax": 0.3963283547730436, "eim_Tmin": 0.0005956516018710562, "eim_anneal": 0.2082787354631025, "eim_eta": 0.024365700014642007, "eim_hscale": 10.278118224157009, "eim_moves": 18832
[I 2026-09-28 16:33:44,603] Trial 3 finished with value: 2.9033100882869256e-06 and parameters: {'start': 'pgreedy', 'eim_R': 16, 'eim_Tmin': 0.0005956516018710562, 'eim_Tratio': 665.369409782665, 'eim_moves': 18832, 'p_add': 0.21851597689967073, 'p_swap': 0.5707798346517168, 'topw': 2, 'eim_rho': 46.458679515124714, 'eim_hscale': 10.278118224157009, 'eim_anneal': 0.2082787354631025, 'eim_eta': 0.024365700014642007}. Best is trial 1 with value: -0.0010350022079479992.
[F2b_tau_rel0.6__eim__b10] trial 4: -0.00001 [-1.952455646048179e-05, -3.023826983250544e-07] {"eim_R": 64, "eim_Tmax": 0.001497337128544553, "eim_Tmin": 1.0014489211897886e-05, "eim_anneal": 0.5041849562408753, "eim_eta": 0.11816610545739868, "eim_hscale": 7.691131563896037, "eim_moves": 7158
[I 2026-09-28 16:34:06,714] Trial 4 finished with value: -9.913469579403422e-06 and parameters: {'start': 'pgreedy', 'eim_R': 64, 'eim_Tmin': 1.0014489211897886e-05, 'eim_Tratio': 149.51707439712612, 'eim_moves': 71580, 'p_add': 0.4361182296415085, 'p_swap': 0.3535977674963949, 'topw': 16, 'eim_rho': 1.517527323680054, 'eim_hscale': 7.691131563896037, 'eim_anneal': 0.5041849562408753, 'eim_eta': 0.11816610545739868}. Best is trial 1 with value: -0.0010350022079479992.
[F2b_tau_rel0.6__eim__b10] trial 5: -0.00082 [-0.0015599451865884184, -7.335962845522737e-05] {"eim_R": 64, "eim_Tmax": 0.0068739603774064986, "eim_Tmin": 9.908093988002197e-07, "eim_anneal": 0.9821209109995948, "eim_eta": 0.25087478372538863, "eim_hscale": 5.717946231165683, "eim_moves": 1027
[I 2026-09-28 16:34:28,653] Trial 5 finished with value: -0.0008166524075218229 and parameters: {'start': 'pgreedy', 'eim_R': 64, 'eim_Tmin': 9.908093988002197e-07, 'eim_Tratio': 6937.722215524238, 'eim_moves': 102727, 'p_add': 0.17954246338043298, 'p_swap': 0.7580912491721993, 'topw': 16, 'eim_rho': 606.5531721590852, 'eim_hscale': 5.717946231165683, 'eim_anneal': 0.9821209109995948, 'eim_eta': 0.25087478372538863}. Best is trial 1 with value: -0.0010350022079479992.
[F2b_tau_rel0.6__eim__b10] trial 6: -0.00004 [-5.2629921938329716e-05, -1.771007840112304e-05] {"eim_R": 64, "eim_Tmax": 0.0034017222810574796, "eim_Tmin": 0.000502708097584304, "eim_anneal": 0.8268876083441974, "eim_eta": 0.013454261930659244, "eim_hscale": 63.15990016986602, "eim_moves": 2236
[I 2026-09-28 16:34:50,597] Trial 6 finished with value: -3.517000016972638e-05 and parameters: {'start': 'pgreedy', 'eim_R': 64, 'eim_Tmin': 0.000502708097584304, 'eim_Tratio': 6.766794283609112, 'eim_moves': 22365, 'p_add': 0.0512206276156186, 'p_swap': 0.8527044109131574, 'topw': 11, 'eim_rho': 0.39386743254121004, 'eim_hscale': 63.15990016986602, 'eim_anneal': 0.8268876083441974, 'eim_eta': 0.013454261930659244}. Best is trial 1 with value: -0.0010350022079479992.
[F2b_tau_rel0.6__eim__b10] trial 7: -0.00002 [-2.249795660103082e-06, -3.753784009286054e-05] {"eim_R": 64, "eim_Tmax": 0.011146422860442984, "eim_Tmin": 1.2201535047944312e-06, "eim_anneal": 0.02111126779401539, "eim_eta": 8.541423309062068, "eim_hscale": 0.12083058229767994, "eim_moves": 195
[I 2026-09-28 16:35:12,629] Trial 7 finished with value: -1.9893817876481812e-05 and parameters: {'start': 'pgreedy', 'eim_R': 64, 'eim_Tmin': 1.2201535047944312e-06, 'eim_Tratio': 9135.262749026737, 'eim_moves': 195394, 'p_add': 0.20251616215560778, 'p_swap': 0.4515795316089084, 'topw': 2, 'eim_rho': 21.44563115301461, 'eim_hscale': 0.12083058229767994, 'eim_anneal': 0.02111126779401539, 'eim_eta': 8.541423309062068}. Best is trial 1 with value: -0.0010350022079479992.
[F2b_tau_rel0.6__eim__b10] trial 8: -0.00012 [-8.144546997868041e-05, -0.00016121223219300873] {"eim_R": 64, "eim_Tmax": 0.00213533126201478, "eim_Tmin": 1.8630225374299144e-06, "eim_anneal": 0.5753183670262931, "eim_eta": 0.01200880730266928, "eim_hscale": 88.30611353681545, "eim_moves": 12327
[I 2026-09-28 16:35:34,374] Trial 8 finished with value: -0.00012132885108584457 and parameters: {'start': 'pgreedy', 'eim_R': 64, 'eim_Tmin': 1.8630225374299144e-06, 'eim_Tratio': 1146.1650190021437, 'eim_moves': 12327, 'p_add': 0.38867096274621826, 'p_swap': 0.21719153456909268, 'topw': 38, 'eim_rho': 1.2055893312867594, 'eim_hscale': 88.30611353681545, 'eim_anneal': 0.5753183670262931, 'eim_eta': 0.01200880730266928}. Best is trial 1 with value: -0.0010350022079479992.
[F2b_tau_rel0.6__eim__b10] trial 9: -0.00000 [-5.442782466946738e-07, -8.46580521074447e-06] {"eim_R": 64, "eim_Tmax": 0.006859037653584145, "eim_Tmin": 0.00033290292469221905, "eim_anneal": 0.8586796428816786, "eim_eta": 3.662396836840411, "eim_hscale": 6.816384595663995, "eim_moves": 17085,
[I 2026-09-28 16:35:56,233] Trial 9 finished with value: -4.505041728719572e-06 and parameters: {'start': 'pgreedy', 'eim_R': 64, 'eim_Tmin': 0.00033290292469221905, 'eim_Tratio': 20.60371701427849, 'eim_moves': 17085, 'p_add': 0.22532214597356157, 'p_swap': 0.48138217174388886, 'topw': 13, 'eim_rho': 61.777646903165234, 'eim_hscale': 6.816384595663995, 'eim_anneal': 0.8586796428816786, 'eim_eta': 3.662396836840411}. Best is trial 1 with value: -0.0010350022079479992.
[F2b_tau_rel0.6__eim__b10] BEST -0.00104 cfg={"eim_R": 64, "eim_Tmax": 0.022388264096178515, "eim_Tmin": 5.6279320474151646e-06, "eim_anneal": 0.07032569761590807, "eim_eta": 0.018255254802399014, "eim_hscale": 59.812219011525556, "eim_moves": 174910, "eim_rho": 18.71450068624066, "p_add": 0.19172075941288885, "p_swap": 0.6420036530145916, "start": "pgreedy", "topw": 11}
[I 2026-09-28 16:35:56,266] A new study created in RDB with name: F2b_tau_rel0.6__milp__b10
[F2b_tau_rel0.6__milp__b10] trial 0: +1.00000 [1.0, 1.0] {"J": 12, "eps_tie": 0.0, "mip_heuristic_effort": 0.05, "presolve": "on", "start": "lp"}
[I 2026-09-28 16:36:47,496] Trial 0 finished with value: 1.0 and parameters: {'start': 'lp', 'presolve': 'on', 'mip_heuristic_effort': 0.05, 'eps_tie': 0.0, 'J': 12}. Best is trial 0 with value: 1.0.
[F2b_tau_rel0.6__milp__b10] trial 1: +1.00000 [1.0, 1.0] {"J": 12, "eps_tie": 0.0, "mip_heuristic_effort": 0.10490756141474163, "presolve": "on", "start": "pgreedy"}
[I 2026-09-28 16:37:35,384] Trial 1 finished with value: 1.0 and parameters: {'start': 'pgreedy', 'presolve': 'on', 'mip_heuristic_effort': 0.10490756141474163, 'eps_tie': 0.0, 'J': 12}. Best is trial 0 with value: 1.0.
[F2b_tau_rel0.6__milp__b10] trial 2: -0.00012 [-7.926826872317605e-05, -0.00015811517339892056] {"J": 24, "eps_tie": 0.0, "mip_heuristic_effort": 0.026406942985185436, "presolve": "off", "start": "lp"}
[I 2026-09-28 16:37:56,217] Trial 2 finished with value: -0.0001186917210610483 and parameters: {'start': 'lp', 'presolve': 'off', 'mip_heuristic_effort': 0.026406942985185436, 'eps_tie': 0.0, 'J': 24}. Best is trial 2 with value: -0.0001186917210610483.
[F2b_tau_rel0.6__milp__b10] trial 3: +0.17407 [0.13033628375329886, 0.2178089283040141] {"J": 6, "eps_tie": 0.0, "mip_heuristic_effort": 0.03176688987641123, "presolve": "off", "start": "lp"}
[I 2026-09-28 16:38:17,183] Trial 3 finished with value: 0.17407260602865648 and parameters: {'start': 'lp', 'presolve': 'off', 'mip_heuristic_effort': 0.03176688987641123, 'eps_tie': 0.0, 'J': 6}. Best is trial 2 with value: -0.0001186917210610483.
[F2b_tau_rel0.6__milp__b10] trial 4: -0.00019 [-8.001174674199252e-05, -0.0003063035389161417] {"J": 24, "eps_tie": 0.0, "mip_heuristic_effort": 0.14664848775807998, "presolve": "off", "start": "lp"}
[I 2026-09-28 16:38:38,202] Trial 4 finished with value: -0.0001931576428290671 and parameters: {'start': 'lp', 'presolve': 'off', 'mip_heuristic_effort': 0.14664848775807998, 'eps_tie': 0.0, 'J': 24}. Best is trial 4 with value: -0.0001931576428290671.
[F2b_tau_rel0.6__milp__b10] trial 5: -0.00012 [-8.001174674199252e-05, -0.00015811517339892056] {"J": 24, "eps_tie": 0.0, "mip_heuristic_effort": 0.889461285781544, "presolve": "off", "start": "lp"}
[I 2026-09-28 16:38:59,182] Trial 5 finished with value: -0.00011906346007045654 and parameters: {'start': 'lp', 'presolve': 'off', 'mip_heuristic_effort': 0.889461285781544, 'eps_tie': 0.0, 'J': 24}. Best is trial 4 with value: -0.0001931576428290671.
[F2b_tau_rel0.6__milp__b10] trial 6: +0.13015 [0.11352008120090629, 0.14678285453152617] {"J": 6, "eps_tie": 0.0001, "mip_heuristic_effort": 0.8969168383552246, "presolve": "off", "start": "lp"}
[I 2026-09-28 16:39:20,148] Trial 6 finished with value: 0.13015146786621623 and parameters: {'start': 'lp', 'presolve': 'off', 'mip_heuristic_effort': 0.8969168383552246, 'eps_tie': 0.0001, 'J': 6}. Best is trial 4 with value: -0.0001931576428290671.
[F2b_tau_rel0.6__milp__b10] trial 7: +1.00000 [1.0, 1.0] {"J": 24, "eps_tie": 0.0001, "mip_heuristic_effort": 0.14471663551217087, "presolve": "on", "start": "lp"}
[I 2026-09-28 16:40:11,417] Trial 7 finished with value: 1.0 and parameters: {'start': 'lp', 'presolve': 'on', 'mip_heuristic_effort': 0.14471663551217087, 'eps_tie': 0.0001, 'J': 24}. Best is trial 4 with value: -0.0001931576428290671.
[F2b_tau_rel0.6__milp__b10] trial 8: +0.00000 [0.0, 0.0] {"J": 24, "eps_tie": 0.0001, "mip_heuristic_effort": 0.15242782316965175, "presolve": "off", "start": "pgreedy"}
[I 2026-09-28 16:40:32,316] Trial 8 finished with value: 0.0 and parameters: {'start': 'pgreedy', 'presolve': 'off', 'mip_heuristic_effort': 0.15242782316965175, 'eps_tie': 0.0001, 'J': 24}. Best is trial 4 with value: -0.0001931576428290671.
[F2b_tau_rel0.6__milp__b10] trial 9: +1.00000 [1.0, 1.0] {"J": 12, "eps_tie": 0.0, "mip_heuristic_effort": 0.6146339667918979, "presolve": "on", "start": "lp"}
[I 2026-09-28 16:41:22,707] Trial 9 finished with value: 1.0 and parameters: {'start': 'lp', 'presolve': 'on', 'mip_heuristic_effort': 0.6146339667918979, 'eps_tie': 0.0, 'J': 12}. Best is trial 4 with value: -0.0001931576428290671.
[F2b_tau_rel0.6__milp__b10] BEST -0.00019 cfg={"J": 24, "eps_tie": 0.0, "mip_heuristic_effort": 0.14664848775807998, "presolve": "off", "start": "lp"}
[I 2026-09-28 16:41:22,741] A new study created in RDB with name: F2b_tau_rel0.6__pt__b10
[F2b_tau_rel0.6__pt__b10] trial 0: +0.00595 [0.005968078991888115, 0.005922966864959411] {"eim_R": 16, "eim_Tmax": 0.003, "eim_Tmin": 1e-06, "eim_anneal": 0.0, "eim_hscale": 10.0, "eim_moves": 20000, "eim_rho": 50.0, "p_add": 0.2, "p_swap": 0.6, "start": "lp", "topw": 8}
[I 2026-09-28 16:41:44,558] Trial 0 finished with value: 0.005945522928423763 and parameters: {'start': 'lp', 'eim_R': 16, 'eim_Tmin': 1e-06, 'eim_Tratio': 3000.0, 'eim_moves': 20000, 'p_add': 0.2, 'p_swap': 0.6, 'topw': 8, 'eim_rho': 50.0, 'eim_hscale': 10.0, 'eim_anneal': 0.0}. Best is trial 0 with value: 0.005945522928423763.
[F2b_tau_rel0.6__pt__b10] trial 1: -0.00073 [-0.0002035050156458107, -0.0012498067226222043] {"eim_R": 64, "eim_Tmax": 0.022388264096178515, "eim_Tmin": 5.6279320474151646e-06, "eim_anneal": 0.07032569761590807, "eim_hscale": 59.812219011525556, "eim_moves": 174910, "eim_rho": 18.714500686240
[I 2026-09-28 16:42:06,565] Trial 1 finished with value: -0.0007266558691340075 and parameters: {'start': 'pgreedy', 'eim_R': 64, 'eim_Tmin': 5.6279320474151646e-06, 'eim_Tratio': 3978.0622629338873, 'eim_moves': 174910, 'p_add': 0.19172075941288885, 'p_swap': 0.6420036530145916, 'topw': 11, 'eim_rho': 18.71450068624066, 'eim_hscale': 59.812219011525556, 'eim_anneal': 0.07032569761590807}. Best is trial 1 with value: -0.0007266558691340075.
[F2b_tau_rel0.6__pt__b10] trial 2: +0.00601 [0.005965057803342333, 0.006059121359323738] {"eim_R": 64, "eim_Tmax": 0.01602000219024075, "eim_Tmin": 0.000157265788541795, "eim_anneal": 0.41051532059061835, "eim_hscale": 3.6774346621052136, "eim_moves": 89005, "eim_rho": 600.7249475906196, 
[I 2026-09-28 16:42:28,441] Trial 2 finished with value: 0.0060120895813330355 and parameters: {'start': 'lp', 'eim_R': 64, 'eim_Tmin': 0.000157265788541795, 'eim_Tratio': 101.86577982905207, 'eim_moves': 89005, 'p_add': 0.05913721293446661, 'p_swap': 0.6420976202961557, 'topw': 3, 'eim_rho': 600.7249475906196, 'eim_hscale': 3.6774346621052136, 'eim_anneal': 0.41051532059061835}. Best is trial 1 with value: -0.0007266558691340075.
[F2b_tau_rel0.6__pt__b10] trial 3: -0.00002 [-7.219799808777516e-06, -2.708016584040962e-05] {"eim_R": 64, "eim_Tmax": 0.010750613178666423, "eim_Tmin": 2.8079081078857258e-05, "eim_anneal": 0.660099048291211, "eim_hscale": 0.1515920461138471, "eim_moves": 162521, "eim_rho": 61.73405204074311
