[I 2026-09-28 17:32:39,877] Trial 2 finished with value: 0.0 and parameters: {'start': 'pgreedy', 'sb_agents': 8, 'sb_steps': 77, 'sb_dt': 1.031897327725781, 'sb_variant': 'discrete', 'sb_heat': 0.040973773756855375, 'sb_xi': 0.14770319740236926, 'sb_warm': 0.7355220049625057, 'sb_eta_mu': 0.23358825194833557, 'sb_alpha_floor': 0.1136867897737297, 'sb_tau_frac': 0.9018789800436355, 'sb_eta': 0.8594903371659688}. Best is trial 0 with value: -0.13022421961205416.
[F1__sb__b10] trial 3: +0.00000 [0.0, 0.0] {"sb_agents": 8, "sb_alpha_floor": 0.08772030269246407, "sb_dt": 0.2782931131180508, "sb_eta": 0.07999440746315747, "sb_eta_mu": 0.513558960650023, "sb_heat": 0.015503857733727292, "sb_steps": 654, "s
[I 2026-09-28 17:33:04,257] Trial 3 finished with value: 0.0 and parameters: {'start': 'pgreedy', 'sb_agents': 8, 'sb_steps': 654, 'sb_dt': 0.2782931131180508, 'sb_variant': 'discrete', 'sb_heat': 0.015503857733727292, 'sb_xi': 0.18190696204307705, 'sb_warm': 0.3455252323954915, 'sb_eta_mu': 0.513558960650023, 'sb_alpha_floor': 0.08772030269246407, 'sb_tau_frac': 0.9988373838059226, 'sb_eta': 0.07999440746315747}. Best is trial 0 with value: -0.13022421961205416.
[F1__sb__b10] trial 4: -0.13191 [-0.11125100604353466, -0.1525759081060809] {"sb_agents": 32, "sb_alpha_floor": 0.12790764691351628, "sb_dt": 0.9781366314927988, "sb_eta": 1.1053939319688928, "sb_eta_mu": 6.38817009093146, "sb_heat": 0.06306448033812095, "sb_steps": 361, "sb_
[I 2026-09-28 17:33:28,840] Trial 4 finished with value: -0.13191345707480778 and parameters: {'start': 'lp', 'sb_agents': 32, 'sb_steps': 361, 'sb_dt': 0.9781366314927988, 'sb_variant': 'ballistic', 'sb_heat': 0.06306448033812095, 'sb_xi': 0.31896357793988156, 'sb_warm': 0.24073122565136285, 'sb_eta_mu': 6.38817009093146, 'sb_alpha_floor': 0.12790764691351628, 'sb_tau_frac': 0.9592088870691005, 'sb_eta': 1.1053939319688928}. Best is trial 4 with value: -0.13191345707480778.
[F1__sb__b10] trial 5: +0.42371 [1.0, -0.15257590810608057] {"sb_agents": 32, "sb_alpha_floor": 0.19780234417617237, "sb_dt": 0.6436723047760182, "sb_eta": 3.814570612061276, "sb_eta_mu": 0.08241374531341575, "sb_heat": 0.011530597063250929, "sb_steps": 626, "
[I 2026-09-28 17:33:54,138] Trial 5 finished with value: 0.4237120459469597 and parameters: {'start': 'lp', 'sb_agents': 32, 'sb_steps': 626, 'sb_dt': 0.6436723047760182, 'sb_variant': 'ballistic', 'sb_heat': 0.011530597063250929, 'sb_xi': 0.25081528474748704, 'sb_warm': 0.2612112560393884, 'sb_eta_mu': 0.08241374531341575, 'sb_alpha_floor': 0.19780234417617237, 'sb_tau_frac': 0.9914161811132042, 'sb_eta': 3.814570612061276}. Best is trial 4 with value: -0.13191345707480778.
[F1__sb__b10] trial 6: -0.13217 [-0.11176238150765905, -0.15257590810608057] {"sb_agents": 32, "sb_alpha_floor": 0.19397546899179888, "sb_dt": 1.4232321618458184, "sb_eta": 0.0965605178058406, "sb_eta_mu": 4.719399631690194, "sb_heat": 0.0125536250820598, "sb_steps": 1432, "sb
[I 2026-09-28 17:34:19,089] Trial 6 finished with value: -0.1321691448068698 and parameters: {'start': 'lp', 'sb_agents': 32, 'sb_steps': 1432, 'sb_dt': 1.4232321618458184, 'sb_variant': 'ballistic', 'sb_heat': 0.0125536250820598, 'sb_xi': 0.07953090488826875, 'sb_warm': 0.10136029824871645, 'sb_eta_mu': 4.719399631690194, 'sb_alpha_floor': 0.19397546899179888, 'sb_tau_frac': 0.9386113363824448, 'sb_eta': 0.0965605178058406}. Best is trial 6 with value: -0.1321691448068698.
[F1__sb__b10] trial 7: -0.13091 [-0.10908100179967295, -0.15274688254860602] {"sb_agents": 32, "sb_alpha_floor": 0.10495505384946222, "sb_dt": 0.2160066056566079, "sb_eta": 1.2217235389541414, "sb_eta_mu": 0.1904447617876336, "sb_heat": 0.02663989797176289, "sb_steps": 507, "s
[I 2026-09-28 17:34:43,189] Trial 7 finished with value: -0.13091394217413949 and parameters: {'start': 'lp', 'sb_agents': 32, 'sb_steps': 507, 'sb_dt': 0.2160066056566079, 'sb_variant': 'ballistic', 'sb_heat': 0.02663989797176289, 'sb_xi': 0.0787719113682172, 'sb_warm': 0.7669725518987822, 'sb_eta_mu': 0.1904447617876336, 'sb_alpha_floor': 0.10495505384946222, 'sb_tau_frac': 0.942607649775167, 'sb_eta': 1.2217235389541414}. Best is trial 6 with value: -0.1321691448068698.
[F1__sb__b10] trial 8: -0.13147 [-0.11036723108979618, -0.1525759081060809] {"sb_agents": 32, "sb_alpha_floor": 0.16222436059873674, "sb_dt": 1.1147401893109368, "sb_eta": 3.818519028925482, "sb_eta_mu": 0.03309945815403003, "sb_heat": 0.014737208286711916, "sb_steps": 707, "
[I 2026-09-28 17:35:07,330] Trial 8 finished with value: -0.13147156959793854 and parameters: {'start': 'lp', 'sb_agents': 32, 'sb_steps': 707, 'sb_dt': 1.1147401893109368, 'sb_variant': 'ballistic', 'sb_heat': 0.014737208286711916, 'sb_xi': 1.7943789966474426, 'sb_warm': 0.5132551063363158, 'sb_eta_mu': 0.03309945815403003, 'sb_alpha_floor': 0.16222436059873674, 'sb_tau_frac': 0.9337928836995604, 'sb_eta': 3.818519028925482}. Best is trial 6 with value: -0.1321691448068698.
[F1__sb__b10] trial 9: -0.13101 [-0.10944225071959979, -0.1525759081060809] {"sb_agents": 32, "sb_alpha_floor": 0.12937050425834662, "sb_dt": 0.5105651450466572, "sb_eta": 0.16449703914336528, "sb_eta_mu": 0.22309198379998565, "sb_heat": 0.018437433346967267, "sb_steps": 1871
[I 2026-09-28 17:35:31,503] Trial 9 finished with value: -0.13100907941284035 and parameters: {'start': 'lp', 'sb_agents': 32, 'sb_steps': 1871, 'sb_dt': 0.5105651450466572, 'sb_variant': 'ballistic', 'sb_heat': 0.018437433346967267, 'sb_xi': 2.0307216047275527, 'sb_warm': 0.2606713043127498, 'sb_eta_mu': 0.22309198379998565, 'sb_alpha_floor': 0.12937050425834662, 'sb_tau_frac': 0.9470181330689641, 'sb_eta': 0.16449703914336528}. Best is trial 6 with value: -0.1321691448068698.
[F1__sb__b10] BEST -0.13217 cfg={"sb_agents": 32, "sb_alpha_floor": 0.19397546899179888, "sb_dt": 1.4232321618458184, "sb_eta": 0.0965605178058406, "sb_eta_mu": 4.719399631690194, "sb_heat": 0.0125536250820598, "sb_steps": 1432, "sb_tau_frac": 0.9386113363824448, "sb_variant": "ballistic", "sb_warm": 0.10136029824871645, "sb_xi": 0.07953090488826875, "start": "lp"}
[I 2026-09-28 17:35:31,535] A new study created in RDB with name: F1__mq__b10
[F1__mq__b10] trial 0: -0.13788 [-0.11274451777810846, -0.16302413094823587] {"mq_dt": 1.0, "mq_iters": 300, "mq_ksamp": 4, "mq_nmax": 800, "mq_pen": 0.05, "mq_q": 6, "mq_reads": 16, "mq_solver": "mq_dsb", "mq_xi": 0.5, "start": "lp"}
[I 2026-09-28 17:35:54,249] Trial 0 finished with value: -0.13788432436317216 and parameters: {'start': 'lp', 'mq_solver': 'mq_dsb', 'mq_nmax': 800, 'mq_reads': 16, 'mq_iters': 300, 'mq_dt': 1.0, 'mq_xi': 0.5, 'mq_pen': 0.05, 'mq_q': 6, 'mq_ksamp': 4}. Best is trial 0 with value: -0.13788432436317216.
[F1__mq__b10] trial 1: -0.02839 [-0.020889373868927863, -0.03588070843342095] {"mq_dt": 1.1646313382487206, "mq_iters": 405, "mq_ksamp": 7, "mq_nmax": 1119, "mq_pen": 0.001825525480239901, "mq_q": 2, "mq_reads": 4, "mq_solver": "dwave_sa", "mq_xi": 0.06687793579777104, "start":
[I 2026-09-28 17:36:16,001] Trial 1 finished with value: -0.028385041151174406 and parameters: {'start': 'pgreedy', 'mq_solver': 'dwave_sa', 'mq_nmax': 1119, 'mq_reads': 4, 'mq_iters': 405, 'mq_dt': 1.1646313382487206, 'mq_xi': 0.06687793579777104, 'mq_pen': 0.001825525480239901, 'mq_q': 2, 'mq_ksamp': 7}. Best is trial 0 with value: -0.13788432436317216.
[F1__mq__b10] trial 2: -0.04075 [-0.05102072388760048, -0.03047966007836178] {"mq_dt": 0.6959964799137436, "mq_iters": 132, "mq_ksamp": 5, "mq_nmax": 565, "mq_pen": 0.05073432032394333, "mq_q": 2, "mq_reads": 8, "mq_solver": "mq_bsb", "mq_xi": 0.3236490137439119, "start": "pgr
[I 2026-09-28 17:36:38,468] Trial 2 finished with value: -0.04075019198298113 and parameters: {'start': 'pgreedy', 'mq_solver': 'mq_bsb', 'mq_nmax': 565, 'mq_reads': 8, 'mq_iters': 132, 'mq_dt': 0.6959964799137436, 'mq_xi': 0.3236490137439119, 'mq_pen': 0.05073432032394333, 'mq_q': 2, 'mq_ksamp': 5}. Best is trial 0 with value: -0.13788432436317216.
[F1__mq__b10] trial 3: -0.06074 [-0.048062869127241115, -0.07341645543298281] {"mq_dt": 0.17227208685390633, "mq_iters": 159, "mq_ksamp": 1, "mq_nmax": 117, "mq_pen": 0.02069209865653834, "mq_q": 31, "mq_reads": 8, "mq_solver": "mq_bsb", "mq_xi": 0.5162571798019395, "start": "p
[I 2026-09-28 17:37:00,839] Trial 3 finished with value: -0.06073966228011196 and parameters: {'start': 'pgreedy', 'mq_solver': 'mq_bsb', 'mq_nmax': 117, 'mq_reads': 8, 'mq_iters': 159, 'mq_dt': 0.17227208685390633, 'mq_xi': 0.5162571798019395, 'mq_pen': 0.02069209865653834, 'mq_q': 31, 'mq_ksamp': 1}. Best is trial 0 with value: -0.13788432436317216.
[F1__mq__b10] trial 4: -0.13648 [-0.11435677200312011, -0.15860778805727838] {"mq_dt": 0.6127962401986928, "mq_iters": 392, "mq_ksamp": 6, "mq_nmax": 1274, "mq_pen": 0.045791260232899984, "mq_q": 7, "mq_reads": 16, "mq_solver": "mq_dsb", "mq_xi": 0.507938059290821, "start": "l
[I 2026-09-28 17:37:23,462] Trial 4 finished with value: -0.13648228003019924 and parameters: {'start': 'lp', 'mq_solver': 'mq_dsb', 'mq_nmax': 1274, 'mq_reads': 16, 'mq_iters': 392, 'mq_dt': 0.6127962401986928, 'mq_xi': 0.507938059290821, 'mq_pen': 0.045791260232899984, 'mq_q': 7, 'mq_ksamp': 6}. Best is trial 0 with value: -0.13788432436317216.
[F1__mq__b10] trial 5: -0.13443 [-0.10975454051567046, -0.1591090845265144] {"mq_dt": 1.0556925918889197, "mq_iters": 468, "mq_ksamp": 1, "mq_nmax": 508, "mq_pen": 0.00869796099948597, "mq_q": 2, "mq_reads": 16, "mq_solver": "mq_dsb", "mq_xi": 0.16673484888184587, "start": "l
[I 2026-09-28 17:37:45,943] Trial 5 finished with value: -0.13443181252109243 and parameters: {'start': 'lp', 'mq_solver': 'mq_dsb', 'mq_nmax': 508, 'mq_reads': 16, 'mq_iters': 468, 'mq_dt': 1.0556925918889197, 'mq_xi': 0.16673484888184587, 'mq_pen': 0.00869796099948597, 'mq_q': 2, 'mq_ksamp': 1}. Best is trial 0 with value: -0.13788432436317216.
[F1__mq__b10] trial 6: -0.13354 [-0.11360569621313965, -0.1534815360272358] {"mq_dt": 1.3970660253002645, "mq_iters": 1072, "mq_ksamp": 5, "mq_nmax": 191, "mq_pen": 0.17189342528042645, "mq_q": 9, "mq_reads": 16, "mq_solver": "mq_dsb", "mq_xi": 2.555158124901922, "start": "lp
[I 2026-09-28 17:38:08,573] Trial 6 finished with value: -0.13354361612018772 and parameters: {'start': 'lp', 'mq_solver': 'mq_dsb', 'mq_nmax': 191, 'mq_reads': 16, 'mq_iters': 1072, 'mq_dt': 1.3970660253002645, 'mq_xi': 2.555158124901922, 'mq_pen': 0.17189342528042645, 'mq_q': 9, 'mq_ksamp': 5}. Best is trial 0 with value: -0.13788432436317216.
[F1__mq__b10] trial 7: -0.13891 [-0.1161434477221791, -0.16167757678384542] {"mq_dt": 0.06526542706084622, "mq_iters": 910, "mq_ksamp": 7, "mq_nmax": 514, "mq_pen": 0.001344312143528808, "mq_q": 2, "mq_reads": 16, "mq_solver": "mq_dsb", "mq_xi": 0.15316981598941554, "start": 
[I 2026-09-28 17:38:31,158] Trial 7 finished with value: -0.13891051225301226 and parameters: {'start': 'lp', 'mq_solver': 'mq_dsb', 'mq_nmax': 514, 'mq_reads': 16, 'mq_iters': 910, 'mq_dt': 0.06526542706084622, 'mq_xi': 0.15316981598941554, 'mq_pen': 0.001344312143528808, 'mq_q': 2, 'mq_ksamp': 7}. Best is trial 7 with value: -0.13891051225301226.
[F1__mq__b10] trial 8: -0.13641 [-0.11072323702662568, -0.1621054600770203] {"mq_dt": 0.350232550230423, "mq_iters": 292, "mq_ksamp": 7, "mq_nmax": 145, "mq_pen": 0.002030508121595855, "mq_q": 7, "mq_reads": 16, "mq_solver": "mq_dsb", "mq_xi": 1.052996956442961, "start": "lp"
[I 2026-09-28 17:38:53,717] Trial 8 finished with value: -0.136414348551823 and parameters: {'start': 'lp', 'mq_solver': 'mq_dsb', 'mq_nmax': 145, 'mq_reads': 16, 'mq_iters': 292, 'mq_dt': 0.350232550230423, 'mq_xi': 1.052996956442961, 'mq_pen': 0.002030508121595855, 'mq_q': 7, 'mq_ksamp': 7}. Best is trial 7 with value: -0.13891051225301226.
[F1__mq__b10] trial 9: -0.13464 [-0.11188378241206631, -0.15739121620664753] {"mq_dt": 0.06850293825816656, "mq_iters": 548, "mq_ksamp": 7, "mq_nmax": 413, "mq_pen": 0.03112333220327883, "mq_q": 32, "mq_reads": 16, "mq_solver": "mq_dsb", "mq_xi": 0.05856655318172979, "start": 
[I 2026-09-28 17:39:17,023] Trial 9 finished with value: -0.13463749930935692 and parameters: {'start': 'lp', 'mq_solver': 'mq_dsb', 'mq_nmax': 413, 'mq_reads': 16, 'mq_iters': 548, 'mq_dt': 0.06850293825816656, 'mq_xi': 0.05856655318172979, 'mq_pen': 0.03112333220327883, 'mq_q': 32, 'mq_ksamp': 7}. Best is trial 7 with value: -0.13891051225301226.
[F1__mq__b10] BEST -0.13891 cfg={"mq_dt": 0.06526542706084622, "mq_iters": 910, "mq_ksamp": 7, "mq_nmax": 514, "mq_pen": 0.001344312143528808, "mq_q": 2, "mq_reads": 16, "mq_solver": "mq_dsb", "mq_xi": 0.15316981598941554, "start": "lp"}
