[I 2026-09-28 16:42:50,419] Trial 3 finished with value: -1.7149982824593568e-05 and parameters: {'start': 'pgreedy', 'eim_R': 64, 'eim_Tmin': 2.8079081078857258e-05, 'eim_Tratio': 382.8691241167905, 'eim_moves': 162521, 'p_add': 0.3409101495517417, 'p_swap': 0.34707103328069744, 'topw': 8, 'eim_rho': 61.73405204074311, 'eim_hscale': 0.1515920461138471, 'eim_anneal': 0.660099048291211}. Best is trial 1 with value: -0.0007266558691340075.
[F2b_tau_rel0.6__pt__b10] trial 4: -0.00007 [-5.690041421635428e-05, -9.308459937018565e-05] {"eim_R": 64, "eim_Tmax": 0.00127403479763842, "eim_Tmin": 1.4066894026586868e-06, "eim_anneal": 0.3685206655782286, "eim_hscale": 17.94906608098131, "eim_moves": 12641, "eim_rho": 1.1889617992500576,
[I 2026-09-28 16:43:12,211] Trial 4 finished with value: -7.499250679326996e-05 and parameters: {'start': 'pgreedy', 'eim_R': 64, 'eim_Tmin': 1.4066894026586868e-06, 'eim_Tratio': 905.6973026387024, 'eim_moves': 12641, 'p_add': 0.29259901288492046, 'p_swap': 0.2073542050430799, 'topw': 21, 'eim_rho': 1.1889617992500576, 'eim_hscale': 17.94906608098131, 'eim_anneal': 0.3685206655782286}. Best is trial 1 with value: -0.0007266558691340075.
[F2b_tau_rel0.6__pt__b10] trial 5: -0.00006 [-5.8239000313542455e-05, -5.248857124318107e-05] {"eim_R": 64, "eim_Tmax": 0.02116030612115081, "eim_Tmin": 2.5642222904151606e-06, "eim_anneal": 0.1998927371341515, "eim_hscale": 38.16581957605278, "eim_moves": 144075, "eim_rho": 0.9621558348013612
[I 2026-09-28 16:43:34,328] Trial 5 finished with value: -5.536378577836176e-05 and parameters: {'start': 'pgreedy', 'eim_R': 64, 'eim_Tmin': 2.5642222904151606e-06, 'eim_Tratio': 8252.134068191432, 'eim_moves': 144075, 'p_add': 0.0014535704173509745, 'p_swap': 0.9479587172950459, 'topw': 10, 'eim_rho': 0.9621558348013612, 'eim_hscale': 38.16581957605278, 'eim_anneal': 0.1998927371341515}. Best is trial 1 with value: -0.0007266558691340075.
[F2b_tau_rel0.6__pt__b10] trial 6: -0.00075 [-0.00010194947694741607, -0.0013959284941829075] {"eim_R": 64, "eim_Tmax": 9.8531236831387e-06, "eim_Tmin": 1.918531125650627e-07, "eim_anneal": 0.8618491954646634, "eim_hscale": 32.359509791414396, "eim_moves": 20465, "eim_rho": 253.57877108648475,
[I 2026-09-28 16:43:56,044] Trial 6 finished with value: -0.0007489389855651618 and parameters: {'start': 'pgreedy', 'eim_R': 64, 'eim_Tmin': 1.918531125650627e-07, 'eim_Tratio': 51.357643102074945, 'eim_moves': 20465, 'p_add': 0.36487873381923774, 'p_swap': 0.4449221265196244, 'topw': 8, 'eim_rho': 253.57877108648475, 'eim_hscale': 32.359509791414396, 'eim_anneal': 0.8618491954646634}. Best is trial 6 with value: -0.0007489389855651618.
[F2b_tau_rel0.6__pt__b10] trial 7: +0.00065 [0.0013253458950450714, -1.603928480720107e-05] {"eim_R": 64, "eim_Tmax": 9.930860075136476e-07, "eim_Tmin": 4.3924877967561744e-07, "eim_anneal": 0.14344897546414093, "eim_hscale": 6.438436220171723, "eim_moves": 7581, "eim_rho": 17.55530284252968
[I 2026-09-28 16:44:17,768] Trial 7 finished with value: 0.0006546533051189352 and parameters: {'start': 'pgreedy', 'eim_R': 64, 'eim_Tmin': 4.3924877967561744e-07, 'eim_Tratio': 2.260873685857558, 'eim_moves': 7581, 'p_add': 0.2216507121566053, 'p_swap': 0.4429768786041202, 'topw': 11, 'eim_rho': 17.55530284252968, 'eim_hscale': 6.438436220171723, 'eim_anneal': 0.14344897546414093}. Best is trial 6 with value: -0.0007489389855651618.
[F2b_tau_rel0.6__pt__b10] trial 8: -0.00134 [-0.0007239595283810019, -0.00196355893774236] {"eim_R": 64, "eim_Tmax": 4.036178984624127e-06, "eim_Tmin": 1.6818666998346027e-07, "eim_anneal": 0.7785641387202241, "eim_hscale": 23.873494260494734, "eim_moves": 15334, "eim_rho": 94.6067008038082
[I 2026-09-28 16:44:39,547] Trial 8 finished with value: -0.001343759233061681 and parameters: {'start': 'pgreedy', 'eim_R': 64, 'eim_Tmin': 1.6818666998346027e-07, 'eim_Tratio': 23.99820975717666, 'eim_moves': 15334, 'p_add': 0.33825003381627866, 'p_swap': 0.22635423387006107, 'topw': 2, 'eim_rho': 94.6067008038082, 'eim_hscale': 23.873494260494734, 'eim_anneal': 0.7785641387202241}. Best is trial 8 with value: -0.001343759233061681.
[F2b_tau_rel0.6__pt__b10] trial 9: +0.00001 [-2.373252896548106e-05, 3.87637726502188e-05] {"eim_R": 64, "eim_Tmax": 0.0010556722572609585, "eim_Tmin": 1.5274955561520317e-07, "eim_anneal": 0.6597971955311203, "eim_hscale": 0.892049863252222, "eim_moves": 9729, "eim_rho": 61.09281888341044,
[I 2026-09-28 16:45:01,460] Trial 9 finished with value: 7.515621842368869e-06 and parameters: {'start': 'pgreedy', 'eim_R': 64, 'eim_Tmin': 1.5274955561520317e-07, 'eim_Tratio': 6911.131446564336, 'eim_moves': 9729, 'p_add': 0.2172662013366612, 'p_swap': 0.23726611577431742, 'topw': 12, 'eim_rho': 61.09281888341044, 'eim_hscale': 0.892049863252222, 'eim_anneal': 0.6597971955311203}. Best is trial 8 with value: -0.001343759233061681.
[F2b_tau_rel0.6__pt__b10] BEST -0.00134 cfg={"eim_R": 64, "eim_Tmax": 4.036178984624127e-06, "eim_Tmin": 1.6818666998346027e-07, "eim_anneal": 0.7785641387202241, "eim_hscale": 23.873494260494734, "eim_moves": 15334, "eim_rho": 94.6067008038082, "p_add": 0.33825003381627866, "p_swap": 0.22635423387006107, "start": "pgreedy", "topw": 2}
[I 2026-09-28 16:45:01,493] A new study created in RDB with name: F2b_tau_rel0.6__cpsat__b10
[F2b_tau_rel0.6__cpsat__b10] trial 0: +0.00612 [0.006003137340540032, 0.006228129031549123] {"cp_model_presolve": true, "linearization_level": 1, "repair_hint": false, "scale": 1000.0, "start": "lp"}
[I 2026-09-28 16:45:23,173] Trial 0 finished with value: 0.006115633186044578 and parameters: {'start': 'lp', 'linearization_level': 1, 'repair_hint': False, 'cp_model_presolve': True, 'scale': 1000.0}. Best is trial 0 with value: 0.006115633186044578.
[F2b_tau_rel0.6__cpsat__b10] trial 1: +0.00000 [0.0, 0.0] {"cp_model_presolve": true, "linearization_level": 1, "repair_hint": false, "scale": 1000.0, "start": "pgreedy"}
[I 2026-09-28 16:45:44,867] Trial 1 finished with value: 0.0 and parameters: {'start': 'pgreedy', 'linearization_level': 1, 'repair_hint': False, 'cp_model_presolve': True, 'scale': 1000.0}. Best is trial 1 with value: 0.0.
[F2b_tau_rel0.6__cpsat__b10] trial 2: +0.00612 [0.006003137340540032, 0.006228129031549123] {"cp_model_presolve": true, "linearization_level": 1, "repair_hint": false, "scale": 3000.0, "start": "lp"}
[I 2026-09-28 16:46:06,619] Trial 2 finished with value: 0.006115633186044578 and parameters: {'start': 'lp', 'linearization_level': 1, 'repair_hint': False, 'cp_model_presolve': True, 'scale': 3000.0}. Best is trial 1 with value: 0.0.
[F2b_tau_rel0.6__cpsat__b10] trial 3: +0.00612 [0.006003137340540032, 0.006228129031549123] {"cp_model_presolve": true, "linearization_level": 1, "repair_hint": false, "scale": 300.0, "start": "lp"}
[I 2026-09-28 16:46:28,519] Trial 3 finished with value: 0.006115633186044578 and parameters: {'start': 'lp', 'linearization_level': 1, 'repair_hint': False, 'cp_model_presolve': True, 'scale': 300.0}. Best is trial 1 with value: 0.0.
[F2b_tau_rel0.6__cpsat__b10] trial 4: +0.00000 [0.0, 0.0] {"cp_model_presolve": true, "linearization_level": 0, "repair_hint": false, "scale": 1000.0, "start": "pgreedy"}
[I 2026-09-28 16:46:50,229] Trial 4 finished with value: 0.0 and parameters: {'start': 'pgreedy', 'linearization_level': 0, 'repair_hint': False, 'cp_model_presolve': True, 'scale': 1000.0}. Best is trial 1 with value: 0.0.
[F2b_tau_rel0.6__cpsat__b10] trial 5: -0.00008 [-1.5591152102478745e-05, -0.00014500095959779635] {"cp_model_presolve": false, "linearization_level": 2, "repair_hint": false, "scale": 1000.0, "start": "pgreedy"}
[I 2026-09-28 16:47:12,012] Trial 5 finished with value: -8.029605585013755e-05 and parameters: {'start': 'pgreedy', 'linearization_level': 2, 'repair_hint': False, 'cp_model_presolve': False, 'scale': 1000.0}. Best is trial 5 with value: -8.029605585013755e-05.
[F2b_tau_rel0.6__cpsat__b10] trial 6: -0.00010 [-1.5794310037620107e-06, -0.0002041516700956869] {"cp_model_presolve": false, "linearization_level": 2, "repair_hint": false, "scale": 1000.0, "start": "pgreedy"}
[I 2026-09-28 16:47:34,017] Trial 6 finished with value: -0.00010286555054972446 and parameters: {'start': 'pgreedy', 'linearization_level': 2, 'repair_hint': False, 'cp_model_presolve': False, 'scale': 1000.0}. Best is trial 6 with value: -0.00010286555054972446.
[F2b_tau_rel0.6__cpsat__b10] trial 7: +0.00000 [0.0, 0.0] {"cp_model_presolve": false, "linearization_level": 0, "repair_hint": true, "scale": 3000.0, "start": "pgreedy"}
[I 2026-09-28 16:47:55,973] Trial 7 finished with value: 0.0 and parameters: {'start': 'pgreedy', 'linearization_level': 0, 'repair_hint': True, 'cp_model_presolve': False, 'scale': 3000.0}. Best is trial 6 with value: -0.00010286555054972446.
Check failed: heuristics.fixed_search != nullptr 
*** Check failure stack trace: ***
[F2b_tau_rel0.6__cpsat__b10] trial 8: +0.50311 [1.0, 0.006228129031549123] {"cp_model_presolve": false, "linearization_level": 2, "repair_hint": true, "scale": 1000.0, "start": "lp"}
[I 2026-09-28 16:48:10,042] Trial 8 finished with value: 0.5031140645157746 and parameters: {'start': 'lp', 'linearization_level': 2, 'repair_hint': True, 'cp_model_presolve': False, 'scale': 1000.0}. Best is trial 6 with value: -0.00010286555054972446.
[F2b_tau_rel0.6__cpsat__b10] trial 9: +0.00000 [0.0, 0.0] {"cp_model_presolve": true, "linearization_level": 2, "repair_hint": true, "scale": 3000.0, "start": "pgreedy"}
[I 2026-09-28 16:48:31,780] Trial 9 finished with value: 0.0 and parameters: {'start': 'pgreedy', 'linearization_level': 2, 'repair_hint': True, 'cp_model_presolve': True, 'scale': 3000.0}. Best is trial 6 with value: -0.00010286555054972446.
[F2b_tau_rel0.6__cpsat__b10] BEST -0.00010 cfg={"cp_model_presolve": false, "linearization_level": 2, "repair_hint": false, "scale": 1000.0, "start": "pgreedy"}
[I 2026-09-28 16:48:31,813] A new study created in RDB with name: F2b_tau_rel0.6__hlns__b10
[F2b_tau_rel0.6__hlns__b10] trial 0: +0.00472 [0.005179019565358045, 0.004254498453112765] {"eim_R": 8, "eim_Tmax": 0.003, "eim_Tmin": 1e-06, "eim_moves": 20000, "hl_frac_sel": 0.5, "hl_nmax": 3000, "hl_p_block": 0.3, "hl_p_milp": 0.0, "hl_q": 8, "hl_slice": 0.25, "start": "lp"}
[I 2026-09-28 16:48:53,735] Trial 0 finished with value: 0.004716759009235405 and parameters: {'start': 'lp', 'hl_nmax': 3000, 'hl_slice': 0.25, 'hl_q': 8, 'hl_p_block': 0.3, 'hl_frac_sel': 0.5, 'hl_p_milp': 0.0, 'eim_R': 8, 'eim_Tmin': 1e-06, 'eim_Tratio': 3000.0, 'eim_moves': 20000}. Best is trial 0 with value: 0.004716759009235405.
[F2b_tau_rel0.6__hlns__b10] trial 1: -0.00003 [-1.1094806258715728e-05, -5.455657463204755e-05] {"eim_R": 4, "eim_Tmax": 0.003294499661706162, "eim_Tmin": 1.3049073550362386e-05, "eim_moves": 74745, "hl_frac_sel": 0.25119498706364835, "hl_nmax": 2170, "hl_p_block": 0.5167152904533249, "hl_p_milp
[I 2026-09-28 16:49:15,638] Trial 1 finished with value: -3.282569044538164e-05 and parameters: {'start': 'pgreedy', 'hl_nmax': 2170, 'hl_slice': 0.37316899400505027, 'hl_q': 6, 'hl_p_block': 0.5167152904533249, 'hl_frac_sel': 0.25119498706364835, 'hl_p_milp': 0.2675319002346239, 'eim_R': 4, 'eim_Tmin': 1.3049073550362386e-05, 'eim_Tratio': 252.47000478548688, 'eim_moves': 74745}. Best is trial 1 with value: -3.282569044538164e-05.
[F2b_tau_rel0.6__hlns__b10] trial 2: -0.00001 [-1.4100213080459056e-06, -1.0204095775234734e-05] {"eim_R": 8, "eim_Tmax": 0.00024602179969746214, "eim_Tmin": 3.628140404024378e-05, "eim_moves": 80536, "hl_frac_sel": 1.8483120598659897, "hl_nmax": 320, "hl_p_block": 0.6960097185974554, "hl_p_milp"
[I 2026-09-28 16:49:37,504] Trial 2 finished with value: -5.80705854164032e-06 and parameters: {'start': 'pgreedy', 'hl_nmax': 320, 'hl_slice': 1.0786410564546558, 'hl_q': 16, 'hl_p_block': 0.6960097185974554, 'hl_frac_sel': 1.8483120598659897, 'hl_p_milp': 0.23974756926501706, 'eim_R': 8, 'eim_Tmin': 3.628140404024378e-05, 'eim_Tratio': 6.780933820107175, 'eim_moves': 80536}. Best is trial 1 with value: -3.282569044538164e-05.
[F2b_tau_rel0.6__hlns__b10] trial 3: +0.00609 [0.005994169875907396, 0.00617833047801053] {"eim_R": 16, "eim_Tmax": 0.0022809729374061983, "eim_Tmin": 5.336803302756711e-05, "eim_moves": 11053, "hl_frac_sel": 0.05358859760545354, "hl_nmax": 714, "hl_p_block": 0.4547471590949188, "hl_p_milp
[I 2026-09-28 16:49:59,218] Trial 3 finished with value: 0.006086250176958963 and parameters: {'start': 'lp', 'hl_nmax': 714, 'hl_slice': 0.8696386278445376, 'hl_q': 6, 'hl_p_block': 0.4547471590949188, 'hl_frac_sel': 0.05358859760545354, 'hl_p_milp': 0.1852906491227631, 'eim_R': 16, 'eim_Tmin': 5.336803302756711e-05, 'eim_Tratio': 42.740434825993454, 'eim_moves': 11053}. Best is trial 1 with value: -3.282569044538164e-05.
[F2b_tau_rel0.6__hlns__b10] trial 4: -0.00001 [-2.001102080473327e-05, 0.0] {"eim_R": 4, "eim_Tmax": 0.184234527622064, "eim_Tmin": 8.449999440828861e-05, "eim_moves": 83132, "hl_frac_sel": 0.0740179160228525, "hl_nmax": 1654, "hl_p_block": 0.5855978916741029, "hl_p_milp": 0.
[I 2026-09-28 16:50:21,195] Trial 4 finished with value: -1.0005510402366635e-05 and parameters: {'start': 'pgreedy', 'hl_nmax': 1654, 'hl_slice': 0.14516578117571163, 'hl_q': 7, 'hl_p_block': 0.5855978916741029, 'hl_frac_sel': 0.0740179160228525, 'hl_p_milp': 0.17546190186032246, 'eim_R': 4, 'eim_Tmin': 8.449999440828861e-05, 'eim_Tratio': 2180.290411995488, 'eim_moves': 83132}. Best is trial 1 with value: -3.282569044538164e-05.
[F2b_tau_rel0.6__hlns__b10] trial 5: -0.00005 [-7.898412680562572e-06, -8.252842128619875e-05] {"eim_R": 4, "eim_Tmax": 4.753629081986275e-05, "eim_Tmin": 7.868657790837972e-06, "eim_moves": 96465, "hl_frac_sel": 0.1509512926377876, "hl_nmax": 6490, "hl_p_block": 0.2385581128702557, "hl_p_milp"
[I 2026-09-28 16:50:43,071] Trial 5 finished with value: -4.521341698338066e-05 and parameters: {'start': 'pgreedy', 'hl_nmax': 6490, 'hl_slice': 1.4198088199172951, 'hl_q': 11, 'hl_p_block': 0.2385581128702557, 'hl_frac_sel': 0.1509512926377876, 'hl_p_milp': 0.01272302833985367, 'eim_R': 4, 'eim_Tmin': 7.868657790837972e-06, 'eim_Tratio': 6.041219745915572, 'eim_moves': 96465}. Best is trial 5 with value: -4.521341698338066e-05.
[F2b_tau_rel0.6__hlns__b10] trial 6: +0.00000 [0.0, 0.0] {"eim_R": 4, "eim_Tmax": 0.006160485507694245, "eim_Tmin": 5.302149932757018e-05, "eim_moves": 13815, "hl_frac_sel": 0.059039861143505436, "hl_nmax": 5699, "hl_p_block": 0.3095167691707834, "hl_p_milp
[I 2026-09-28 16:51:04,793] Trial 6 finished with value: 0.0 and parameters: {'start': 'pgreedy', 'hl_nmax': 5699, 'hl_slice': 1.6340155810335355, 'hl_q': 25, 'hl_p_block': 0.3095167691707834, 'hl_frac_sel': 0.059039861143505436, 'hl_p_milp': 0.07509178070746522, 'eim_R': 4, 'eim_Tmin': 5.302149932757018e-05, 'eim_Tratio': 116.18844404294144, 'eim_moves': 13815}. Best is trial 5 with value: -4.521341698338066e-05.
[F2b_tau_rel0.6__hlns__b10] trial 7: -0.00008 [-5.560460389997246e-05, -0.00010961187018199148] {"eim_R": 4, "eim_Tmax": 2.3160023485701185e-05, "eim_Tmin": 1.6605414256086762e-06, "eim_moves": 72310, "hl_frac_sel": 0.11780220662895499, "hl_nmax": 6565, "hl_p_block": 0.25377576982478034, "hl_p_m
[I 2026-09-28 16:51:26,538] Trial 7 finished with value: -8.260823704098197e-05 and parameters: {'start': 'pgreedy', 'hl_nmax': 6565, 'hl_slice': 0.08227468084128184, 'hl_q': 31, 'hl_p_block': 0.25377576982478034, 'hl_frac_sel': 0.11780220662895499, 'hl_p_milp': 0.12055794770172312, 'eim_R': 4, 'eim_Tmin': 1.6605414256086762e-06, 'eim_Tratio': 13.947272334510902, 'eim_moves': 72310}. Best is trial 7 with value: -8.260823704098197e-05.
[F2b_tau_rel0.6__hlns__b10] trial 8: -0.00023 [-4.163195871009773e-05, -0.0004093305717064455] {"eim_R": 4, "eim_Tmax": 1.1496448520528694e-05, "eim_Tmin": 3.7212480628215847e-07, "eim_moves": 83450, "hl_frac_sel": 0.5352496268116972, "hl_nmax": 885, "hl_p_block": 0.4011308291545138, "hl_p_milp
[I 2026-09-28 16:51:48,324] Trial 8 finished with value: -0.0002254812652082716 and parameters: {'start': 'pgreedy', 'hl_nmax': 885, 'hl_slice': 0.45079906794924024, 'hl_q': 14, 'hl_p_block': 0.4011308291545138, 'hl_frac_sel': 0.5352496268116972, 'hl_p_milp': 0.10003840486024333, 'eim_R': 4, 'eim_Tmin': 3.7212480628215847e-07, 'eim_Tratio': 30.89406652404589, 'eim_moves': 83450}. Best is trial 8 with value: -0.0002254812652082716.
[F2b_tau_rel0.6__hlns__b10] trial 9: -0.00059 [-0.000456718309048032, -0.000730088002732443] {"eim_R": 4, "eim_Tmax": 1.3634424241269136e-05, "eim_Tmin": 1.9712947654928525e-06, "eim_moves": 2664, "hl_frac_sel": 0.7463316723057934, "hl_nmax": 2055, "hl_p_block": 0.5334676571643976, "hl_p_milp
[I 2026-09-28 16:52:10,004] Trial 9 finished with value: -0.0005934031558902375 and parameters: {'start': 'pgreedy', 'hl_nmax': 2055, 'hl_slice': 0.15185070244922075, 'hl_q': 3, 'hl_p_block': 0.5334676571643976, 'hl_frac_sel': 0.7463316723057934, 'hl_p_milp': 0.17773626833619632, 'eim_R': 4, 'eim_Tmin': 1.9712947654928525e-06, 'eim_Tratio': 6.916481735728817, 'eim_moves': 2664}. Best is trial 9 with value: -0.0005934031558902375.
[F2b_tau_rel0.6__hlns__b10] BEST -0.00059 cfg={"eim_R": 4, "eim_Tmax": 1.3634424241269136e-05, "eim_Tmin": 1.9712947654928525e-06, "eim_moves": 2664, "hl_frac_sel": 0.7463316723057934, "hl_nmax": 2055, "hl_p_block": 0.5334676571643976, "hl_p_milp": 0.17773626833619632, "hl_q": 3, "hl_slice": 0.15185070244922075, "start": "pgreedy"}
[I 2026-09-28 16:52:10,048] A new study created in RDB with name: F2b_tau_rel0.6__lp__b10
[F2b_tau_rel0.6__lp__b10] trial 0: +0.00603 [0.006003137340540032, 0.006058631525951652] {"J": 12, "lexi": false}
[I 2026-09-28 16:52:14,636] Trial 0 finished with value: 0.006030884433245842 and parameters: {'start': 'pgreedy', 'lexi': False, 'J': 12}. Best is trial 0 with value: 0.006030884433245842.
[F2b_tau_rel0.6__lp__b10] trial 1: -0.00013 [-8.001174674199252e-05, -0.00017300936327413474] {"J": 24, "lexi": true}
[I 2026-09-28 16:52:33,366] Trial 1 finished with value: -0.00012651055500806363 and parameters: {'start': 'lp', 'lexi': True, 'J': 24}. Best is trial 1 with value: -0.00012651055500806363.
[F2b_tau_rel0.6__lp__b10] trial 2: +0.18210 [0.12526030651994424, 0.23893984726571138] {"J": 6, "lexi": true}
[I 2026-09-28 16:52:50,509] Trial 2 finished with value: 0.1821000768928278 and parameters: {'start': 'pgreedy', 'lexi': True, 'J': 6}. Best is trial 1 with value: -0.00012651055500806363.
[F2b_tau_rel0.6__lp__b10] trial 3: +0.17408 [0.13032786291166487, 0.21783739894116483] {"J": 6, "lexi": true}
[I 2026-09-28 16:53:07,616] Trial 3 finished with value: 0.17408263092641485 and parameters: {'start': 'pgreedy', 'lexi': True, 'J': 6}. Best is trial 1 with value: -0.00012651055500806363.
[F2b_tau_rel0.6__lp__b10] trial 4: -0.00020 [-8.001174674199252e-05, -0.0003108418850037431] {"J": 24, "lexi": true}
[I 2026-09-28 16:53:27,043] Trial 4 finished with value: -0.0001954268158728678 and parameters: {'start': 'lp', 'lexi': True, 'J': 24}. Best is trial 4 with value: -0.0001954268158728678.
[F2b_tau_rel0.6__lp__b10] trial 5: -0.00012 [-8.001174674199252e-05, -0.00015811517339892056] {"J": 24, "lexi": false}
[I 2026-09-28 16:53:32,901] Trial 5 finished with value: -0.00011906346007045654 and parameters: {'start': 'lp', 'lexi': False, 'J': 24}. Best is trial 4 with value: -0.0001954268158728678.
[F2b_tau_rel0.6__lp__b10] trial 6: +0.00601 [0.005963806750098888, 0.0060627256457845835] {"J": 12, "lexi": true}
[I 2026-09-28 16:53:50,775] Trial 6 finished with value: 0.006013266197941736 and parameters: {'start': 'lp', 'lexi': True, 'J': 12}. Best is trial 4 with value: -0.0001954268158728678.
[F2b_tau_rel0.6__lp__b10] trial 7: +0.18154 [0.1306119464209583, 0.23245808764246556] {"J": 6, "lexi": false}
[I 2026-09-28 16:53:54,268] Trial 7 finished with value: 0.18153501703171193 and parameters: {'start': 'lp', 'lexi': False, 'J': 6}. Best is trial 4 with value: -0.0001954268158728678.
[F2b_tau_rel0.6__lp__b10] trial 8: -0.00020 [-8.001174674199252e-05, -0.00031834661229745986] {"J": 24, "lexi": true}
[I 2026-09-28 16:54:13,426] Trial 8 finished with value: -0.0001991791795197262 and parameters: {'start': 'pgreedy', 'lexi': True, 'J': 24}. Best is trial 8 with value: -0.0001991791795197262.
[F2b_tau_rel0.6__lp__b10] trial 9: -0.00013 [-7.926826872317605e-05, -0.00017300936327413474] {"J": 24, "lexi": true}
[I 2026-09-28 16:54:32,258] Trial 9 finished with value: -0.0001261388159986554 and parameters: {'start': 'pgreedy', 'lexi': True, 'J': 24}. Best is trial 8 with value: -0.0001991791795197262.
[F2b_tau_rel0.6__lp__b10] BEST -0.00020 cfg={"J": 24, "lexi": true}
[I 2026-09-28 16:54:32,291] A new study created in RDB with name: F2b_tau_rel0.6__sb__b10
[F2b_tau_rel0.6__sb__b10] trial 0: +0.00603 [0.006003137340540032, 0.006058631525951652] {"sb_agents": 32, "sb_alpha_floor": 0.0, "sb_dt": 1.0, "sb_eta_mu": 1.0, "sb_heat": 0.06, "sb_steps": 400, "sb_variant": "ballistic", "sb_warm": 0.0, "sb_xi": 0.7, "start": "lp"}
[I 2026-09-28 16:54:56,672] Trial 0 finished with value: 0.006030884433245842 and parameters: {'start': 'lp', 'sb_agents': 32, 'sb_steps': 400, 'sb_dt': 1.0, 'sb_variant': 'ballistic', 'sb_heat': 0.06, 'sb_xi': 0.7, 'sb_warm': 0.0, 'sb_eta_mu': 1.0, 'sb_alpha_floor': 0.0}. Best is trial 0 with value: 0.006030884433245842.
[F2b_tau_rel0.6__sb__b10] trial 1: +0.00000 [0.0, 0.0] {"sb_agents": 64, "sb_alpha_floor": 0.017425859940308142, "sb_dt": 1.3593049010167038, "sb_eta_mu": 0.0163345876110695, "sb_heat": 0.060428515788450606, "sb_steps": 250, "sb_variant": "ballistic", "sb
