[I 2026-10-01 14:44:42,056] A new study created in RDB with name: F1__pt__b1
[F1__pt__b1] trial 0: -0.08651 [-0.1198, -0.1549, -0.0746, -0.0766, -0.0577, -0.0807, -0.0637, -0.0641] {"eim_R": 16, "eim_Tmax": 7.3329031629428645e-06, "eim_Tmin": 1.1006348269620852e-06, "eim_anneal": 0.9462286962175356, "eim_hscale": 1.8587633596816164, "eim_m
[I 2026-10-01 14:44:51,358] Trial 0 finished with value: -0.08650895722798686 and parameters: {'start': 'lp', 'eim_R': 16, 'eim_Tmin': 1.1006348269620852e-06, 'eim_Tratio': 6.662430611234392, 'eim_moves': 18358, 'p_add': 0.22230587257383633, 'p_swap': 0.46272105013386755, 'topw': 20, 'eim_rho': 3.506794739778118, 'eim_hscale': 1.8587633596816164, 'eim_anneal': 0.9462286962175356, 'g_scale': 774.8399988560119}. Best is trial 0 with value: -0.08650895722798686.
[F1__pt__b1] trial 1: -0.08442 [-0.0668, -0.0932, -0.0634, -0.1042, -0.0704, -0.1144, -0.0796, -0.0834] {"eim_R": 64, "eim_Tmax": 0.022388264096178515, "eim_Tmin": 5.6279320474151646e-06, "eim_anneal": 0.07032569761590807, "eim_hscale": 59.812219011525556, "eim_mo
[I 2026-10-01 14:45:01,965] Trial 1 finished with value: -0.08441536638487104 and parameters: {'start': 'pgreedy', 'eim_R': 64, 'eim_Tmin': 5.6279320474151646e-06, 'eim_Tratio': 3978.0622629338873, 'eim_moves': 174910, 'p_add': 0.19172075941288885, 'p_swap': 0.6420036530145916, 'topw': 11, 'eim_rho': 18.71450068624066, 'eim_hscale': 59.812219011525556, 'eim_anneal': 0.07032569761590807, 'g_scale': 149.36835544198456}. Best is trial 0 with value: -0.08650895722798686.
[F1__pt__b1] trial 2: -0.08472 [-0.0728, -0.0976, -0.0566, -0.1131, -0.0721, -0.1087, -0.0736, -0.0832] {"eim_R": 32, "eim_Tmax": 0.01081686613933192, "eim_Tmin": 7.013219779945795e-06, "eim_anneal": 0.2619100559835807, "eim_hscale": 1.7538232373118046, "eim_moves
[I 2026-10-01 14:45:11,480] Trial 2 finished with value: -0.08471765893675365 and parameters: {'start': 'pgreedy', 'eim_R': 32, 'eim_Tmin': 7.013219779945795e-06, 'eim_Tratio': 1542.3537945099908, 'eim_moves': 7734, 'p_add': 0.3199605106637619, 'p_swap': 0.2616475745120573, 'topw': 52, 'eim_rho': 12.229065947034353, 'eim_hscale': 1.7538232373118046, 'eim_anneal': 0.2619100559835807, 'g_scale': 3535.6346291488144}. Best is trial 0 with value: -0.08650895722798686.
[F1__pt__b1] trial 3: -0.09249 [-0.0858, -0.1203, -0.0419, -0.1155, -0.0828, -0.1212, -0.0774, -0.095] {"eim_R": 16, "eim_Tmax": 0.3963283547730436, "eim_Tmin": 0.0005956516018710562, "eim_anneal": 0.2082787354631025, "eim_hscale": 10.278118224157009, "eim_moves"
[I 2026-10-01 14:45:20,747] Trial 3 finished with value: -0.09248884150029704 and parameters: {'start': 'pgreedy', 'eim_R': 16, 'eim_Tmin': 0.0005956516018710562, 'eim_Tratio': 665.369409782665, 'eim_moves': 18832, 'p_add': 0.21851597689967073, 'p_swap': 0.5707798346517168, 'topw': 2, 'eim_rho': 46.458679515124714, 'eim_hscale': 10.278118224157009, 'eim_anneal': 0.2082787354631025, 'g_scale': 181.07254066631089}. Best is trial 3 with value: -0.09248884150029704.
[F1__pt__b1] trial 4: -0.11036 [-0.0964, -0.1234, -0.063, -0.1287, -0.1057, -0.1438, -0.1023, -0.1196] {"eim_R": 16, "eim_Tmax": 0.0018454771330095238, "eim_Tmin": 2.3364917297093765e-06, "eim_anneal": 0.37442683988677017, "eim_hscale": 15.798790043320883, "eim_m
[I 2026-10-01 14:45:30,069] Trial 4 finished with value: -0.11036443891833723 and parameters: {'start': 'pgreedy', 'eim_R': 16, 'eim_Tmin': 2.3364917297093765e-06, 'eim_Tratio': 789.8496320545815, 'eim_moves': 10230, 'p_add': 0.3385264442295092, 'p_swap': 0.22443066908599205, 'topw': 2, 'eim_rho': 1.291360202801736, 'eim_hscale': 15.798790043320883, 'eim_anneal': 0.37442683988677017, 'g_scale': 1367.4385728086665}. Best is trial 4 with value: -0.11036443891833723.
[F1__pt__b1] trial 5: -0.11166 [-0.0902, -0.124, -0.0678, -0.1357, -0.1061, -0.142, -0.1061, -0.1213] {"eim_R": 16, "eim_Tmax": 9.652015291543115e-05, "eim_Tmin": 9.103174488464979e-07, "eim_anneal": 0.6940426877145585, "eim_hscale": 51.087850352945644, "eim_mov
[I 2026-10-01 14:45:39,581] Trial 5 finished with value: -0.11166342592760928 and parameters: {'start': 'pgreedy', 'eim_R': 16, 'eim_Tmin': 9.103174488464979e-07, 'eim_Tratio': 106.02911439051944, 'eim_moves': 15662, 'p_add': 0.05214329821518898, 'p_swap': 0.8827286755648714, 'topw': 3, 'eim_rho': 0.27042397645623645, 'eim_hscale': 51.087850352945644, 'eim_anneal': 0.6940426877145585, 'g_scale': 5671.407524071687}. Best is trial 5 with value: -0.11166342592760928.
[F1__pt__b1] trial 6: -0.12105 [-0.0979, -0.1367, -0.0746, -0.1401, -0.1199, -0.1544, -0.1168, -0.1279] {"eim_R": 16, "eim_Tmax": 3.949337716221304e-05, "eim_Tmin": 4.436381976497595e-06, "eim_anneal": 0.7788059172121389, "eim_hscale": 11.150146265598396, "eim_mov
[I 2026-10-01 14:45:53,633] Trial 6 finished with value: -0.12104631987093233 and parameters: {'start': 'pgreedy', 'eim_R': 16, 'eim_Tmin': 4.436381976497595e-06, 'eim_Tratio': 8.902158869870805, 'eim_moves': 25466, 'p_add': 0.09456781797506153, 'p_swap': 0.8125918619786677, 'topw': 4, 'eim_rho': 1.0318704311651328, 'eim_hscale': 11.150146265598396, 'eim_anneal': 0.7788059172121389, 'g_scale': 7195.057490616544}. Best is trial 6 with value: -0.12104631987093233.
[F1__pt__b1] trial 7: -0.12879 [-0.1055, -0.143, -0.0746, -0.1498, -0.129, -0.1632, -0.1256, -0.1396] {"eim_R": 16, "eim_Tmax": 0.028957879838155714, "eim_Tmin": 0.00014085806091378926, "eim_anneal": 0.6667937093223893, "eim_hscale": 14.397526962964195, "eim_mov
[I 2026-10-01 14:46:04,217] Trial 7 finished with value: -0.1287871117494533 and parameters: {'start': 'pgreedy', 'eim_R': 16, 'eim_Tmin': 0.00014085806091378926, 'eim_Tratio': 205.58198551291352, 'eim_moves': 21240, 'p_add': 0.016112416050217765, 'p_swap': 0.9199404544251992, 'topw': 29, 'eim_rho': 0.2732819455468925, 'eim_hscale': 14.397526962964195, 'eim_anneal': 0.6667937093223893, 'g_scale': 1371.7796754231676}. Best is trial 7 with value: -0.1287871117494533.
[F1__pt__b1] trial 8: -0.10810 [-0.0971, -0.1253, -0.0679, -0.1275, -0.1029, -0.1398, -0.0911, -0.1132] {"eim_R": 16, "eim_Tmax": 0.1398543194837322, "eim_Tmin": 0.000983450271945902, "eim_anneal": 0.5129117643167751, "eim_hscale": 0.6947762045632158, "eim_moves":
[I 2026-10-01 14:51:20,813] Trial 8 finished with value: -0.10810263715090483 and parameters: {'start': 'pgreedy', 'eim_R': 16, 'eim_Tmin': 0.000983450271945902, 'eim_Tratio': 142.20782023580074, 'eim_moves': 64978, 'p_add': 0.3458380936480273, 'p_swap': 0.3538353950720029, 'topw': 3, 'eim_rho': 12.667905610173959, 'eim_hscale': 0.6947762045632158, 'eim_anneal': 0.5129117643167751, 'g_scale': 2747.380147053342}. Best is trial 7 with value: -0.1287871117494533.
[F1__pt__b1] trial 9: -0.12949 [-0.1147, -0.1427, -0.0746, -0.1537, -0.128, -0.1606, -0.1235, -0.1381] {"eim_R": 16, "eim_Tmax": 0.008864549059196352, "eim_Tmin": 1.0984360218168416e-06, "eim_anneal": 0.5384470725102187, "eim_hscale": 1.2835823710365764, "eim_mov
[I 2026-10-01 14:51:44,628] Trial 9 finished with value: -0.12948563909071462 and parameters: {'start': 'pgreedy', 'eim_R': 16, 'eim_Tmin': 1.0984360218168416e-06, 'eim_Tratio': 8070.155096092132, 'eim_moves': 140985, 'p_add': 0.039777647903175034, 'p_swap': 0.7399689064220577, 'topw': 20, 'eim_rho': 14.353412217010282, 'eim_hscale': 1.2835823710365764, 'eim_anneal': 0.5384470725102187, 'g_scale': 1163.4607209533538}. Best is trial 9 with value: -0.12948563909071462.
[F1__pt__b1] trial 10: -0.11710 [-0.0961, -0.1249, -0.07, -0.1372, -0.1117, -0.1511, -0.1156, -0.1303] {"eim_R": 16, "eim_Tmax": 0.004394809951257144, "eim_Tmin": 2.67013172576051e-06, "eim_anneal": 0.21083850426545225, "eim_hscale": 3.8286983000605996, "eim_move
[I 2026-10-01 14:51:58,401] Trial 10 finished with value: -0.11710113397220952 and parameters: {'start': 'pgreedy', 'eim_R': 16, 'eim_Tmin': 2.67013172576051e-06, 'eim_Tratio': 1645.9150343998137, 'eim_moves': 44557, 'p_add': 0.3179598841522244, 'p_swap': 0.36034612283482087, 'topw': 32, 'eim_rho': 28.48283157246602, 'eim_hscale': 3.8286983000605996, 'eim_anneal': 0.21083850426545225, 'g_scale': 1021.1798073808751}. Best is trial 9 with value: -0.12948563909071462.
[F1__pt__b1] trial 11: -0.12932 [-0.1109, -0.1388, -0.0746, -0.1488, -0.1264, -0.169, -0.1212, -0.1448] {"eim_R": 16, "eim_Tmax": 0.0029829953274759097, "eim_Tmin": 3.2962861812862887e-07, "eim_anneal": 0.7266103063004783, "eim_hscale": 3.9004549474068635, "eim_mo
[I 2026-10-01 14:57:07,880] Trial 11 finished with value: -0.12932301078556352 and parameters: {'start': 'pgreedy', 'eim_R': 16, 'eim_Tmin': 3.2962861812862887e-07, 'eim_Tratio': 9049.564156204042, 'eim_moves': 89010, 'p_add': 0.11420272465356197, 'p_swap': 0.7197283444498023, 'topw': 19, 'eim_rho': 12.00149180168365, 'eim_hscale': 3.9004549474068635, 'eim_anneal': 0.7266103063004783, 'g_scale': 864.108836036295}. Best is trial 9 with value: -0.12948563909071462.
[F1__pt__b1] BEST t9 -0.12949 cfg={"eim_R": 16, "eim_Tmax": 0.008864549059196352, "eim_Tmin": 1.0984360218168416e-06, "eim_anneal": 0.5384470725102187, "eim_hscale": 1.2835823710365764, "eim_moves": 140985, "eim_rho": 14.353412217010282, "g_scale": 1163.4607209533538, "p_add": 0.039777647903175034, "p_swap": 0.7399689064220577, "start": "pgreedy", "topw": 20}
[I 2026-10-01 14:57:07,920] A new study created in RDB with name: F1__lp__b1
[F1__lp__b1] trial 0: -0.05758 [-0.0401, -0.0637, -0.0613, -0.0661, -0.046, -0.0723, -0.0547, -0.0564] {"lexi": false}
[I 2026-10-01 14:57:14,187] Trial 0 finished with value: -0.05758396405468845 and parameters: {'start': 'lp', 'lexi': False}. Best is trial 0 with value: -0.05758396405468845.
[F1__lp__b1] trial 1: -0.05683 [-0.0416, -0.0636, -0.054, -0.0661, -0.046, -0.0723, -0.0547, -0.0564] {"lexi": false}
[I 2026-10-01 14:57:19,916] Trial 1 finished with value: -0.056827332048849696 and parameters: {'start': 'pgreedy', 'lexi': False}. Best is trial 0 with value: -0.05758396405468845.
[F1__lp__b1] trial 2: +0.20804 [-0.0401, 1.0, 1.0, -0.0661, -0.046, -0.0723, -0.0547, -0.0564] {"lexi": true}
[I 2026-10-01 14:57:45,739] Trial 2 finished with value: 0.20804412210557297 and parameters: {'start': 'pgreedy', 'lexi': True}. Best is trial 0 with value: -0.05758396405468845.
[F1__lp__b1] trial 3: -0.07736 [-0.1139, -0.1484, -0.0611, -0.0661, -0.046, -0.0723, -0.0547, -0.0564] {"lexi": false}
[I 2026-10-01 14:57:49,804] Trial 3 finished with value: -0.07736388069777324 and parameters: {'start': 'lp', 'lexi': False}. Best is trial 3 with value: -0.07736388069777324.
[F1__lp__b1] trial 4: +0.33823 [1.0, 1.0, 1.0, -0.0661, -0.046, -0.0723, -0.0547, -0.0551] {"lexi": true}
[I 2026-10-01 14:58:22,788] Trial 4 finished with value: 0.3382269865667593 and parameters: {'start': 'lp', 'lexi': True}. Best is trial 3 with value: -0.07736388069777324.
[F1__lp__b1] trial 5: -0.06870 [-0.0401, -0.1502, -0.0637, -0.0661, -0.046, -0.0723, -0.0547, -0.0564] {"lexi": false}
[I 2026-10-01 14:58:27,592] Trial 5 finished with value: -0.06869540133008367 and parameters: {'start': 'lp', 'lexi': False}. Best is trial 3 with value: -0.07736388069777324.
[F1__lp__b1] trial 6: -0.07579 [-0.1097, -0.1368, -0.0644, -0.0661, -0.046, -0.0723, -0.0547, -0.0564] {"lexi": false}
[I 2026-10-01 14:58:31,702] Trial 6 finished with value: -0.07579279508006405 and parameters: {'start': 'lp', 'lexi': False}. Best is trial 3 with value: -0.07736388069777324.
[F1__lp__b1] trial 7: +0.33810 [1.0, 1.0, 1.0, -0.0658, -0.046, -0.0723, -0.0547, -0.0564] {"lexi": true}
[I 2026-10-01 14:59:01,317] Trial 7 finished with value: 0.3381003528861215 and parameters: {'start': 'lp', 'lexi': True}. Best is trial 3 with value: -0.07736388069777324.
[F1__lp__b1] trial 8: -0.06647 [-0.1117, -0.0637, -0.0609, -0.0661, -0.046, -0.0723, -0.0547, -0.0564] {"lexi": false}
[I 2026-10-01 14:59:06,467] Trial 8 finished with value: -0.06646792947263375 and parameters: {'start': 'pgreedy', 'lexi': False}. Best is trial 3 with value: -0.07736388069777324.
[F1__lp__b1] trial 9: -0.07673 [-0.11, -0.1446, -0.0637, -0.0661, -0.046, -0.0723, -0.0547, -0.0564] {"lexi": false}
[I 2026-10-01 14:59:10,991] Trial 9 finished with value: -0.07672891042060988 and parameters: {'start': 'lp', 'lexi': False}. Best is trial 3 with value: -0.07736388069777324.
[F1__lp__b1] trial 10: +0.20804 [-0.0401, 1.0, 1.0, -0.0661, -0.046, -0.0723, -0.0547, -0.0564] {"lexi": true}
[I 2026-10-01 14:59:37,648] Trial 10 finished with value: 0.20804412210557297 and parameters: {'start': 'pgreedy', 'lexi': True}. Best is trial 3 with value: -0.07736388069777324.
[F1__lp__b1] trial 11: -0.06815 [-0.0401, -0.1487, -0.0609, -0.0661, -0.046, -0.0723, -0.0547, -0.0564] {"lexi": false}
[I 2026-10-01 14:59:42,655] Trial 11 finished with value: -0.06815048748274437 and parameters: {'start': 'lp', 'lexi': False}. Best is trial 3 with value: -0.07736388069777324.
[F1__lp__b1] BEST t3 -0.07736 cfg={"lexi": false}
[I 2026-10-01 14:59:42,692] A new study created in RDB with name: F1__eim__b1
